0	avoir trové. » 	auoir troue 	0
712	que vos l’enportois. — A morir, fet il, en estes donc tuit, 	que uous lemportoit. |Au morir fait il estes uos tuit 	683|684
713|714	puis|que a mains ne vos en volés soffrir !» 	puis que au mains ne uos en uolez souffrir. 	685
715	Si saut dedens les prones 	Lors saut dedens les pronez. 	686
716	et il li corent sus, 	et cil li corrent sus 	687
717|718	kar arrieres le cuident fere sailir |por poor de morir; 	car arreres le cuident faire flatir por paour de mort 	688
719	si le fierent par la ou il le pueent ataindre 	si le fierent par la |ou il pueent ataindre 	689|690
720	et il ot el poing l’espee nue ;	et il ot el poing lespee nue. 	691
721	si lor done grans cops et pesans 	si lor done grant cox et pesans 	692
722	et fiert le premier 	et fiert le premier	693
723	qu’il encontre si durement 	quil puet encontre si durement: 	694
724	que por le hialme ne por la coife de fer ne remaint 	que por hiaume ne por la coiffe ne remaint 	695
725|726	qu’il ne li mete l’espee |jusqu’al test; 	que il ne li meste lespee iuscau test. 	696
727	et il le hurte de soi, 	Si le hurte desor 	697
728	Si l’abat a terre. 	et labat a terre. 	698
729	Et lors saillent molt irieement tuit li autre, 	et lors saillent tuit li autre	699
730|731	si depiecent son escu et son hialme et son hauberc |et le blecent en pluisors lieus. 	si li deprirent son haubert et son escu et son hiaume. et le blecerent en plusors lieus. 	700
732|733	Mais il ne li chaut de rien |qu’il li facent, 	Mais il ne len chaut de rien.	701
734	kar tant est dolens 	Car tant est dolens 	702
735	que nus plus; 	que nus plus ne puet estre. 	703
736	si lor laisse corre par grant ire 	Si lor laisse corre par grant ire. 	704
737	et lor done de l’espee si grans cops 	et lordone de lespee si grant cox	705
738	que tos les fet guenchir avant lui.	que toz les fait guenchir auant lui. 	706
739	Et lors esgarde celui des IllI. 	Lors esgarde de celui des qͣtre 	707
740	qui plus li faisoit mal et cil estoit molt grans et molt fors; 	que miex le faissoit a son essianc. |et cil estoit mout grans cheualiers et mout fors. 	708|709
741|742	et Lancelos |qui le vient ataignant li done par mi le hialme si grant cop 	et lanc̾ qui le uient atangnant li done parmi le hiaume si grant cop. 	710
743	qu’il en fet le feu saillir, 	que il en fait le fen saillir. 	711
744	et l’espee glace 	et lespee glace 	712
745	qui de droit ne fu pas ferue. 	qui droit ne fu pas ferue. 	713
746	si descent desus la senestre espaule. 	Si li descent desous la senestre espaule. 	714
747|748	Li cops fu grans et par ire ferus, |et bien i parut 	et li cox fu grans et par ire feruset bien i parut 	715
749	que l’espee cola par mi l’espaule a al chevalier, 	que lespee cola parmi lespaule au cheualier. 	716
750	si que li bras a tote l’espaule chiet desus le pavement. 	Si que li bras atout lespee chai seur le pauement. et cil trebuche a terre |et se pasme: de langoisse 	717|718
		que il sent.	719
751	Et lors sont molt esmaié li autre troi, 	Et lors sont mout esmaiet li autre trois. 	720
752	si font molt malvés samblant d’els deffendre por le grant cop	Si font mout mauuais sanblant daus desfandre. |por le grant cop 	721|722
753	qu’il ont veu et por l’espee 	quil ont ueu et por lespee 	723
754	que chescuns d’els a ja sentie jusqu’al sanc. 	que chascuns daus a sentie iussqua sanc. et lanceloz 	724
755	Et Lancelos lor cort sus 	qui ne recroit pas lor cor sus. 	725
756	et en fiert I. el hialme 	et en fiert .i. amont el hiaume	726
757	si qu’il le fet flatir a terre d’ambesdeus les paumes. 	si quil le fait flatir a teree. danbedeus les paumes 	727
758|759	Et|quant li autre dui voient ce, 	et quant li autre dui uoient ce: 	728
760	si tornent en fuies vers l’uis a garison; 	si corret᷑ uers luis |et uiennent a garison. 	729|730
761	et Lancelos vint ataignant le deerrain, 	et lanc̃ uient atangnant 	731
762	si le fiert par entre l’escu et le bras 	et en fiert a grant uue par entre lescu et le bras 	732
763|764	si qu’il li trenche le poing |et li escus chiet a terre, 	si quil li tranche le poing. et li escus chiet a terre. 	733
765	et cil torne en fuies 	et sil torne en fuie 	734
766	qui maheignié se sent. 	qui afolez ce sent. 	735
767	Et Lancelos vient a l’autre 	et lanc̃ uient a lautre 	736
768	qui ja se relevoit, sel fiert de l’espee si grant cop 	que ia se releuois. |si le fiert de lespee si grant cop 	737|738
769	qu’il li fet le hialme voler en la place. 	que le hiaume li fait uoler en pieces. 	739
770	Et quant cil sent son chief nu, 	et quant cis sent son chief nu: 	740
771	si cria merci 	Si crie merci 	741
772	et dist 	et dit 	742
773	qu’il ne l’ocie pas, 	quil ne locie pas. 	743
774	kar il est pres de sa volenté fere. « 	Car il est pres de sa uolente faire. sans contredit 	744
775	Or te covient donc, fet Lancelos, fiancer	Or te couient |dont a fiencier fait lanc̃. 	745|746
776	que tu le cors mon seignor Galehout conduiras a la Dolerose Garde	que tu le cors Galeh̾. condiuras a la dolereuse garde. 	747
777	et iluec le feras garder 	et illuec le feras garder 	748
778	tant que je i viegne; 	tant que ie i uaigne. 	749
779	et se l’en te demande 	et se lon te demande 	750
780	qui t’i envoie, 	qui ti enuoie: 	751
781	si diras « cil 	Si diras 	752
782	qui ot les ames blanches le jor 	que cil qui ot les armes blanches. le ior 	753
783	que li chastials fu conquis. » 	que li chastiax fu conquis 	754
784	Et il li fiance 	et cil li fiance 	755
785	que tot ensi le fera il. 	que tout ainsi le fera il. 	756
786	Lors prent Lancelos la lame par le plus gros chief, 	Lors prent lanc̃. la lemme par le plus gros chief. 	757
787	si tire de grant force 	si la tire de si grant force	758
788	qu’a pou qu’il ne se deront tos, 	que a pou quil ne se desront tous. 	759
789	si que li sans li vole par mi le nes et par mi la boche et li cors li sue d’anguoisse. 	Si que li sans li uole parmi le nes et parmi la boche |et li cors li sue dangoisse 	760|761
790	Mais por tote la destrece ne remaint	mais portoie la destresce ne remaint 	762
791	qu’il n’ait la tombe levee en haut à; mes nule dolors 	que il nait la tombe leuee en haut. |mais nule dolors 	763|764
792|793	qu’il eust |onques ne monte rien a cele dolor 	que il eust onques ne monte sur rien. A cele 	765
794	qu’il ot, 	que il ot 	766
795	quant il vit le cors Galehout tot ensi armé 	quant il uit le cors Galehot. |ensi arme 	767|768
796	com il estoit; 	con il estoit. 	769
797	si trova s’espee delés lui 	si troua lespee deles lui 	770
798|799	qui molt estoit et bone et clere; |et sans faille de l’espee meesmes se fust il ocis, 	qui mout estoit bele et bone. et sans faille de lespee meismes 	771
800	se la damoisele ne li eust tolue erraument. 	ce fust il ocis |se la damoisele ne li eust tolue.	772|773
801	Lors fist Lancelos une biere fere de fust 	Lors fait lanc̃. faire une biere de fust 	774
802	et la fist covrir des plus riches pailes de laiens, 	et la fait courir des plus biax pailes de laiens 	775
803|804	et|quant il l’ot atornee al plus richement 	et quant il lot atornre au plus richement 	776
805	qu’il pot, li chevaliers prisons li dist: « Sire, fet il, 	que il pot. Li cheualiers prisons dit |si fait il	777|778
806	se l’en movoit tot de nuis, ce seroit sens. — 	se len mouoit tout de nuit se seroit sens. 	779
807|808	Por quoi ? fet il. — |Por ce	Por ce fait il 	780
809|810	que, |se li chevalier de cest païs savoient 	que ce li cheualier de cest pais sauoient 	781
811	que l’en len deust porter, il feroient gaitier les trespas 	que on le deust laiens porter: il feroient garder les trespas. 	782
812	si qu’il seroit arestés en alcun lieu ; 	si que il seroit arester en aucun lieu. 	783
813	et por ce vos loeroie je 	et porce loeroie ie 	784
814	qu’il meust orendroit, 	que il meust orendroit.	785
815	kar il seroit bien eslongiés, 	Car il seroit bien eslongiez .xx. lieues Galesches 	786
816	ains qu’il fust jors, XX. lieues englesches.	ains quil fust iors.	787
817	Et il s’i acorde bien; 	et il |si acorde bien. 	788|789
818	si met la litiere sor Il. palefrois amblans 	Si mestent la biere seur ii cheuaus anblans. 	790
819	et enportent ensi Galehout fors de sa region; 	et enportent ainsi Galeh̾. fors de la religion. 	791
820	si en font li frere grant duel 	Si en font li frere mout grant duel 	792
821	et molt en sont corocié et dolenta de ce 	et mout en sont dolent. et lanc̃ le conuoie gn̾t piece de nuit plorant et plangnant 	793
822|823	que l’en l’enporte. |Et Lancelos le convoie grant piece de nuis, plorant et regretant sa proesce et sa valor 	et regretant sa proesce. 	794
824	et se ne fust la damoisele 	et se ne fust la damoisele 	795
825	qui avec lui estoit molt en eust plus fet	qui auec lui estoit mout en eust plus fait 	796
826	qu’il ne fist, 	quil ne fist. 	797
827|828	mais ele l’en detorna, |et il deffendi al chevalier 	mais le le desfandi au cheualier 	798
829	que il nel feist en terre metre devant 	que il ne fust enterres 	799
830	que il fust venus. 	deuant que lanc᷑. i fust uenus.	800
831	Si se part atant li uns de l’autre 	Si se partent li un de lautre. 	801
832	et il retorne a l’abeie, 	et lanc̃ retorne a labeye	802
833	si se couche, 	et se coche 	803
834	c’onques la nuit 	ne onques la nuit 	804
835	ne volt mengier ne boivre por chose 	ne uot mangier ne boire por chose 	805
836	que l’en li deist, 	que len li deist. 	806
837	ains plora 	ains plora 	807
838	et dolosa tot adés; 	et dolosa tout ades.	808
839	si li anuioit molt li jors 	si li anuia mout li iors 	809
840	qui tant demoroit a venir. a Al matin, 	qui tant demora a uenir. Au mation 	810
841	si tost com li jors aparut, se leva	si tost com li iors aparut se lena lanc̃. 	811
842	et oi messe entre lui et la damoisele 	et oi messe entre lui et la damoisele. 	812
843	et puis s’arma. 	et puis sarma 	813
844	Lors » li dist ele les noveles de Boort 	et lors dist ele les nouelles de behort. 	814
845	et ce qu’ele en avoit veu devant Honguefort, 	et se quele en auoit uen deuant le chastel de honguefort. 	815
846|847	et il en fu molt liés. |Et ele li dist: « Sire, il vos vet querant 	et il en fu mout liez et ele li dist. Sire il uos ua querant 	816
848	ne jamés ne finera	ne ia mais ne finera	817
849	tant qu’il vos avra trové. — Damoisele, fet il, 	tant quil uos ait troue. |ha; damoisele fait il 	818|819
850	se vos le cuidiés trover ains de moi, je vos voldroie proier 	se uus le cuidiez trouer ains de moi. Ie uous uodroie prier 	820
851	que vos feissiés tant por moi 	que uous feissiez tant por amor de moie: 	821
852	que vos li portissiés ceste espee 	que uos li portissiez ceste espee. 	822
853	qui fu mon seignor Galehout, 	qui fu monsignor Gal̾. 	823
854	et li dites 	et li dires 	824
855	qu’il la DOrt de par moi, 	quil laport de par moi 	825
856	que molt est bone. » 	car mout est bone. 	826
857	Et ele dist 	et ele dist 	827
858	qu’ele le trovera par tens	que ele le trouera par tans.	828
859	et bien fera cest message; 	et que bien fera cest mesaige . 	829
860	si s’en part atant de lui et il s’en vet droit vers le chastel de Floego, 	Atant se part de lanc̃. la damoisele. |et il sen ua tout droit uers le chastel de floego. 	830|831
861|862	si i vint a hore de prime. |Et il esgarde es pres defors la vile, 	Si i uint a hore de prime et des garde es pres de fors La uille 	832
863	si voit molt grant gent entor le feu 	si auoit mout de gent entor .i. fe. 	833
864	ou l’en devoit ardoir la suer Meleagan», 		
865	et quant il aperçoit le feu, 	Et quant il aparsoit le feu 	834
866	si a poor de la damoisele. 	si a paor de la damoisele. 	835
867	Lors broche le cheval 	et lors broche li cheual 	836
868	et vint errant cele part 	et uient corant cele part. 	837
869	tant com il puet del cheval traire. 	tant|comme il puet de cheual traire. 	838|839
870	Et quant il est venus jusque la, 	et quant il uien iusque la	840
871	si esgarde 	si esgarde 	841
872	et voit la damoisele 	et uoit la damoisele 	842
873	qui ja estoit amenee al feu 	que ia estoit amenee au feu	843
874	por destruire, 	por destruire. 	844
875	si estoit en pure sa chemise et le tenoient. VI. pautonier, trois d’une part et trois d’autre; 	Si estoit en la pure chemisse |si la tenoien .ui. pautenier trois deuant et trois derier. 	845|846
876	si n’atendoient a geter le el feu fors le commandement as juges, 	Si natandoient a geter li el feu fort le comandement les menistres. 	847
877|878	et ele ploroit trop durement |et regretoit Lancelot: « 	et ele ploroit trop meruilleusement et regretoit lanc̾. 	848
879	Ha, gentilx chevaliers Lancelos,	ha gentil cheualiers lanc̃. 	849
880	kar pleust ore a nostre Salveor 	car pleust ore a dieu 	850
881	que vos seuissiés ceste novele, 	que uos seussiez ceste nouelle. 	851
882	si fuissiés pres de ci a demie lieue! 	et uos fussiez pres de ci a demi lieue. 	852
883	Certes a l’aide de Dieu	Certes a laide de dieu 	853
884	et de la vostre seroie je encore anuit rescosse malgré tos mes enemis. 	et ala uostre seroie ie encore ennuit rescouce maugre mes anemis. 	854
885	Mais vos ne le savés pas a, 	Mais uos ne le sauez pas 	855
886	si me covendra ore morir por la vie 	si me couanra morir. por la uie 	856
887	que je vos sauvai emprés Dieu; 	que ie uos sauuai apres dieu.	857
888|889	mais certes il ne m’en poise pas tant |por moi 	mais certes il ne men poise pas tant por moi 	858
890	com il fet por le coros 	comme por uos. por le corrous 	859
891	que vos en avrois, 	que uos en arrois 	860
892	quant vos le savrois. 	quant uos le saurois.	861
893	Mais ce me reconforte molt 	mais ce me reconforte mout. 	862
894	que je sai bien 	que ie sai bien 	863
895	que les damoiseles gaaigneront tant en ma mort 	queles damoisele gaangneront tant en ma mort 	864
896	que jamés nule ne vos requerra d’aide 	que iamais nule ne uos requerra a aide.	865
897	que vos li faillois tant com il vos remenbre de moi, 	que uos li faillois tant |comme il uos membera de moi. 	866|867
898	kar vostre cuers est si frans 	Car uostres cuers est si sains 	868
899	qu’il ne puet estre sans trop grant merites rendre a totes celes 	quil ne puet estre sans grant merites rendre a totes celes 	869
900	qui de par moi se reclaiment: 	qui de par moi se reclameront. 	870
901	si m’est avis	Si mest	871
902	qu’il m’est molt miels a m’ame de morir 	auis que il est miex a marme de morir por la loiaute faire et por oster de prison 	872
903	por loialté fere et por geter de prison si vaillant home comme vos 	si uaillant home |comme uos estes ; 	873|874
904	que vos fuissiés mors par la desloialté de Meleagan 	que uos fussiez mors par la desloiaute meleagant 	875
905	qui en prison vos avoit mis par traïson. » 	qui uos auoit mis en prison par traison. 	876
906	Ensi disoit la damoisele molt tendrement plorant et lors vint Lancelos poignant cele part 	ANsi dissoit la damoisele ml̃t tandrement en plorant. |et lors uint lanc̃. cele part 	877|878
907	ou il la vit: 	ou il la uit. 	879
908	si dist a cels 	et dit a ciax 	880
909	qui le tenoient: « Laissiés la damoisele! — 	qui la renoient Laissiez la damoisele. 	881
910	Por quoi, sire, fet J. chevaliers armés 	Por qoi sire fait uns cheualiers 	882
911	qui avant saut, le lairons nos ? — 	qui auant saut |por quoi la lairons nous. 	883|884
912	Por ce, fet il, 	Por ce fait il 	885
913	que vos n’avés droit en li por fere mal. — 	que uous ni auez droit en li faire morir.	886
914	Si avons, fet cil, si grant 	Si auons fait cil 	887
915	que nos l’avons atainte de murdre 	que nos lauons atainte do mudre 	888
916	dont je l’apelai, 	que nos li meciens sus. 	889
917	et ele s’en offri a deffendre,	et ele sen offri a desfandre. 	890
918	mais ele ne trova onques 	Mais ele ne troua onques. cheualier 	891
919|920	qui |por li en prist escu 	qui por li enprrist escu. 	892
921	et ce n’est pas merveille, 	et se nest pas m̾ueille 	893
922	que chescuns set bien 	que chascuns set bien 	894
923|924	quele en a desloialment ovré. — |De quoi ? fet Lancelos. — 	comment ele en a erer de coi fait lanc̃. 	895
925	De ce, fet il,	Decce fat cil 	896
926	qu’ele delivra Lancelot por Meleagan ocirre, son frere. — 	que ele deliura lanc̃. |por ocirre meleagan son frere. 	897|898
927|928	Se vos, fet Lancelos, |osiés mostrer 	Ce uos fait lanc̃. le uoliez mostrer 	899
929	qu’ele eust fet traïson ne murdre, je seroie pres del deffendre. — 	que ele fist traison ne murdre: Ie seroie pret del desfandre 	900
930	Qui estes vos? fet cil. — Uns chevaliers sui, fet Lancelos, 	Qui estes uos fait cil. uns cheualiers sui fait cil. 	901
931	qui vieng ceste part 	Qui uing ceste part 	902
932	por ceste damoisele deffendre. —	por li desfendre. 	903
933	Par foi, fet cil, 	Par foi fait cil. 	904
934	se je voloie, il ne m’en covendroit ja combatre, 	Ce ie uoloie il |ne men conuanroit ia conbatre. 	905|906
935	kar des ier en est ! ele atainte, 	Car des ier eu est ele ia atainte. 	907
936	puis qu’ele ne pot trover 	puis que ele ne post trouer 	908
937	qui la deffendist, 	qui la desfandist. 	909
938	mais je sent ma querele a si loial et si droituriere 	mais ie sen ma querele si aloial. et si a droituriere; 	910
939	qu’il n’a chevalier el monde 	quil na cheualier el monde uers	911
940	vers cui je ne l’osaise bien prover au ? grant droit 	cui ie ne lo fasse bien prouer au grant droit 	912
941	que je i ai. — En non Dieu, fet Lancelos, 	que gi ai. |EN non dieu fait lanc̃. 	913|914
942	or i parra, 	or i parra. 	915
943|944	que je sui pres que je la desfende vers vos. — Voire, fet cil, par mon chief, |et vos en morrois comme traitres et desloials. »	car ie sui pres que ie la deffande uers uos. Uoire fait cil. par mon chief et uos en morrois comme traites et desloiax. 	916
945	Lors traient la damoisele loins del feu 	Lors traient la damoisele ensus del feu 	917
946	et li chevalier s’entreslongent li uns de l’autre, 	et li cheualier sentͤa longuet li uns de lautre. 	918
947	si s’entrevienent 	Si sentreuienuent nent 	919
948	si tost com li cheval pueent aler	si tost conli cheuaus lor pueent aler. 	920
949	et s’entrefierent des glaives si durement 	Si sentrefierent des glaiues si durement 	921
950	qu’il les font voler en pieces;	quil les font uoler en pieces. 	922
951	puis s’entrehurtent si des cors et des visages 	puis sentrehurtent des cors et des uisages. 	923
952	qu’il n’i a celui	Si que il ni a celui	924
953	qui tos ne soit estordis et desconreez. 	qui tous ne soit estordis et desconrares. 	925
954	Mais li chevaliers par est si estonés 	mais li cheualiers est Si estordis 	926
955	qu’il ne se puet tenir en sele, 	quil ne se puet tenir en sele 	927
956|957	ains vole jus del cheval |et al parchaoir feri li quins del hialme en la terre, 	ains bale a terre. et au parcheoir feri li coins en cͣre del hiame. 	928
958	si qu’a bien pou qu’il n’a le col brisié. 	Si qua bien pou |que cil na le col brisie. s 	929|930
959|960	Et|quant Lancelos a fet son tour, 	quant lanc̃. a fait son cor 	931
961	si descent, 	si descent 	932
962	kar honte li seroit de requerre a cheval celui 	Car honte li fust de requerre a cheual celui 	933
963	qui est a pié; 	qui estoit a pie. 	934
964	si trait l’espee	Si trait lespee 	935
965	et cort sus a celui 	et cort sus celui 	936
966	qui ja se relevoit, 	qui ia ce releuoit. 	937
967	si li done par mi le hialme tel cop 	Si li done si grant cop parmi le hiaume 	938
968	qu’il le fet a terre flatir des paumes et des genols ; 	quil le fait uoler a terre des paumes et des ienos. 	939
969|970	puis recuevre I. autre cop |et le fiert 	Si quil recueure un autre cop 	940
971	si qu’il le fet tot parchaoir 	si quil le fait tout parcheoir. 	941
972	et le prent par le hialme, 		
973|974	si le traine jusqu’al feu |et le gete dedens.	et lors le prent par le hiaume et le traine iuscau feu. et le gecte dedens. 	942
975|976	Et cil estoit si estordis |et tant avoit perdue la force del cors 	et ciz estoit si estordiz et tant auoit perdu la force dou cors 	943
977	que relever ne se pot, 	que releuer ne se puet. 	944
978	si le covint remanoir el feu	si le couint remanoir 	945
979	et morir en tel maniere. 	et morir en tel maniere. 	946
980	Et lors vienent avant cil 	Lors uiennent auant cil	947
981	qui le champ gardoient, 	qui le feu gardoient. 	948
982	si dient a Lancelot 	Si dient a lanc̃. 	949
983	qu’il en a assés fet et li rendent la damoisele saine et haitiee, 	quil auoit assez fait.|et li rendent la damoisele sainne et haitie. 	950|951
984|985	et il la fet vestir,|puis li demande 	et il la fait uestir. pus Li demande 	952
986	qu’ele velt 	que ele uet 	953
987	qu’il face mes. « Sire, fet ele,	que il face mais. |SIre fait ele 	954|955
988	que vos me menés a salveté a mon chastel. » 	que uos me remenez a mon chastel. 	956
989	Et il dist 	et il dit	957
990	que volentiers: 	si fera il. 	958
991	si le fet monter 	Si la fait monter 	959
992	et le conduit jusqu’al chastel	et la conduit iuscau chastel	960
993	ou ele l’ot gardé maint jor. 	oue ele lauoit garde maint ior. 	961
994|995	Li chastials avoit non Galefort|et seoit sor une petite riviere, 	Ciz chastiax auoit non Balefort et seoit sor une petite riuiere. 	962
996	si estoit molt aaisiés de totes choses 	Si estoit mout aisiez de totes choses:	963
997	et fors a merveille, 	et fors a merueillens. 	964
998|999	Et quant Lancelos vint la, il ne fet pas a demander |se l’en li fist joie, 	et quant lanc̃. uint la il ne fait pas a demander cil en fist ioie. 	965
1000	kar cil del chastel savoient ja bien 	Car cil del chastel sauoien ia bien 	966
1001	que lor dame estoit delivree par I. chevalier	commen lor dame estoit deliuree par .i. cheualier 	967
1002	qui o li venoit. 	qui o li uenoit 	968
1003	Et quant il le virent, 	et quant il le uirent 	969
1004	si le reçurent a si grant joie 	Si le resurent a si grant ioie 	970
1005	com se ce fust Damedieu meismes 	comme ce fudt diex meismes. 	971
1006	et s’agenoillent tuit devant lui 	et sagenoillent deuant lui par la 	972
1007	et crioient a une vois tuit ensamble : « Sire, sor tos cels del monde soiés vos bien venus, 	ou il uenoit. |Et crioient a une uois tuit ensanble. Sire sor tous ciax dou monde soiez uous li bien uenus. 	973|974
1008	qui nostre grant duel avés torné en grant joie !» A tel feste ont laiens Lancelot receu 	Car nostre grant duel auez atorne a ioie. a tous iors mais. A tel Ioie out lanc̃. receut. 	975
1009	et quant il ont la damoisele descendue devant son mestre palés, 	Et quant il ot la damoisele descendue deuant son palais 	976
1010	si s’en volt aler maintenant, 	Si sen uoloit aler maintenant. 	977
1011	kar il n’estoit mie encore plus de tierce. 	Car il niert encore plus de tierce. 	978
1012	Mais ele le prist al frain 	mais ele le print au franc 	979
1013	et le fist descendre a fine force a 	et le fist descendre a fine force. 	980
1014	et dist: « 	et li dist. 	981
1015	Par Sainte Crois. vos ne m’eschaperois mie ensi. » 	Par foi sire cheualiers |ainsi ne meschaperes uos mie. 	982|983
1016	Lors le commande a desarmer et vaslet saillent avant 	et lors li comande a desarmer. |et uarles saillent	984|985
1017	por fere son commandement a; 	por faire son coumandement. 	986
1018	et tantost 		
1019|1020	com il ot son hialme osté |et ele le conut, 	et tantost comme il a oste son hiamre ele le quenoit. 	987
1021	si li cort les bras tendus 	Si li cort les bras tandus 	988
1022	et le volt baisier en la boche, 	et le uet baisier a force en la boche. 	989
1023	quant il li guenchist, 	quant il li guenchit 	990
1024	et ele li baise la face et le col et le menton, 	ele li baise la boche et le col et le menton. 	991
1025	puis que autre chose n’em puet avoir ; 	puis que autre chose nen puet auoir. 	992
1026	si plore de pitié 	Si pleure de pitie 	993
1027	et li dist: « 	et dit 	994
1028	Ha, gentilx chevaliers, 	ha: gentiz cheualiers 	995
1029	tant vos avoie desirré a veoir 	tant uos auoie desire a ueoir. 	996
1030|1031	ains |que je moreuisse! 	ains que ie morisse. 	997
1032	Mais comment l’avez vos puis fet?,	Mais coment lauez uos puis fait 	998
		que ie ne uos ui. 	999
1033	Et il li dist : « Bien, Dieu merci. — 	et il dit mout bien la dieu merci. 	1000
1034	Et ceste part, fet ele, 	Et ceste part fait ele 	1001
1035	comment venistes vos, 	comment uenistes uos 	1002
1036	qui avant ier vos en partistes ? — 	qui auant ier uos en partites. 	1003
1037	Par foi, fet il, une grant acheison. m’i amena. »	Par foi fait il une grant ocoisons mi amena. 	1004
1038|1039	Si li conte |comment. I. chevalier o unes armes vermeilles l’avoit apelé de traïson a la cort le roi Artu por la mort de Meleagan; 	Puis li conte coment uns cheualiers a unes armes uermeilles lauoit apele de traisson a la cort le roi artu. por la mort de meleagͣ. 	1005
1040	si l’en covient a deffendre en la cort le roi Baudemagu. « 	Si li couient a desfandre en la cort le roi bademagu de gorre. 	1006
1041	Ha, fet ele, je sai bien 	Ha; fait ele ie sas bien 	1007
1042	qui il est. 	qui il est. 	1008
1043	C’est Argodras li Ros et li chevaliers 	Cest agodras li rous. et li cheualiers cui uos auez ocis 	1009
1044	que vos avés hui ocis et ars estoit ses freres; 	et ars hui en cest ior. estoit ses freres.	1010
1045	si ne sai 	Si ne sai 	1011
1046	que vos puissiés fere, 	que uos en puissiez faire. 	1012
1047|1048	kar se mes peres |set 	Car ce mes peres cest 	1013
1049	que vos aiés ocis Meleagan, je criem	que uos auez ocis mel̾. mon frere ie crien 	1014
1050	qu’il ne vos face ocirre por le grant duel 	que il ne uos face ocirre por le grant duel 	1015
1051|1052	qu’il avra des noveles. — |Coment ? fet Lancelos, 	que il en auoi. Coument fait lanc̃. ne le cest il encore pas. 	1016
1053|1054	nel set il mie encore ? — |Certes, sire, nenil; 	Si maist diex fait ele nenil. 	1017
