0	avoir trové. » 	auoir troue 	0
1055	si est Meleagans en cest païs aportés plus a de XV. jors 	Si est mell. aporte en cest pais bien a .xu. iors. 	1018
1056	et est el chastel des Illl. Pierres et le gardent iluec si celeement 	et est el chastel de .iiii. pierres. |et le gardent la 	1019|1020
		si celeement 	1021
1057	que li rois n’en set encore riens:	que li rois nen cest encore riens. 	1022
1058	si en covendra esploitier al plus sagement que vos porrois. 	si uos en couenra esploitier au plus saigement 	1023
1059	Mes a	que uos porrois 	1024
1060|1061	quant est li jors |que vos vos en devés deffendre? » 	Et quant est li iors que uos nous en deuez desfandre. 	1025
1062	Et il dist 	et il dit 	1026
1063	que c’est le jor de la Magdalaine. « 	que cest le ior de la magelainne. 	1027
1064	Or vos en conseut Diex, fet ele. 	Or uas en consaut fait ele diex. 	1028
1065	kar j’ai grant poor 	que iai grant paour 	1029
1066	que Argodras ne vos face anui par traïson. — 	que agodras ne uous face anui par traison. 	1030
1067	De ce, fet il, n’aiés ja garde! Tot son pooir en face, 	De ce fait il naiez ia garde tout son pooir en face 	1031
1068|1069	que je n’en avrai ja poor. » |Assés parlerent cele nuit de maintes choses a 	que ie ne le dout pas. Assez parleren cele nuit de maintes chosez. 	1032
1070	et molt firent cil del chastel grant joie de lor dame 	et mout firrent cil del chastel grant Ioie de lor dame 	1033
1071	qu’il cuidoient avoir perdue, 	que il cuidoient auoir perdue. 	1034
1072	et or l’ont saine et haîtie 	et orlat sainne et haitie. 	1035
1073	Et al matin, 	Et au matin 	1036
1074	si tost	quant li iors aparut biax 	1037
1075	com li jors parut cler, se leva Lancelos 	et clers se leua lautre de son lit 	1038
1076	et se parti de la damoisele, 	et se parti de la damoisele 	1039
1077|1078	quant il fu armés; |et ele le commande molt a Dieu 	Quant il fu armez la damoisele comande a 	1040
1079	et li pria 	dieu.et li prie 	1041
1080	qu’il s’en revenist par li al repairier; 	que il sen reuenist par li au repairier. 	1042
1081	et il dist 	et il dit 	1043
1082|1083	que si feroit il, |s’il pooit. 	que si feroit il se il puet. 	1044
1084	Si se remet en son chemin 	et il se remest en son chemin. 	1045
1085	et eirre tot le jor jusqu’al vespre 	et erre iuscau uespre. 	1046
1086	et lors aproche d’une riviere 	et lors aproche une riuiere 	1047
1087	que l’en apeloit Aglonde, 	que len apele aglode. 	1048
1088	si en estoit l’eve molt parfonde	et si en estoit leue parfonde 	1049
1089	et molt noire. 	et mout noire. 	1050
1090	Et quant il vint pres de l’eve, 	et quant il uint pres de leue 	1051
1091	si vit trois paveillons tendus pres de la rive; 	si uit .iii. pauillons. tandus delez la riuiere. 	1052
1092	si en estoit li uns grans et bials 	et en estoit li uns grans et biax. 	1053
1093	et li autre dui estoient moien. 	et li autres estoient 	1054
1094	Et lors issi del greignor paveillon I. chevaliers tos desarmés 	moien.et lors issi de lun des pauilons uns cheualiers tous armez 	1055
1095	qui li dist 	qui li dit	1056
1096	que bien soit il venus, 	que bien soit il uenus. 	1057
1097	et il li rent maintenant son salu. «	et il li rent tout maintenant son salu. 	1058
1098	Ha, sire, fet il, vos me samblés chevaliers errans 	ha: Sire uos me sanblez cheualiers errans 	1059
1099	et je aim tos cels 	et ie ain tous seus 	1060
1100	qui en tel mestier usent lor vie, 	qui en tel maniere ussent lor uie. 	1061
1101	kar je meismes sui chevaliers errans 	Et ie meismes sui cheualiers errans 	1062
1102	et por ce vos vueil je proier 	Si uos uoroie prier. 	1063
1103	que vos herbergiés anuit mes o moi; 	que uos herberresiez hui |mais auec moi ennuit. 	1064|1065
1104|1105	kar se vos passés avant de ci, vos ne troverois |se forest non, si salvages 	Car ce uos passez de ci uos ne trouerois ce fores non si sauuages: 	1066
1106	que vos i porrois tost desvoier. 	que uos i porrois moutost desuoier. 	1067
1107	Et il est bien tens de herbergier, 	et il est bien tans de herbreger. 	1068
1108	ce veés vos bien : 	ce ueez uus. 	1069
1109	por ce vos lo 	Por ce uos loie|que uus remenois 	1070|1071
1110|1111	que vos remanois et vos avrois ostel bel |et buen tot a vostre voloir. — 	et uos aurois ostel et bel et bon au ren chois 	1072
1112	Bials sire, fet Lancelos, 	Biax sire fait lanc̃ |des 	1073|1074
1113	puis qu’il vos plest, je remaindrai et por vostre proiere et	que il uos plait ie remendrai |por uostre proiere 	1075|1076
		et 	1077
1114|1115	por ce |que vos dites 	por ce que uos me dites 	1078
1116	que vos estes chevaliers errans. a,	que uos estes cheualiers errans 	1079
1117	Lors descent et vaslés saillent des autres paveillons, 	com ie sui Ices descent lancel. |et uarles saillent des autres pauillons. 	1080|1081
1118	si le desarment et li aportent I. mantel de samit legier a afubler por le chaut	si le desarment |et li portent un mantel de samis uermeil legier por le chaut 	1082|1083
1119	qui grans estoit ; 	qui grans estoit 	1084
1120	si le mainent el grant paveillon avec l’autre chevalier. 	si le mainnent el grant pauillon entre lui et le cheualier. 	1085
1121	Et lors parlerent ensamble 	et lors parolent ensanble entre lui et ses grans cheualiers. et lanc̃. 	1086
1122|1123	et s’entracointierent |et demanda li uns a l’autre de son estre ». 	et satracointent. et demande li uns a lautre de son estre. 	1087
1124|1125	Li chevaliers enquiert a Lancelot |dont il vient 	Si demande li cheualiers don il uient 	1088
1126	et ou il vet 	et don il ua. 	1089
1127|1128	et quele aventure le maine |si sol,	et quel auanture le mainne si seul. 	1090
1129|1130	et il li conte une partie de son estre |et autre l’en çoile e; 	et il li conte une partie de son estre et une partie len soile. 	1091
1131	et totes voies li dist 	et totesuoie li dit 	1092
1132	que en la cort al roi Baudemagu voldroit estre por soi deffendre vers un chevalier 	que a la cort bademagu: uodroit estre. |por soi desfandre uers un cheualier. 	1093|1094
1133	qui l’a apelé de traïson. 	qui apelela de traison. EN ce 	1095
1134	En ce qu’il parloient ensi, orent li escuier mise la table, 	quil parloient ensamble. |si ont li escuier misses les tables. 	1096|1097
1135	si vont laver; 	Si ont laue. 	1098
1136	si s’asiet Lancelos et li chevaliers et une damoisele 	Si ont assis lanc̃. et le cheualier et une damoisele 	1099
1137	qui molt ert bele 	qui mout estoit bele. 	1100
1138	et estoit amie al seignor de laiens; 	et estoit amie au signor de Laiens. 	1101
1139	si mengierent tuit troi ensamble. 	Si mengerent cui troi ensenble 	1102
1140	mes cele 	mais cele 	1103
1141	qui Lancelot esgarde ne se puet saoler de lui veoir, 	qui lanc̃ esgarde ne se puet saouler de lui esgarder. 	1104
1142	Kar tant li samble bials 	Car tant li sanble biax: 	1105
1143	qu’ele ne prisa onques mes bialté d’ome envers cesti : 	que ele ne prisa onques mais biaute |a ome enuers la soie nule rieu. 	1106|1107
1144	si l’esgarde si viselment 	Si le regarde si uiseument 	1108
1145	que tot en laisse le mengier n’a autre chose n’entent. fors a lui remirer. 	que tout en laisse le mengier.|Na autre chose nentant fors a lui remirer. 	1109|1110
1146	Si ont li escuier osté le premier mes de sor la table 	Si ont li escuier oste le premier mes desus la table 	1111
1147	c’onques la damoisele n’en tasta, 	que onques la damoisele nen tata. 	1112
1148	ains pensa totes voies.	ains pance totesuoies . 	1113
1149	Et en cel pensé li descent el cuer une si grant amor	et en se panser li dessent une|si tresgrant amor 	1114|1115
1150	qu’ele aime Lancelot outre ce 	que ele aimme lautͣ. outre ce 	1116
1151	que feme n’ama mes home; 	que fame nemma mais home. 	1117
1152	si li est avis 	Si li est bien auis 	1118
1153	que s’il l’amoit 	que ce il lenmoit 	1119
1154	qu'ele seroit beneuree. 	que ele seroit bone euree. 	1120
1155	Mais ci endroit n’em parole plus li contes, 	mais ci endroit nen parole plus li contes.	1121
1156	kar ça avant le devisera 	Mais sa auant en la deuine page le uos deuisera il bien.	1122
1157	et comment ele l’ama merveillosement 	et coment ele lenma meruilleusement 	1123
1158	et comment ele le proia et la merveille 	et coment ele le proia.et la merueille	1124
1159	que ses amis en fist, 	que ses amis en fist 	1125
1160	quant il sot 	quant il sot 	1126
1161	qu’ele l’amoit, 	que ele lemmoit. 	1127
1162	et comment cele morut	et coument ele morust porce 	1128
1163|1164	por ce qu’il la refusa, |tot ce vos trespassera li contes ci endroit 	que il la refasa. Tout ce nos trespasera li contes ci endroit. 	1129
1165	por deviser une aventure 	por deuiser une auanture 	1130
1166|1167	qu’il lor avint el paveillon |ou il estoient. 	qui lor auint el pauillon. 	1131
1168	Ci dist li contes 	OR dit li contes 	1132
1169|1170	que, |quant il orent le secont mes eu, es vos un chevalier armé d’unes armes vermeilles 	que quant il orrent le secont mes eu. E uous un cheualier arme a unes armes uermeilles. 	1133
1171|1172	qui vint corant par devant le paveillon o grant compaignie de chevaliers. |Et cil as armes vermeilles 	et uuit acorant par deuant le pauillon o grant compangnie de cheualiers. et ciz as armes uermeilles 	1134
1173	qui devant venoit entre el paveillon a et voit. I. escuier 	qui deuant uenoit: entra el pauillon. |et uoit un escuier 	1135|1136
1174	qui servoit a la table, 	qui seruoit a la table. 	1137
1175	si estoit freres al chevalier de laiens. 	et estoit freres au cheualier de laiens. 	1138
1176	Et il cort maintenant cele part, 	et il cort maintenant cele part 	1139
1177	si le prent par les espaules 	et le prant as espaules	1140
1178	et le lieve devant lui sor l’arçon de la sele, si s’en torne a tot. 	et le trait deuant lui sor larson de sa cele. |Si sen torne atant 	1141|1142
1179	Et quant cil del paveillon voit ce. 	et quant cil del pauillon uoit ce: 	1143
1180	si crie a Lancelot: « 	Si crie a lanc̾. 	1144
1181|1182	Ha, bials sire, je sui mors, |se cil enporte ensi mon frere, 	a biax sire ie sui mors ce ciz en porte mon frere. 	1145
1183	kar il l’ocirra, 	Car il locirra ia. 	1146
1184	s’il n’est secors: 	ce i nest cecorus. 	1147
1185	si vos pri por Dieu 	Si uous pri por dieu 	1148
1186	que vos i metés paine. » 	que uos metes painne en lui rauoir. 	1149
1187	Et Lancelos saut de la table 	Et lanc̃ saut de la table 	1150
1188	et demande ses armes, 	et demande ses armes. 	1151
1189	et I. escuiers vint avant,	et uns escuiers saut auaut	1152
1190	si li dist : « 	si li dist. 	1153
1191	Par foi, sire, vos armes et vostre cheval enmainent il ! — 	Par foi sire et uos armes et uostre cheual enmainnent il. uoire fait cil: 	1154
1192|1193	Voire, fet il. par mon chief, ja|por ce ne remaindra 	par mon chief iaporte ne remandra 	1155
1194	que je nes sieve.» 	que ie nes sieue. 	1156
1195|1196	Lors vient fors del paveillon |et li chevaliers o lui 	Lors uient fors del pauillon et li cheualiers o lui 	1157
1197	et il esgarde cels 	et regardent cex 	1158
1198	qui s’en vont 	qui sen uont. 	1159
1199	qui ja avoient passé l’eve par J. pont de fust;	qui ia auoiet passe leue par .i. poncel de fust. 	1160
1200	et Lancelos demande al chevalier 	et lanc̃. demande au cheualier 	1161
1201	s’il remaindra. « Sire, fet il, nenil,	ce il remaindra. Sire fait cil non. 	1162
1202	ains vos ferai compaignie 	ains uos ferai compangnie. 	1163
1203	tant que nos aions trové 	tant que nos aions troue 	1164
1204	qui armes vos baut. » 	qui armes nos baut. 	1165
1205	Lors acueillent lor voie tot a pié 	Et lors acuellent lor uoie. tout a pie. 	1166
1206	et vienent au pont, 	et uienent au pont 	1167
1207	si passent outre 	si passent outre. 	1168
1208|1209	et s’adrecent a I. tertre |par ou li chevalier s’en vont; 	et sadrescent au tertre par ou li cheualiers sen ua. 	1169
1210	si n’ont gaires alé 	Si nont gaires ale 	1170
1211	quant il encontrent I. chevalier armé d’unes armes noires 	quant il uoient .i. cheualier arme a unes armes noires. 	1171
1212	qui venoit al pont par I. chemin de travers. 	qui uenoit au pont par .i chemin de de trauers. 	1172
1213	Et quant il voit Lancelot, 	et quant il uoit lanc̃	1173
1214	si s’areste 	si sareste 	1174
1215	por ce que bien le conoissoit, 	por ce que bien le quenoissoit. 	1175
1216	si li demande 	Si li demande ou il ua 	1176
1217	ou il vet ensi a pié tos desammés. « 	Si a pie et ansi desarmes 	1177
1218	Qui estes vos, sire chevaliers, fet Lancelos, 	Qui estes uos fait il sire cheualiers 	1178
1219	qui me demandés 	qui me demandes 	1179
1220	ou je vois ? — Je sui, fet il, I. chevaliers d’estrange païs, 	ou ie uois. Ie sui fait il de cest estrange pais. 	1180
1221	mais molt me merveil de ce 	mais mout me merueil de ce 	1181
1222	que je vos voi ensi aler. » 	que ainsi uos uoi aler. 	1182
1223	Et Lancelos li conte 	et lanc̃. li conte 	1183
1224	comment il estoit herbergiés et	comment il estoit ainsi herbregiez. 	1184
1225|1226	comment I. chevaliers vint laiens |ou il menjoit, 	et coment li cheualiers enporte lescuier. 	1185
1227	qui prist a force I. vaslet 		
1228|1229	et le mist sor le col de son cheval. «|Et encore m’a il plus meffet, fet Lancelos, 	et encor ma il plus mesfait fait fait lanceloz. 	1186
1230	kar cil 	Car cil 	1187
1231	qui avec lui vindrent enporterent mes armes 	qui auec lui uindrent enportent mes armes. 	1188
1232	et enmenerent mon cheval. — 	et en mainnent mon cheual. 	1189
1233|1234	Quel guerredon, fet cil, |porroie je atendre de vos, 	Quel guerredon porroi ge atandre de	1190
1235|1236	se je por vos me desarmoie |et vos bailloie mes armes et mon cheval ? — 	uus se ie uos bailloie mes armes et mon cheual. 	1191
1237	Certes, fet Lancelos, 	Certes fait lanc̃. tel 	1192
1238	tel com vos deviseriés. — 	com uous deuiserois. 	1193
1239	Se vos, fet il, el premier lieu 	Ce uous fait cil me creantes |que el premier lieu 	1194|1195
1240	ou je vos troverai armé, 	ou ie uos troueroie arme 	1196
1241	por que je soie desarmés, me creantés a doner vos armes » Ie vos bailleroie les moies. — 	puis que ie fusse desarmes me donriez uos armes. le uous bailleroie les moiees. 	1197
1242	Certes, fet Lancelos, 	Certes fait cil 	1198
1243	si ferai je, 	si ferai ge 	1199
1244|1245	por que vos ne me truisiés combatant. » |Et cil descent maintenant, 	puis que uos ne me trussiez conbatant. et cil descent maintenant 	1200
1246	si se desarme et baille a Lancelot tot son hernois, 	si se desarme. |et baille a lanc̃ son harnois.	1201|1202
1247	et il s’en appareille 	et il sarme 	1203
1248	et monte en son cheval, 	et monte en son cheual. 	1204
1249	puis dist a son oste 	Puis dit a son oste 	1205
1250	qu’il s’en retort; Imes il dist 	quil sen retort |et il dit 	1206|1207
1251	que non fera. « 	que non fera. 	1208
1252	Si ferois, fet Lancelos a lar je conoistrai bien les armes a celui 	Si ferois fait lanc̃. |Car ie quenoistrai bien ciax as armes 	1209|1210
1253	que je vois querant en quelque lieu je les truisse. 	que ie uois querant en quel que lieu |que ie les truisse. 	1211|1212
1254	Et cil dist, 	et cil dit	1213
1255|1256	puis qu’il velt, |s’en retornera: 	puis quil le ueit il sen retornera. 	1214
1257	si s’en vet 	Si sen ua 	1215
1258	et enmaine o lui le chevalier 	et enmainne le cheualier auecque lui. 	1216
1259	qui molt est liés de ce 	qui mout est liez de ce 	1217
1260	que Lancelos li doit I. guerredon. 	que lanc̃ li doit guerredoner. 	1218
1261	Et Lancelos aquelt son chemin aprés cels 	Et lanc̃ aquiet son chemin apres ciax 	1219
1262	que ? il sieut 	que il sieut. 	1220
1263|1264	tant |qu’il est venus el tertre en haut 	tant que il est uenus el haut tertre. 	1221
1265|1266	et lors voit devant lui la forest|que l’en apele la forest des Trois Perilx, 	et lors uoit deuant lui la forest des trois perilx. 	1222
1267	et ce 	et ce porquoi ele fu	1223
1268	por quoi ele fu ensi apelee devisera bien li contes ça avant. 	ainsi apelee ce deuissera li contes sa auant. 	1224
1269	Quant il fu amont el tertre, 	Quant lanc̃. fu amon el tertre 	1225
1270	si esgarde devant lui, 	si regarde 	1226
1271	mais il ne voit nul de cels 	Mais il ne uoit deuant lui nus de ciax 	1227
1272	que il queroit, 	que il guiert. 	1228
1273	kar il s’estoient ja ferus en la forest. 	Car il cestoient ia feru en la forest.	1229
1274	Et totes voies sieut il les esclos des chevals	et totesuoiez sieut il les escloz des cheuaus. 	1230
1275	tant que il vient a l’entree de la forest; 	tant que il uient en lentree 	1231
1276	et lors encontre une damoisele tote chenue 	et lors encontre une dame tote chenuee. 	1232
1277	qui chevalchoit molt cointement 	qui cheuauchyt mout coitement. 	1233
1278|1279	et estoit tote deslie, ses treces par ses espaules comme pucele |et avoit en son chief l. chapel de roses, 	et ert tote desliie.ses tresces par ses espaules comme pucele. et auoit en son chief un chapelat de rosez. 	1234
1280	kar c’estoit entor la Saint Johan. Il le salue 	Car cestoit Entor la feste saint iehen. Il la salue 	1235
1281	et ele li dist 	et ele li dist 	1236
1282	que bone aventure li doinst Diex. « Damoisele, fet il, me savriés vos a dire 	que bone auauture li doint diex. Dame fait lanc̃. me saurrez uos adire 	1237
1283	quel part uns chevaliers o unes armes vermeilles s’en vet ? — 	quel part uns cheualiers a unes armes uermeilles sen ua. 	1238
1284	En non Diex, fet ele, je le vos enseigneroie bien, 	En nodieu fait ele ie le uos ensangneroie bien 	1239
1285	se je voloie. — 	ce ie uoloie. 	1240
1286|1287	Dites le moi, fet il, |par covent 	Dites le moi fut il par couent 	1241
1288	que je soie vostre chevaliers el premier lieu 	que ie soie uostres cheualiers el premier lieu	1242
1289	ou vos me requerrois. — 	ou ie buos trouerai. 	1243
1290	Se vos me creantés, fet ele,	Se uous me uoles creanter 	1244
1291	que vos me sievrois de quel hore 	que uos me siere de quel hore 	1245
1292	que vos en semoigne, je le vos enseignerai. » 	que ie uus en semongne ; ie le uos en sangnerai. 	1246
1293	Et cil li creante, 	et il li creante. 	1247
1294	dont il se repenti puis molt durement tel hore fu. « 	dont il se repanti |puis mout durement tel hore fu. 	1248|1249
1295	Or alés, fet ele, tot cest chemin», 	Or uos en alez fait ele par|ci 	1250|1251
1296	si li mostre I. sentier estroit 	si li mostre .i. estroit santier 	1252
1297	qui aloit al travers de la forest. « 	qui aloit outre uers de la forest. 	1253
1298	Si ne tornés, fet ele, de nule part 	Si ne tornez de nule part. 	1254
1299	et quant vos avrois alé entor demie lieue, 	et quant uos aures ale entor demie lieue : 	1255
1300	si verrois delés I. vivier trois paveillons tendus. 	si uerres delez .i. uanier aux pauillons tandus. 	1256
1301	La dedens troverois le chevalier 	La dedens troueres le cheualier 	1257
1302	que vos querés 	que uos queres 	1258
1303	que l’en apele Arramant le Gros; 	que len apele arramant le gros. 	1259
1304	si le conoistrois a ces enseignes 	Si le quenoistres a ses ansangnes 	1260
1305	qu’il a en mi le front II. plaies. 	quil a el fronc .ii. plaieez. 	1261
1306	Or vos en poés aler, 	Or uos en poez aler 	1262
1307	mais que vos m’aiés dit vostre nom. » 	mais que uos mauez dit uostre non. 	1263
1308|1309	Et il se nome molt a envis |et totes voies li dist 	et il se nome mout a enuiz et totesuoiez dit il 	1264
1310	qu’il a non Lancelot del Lac. « Alez a Dieu », fet ele.	quil a non lanc̃ del lac. 	1265
1311	Atant s’en part 	si sen part atant.	1266
1312	et s’en vet tot le chemin 	et sen ua tout le chemin 	1267
1313	qu’ele li avoit enseigné, si grant aleure 	que cele li auoit ensangnie. |Si grant aleure 	1268|1269
1314	com il plus puet del cheval traire,	comme il puet del cheual traire. 	1270
1315	tant que il atainst les chevaliers 	Et tantost ataint les cheualiers 	1271
1316	que il sievoit. 	que il suoit. 	1272
1317	Et cil lor i escrie si haut 	et il les escrie si haut 	1273
1318	que bien porent oîr, 	que bien le pueent entandre 	1274
1319	et maintenant li vient acorant li uns d’eus, l’escu al col, le lance el poing, 	et maintenant li uient acorant li uns daus lescu au col la lance el poing. 	1275
1320	et fu armés de totes armes. 	et fu armes de toutes armes.	1276
1321	Et Lancelos le fiert 	et lanc̃ le fiert 	1277
1322	si que pour le hauberc ne remaint 	si que por le haubert ne remaint: 	1278
1323	qu’il ne li met par mi le cors le fer del glaive 	que il ne li meste parmi le cors et le fer et la glauie. 	1279
1324	si l’empaint bien com cil 	Si lenpant bien comme cil 	1280
1325	qui assés ot et cuer et force: 	qui auoit assez cuer |et force	1281|1282
1326	si le porte del cheval a terre et retrait son glaive a lui; 	Si le porte a terre. |et retrait son glaiue a lui. 	1283|1284
1327	si voit I. autre venir tot appareillié de joster 	Si uoit un autre uenir a lui tout aparillie de ioster. 	1285
1328	et il nel refuse pas, 	et il nel refuse pas. 	1286
1329	ains li torne le chief del cheval, 	ains li torne le chief del cheual. 	1287
1330	et cil 	et cil	1288
1331	qui vint acorant li done tel cop en l’escu 	qui uint acorant li done tel cop sor lescu 	1289
1332	que tote sa lance vole en pieces. 	que la lance uole tote en pieces. 	1290
1333	Et Lancelos, 	et lanc̃. 	1291
1334	qui un poi porta sa lance bas. l'ataint par desus l’arcon de la sele,	qui tuit sa lance .i. pou bas le fiert par desus larson de la sele. 	1292
1335	si le fiert 	Et le fiert	1293
1336	si que les mailes del hauberc ne pueent soffrir le grant cop 	si que les maillez de haubert ne pue en soufrir le grant cop. 	1294
1337|1338	que li glaives ne li voist par mi le cors |si que li fers pert d’autre part; 	et li glaiuez li pert de lautre part. 	1295
1339	si l’empainst si durement	et il len paine si durement 	1296
1340	qu’il le porte a terre et lui et le cheval. 	que il porte et lui et le cheual ensanble a terre. 	1297
1341|1342	Et|lors dient cil 	Et lors dient cil 	1298
1343	qui devant s’en aloient 	qui deuant sen aloret 	1299
1344	que molt joste bien li chevaliers, 	que mout ioste bel li chrł 	1300
1345	quant. Il. de lor meillors compaignons a ensi abatus. 	que deus de nos mallors cheualiers a abatus.	1301
1346	Et Lancelos laisse corre a els tos 	et lanc̃ lait corre a aus 	1302
1347	qui encore estoient nuef; 	qui encor estoient .ix. 	1303
1348	si ot l’espee traite, 	Si trait lespee 	1304
1349	por ce que ses glaives estoit brisiés al chevalier 	que ses glaiues estoit abatus 	1305
1350	qu’il ot derrainement abatu ; 	et brisiez au daurien cheualier. 	1306
1351	si lor detrenche lor escus 	Si lor detranche lor hiaumes 	1307
1352|1353	et lor depiece lor hialmes |et lor ront les haubers sor les bras et sor les espaules; 	et lor uont Lor haubers sor. Les bras et sor les espaulez. 	1308
1354	si fet tant par sa proesce 	Si fait tant par sa proesce 	1309
1355	que tuit cil 	que tuit cil 	1310
1356	qui le voient s’en merveillent. 	qui le uoient sen esmaient et merueillent 	1311
1357	Et la ou il voit le chevalier as armes vermeilles, 	Et la ou il uoit le cheualier as armes uermeilles: 	1312
1358|1359	si nel mesconoist pas, |ains li adresce par mi els tos	Si ne le mesquenoit pas ains li adresce parmi aus cous. 	1313
1360	et li done si grant cop par mi le hialme 	et li done si grant cop parmi le hiaume 	1314
1361	que cil est si estordis 	que cil est si estordiz 	1315
1362|1363	qu’il ne se puet es arçons tenir, |ains vole a terre. 	quil ne se puet es arsos tenir ains uole a terre. 	1316
1364	Et Lancelos li va par desus le cors a cheval	et lanc̃ li ua par desus le cors A cheual 	1317
1365	tant que cil pert la vertu et la force tote. 	si que tout le cors li debrise. |et li faut la uertus et li forte tote 	1318|1319
1366|1367	Et|lors sont li autre molt esmaié, 	Lors sont tuit li autre esmaiet. 	1320
1368	kar bien cuident 	Car bien cuident 	1321
1369	que cil soit mors 	que cil soit mors 	1322
1370	qui lor sires estoit; 	qui lor sires estoit. 	1323
1371	si se metent en paine del vengier	Si ce mestent en painne de lui uangier. 	1324
1372	et corent sus a Lancelot tuit ensamble. 	et courent sus lanc̃. tuit. ensanble. 	1325
1373	Mais il nel truevent pas si esbahi 	Mais ne le trueuent pas si esbahit : 	1326
1374	qu’il ne soit tos pres de soi deffendre; 	que il ne soit tous pres de lui desfandre. 	1327
1375	si lor abandone son escu 	Si lor abandone son escu. 	1328
1376	et tient l’espee 	et ci ot lespec 	1329
1377	dont il lor done grans cops par la 	dont il lor done grans cox. par la 	1330
1378	ou il les ataint, 	ou il les ataint. 	1331
1379	ne onques por pooir 	et onques por pooir 	1332
1380	qu’il aient ne li porent tolir terre, 	quil aient ne li purent tolir terre 	1333
1381|1382	ains se met par mi els maintes fois, |quel gré 	ains sen ua parmi aus tous maintes fois. quel gre 	1334
1383	qu’il en aient. 	que il auient. 	1335
1384	Et de tant li avient il bien 	et detant li auient il bien 	1336
1385	qu’il n’aconsieut chevalier a droit cop 	quil nataint cheualier a droit cop; 	1337
1386	qu’il ne face s’espee sentir en char nue 	quil nel face santir en char nue. 	1338
1387	ou il nel port del cheval a terre: 	ou il ne le port del cheual a terre 	1339
1388	si lor esrache les escus des cols et les hialmes des testes et lor decoupe poins et bras a 	si lor esrache les escuz des cox et les hiaumes des testes |et lor decope et poins et bras 	1340|1341
1389	et se hurte en els de cors et de cheval »; 	et se hurte en aus. de cors et de manbres. 	1342
1390	si en a V. si atornés 	Si en a .u. si accenes 	1343
1391	qu’il gisent a terre si conreé 		
1392	qu’il n’ont pooir de relever. 	quil non pooir de leuer eux. 	1344
1393	Quant li autre voient ce, 	Et quant li autre uoient ce; 	1345
1394	si lor est avis 	si lor est auis 	1346
1395	que, s’il i demorent plus, il n’em pueent eschaper sans morir 	que ce il i demeuret plus |quil nen pueent eschaper 	1347|1348
		sans mort. 	1349
