763	et vait tolir au nain le brachet et mes sire Yvain li dist : « Traiez vos arriere. sire vassaux,		
764	car je ne sofferroie mie 		
765	que vos an lui meissiez main. —		
766	Non ? fait il. 		
767	Par Sainte Croiz mar le deistes! 		
768	Or vos gardez de moi, 		
769	car vos estes venuz a la bataille. » 		
770	Et il respont 		
771	que de ce ne li chaut. 		
772	Lors s’esloingnent li un de l’autre 		
773	et mestent lor escuz devant lor piz 		
774	et esloingnent les glaives 		
775	et laissent corre les chevax forz et isniax 		
776	et s’antrefierent si durement 		
777	qu’il en font voler les esclaz. Il s’antrehurtent des cors et des escuz, 		
778	si qu’il n’i a celui 		
779	qui i n’ait le cerveil tourblé en la teste, 		
780	si s’entrebatent a la terre par desus les croupes as chevax, 		
781	si estordi 		
782	qu’il ne sevent d’aux panre conseil. Il resaillent em piez au plus tost 		
783	qu’il en ont le pooir et traient les espees tranchanz 		
784	et s’antrefierent granz cox sor les escuz et sor les hiaumes 		
785	et s’entreblescent 		
786	quanqu’il pueent 		
787	et se font voler le sanc vermeil des chars des espees. Sidure tant li premiers assauz 		
788	qu’il n’i a celui 		
789	qui assez ne soit las et travilliez. 		
790	Et mes sire Yvain est tex atornez 		
791	qu’il n’an cuide mie eschaper sanz mort,		
792	car il a tex VII. plaies 		
793	dont la mendre est assez perilleuse		
794	et il troeve celui 		
795	a cui il se combat si fort et si seur 		
796	qu’il ne cuide mie 		
797	que en tex. VIl. chevaliers eust tant de force et de prouesce 		
798	com il a en lui et bien connoist 		
799	qu’il est em peril de mort et en avanture d’estre menez a outrance, 		
800	se il ne fait 		
801	qu’il ait pais entr’els Il.		
802	Et il se furent traist arrieres 		
803	por repanre lor alainnes, 		
804	car a merveilles longuement avoit duré lor premiers asauz; 		
805	si resgardoit li chevaliers s’espee,		
806	car toute estoit rouge del sans mon signor Yvain 		
807	et la tersoit del pan de son haubert. 		
808	Et mes sire Vvain l’araisonne premierement, 		
809	si li dist: « Sire chevaliers. 		
810	tant nos somes combatu moi et vos		
811	qu’il n’i a celui 		
812	qui bien ne se soit essaiez li uns contre l’autre 		
813	et vos savez bien 		
814	que de ceste querele est li droiz miens 		
815	et li torz vostres: 		
816	et 		
817	por ce me samble il		
818	que ceste bataille deussiez laissier, 		
819	ainz que pis vos an venist, 		
820	car d’aler contre droit 		
821	ne vos puet venir 		
822	se domages non. » 		
823	Et il dist 		
824	que de la bataille laissier n’est il mie encore conseilliez ne ne sera tant 		
825	com il puisse tenir s’espee. « 		
826	Par mon chief, fait mes sire Yvain, 		
827	dont somes nos au recommancier, 		
828	que mon droit desfandrai je dusqu’a la mort; 		
829	mais ançois 		
830	que nos en façons plus, vos pri je par cortoisie 		
831	que vos me diez vostre non,		
832	et puis face chascuns a son pooir 		
833	de l’onor avoir. — 		
834	Certes. fait li chevaliers, 		
835	vos me samblez si prodome 		
836	que je ne vos celerai mie ce 		
837	que vos me demandez. Je aia non Boort li Essilliez et sui cousins mon signor Lancelot del Lac. » 		
838	Quant mes sire Yvain l’antant, 		
839	si a trop grant joie. 		
840	Lors gete s’espee a terre 		
841	et oste son escu de son col 		
842	et dist a Boort : « 		
843	Ha, sire, je vos quit ceste bataille, 		
844	puis que vos estes cousins mon signor Lancelot del Lac 		
845	et je me tieng por outré, 		
846	si vos pri 		
847	que vos me pardoingniez ce 		
848	que je me sui a vos combatuz » —Sire,fait Boorz, 		
849	qui estes vos 		
850	qui me faites tele honor de ce 		
851	dont je n’ai droit 		
852	que vos vos tenez por outré 		
853	et si ne l’estes mie ?» 		
854	Et il se nome, 		
855	et quant Boorz entant 		
856	que ce est mes sire Yvain, 		
857	si li velt s’espee randre, 		
858	mais il ne la volt panre en nule manniere, 		
859	quar molt estoit cortois, 		
860	et dist 		
861	que ceste honor ne li avandra, 		
862	car il n’est mie raison, » 		
863	ainz la devez avoir par raison, biaux sire, 		
864	car vos m’avez mené dusqu’a outrance. » 		
865	Lors deslacent lor hiaumes 		
866	et s’antrefont molt grant joie conme eil 		
867	qui molt s’entramoient,		
868	si s’asient sor l’erbe vert 		
869	et resgarde li uns l’autre ses plaies;		
870	si demande mes sire Vvain i noveles de Lancelot 		
871	et il les conte teles 		
872	com il les set 		
873	et dist 		
874	qu’il le laissa malade molt durement, 		
875	se li conte 		
876	conment il fu anvenismés 		
877	et par quele achoison. « 		
878	En non Dieu, fait mes sire Yvain, nos cuidons a		
879	cort qu’il soit mort, 		
880	car la roine le nos avoit fait antandant		
881	et 		
882	por savoir en la verité, somes nos meu de cort dusqu’a X. chevaliers de la Table Reonde 		
883	et avons juré sor sainz 		
884	que jamais ne retornerons a cort devant 		
885	que nos en saichons vraies noveles. ? — Enon Deu, fait Boorz, il n’est mie morz, 		
886	ainz est touz gariz a mon esciant. »		
