707	et aloit molt grant duel faisant. 	et faisoit moult grant duel. 	689
708	Et mes sire Yvain li demande 		
709	s’il set nouveles d’un chevalier 		
710	qu’il vet querant. 		
711|712	Et li nains s’areste |et li demande 	Et mesire ywains li demande 	690
713	qui li chevaliers est 		
714	et il dist 		
715|716	que ce est mes sire a Lanceloz. del Lac. |«e En non Dieu, fait li nains, 	sil set nulles noueles de lancelot. Enon dieu fait li nains 	691
717	de Lancelot vos dirai je bien nouveles,	oil de lui vous dirai iou bien nouelles 	692
718|719	se vos tant voliez faire |por moi 	se vous tant voles faire pour moi 	693
720	que I. brachet me feissiez randre 	que vous vn mien brachet me feissies rendre 	694
721	que une damoisele m’a orandroit tolu a force. » 	que vne damoisele ma orendroit tolu a force. 	695
722	Et il dist, 	Et il li dist 	696
723	se il la damoile li monstre, il li randra le brachet, aseur soit il. 	que il li moustrast la damoisele |et il li rendra son brachet asseurs en soit. 	697|698
724	Et cil li creante loiaument 	Et li nainz li creante 	699
725	que il tex nouveles li dira 	que il li dira nouelles 	700
726	par quoi il devra estre bien creuz. « 	dont il deuera bien estre creus. 	701
727	Or me moinne donc, fait mes sire Yvain la 	Or me maine fait mesire ywains 	702
728	ou la damoisele est 	dont la ou la damoisele est 	703
729	dont tu te plainz 	de qui tu te plains. 	704
730	et je te creant leaument 	et iou te creans loiaument 	705
731	que je ferai mon pooir de randre le toi. » 	que iou ferai mon pooir de toi rendre ton brachet. 	706
732	Et cil dist 	Et cil dist 	707
733	qu’il ne demande plus, 	quil ne demande plus.	708
734	si s’an torne tout le chemin 	si sen retorne le chemin 	709
735|736	qu’il estoit venu grant oirre|et mes sire Vvain le siut adés. 	quil estoit uenus grant oirre et mesire ywain apres. Ant ont ale 	710
737	Tant ont alé 		
738	qu’il viennent a l’avaler d’un tertre 	quil viennent en la ualee dun tertre.	711
739	et lors voient devant aux I. chevalier tout armé et I. damoisele avec lui. « Sire, fait li nains a mon signor Yvain, veez la damoisele 	Et lors voient deuant euls vn cheualier arme et vne damoisele auec lui. |Et li nains dist a monseignor ywain Sire uees la la damoisele 	712|713
740	qui mon brachet emporte 	qui mon brachet emporte 	714
741	qu’ele me toli par la seurté del chevalier 	que elle me toli par la seurte del cheualier 	715
742	qui est avec li. — 	qui est aueques lui. 	716
743	Or va donc, fait mes sire Vvain, 	Or ua dont fait mescas clsire ywains 	717
744	si li oste des mains maugré suen, 	si li oste dez mains malgre sien. 	718
745	et se li chevaliers em parole, moi ne chaut 	Et se li cheualiers en parole ne ten chaut 	719
746	et ne doute riens, 	et nel redoute de riens. 	720
747	que se li chevaliers se velt prandre a toi, je te garantirai. » 	quar sil sen veult prendre a toi fie ten esmaie ia : |quar iou ten garantirai bien 	721|722
748	Et li nains en est molt liez: 	Et li nains en est moult lies 	723
749	si vient a la damoisele 	si vient a la damoisele 	724
750	et li oste le brachet des mains si felonnessement	et li oste le brachet dez mains si felenessement	725
751	qu’a poi qu’il ne l’a jus abatue del cheval. 	que pour. j. poi |quil ne la abatue del cheual. 	726|727
752	Et quant cele voit 	Et quant cele voit 	728
753	qu’il l’amporte. 	que il lenporte 	729
754	si vient aprés por lui tolir et mes sires Yvain li dist: « Damoisele, ne le touchiez, 	si vient auant pour lui tolir. |Et mesire ywains li dist damoisele ne le touchies 	730|731
755	car il est en mon conduit 	quar il est en mon conduit 	732
756	et laissiez le brachet, 	et laissies le brachet 	733
757	car il est suens, 	quar il est siens 	734
758|759	si le doit mielz avoir |que vos ne devez, 	si le doit miex auoir de vous 	735
760	car en la soue chose n’avez vos droit outre son gré. » 	quar a la soie cose naues vous droit encontre son gre. 	736
761	Lors saut avant li chevaliers	Lors saut auant li cheualiers 	737
762	qui la damoisele conduisoit 	qui la damoisele conduisoit. 	738
763	et vait tolir au nain le brachet et mes sire Yvain li dist : « Traiez vos arriere. sire vassaux,	et volt tolir au nain le brachet. |Et mesires ywainz li dist traies vous arriere sire Cheualiers 	739|740
764	car je ne sofferroie mie 	que iou ne sofferoie mie 	741
765	que vos an lui meissiez main. —	que vous a lui mesissiez main. 	742
766|767	Non ? fait il. |Par Sainte Croiz mar le deistes! 	Non fait cil par sainte crois mar le deistes. 	743
768	Or vos gardez de moi, 	or vous gardes de moi 	744
769	car vos estes venuz a la bataille. » 	quar vous estes uenus a la bataille. 	745
770	Et il respont 	et il respont 	746
771	que de ce ne li chaut. 	que de chou ne li chaut 	747
772	Lors s’esloingnent li un de l’autre 	Lors seslongent livns de lautre 	748
773|774	et mestent lor escuz devant lor piz |et esloingnent les glaives 	et metent lez escus deuant leur pis et alongent lor glaiues 	749
775	et laissent corre les chevax forz et isniax 	et puis brochent lor cheuaus 	750
776	et s’antrefierent si durement 	et sentrefierent si durement	751
777	qu’il en font voler les esclaz. Il s’antrehurtent des cors et des escuz, 	que lor glaiues volent en pieces |puis sentrehurtent des cors et dez escus si durement 	752|753
778	si qu’il n’i a celui 	quil ni or celui 	754
779	qui i n’ait le cerveil tourblé en la teste, 	qui nait le ceruel troble en la teste 	755
780|781	si s’entrebatent a la terre par desus les croupes as chevax, |si estordi 	et sentreabatent dez cheuaus a terre si estordi 	756
782	qu’il ne sevent d’aux panre conseil. Il resaillent em piez au plus tost 	quil ne seuent deuls prendre nul conroi. |puis resaillent en pies au plus	757|758
		tost 	759
783	qu’il en ont le pooir et traient les espees tranchanz 	quil poent |et traient lor espees trenchans 	760|761
784	et s’antrefierent granz cox sor les escuz et sor les hiaumes 	et sentredonent grans copz la |ou il sentrataignent 	762|763
785|786	et s’entreblescent |quanqu’il pueent 	et sentreblecent de quamquil pueent 	764
787	et se font voler le sanc vermeil des chars des espees. Sidure tant li premiers assauz 	et se font Voler le sanc dez chars blanches et tendres. |Et dura tant la bataille 	765|766
788	qu’il n’i a celui 	quil ni ot celui 	767
789	qui assez ne soit las et travilliez. 	qui ne fust asses las et traueillies.	768
790	Et mes sire Yvain est tex atornez 	mais mesire ywain est teuls atornes 	769
791	qu’il n’an cuide mie eschaper sanz mort,	quil ne quide mie escaper |sans mort. 	770|771
792	car il a tex VII. plaies 	quar il a teuls. iij.» plaies 	772
793	dont la mendre est assez perilleuse	dont li meindre est asses perilleuse:. 	773
794	et il troeve celui 	et trueue celui 	774
795	a cui il se combat si fort et si seur 	qui a lui se combat si fort et|si seur. 	775|776
796	qu’il ne cuide mie 	quil ne quidoit mie 	777
797	que en tex. VIl. chevaliers eust tant de force et de prouesce 	que en nuls. vij. eust autant de proece 	778
798	com il a en lui et bien connoist 	comme il a en lui. |Et bien connoist 	779|780
799|800	qu’il est em peril de mort et en avanture d’estre menez a outrance, |se il ne fait 	quil est en peril de mort. ou en auenture destre menes iusques a outrance. sil ne fait tant 	781
801	qu’il ait pais entr’els Il.	que il ait pais entreuls. ij. 	782
802	Et il se furent traist arrieres 	Et il se furent trait arriere 	783
803|804	por repanre lor alainnes, |car a merveilles longuement avoit duré lor premiers asauz; 	quar longement auoit dure lor premiers assaus. 	784
805	si resgardoit li chevaliers s’espee,	Si regardoit li cheualiers sespee 	785
806	car toute estoit rouge del sans mon signor Yvain 	qui toute estoit rouge del sanc monseignor ywain	786
807	et la tersoit del pan de son haubert. 	si le commencha a terdre del pan de son hauberc. 	787
808	Et mes sire Vvain l’araisonne premierement, 	Lors laraisonne ywain premierement. 	788
809	si li dist: « Sire chevaliers. 	et il li dist. Sire cheualiers. 	789
810	tant nos somes combatu moi et vos	tant nous sommes combatu entre moi et vous 	790
811	qu’il n’i a celui 	quil ni a celui 	791
812	qui bien ne se soit essaiez li uns contre l’autre 	qui bien ne soit esprouues a lautre. 	792
813	et vos savez bien 	Et vous saues bien 	793
814	que de ceste querele est li droiz miens 	que de ceste querele est li drois miens 	794
815	et li torz vostres: 	et li tors vostres. 	795
816|817	et |por ce me samble il	et pour ce me samble il bien 	796
818	que ceste bataille deussiez laissier, 	que vous ceste bataille deussies laissier 	797
819	ainz que pis vos an venist, 	ains que pis vous en auenist 	798
820|821	car d’aler contre droit |ne vos puet venir 	quar daler encontre droit ne vous puet uenir se damages non 	799
822	se domages non. » 		
823	Et il dist 	et il dist 	800
824	que de la bataille laissier n’est il mie encore conseilliez ne ne sera tant 	que de la bataille laissier nest il mie encore conseillies. |ne ne sera tant 	801|802
825	com il puisse tenir s’espee. « 	comme il puist tenir sespee. 	803
826	Par mon chief, fait mes sire Yvain, 	par mon chief fet mesire ywains 	804
827	dont somes nos au recommancier, 	donques sommes nous au recommencier 	805
828	que mon droit desfandrai je dusqu’a la mort; 	quar mon droit ne voel iou mie laissier iusques a la mort 	806
829	mais ançois 	Mais aincois	807
830	que nos en façons plus, vos pri je par cortoisie 	que nous en facons plus vous pri iou 	808
831	que vos me diez vostre non,	que vous me dies vostre non. 	809
832	et puis face chascuns a son pooir 	quar teuls porries vous estre 	810
833	de l’onor avoir. — 	que iou ne me combateroie mie volentiers a vous 	811
834	Certes. fait li chevaliers, 	Et il dist. 	812
835|836	vos me samblez si prodome |que je ne vos celerai mie ce 	par foy Sire iou ai a non bohors li escillies. 	813
837	que vos me demandez. Je aia non Boort li Essilliez et sui cousins mon signor Lancelot del Lac. » 	et sui cousins germains lancelot del lac	814
838	Quant mes sire Yvain l’antant, 	Qant mesires ywains entent 	815
839	si a trop grant joie. 	que ce est bohors |si en ot moult grant ioie 	816|817
840|841	Lors gete s’espee a terre |et oste son escu de son col 	si giete son escu a terre 	818
842	et dist a Boort : « 	et dist a bohort.	819
843	Ha, sire, je vos quit ceste bataille, 	ha : sire ie vous quit ceste bataille. 	820
844	puis que vos estes cousins mon signor Lancelot del Lac 		
845|846	et je me tieng por outré, |si vos pri 	si men tieng pour outre. 	821
847	que vos me pardoingniez ce 	Qui estes vous fait 	822
848|849	que je me sui a vos combatuz » —Sire,fait Boorz, |qui estes vos 	dont bohors 	823
850	qui me faites tele honor de ce 	qui me faites tele honor	824
851	dont je n’ai droit 		
852	que vos vos tenez por outré 		
853|854	et si ne l’estes mie ?» |Et il se nome, 	Et il se nomme maintenant. 	825
855	et quant Boorz entant 	Et quant bohors oit 	826
856	que ce est mes sire Yvain, 	que cest mesire ywains 	827
857	si li velt s’espee randre, 	si li uait sespee rendre 	828
858|859	mais il ne la volt panre en nule manniere, |quar molt estoit cortois, 	mais il ne le volt prendre en nulle maniere. 	829
860	et dist 		
861	que ceste honor ne li avandra, 		
862	car il n’est mie raison, » 		
863	ainz la devez avoir par raison, biaux sire, 		
864	car vos m’avez mené dusqu’a outrance. » 		
865	Lors deslacent lor hiaumes 	Et lors deslacent lor heaumes 	830
866	et s’antrefont molt grant joie conme eil 	et sentrefont trop grant ioie comme cil 	831
867	qui molt s’entramoient,	qui moult sentramoient. 	832
868|869	si s’asient sor l’erbe vert |et resgarde li uns l’autre ses plaies;	Si sassistrent sor lerbe uert et regarde li vns lautre sez plaies. 	833
870|871	si demande mes sire Vvain i noveles de Lancelot |et il les conte teles 	Si demande mesire ywains noueles de lancelot. 	834
872|873	com il les set |et dist 	Et bohors li dist 	835
874	qu’il le laissa malade molt durement, 	quil le laissa moult durement malade 	836
875	se li conte 	Si li conte 	837
876|877	conment il fu anvenismés |et par quele achoison. « 	comment il fu enuenimes et par quele ocoison. Enon dieu fet mesire ywain nous quidiemes bien a cort quil fust mors. 	838
878	En non Dieu, fait mes sire Yvain, nos cuidons a		
879	cort qu’il soit mort, 		
880	car la roine le nos avoit fait antandant	Car la royne le nous auoit fait entendant. 	839
881	et 	Et 	840
882	por savoir en la verité, somes nos meu de cort dusqu’a X. chevaliers de la Table Reonde 	por sauoir ent la uerite sommes meut de la cort iusques a. X. cheualiers de la table roonde 	841
883	et avons juré sor sainz 	et auons tout iure sour sains 	842
884	que jamais ne retornerons a cort devant 	que iames ne renterrons en la court 	843
885	que nos en saichons vraies noveles. ? — Enon Deu, fait Boorz, il n’est mie morz, 	deuant que nous en saurons uraies nouelles Enon dieu fait bohors il nest mie mors 	844
886	ainz est touz gariz a mon esciant. »	ains est tous garis au mien escient	845
