1232|1233	et je aim tos cels|qui en tel mestier usent lor vie	e porque ya fue tiempo	979
1234|1235	kar je meismes sui chevaliers errans|et por ce vos vueil je proier	que yo mesmo fui cauallero andante Ruego vos	980
1236	que vos herbergiés anuit mes o moi;	que esta noche aluerguedes Conmigo	981
1237	kar se vos passés avant de ci vos ne troverois se forest non	Ca si de aqui partides non fallaredes sino floresta muy yerma	982
1238	si salvages	e saluaje	983
1239	que vos i porrois tost desvoier	que no fallaredes	984
1240	Et il est bien tens de herbergier ce veés vos bien :		
1241|1242	por ce vos lo|que vos remanois	do aluergar esta noche	985
1243	et vos avrois ostel bel	e poresto vosloaria	986
1244	et buen tot a vostre voloir	Que finquedes aqui esta noche	987
1245	— Bials sire fet Lancelos		
1246|1247	puis qu' il vos plest je remaindrai|et por vostre proiere	e abredes muy buena Posada a toda vuestra voluntad buen señor dixo Lançarote yo fincare pues vos plaz Porvuestro Amor Pues dezides	988
1248	et por ce		
1249	que vos dites		
1250|1251	que vos estes chevaliers errans|a	Que fuistes cauallero Andante	989
1252	Lors descent		
1253|1254	et vaslés saillent des autres paveillons|si le desarment	e luego salieron delas tiendas escuderos Quelo desarmaron	990
1255|1256	et li aportent I|mantel de samit legier a afubler	e desque fue desarmado Truxeronle vn manto de xamete	991
1257	por le chaut	para cubrir Porla calor	992
1258	qui grans estoit a;	que façia grande	993
1259	si le mainent el grant paveillon avec l' autre chevalier	e entonçe se entraron el cauallero	994
1260	Et lors parlerent ensamble	e lançarote enla tienda	995
1261	et s' entracointierent	e asentaronse	996
1262	et demanda li uns a l' autre de son estre	e començaron a fablar envno	997
1263|1264	Li chevaliers enquiert a Lancelot|dont il vient	e el cauallero le pregunto	998
1265	et ou il vet	e dixo señor	999
1266	et quele aventure le maine	que auentura os lleba	1000
1267	si sol	asi solo	1001
1268|1269	et il li conte une partie de son estre|et autre l' en çoile e;	e lançarote le conto toda su façienda enpero todavia le dixo	1002
1270	et totes voies li dist		
1271|1272	que en la cort al roi Baudemagu voldroit estre|por soi deffendre vers un chevalier	que yua ala corte del Rey bandemagus aque dixo el cauallero ame defender devn cauallero dixo lançarote	1003
1273	qui l' a apelé de traïson	que me Recto de traiçion	1004
1274	a En ce	e ellos	1005
1275	qu' il parloient ensi orent li escuier mise la table	asi fablando entro vn escudero|e puso la mesa	1006|1007
1276|1277	si vont laver;|si s' asiet Lancelos	e asentose el cauallero a comer	1008
1278	et li chevaliers	e lançarote	1009
1279|1280	et une damoisele|qui molt ert bele	e vna donzella muy fermosa	1010
1281	et estoit amie al seignor de laiens;	que hera amiga del cauallero|mas la donçella en	1011|1012
1282	si mengierent tuit troi ensamble	quanto vido a lançarote	1013
1283	mes cele	ansi lo cataua	1014
1284	qui Lancelot esgarde ne se puet saoler de lui veoir Kar tant li samble bials	que no se hartaua delo ver enque lo via tan fermoso	1015
1285	qu' ele ne prisa onques mes bialté d' ome envers cesti :	e no cuidaua|que tan fermoso ome pudiese auer enel mundo	1016|1017
1286|1287	si l' esgarde|si viselment	e asi lo estaua catando	1018
1288|1289	que tot en laisse le mengier n' a autre chose n' entent|fors a lui remirer	que no podia comer	1019
1290	Si ont li escuier osté le premier mes de sor la table c' onques la damoisele n' en tasta ains pensa totes voies	que auia el escudero tirado el primero manjar dela mesa|e ella no auia metido vocado enla voca	1020|1021
1291	Et en cel pensé li descent el cuer une	e la donçella|asi lo catando començo a pensar tan fieramente	1022|1023
1292	si grant amor	que no hera sino marauilla	1024
1293	qu' ele aime Lancelot outre ce	e ella|ansi pensando cayo vn amor ensu corazon quelo començo	1025|1026
		ansi a amar a lançarote	1027
1294	que feme n' ama mes home;	que mas muger podia a ome amar	1028
1295	si li est avis	e deçia entresi mesma	1029
1296	que s' il l' amoit qu'ele seroit beneuree	que si la el quisiese amar|que se ternia porla	1030|1031
1297	Mais ci endroit n' em parole plus li contes lkar ça avant le devisera	mas bien auenturada muger del mundo|mas de	1032|1033
1298|1299	et comment ele l' ama merveillosement|et comment ele le proia	como ella amo muy afincadamente a lançarote	1034
1300	et la merveille	e delas cosas	1035
1301	que ses amis en fist	que su amigo fiço	1036
1302	quant il sot	quando sopo	1037
1303	qu' ele l' amoit	que ella tan desmesuradamjente lo amaua	1038
1304	et comment cele morut	e de|como ella murio	1039|1040
1305	por ce	quando supo	1041
1306	qu' il la refusa tot ce vos trespassera li [c) contes ci endroit	que lançarote no la queria amar todo lo dexa aqui el Cuento de contar	1042
1307	por deviser une aventure	Por contar vna auentura	1043
1308	qu' il lor avint el paveillon ou il estoient	que les auino enla tienda	1044
1309|1310	L|Ci dist li contes que	do estauan comiendo Dize el cuento	1045
1311	quant il orent le secont mes eu es vos un chevalier armé d' unes armes vermeilles	que ellos estando comiendo|asi como vos digo he aqui	1046|1047
1312	qui vint corant par devant le paveillon o grant compaignie de chevaliers	por do viene|por antela tienda vn cauallero convnas armas vermejas con gran conpaña de caualleros	1048|1049
1313	Et cil as armes vermeilles	e el Cauallero delas armas vermejas	1050
1314	qui devant venoit entre el paveillon a	que delante venia entro enla tienda	1051
1315|1316	et voit|I	e vio vn escudero	1052
1317|1318	escuier|qui servoit a la table	que seruia antela mesa	1053
1319|1320	si estoit freres al chevalier de laiens|Et il cort maintenant cele part	e el cauallero enque lo vido fue contra el	1054
1321	si le prent par les espaules	e tomolo porlos braços	1055
1322	et le lieve devant lui sor l' arçon de la sele	e pusolo antesi sobre el cuello del cauallo	1056
1323	si s' en torne a tot	e salio conel dela tienda	1057
1324	Et quant cil del paveillon voit ce	e el cauallero quelo vio	1058
1325	si crie a Lancelot Ha bials sire je sui mors se cil enporte ensi mon frere	ansi lleuar començo a dar vozes a lançarote ay señor muerto so|si asi me lleba a aquel escudero mi hermano	1059|1060
1326	kar il l' ocirra s' il n' est secors:	Ca lo matara|si lo no acorredes	1061|1062
1327	si vos pri	e porende vos Ruego	1063
1328	por Dieu	por dios	1064
1329	que vos i metés paine	que me ayudedes alo cobrar	1065
1330	Et Lancelos saut de la table	e lançarote salio luego dela mesa	1066
1331	et demande ses armes	e pidio sus armas a vn su escudero	1067
1332	et I	Que y estaua le dixo señor	1068
1333|1334	escuiers vint avant|si li dist Par foi sire vos armes	Por buena fee el cauallero vos a hecho llebar vuestras armas	1069
1335|1336	et vostre cheval enmainent il ! — Voire fet il|par mon chief ja	e vuestro cauallo pormi cabeza dixo lançarote ni	1070
1337|1338	por ce ne remaindra|que je nes sieve	por eso non fincara quelo non siga	1071
1339|1340	Lors vient fors del paveillon|et li chevaliers o lui	e luego salio lançarote dela tienda	1072
1341	et il esgarde cels	e el cauallero conel	1073
1342	qui s' en vont		
1343	qui ja avoient passé l' eve par J		
1344	pont de fust;		
1345|1346	et Lancelos demande al chevalier s' il remaindra|Sire fet il nenil ains vos ferai compaignie	e vieron yr los caualleros pasando el agua Porvna puente de madero señor dixo lançarote al cauallero fincad vos aqui no fare dixo el	1074
1347	tant que nos aions trové	mas antes yre con vos fasta	1075
1348	qui armes vos baut	que falledes quien vos de armas	1076
		e cauallo enque sigades el cauallero Luego se començaron de yr	1077
1349|1350	Lors acueillent lor voie tot a pié|et vienent au pont	e andubieron tanto fastaque llegaron ala puente de madera	1078
1351	si passent outre	e pasaronla	1079
1352	et s' adrecent a I	e fueronse contravn otero	1080
1353	tertre par ou li chevalier s' en vont;	Por do los caualleros se yuan	1081
1354	si n' ont gaires alé	e lançarote	1082
1355|1356	quant il encontrent I|chevalier armé d' unes armes noires	e el cauallero fueron tanto enpos ellos fastaque encontraron vn cauallero armado devnas armas negras	1083
1357|1358	qui venoit al pont par I|chemin de travers	que venia ala puente porvn sendero pequeño altrabes	1084
1359|1360	Et quant il voit Lancelot|si s' areste	e quando el vio a lançarote luego lo conoçio	1085
1361	por ce	e estovo quedo fastaque llego	1086
1362	que bien le conoissoit	e dixole señor	1087
1363|1364	si li demande ou il vet ensi a pié tos desammés|Qui estes vos sire chevaliers fet Lancelos	do ydes	1088
1365	qui me demandés ou je vois	asi de pie	1089
1366	? — Je sui fet il I	e desarmado	1090
1367|1368	chevaliers Une vieille met Lancelot sur la voie (L )|d' estrange païs	e quien sodes vos dixo lançarote yo so dixo el vn cauallero destraña tierra	1091
1369	mais molt me merveil de ce	que mucho me marauillo	1092
1370	que je vos voi ensi aler	porque vos veo yr	1093
1371	Et Lancelos li conte comment il estoit herbergiés		
1372	et comment I	asi e apie	1094
1373	chevaliers vint laiens ou il menjoit	e lançarote lo conoçio	1095
1374	qui prist a force I	e començole a contar	1096
1375|1376	vaslet|et le mist sor le col de son cheval	como el cauallero lo aluergara	1097
1377	Et encore m' a il plus meffet fet Lancelos	e como el otro les llebo el escudero	1098
1378	kar cil	que ala mesa seruia afuerça ençima del cauallo	1099
1379|1380	qui avec lui vindrent enporterent mes armes|et enmenerent mon cheval a —	e como le fiço llebar sus armas	1100
1381	Quel guerredon fet cil porroie je atendre de vos se je	Que galardon me daredes dixo el cauallero	1101
1382	por vos me desarmoie		
1383	et vos bailloie mes armes	si vos diese mis armas	1102
1384|1385	et mon cheval|? — Certes fet Lancelos tel com vos deviseriés	e mi cauallo porçierto dixo lançarote tal qual vos supieredes deuisar	1103
1386	— Se vos fet il el premier lieu ou je vos troverai armé	si vos me juraredes dixo el Cauallero|que enel primer lugar	1104|1105
1387	por que je soie desarmés me creantés a doner vos armes ¡e vos bailleroie les moies	que vos fallare armado|e yo fuere desarmado me dedes vuestras armas yo vos dare estas mis armas	1106|1107
1388|1389	— Certes fet Lancelos|si ferai je	e mi cauallo Muy de grado dixo lançarote ental	1108
1390	por que vos ne me truisiés combatant	que me non falledes conuatiendo	1109
1391	Et cil descent maintenant	e luego selo juro entonçe desçendio el cauallero desu cauallo	1110
1392	si se desarme	e desarmose	1111
1393	et baille a Lancelot tot son hernois	e dio todas sus armas|e su Cauallo a Lançarote	1112|1113
1394	et il s' en appareille	e Lançarote se armo	1114
1395	et monte en son cheval	e subio enel cauallo	1115
1396	puis dist a son oste	e dixo asu huesped	1116
1397|1398	qu' il s' en retort; Imes il dist|que non fera	que se tornase No fare dixo el huesped	1117
1399	Si ferois fet Lancelos a lar je conoistrai bien les armes a celui	si faredes dixo lançarote|que yo conoçere vien el cauallero enlas armas	1118|1119
1400	que je vois querant en quelque lieu je les truisse	que lleba en qualquier lugar	1120
1401|1402	Et cil dist|puis qu' il velt s' en retornera:	que el vaya yo me tornare dixo el huesped pues vos plaz	1121
1403	si s' en vet	E luego se torno	1122
1404	et enmaine o lui le chevalier	e llebo consigo el cauallero quelas armas auia dado a lançarote	1123
1405	qui molt est liés de ce	que yua muy alegre de aquello	1124
1406	que Lancelos li doit I	que lançarote le auia prometido	1125
1407|1408	guerredon|Et Lancelos aquelt son chemin aprés cels	e lançarote se fue porel camino enpos el cauallero	1126
1409|1410	que|? il sieut tant	e andubo tanto fasta	1127
1411	qu' il est venus el tertre en haut	que paso porel otero	1128
1412	et lors voit devant lui la forest	e llego avna floresta	1129
1413	que l' en apele la forest des Trois Perilx	que llamauan la floresta delos tres pilares	1130
1414	et ce	e porque fue ella	1131
1415	por quoi ele fu ensi apelee devisera bien li contes ça avant	asi llamada este cuento lo deuisara aca adelante	1132
1416	Quant il fu amont el tertre	Quando el llego ala floresta	1133
1417	si esgarde devant lui		
1418|1419	mais il ne voit nul de cels|que il queroit	e no vido aquel enpos quien yua	1134
1420	kar il s' estoient ja ferus en la forest		
1421	Et totes voies sieut il les esclos des chevals		
1422|1423	tant que il vient a l' entree de la forest;|et lors encontre une damoisele tote chenue	e fue entonçe porende muy triste entonçe encontro vna donçella envn muy fermoso palafren	1135
1424	qui chevalchoit molt cointement	que hera toda cana	1136
1425	et estoit tote deslie ses treces par ses espaules comme pucele	e lleuaua los cauellos tendidos porlas espaldas|como si fuese muy moça	1137|1138
1426|1427	et avoit en son chief l|chapel de roses	e traia vn capillejo de Rosas enla cabeça	1139
1428	kar c' estoit entor la Saint Johan	Ca hera entonçe|por sant juan	1140|1141
1429|1430	Il le salue|et ele li dist	e lançarote lo saluo	1142
1431|1432	que bone aventure li doinst Diex|Damoisele fet il me savriés vos a dire	e ella lo torno sus saludes Donçella dixo lançarote saberme yades enseñar	1143
1433	quel part uns chevaliers o unes armes vermeilles s' en vet	por do va vn Cauallero devnas armas bermejas	1144
1434	? — En non Diex fet ele je le vos enseigneroie bien se je voloie	Por dios dixo ella yo voslo enseñare bien|si quisiere dezidme dixo lançarote	1145|1146
1435	— Dites le moi fet il par covent	Por tal conuenençia	1147
1436	que je soie vostre chevaliers el premier lieu ou vos me requerrois	que yo sea vuestro cauallero enel Primer lugar	1148
1437	— Se vos me creantés fet ele	que me rrequerades Si vosme jurades dixo la donçella	1149
1438|1439	que vos me sievrois de|quel hore	que vayades conmigo luego enla ora	1150
1440|1441	que vos en semoigne je le vos enseignerai|Et cil li creante	que vos llamare yo voslo mostrare	1151
1442	dont il se repenti		
1443|1444	puis molt durement tel hore fu|Or alés fet ele tot cest chemin	e lanzarote lo juro luego donde el se arrepintio despues muy duramente tal ora fue Vos yredes poreste camino dixo la donzella fasta	1152
1445	si li mostre I		
1446|1447	sentier estroit|qui aloit al travers [d) de la forest	que falledes vn sendero atrauieso dela floresta	1153
1448	Si ne tornés fet ele de nule part	e entonçe tomaredes aquel sendero	1154
1449	et quant vos avrois alé entor demie lieue	e desque hubieredes porel andado	1155
1450|1451	si verrois delés I|vivier trois paveillons tendus	quanto vna legua fallaredes antevn nogal tres tiendas Armadas	1156
1452	La dedens troverois le chevalier	e enla vna dellas fallaredes el Cauallero	1157
1453|1454	que vos querés|que l' en apele Arramant le Gros;	que buscades aque llaman aramante el grueso	1158
1455|1456	si le conoistrois a ces enseignes|qu' il a en mi le front II	e vos lo conoçeredes porestas señales en medio dela frente ados llagas agora vos podedes yr	1159
1457	plaies		
1458	Or vos en poés aler		
1459	mais que vos m' aiés dit vostre nom	mas anteme deçid|como auedes nombre	1160|1161
1460|1461	Et il se nome molt a envis|et totes voies li dist	e el se nombro mucho amidos	1162
1462|1463	qu' il a non Lancelot del Lac|Alez a Dieu fet ele a	e dixo yo he nombre Lançarote del lago Lançarote se partio luego dela donçella	1163
1464	Atant s' en part		
1465	et s' en vet tot le chemin	e fuese Porel camino	1164
1466	qu' ele li avoit enseigné	que ella hauia mostrado	1165
1467	si grant aleure com il plus puet del cheval traire	e yua tan apriesa|quanto el cauallo podia andar	1166|1167
		e andubo	1168
		asi fasta	1169
1468|1469	tant que il atainst les chevaliers|que il sievoit	que alcanço los caualleros depos quien yba	1170
1470	Et cil lor i escrie	e el les començo a dar vozes de	1171
1471	si haut	quanto vido	1172
1472	que bien porent oîr	que le podian oyr	1173
1473	et maintenant li vient acorant li uns d' eus l' escu al col le lance el poing	e luego vino contrael vno delos caualleros el escudo al cuello	1174
1474	et fu armés de totes armes	e la lança enla mano armado de todas armas	1175
1475	Et Lancelos le fiert	e lançarote lo yryo	1176
1476	si que pour le hauberc ne remaint	asi tan duramente	1177
1477	qu' il ne li met par mi le cors le fer del glaive	que porel escudo ni porla loriga no finco quele no metiese la lança pormedio del cuerpo	1178
1478	si l' empaint bien com cil	e dio conel gran cayda en tierra Como	1179
1479|1480	qui assés ot|et cuer	aquel que hera de Gran fuerça	1180
1481	et force:		
1482	si le porte del cheval a terre		
1483	et retrait son glaive a lui;		
1484|1485	si voit I|autre venir tot appareillié de joster	e Luego vino otro contrael aparejado de Justar	1181
1486|1487	et il nel refuse pas ains li torne le chief del cheval|et cil	e lançarote no Rehuso ante boluio la Cabeza del cauallo alla	1182
1488	qui vint acorant li done tel cop en l' escu	do lo vyo venir|e el cauallero lo firio	1183|1184
1489	que tote sa lance vole en pieces	ansi que su lança le quebro En medio del escudo	1185
1490	Et Lancelos	e lançarote lo hirio	1186
1491	qui un poi porta sa lance bas	ansi vn poco baxo	1187
1492	l'ataint par desus l' arcon de la sele a	asi ençima del arçon dela silla	1188
1493	si le fiert		
1494|1495	si que les mailes del hauberc ne pueent soffrir le grant cop|que li glaives ne li voist par mi le cors	asi quela loriga no lo pudo defender quela lança no le metiese pormedio del cuerpo	1189
1496|1497	si que li fers pert d' autre part;|si l' empainst	asi que la Lança paresçio dela otra parte	1190
1498	si durement	e Dio conel	1191
1499|1500	qu' il le porte a terre|et lui	e conel Cauallo envno en tierra Mucho se Marauillaron los otros Caualleros desto	1192
1501	et le cheval	e dixeron	1193
1502	Et lors dient cil		
1503	qui devant s' en aloient		
1504	que molt joste bien li chevaliers quant	que mucho Justaua bien el Cauallero	1194
1505|1506	Il|de lor meillors compaignons a ensi abatus	Que dos delos mejores Conpañeros auia derribado	1195
1507	Et Lancelos laisse corre a els tos	e lanzarote se lanço entonçe entre ellos	1196
1508	qui encore estoient nuef;	que heran veinte	1197
1509|1510	si ot l' espee traite|por ce	e el conla espada enla mano	1198
1511|1512	que ses glaives estoit brisiés al chevalier|qu' il ot derrainement abatu ;	que la lança hera quebrada	1199
1513	si lor detrenche lor escus	e començo a derribar escudos	1200
1514	et lor depiece lor hialmes	e a cortar yelmos	1201
1515	et lor ront les haubers sor les bras	e lorigas ençima de braços	1202
1516	et sor les espaules;	e de espaldas	1203
1517	si fet tant par sa proesce	asi que tanto hizo Porsu proeza	1204
1518|1519	que tuit cil|qui le voient s' en merveillent	que quantos lo vian se marauillauan ende mucho	1205
1520|1521	Et la ou il voit le chevalier as armes vermeilles|si nel mesconoist pas ains li adresce par mi els tos	e Quando vido el Cauallero delas armas vermejas ende endereço contrael	1206
1522	et li done	e dixo esperad Cauallero	1207
1523|1524	si grant cop par mi le hialme|que cil est	e diole vn tal golpe dela espada de toda su fuerça sobre el yelmo	1208
1525|1526	si estordis|qu' il ne se puet es arçons tenir ains vole a terre	que dio conel en tierra estendido	1209
1527|1528	Et Lancelos li va par desus le cors a cheval|tant que cil pert la vertu	e traxo al cauallo tantas vezes sobre el quelo dexo medio muerto	1210
1529|1530	et la force tote a|Et lors sont li autre molt esmaié	e quando los otros caualleros esto uieron fueron muy escaidos	1211
1531	kar bien cuident	Ca bien Cuydauan	1212
1532|1533	que cil soit mors|qui lor sires estoit;	que su señor hera muerto	1213
1534	si se metent en paine del vengier	e metieronse en auentura de muerte lo vengar	1214
1535	et corent sus a Lancelot tuit ensamble	e dexaronse yr ael muy determinadamente|e lançarote	1215|1216
1536|1537	Mais il nel truevent pas|si esbahi	que desto no se espanto ni vn poco	1217
1538|1539	qu' il ne soit tos pres de soi deffendre;|si lor abandone son escu	Ca bien se cuydaua defender baldonaua a todos su escudo	1218
1540|1541	et tient l' espee|dont il lor done grans cops par la ou il les ataint ne onques	e daba tales Golpes consu espada	1219
1542	por pooir		
1543	qu' il aient ne li porent tolir terre ains se met par mi els maintes fois		
1544	quel gré	Que aquel	1220
1545	qu' il en aient		
1546|1547	Et de tant li avient il bien|qu' il n' aconsieut chevalier a droit cop	que alcançaua aderecho golpe le fazia sentir la espada enla carne desnuda	1221
1548	qu' il ne face s' espee sentir en char nue ou il nel port del cheval a terre:	e daua conel del cauallo en tierra	1222
1549	si lor esrache les escus des cols	e les quebranto los yelmos enlas cabeças	1223
1550	et les hialmes des testes		
1551	et lor decoupe poins	e les cortaba piernas	1224
1552	et bras a	e braços|e	1225|1226
		asi que quanto alcançaua todo lisiaba	1227
1553	et se hurte en els de cors	Que delos golpes dela espada	1228
1554	et de cheval ;	que delos Pechos del caballo	1229
1555	si en a V	e asi abia los çinco a tales partido	1230
1556|1557	si atornés|qu' il gisent a terre	que non podian bollir pie ni mano tales yazian en tierra	1231
1558|1559	si conreé|qu' il n' ont pooir de relever	e quando los Caualleros vieron las marauillas de armas	1232
1560|1561	Quant li autre voient ce|si lor est avis que s' il i demorent plus il n' em pueent eschaper sans morir	Que el façia luego vieron queles conuenia morir	1233
1562|1563	et por ce s' enfuient al plus tost|qu' il pueent vers la forest ou il la voient plus espesse	si mas ay porfiasen entonçes començaron todos a fuir contrala floresta ado vian la mayor espesura	1234
1564	Et Lancelos ne les sieut mie granment ains retorne al chevalier	Quanto los cauallos los podian llebar Mas lan çarote no los quiso seguir	1235
1565	qu' il ot abatu celui as armes vermeilles	mas antes se fue al cauallero delas armas vermejas|que auia derribado	1236|1237
1566|1567	kar il voldra savoir|qui il est	Por saber quien hera	1238
1568|1569	Et quant il i est venus|si trueve l' escuier	e quando lançarote ay llego luego fallo el escudero	1239
		que ante el estaua enla tienda	1240
1570	que il queroit	que auia tomado	1241
1571	que on avoit mis sor I		
1572	roncin a les mains liies triés le dos	e estaua envn rroçin las manos atadas atras	1242
1573|1574	et vient a lui|si le deslie	e fue luego alo desatar	1243
1575|1576	Et quant il se sent delivrés|si li chiet as piés	e el escudero enque se vio libre hecho sele alos pies	1244
1577	et le mercie de Dieu ;	e agradesçio mucho a dios	1245
		porque asi lo auia librado	1246
1578	et Lancelos descent	e lançarote desçendio del cauallo	1247
1579	si li baille son cheval a garder	e diolo al escudero	1248
1580	puis vet al chevalier	e fuese al cauallero	1249
1581	qui ja s' estoit relevés en son seant	que estaua ya ensu acuerdo	1250
1582	si estordis	e se Reuoluia porse leuantar enpero estaua aun atordido	1251
1583	qu' il ne veoit gote	que no via ni aun gota	1252
1584|1585	Et Lancelos li esrache le hialme de la teste|si felenessement	e lançarote quitole el yelmo dela cabeça tan rreçio	1253
1586	que cil flatist à terre des paumes	que dio conel en tierra delas manos	1254
1587	et de tot le viaire;	e delas Rodillas	1255
1588	si saine del nes	e al arrancar desollole las narizes	1256
1589|1590	et del front [a) trop durement|Et Lancelos dist	e la frente	1257
1591|1592	qu' il l' ocirra s' i ne se tient|por outré;	que la sangre le hizo ende salir muy fieramente	1258
1593	et cil est	e dixole	1259
1594	si esmaiés a	si te no tienes	1260
		por vencido yo te matare	1261
1595	qu' il ne li puet respondre ains gist pasmés adens b	e el cauallero estaua atal quele no podia rresponder	1262
1596	Et Lancelos le redrece	e asi estaua amortesçido|e lançarote catolo	1263|1264
1597|1598	si le trueve|si ensanglenté	e fallolo todo sangriento	1265
1599	qu' il cuide bien	e bien cuydo	1266
1600	que il soit mors	que hera muerto	1267
1601	et lors se repent de ce	e mucho se arrepintio	1268
1602	que tant li avoit fet mal;	porque tan mal lo auia fecho	1269
1603	si s' asiet les lui	e tirose del todo	1270
1604	por veoir	por verlo	1271
1605	que il fera	que aria	1272
1606	Et ja se relevoient troi de cels	e los tres caualleros|que ante derribara començaronse a Reboluer	1273|1274
		e lançarote enquelo vido fue alla	1275
1607	qui a terre avoient geu	e dixoles|si vos no tenedes	1276|1277
1608	et Lancelos lor laisse core	por vençidos yo vos matare|e los caualleros enque aquello vieron Rindieronle sus espadas con pauor de muerte	1278|1279
1609|1610	et dit|que mort sont	e dixeron ay señor	1280
		ca nos faremos tu voluntad	1281
		e lançarote los tomo luego	1282
		e los caualleros le juraron de hazer toda su voluntad	1283
