0	avoir trové	que queria fallar muy de grado|e luego le conto todo	0|1
1	Si li conte tote s' aventure issi com vos avés oi dire ça arrieres	como le auia conel contesçido|asi como el cuento lo a deuisado	2|3
2|3	tant|qu' il conoist bien	e luego entendio boores	4
4|5	que c' est il|qu' ele quiert a	que ael andaua ella buscando	5
6	Mais por le coros de la mort al seneschal ne se volt fere conoistre ains li respont Certes damoisele chevalier	mas porel pesar dela muerte del senescal no se quiso fazer conosçer antele rrespondio çierto donçella al cauallero	6
7|8	qui porte escu blanc ne conois je nul|— En non Dieu sire fet ele ce poise moi chierement	que traia blancas armas no conozco yo Pardios dixo la donçella mucho me Pesa caramjente	7
9	Et il n' en tient plus a li parole ains part	e boores non quiso conella|mas estar	8|9
10	si tost com il l' ot commandee a Dieu a	e acomendo la a dios|e fuese	10|11
11	et chevalche en tel maniere jusqu' a tierce tant	e andubo tanto	12
12	qu' il vint a l' issue de la forest;	que salio dela floresta	13
13	et il torne a destre vers un chemin viés	e dexo el camino|e tomo a mano derecha vn camino pequeño	14|15
14	et ancien;	e biejo lleno de yerba	16
15	si ne demora gueres	e non andubo mucho	17
16	qu' il vint a une eve P lee	porque llego a vn valle	18
		Por do corria vn agua muy negra	19
17	et parfonde	e fea|e fonda	20|21
18	mais il n' i trueve pont ne gué ne passage nul	e non fallo puente|por do Pudiese pasar	22|23
19	Et il regarde d' autre part de l' eve	e cato dela otra parte Del agua	24
20|21	si voit I|petit chastel molt bien seant clos de mur bateillié tot entor a la roonde	e vio vn castillo muy bien asentado çercado de muy buen muro todo enderredor	25
22	ll regarde grant piece le chas tel	e el cato gran pieça el castillo	26
23	dont la façons li plest molt a regarder	ca mucho se pagaua delo catar	27
24	puis s' en torne contreval la riviere	e despues torno la rribera ayuso	28
25	por savoir s' il i peust trover ne pont ne gué	Por saber|si podria fallar puente	29|30
		Por do pasase	31
26	mais il n' en trueve point	mas el no pudo fallar ninguna	32
27|28	et quant il voit|qu' il n' i passera	e boores desque esto vido no sabia	33
29	si ne set		
30	que fere	que se façer	34
31	que retorner ne voldroit il mie	ca el no se queria tomar en ninguna manera	35
32|33	Atant voit issir del chastel une damoisele|qui ert tote nue en sa chemise	Ansi estando vio del castillo salir vna donçella en camisa	36
34	si le menoient troi vilain molt vilainement a	que traian quatro rribaldos muy sañudamente	37
35	et tenoit chescuns une hache en sa main;	e cadavno traia enla mano vna lança	38
36|37	et ele crioit quanque ele pooit crier|por els	e ella daua vozes	39
38|39	qui li faisoient tel honte|et tel laidure	quanto podia dar	40
40	qu' il la venoient batant tot contreval la riviere	e ellos la lleuaron muy desonrrada mente contra la rribera porla yr ha echar	41
41	Et quant la damoisele vit le chevalier de l' autre part de ! l' eve	e quando la donçella vio a bores dela otra parte del agua començo a dar vozes	42
42	si commence a crier Ha gentilz chevaliers secorés ceste damoisele	e a deçir ay jentil cauallero acorred a esta donçella	43
43	que cist ribaut vuelent ocirre	que estos Ribaldos me quieren	44
44	Ha frans hom ne m' i laissiés morir se vos onques eustes pitié de nule gentil damoisele	ansi matar ay buen cauallero|si nunca oviste piedad de donçella auelda agora de mi	45|46
45	Quant Boors ot ce		
46	qu' ele li prie	e no me dexedes	47
47	si pitousement qu'il la secore	asi morir|Quando boores oyo lo	48|49
48	si ne set	que la donçella deçia no supo	50
49	que fere	que façer	51
50	kar volentiers li aidast s' il peust;	ca muy de grado la quisiera acorrer	52
51|52	mais il voit l' eve noire|et parfonde	si pudiese Mas el agua hera muy fonda	53
53	et si perilluse	e peligrosa|e negra	54|55
54	qu' il cuide bien noier s' il se met dedens;	e bien cuidaua morir|si se y Metiese	56|57
55	et d'autre part il voit cele	e dela otra parte veya la donçella	58
56	qui si durement crie merci;	que muy afincada mente le pedia merçed	59
57	si l'em prent tels pitiés	e ovo tal piedad della	60
58	qu' il en laisse totes poors	que le fiço todo el miedo perder	61
59	et fet le signe de la crois en mi son vis	e fiço la señal dela cruz sobre	62
60	puis enbrace l' escu	si e enbraço el escudo	63
61	et broche le cheval des esperons	e firio al cauallo de las espuelas	64
62	et se fiert en l' eve	e lanço se en el agua	65
63|64	Et li chevals fu fors|si commence a noer	e el cauallo començo de nadar luego	66
65	si tost com il ot terre perdue	e perdio tierra en tal manera	67
66	si l' enporte d' autre part de la rive a quelque paine	que paso dela otra parte del agua	68
67	mais ançois ot beu de l' eve li uns	mas ante beuio el cauallo del agua	69
68	et li autre		
69|70	et se li chevals ne fust|si buens noié fuissent ambedui	e si el caballo tan bueno no fuera sin dubda el moriera enel agua	70
71|72	kar li chevaliers estoit pesans|por les armes	e boores porel peso delas armas	71
73	qu' il avoit vestues	que llebaua	72
74|75	Quant il fu de l' autre part de l' eve|si ne descendi pas ains cort vers cels	e desque fue dela otra Parte del agua dexo se correr aquellos	73
76	qui la damoisele tenoient	que la donçella tenian	74
77|78	et fiert|si le premier	e firio al primero	75
79	qu' il aconsieut	que encontro en tal manera	76
80|81	qu' il li met le glaive par mi le cors|si l' abat a terre	que le metio la lança porel cuerpo	77
82	et li autre s' enfuient erraument	e los otros dos|que aquello vieron fuyeron luego	78|79
83	por ce	por miedo de no ser muertos	80
84	que desarmé estoient	ca todos estauan desarmados	81
85|86	Et la damoisele|qui delivree se voit se met a genols devant Boort	e la donçella desque aquello vido finco los ynojos ante boores	82
87	et dist Ha gentils chevaliers de Dieu soiés vos beneois	e dixo ay jentil cauallero vendito seades de dios	83
88	quant vos m' avés de mort rescosse	que asi me librastes de muerte	84
89	et aorés en soit Diex	e bendito sea dios	85
90	quant il ceste part vos amena	que aqui vos traxo	86
91	kar cist gloton m' euissent ja morte	que estos villanos me hubieran muerto	87
92	— Damoisele fet il	si por vos no fuera donçella dixo boores	88
93|94	por quoi|? — Sire fet ele jel vos dirai bien	Por que señor dixo ella yo vos lo dire	89
95|96	mais que vos m' aiés mise a sauveté|— Coment	mas ante conuiene	90
97	? fet il		
98	Avés vos		
99|100	dont garde|? — Certes fet ele ja asseur ne seraî fant com je sache laiens le seignor del chastel	que non aya miedo de ninguno Donzella dixo boores de quien auedes miedo señor dixo ella del señor del castillo	91
101	kar c' est li plus fel chevaliers del monde	ca es el|mas follon omne de todo el mundo	92|93
102	et li plus traîtres	e mas cruel Ellos	94
103|104	A ces paroles voient issir I|chevalier del chastel	asi fablando vieron salir del castillo vn caballero	95
105	et la ou il vit Boort	e quando vido a boores començo le a dar boçes	96
106	si li escrie Laissiés dans chevaliers la damoisele	e a deçir don cauallero a dexar vos conuiene la donzella	97
107	que vos n' enmenrois mie! Par mon chief mar le rescosistes	ca la non lleuaredes|e porla my cabeza ental Punto la acorristes	98|99
108	Si li cort quanqu' il puet le glaive alongié;	e luego se dexaron correr el vno contra el otro	100
109	et Boors retrait son glaîve a lui del cors a celui	e boores lo firio conla lança	101
110|111	qu' il avoit ocis;|si laisse le cheval corre	que auia sacado del cuerpo del villano	102
112|113	et le fiert|si tres durement	que auia muerto en tal manera	103
114	qu' il l' abat a terre	que dio conel Porlas ancas del cauallo a tierra	104
115	si estordi	asi estordido	105
116	qu' il n' a pooir de relever ains gist pasmés	que non se pudo leuantar	106
117|118	kar il chai|si felenessement	asi estaua amorteçido dela cayda	107
119|120	qu' a poi|que la canole del col n'avoit brisee	que las coyunturas del pescuezo tenia quebradas	108
121	Et Boors li vet a cheval par desus le cors	e boores traxo tantas vezes el cauallo sobre el	109
122	tant que tot le debrise	Que todo lo quebranto	110
123	Et lors est la damoisele	e la donçella	111
124	si liee	que aquello vido fue muy alegre	112
125	qu' ele ne puet plus	que mas no lo podia ser	113
126	et dist a Boort Sire nos n' avons mes garde	e dixo a boores señor agora non auedes aqui deque vos	114
127	kar je ne cuit	mas guardar	115
128	qu' il eust plus de chevaliers çaiens	ca eneste castillo no auia|mas deste cauallero segund cuydo	116|117
129	que cestui;	e agora os direlo	118
130|131	si vos dirai ore seurement ce|que vos me demandastes n' a encor gaires	que me preguntastes seguramente Pues deçidmelo dixo boores	119
132	— Dites fet il	asi es dixo la donçella	120
133	— Sire fet ele entre moi	que oy mañana entre mi	121
134|135	et I|chevalier	e vn cauallero	122
136	qui mes amis estoit chevalchions hui matin par mi cest chastel	que hera mi amigo pasamos poreste castillo	123
137	et quant li freres a celui	e quando el señor del castillo hermano de	124
138|139	que vos avés abatu me vit|si me volt a force prendre	aquel que vos derribastes me vido quisome prender afuerça	125
140	kar il m' avoit molt longuement amee;	e trabo del freno demi palafren	126
141	si me prist al frain	e quisome llebar	127
142	et m' en volt mener a force mes mes amis se combati a lui tant	e me vido mi amigo llebar conbatiose conel tanto quelo mato	128
143|144	qu' il l' ocist|Et quant cist	e quando	129
145|146	que vos veez ci ore vit son frere mort|si fist mon ami prendre a force de vilains	aquel que alli esta vido asu ermano muerto fiço prender ami amigo a fuerça de gente	130
147	et de gens	e de villanos	131
148	et l' ocist en venjance de son frere	e matolo en enmienda dela muerte desu hermano	132
149	Mais de moi	e dixo	133
150	por cui Ses freres avoit esté ocis dist il	que demi se vengaria el seguramente	134
151|152	qu' il se vengeroit sans main metre;|si me fist prendre a ces ribaus	porque fui ocasion dela muerte de su hermano entonçe fiço tomar aquellos quatro villanos	135
153	que vos veistes	que vos vistes	136
154	et lor commanda	e mandoles	137
155	qu' il me noiaissent	que me matasen en aquel agua	138
156	kar par armes dist il ne vueil je mie	ca por armas no me queria matar	139
157|158	qu' ele muire ;|si m'enmenoient	e ellos me mataran sin falta	140
159|160	si com vos veistes morir|quant vos me venistes secorre par la volenté de Dieu	si vos porla voluntad de dios	141
161	et par la vostre	e porla vuestra no me acorrierades agora vos	142
162	Or vos ai conté mon errement ;	e contado todo mi acaesçimiento|como me contesçio	143|144
163	si voldroie des Ore mes se vostre plaisirs estoit	e querria	145
164	que vos me menissois a salveté en un mien chastel	que me llebasedes a vn mi castillo	146
165	qui est ci pres	que es çerca de aqui	147
166|167	— Volentiers fet il|Si le prent par les bras	si vos plaze de GraDo dixo boores	148
		e luego echo su escudo alas espaldas	149
168	et le monte par devant lui sor le col de son cheval	e tomola Porel braço|e pusola antesi Ensu caballo	150|151
169	si a geté son escu derieres [c) son dos	e fuese|ansi conella	152|153
170|171	si s' en vet cele part ou la damoisele li enseigne|tant que ce vint aprés midi	por do ella lo yria guiando fasta medio dia	154
172|173	qu' il voient en un tertre I|bel a chastel	Que vieron vn muy fermoso castillo	155
174|175	et lors ataignent Il|escuiers	e alcançaron dos escuderos ala salida devn monteçillo	156
176|177	qui issoient d' un bossel|et aportoit chescuns venoisons trosee detriers soi	que traia cada vno vn corço atroxado trassi	157
178	Quant il virent la damoisele	e desque vieron la donçella desçendieron apie	158
179	si descendent a pié	e fueron	159
180	et li font grant joie com a celi	e fezieron gran alegria conella|como aquella	160|161
181	qui lor dame estoit	que hera su señora	162
182	mais molt se merveillent de ce	mas mucho se marauillaron	163
183	qu' il la virent plorer:	porque la vian|ansi venir	164|165
184	si li enquierent	e preguntaronla	166
185	que ele a	que auia	167
186	Et ele lor dit comment ses amis avoit esté ocis	e ella les conto|como su amigo hera muerto	168|169
187	et je meismes euisse esté morte	e dixo yo mesma fuera muerta sino fuera	170
188	se ne fust cis frans chevaliers	por aqueste buen cauallero	171
189	qui par sa debonaireté me resqueust	que me libro	172
190	et se mist em peril de mort	e se metio en peligro de muerte	173
191	por ma vie sauver	Por me librar	174
192	Et lors conseille a l' un de ses escuiers		
193	et cil se destrosse maintenant de sa venoison	e luego destroçaron el vn corço	175
194	si la baille a son compaignon	e pusieronlo enel Palafren	176
195	por porter	e ymbiaronlo al castillo conel vn escudero|e pusieron ala donçella enel otro	177|178
196	si s' en vet vers le chastel quanqu' il puet traire del roncin	e fueronse contrael castillo|quanto podian	179|180
197	Et Boors demande a la damoisele comment li chastials a non ou ses amis a esté ocis	e boores pregunto ala donçella|como auia nombre el castillo	181|182
198	Sire fet ele il a non Galedon	Do su amigo auian muerto señor dixo ella el a nombre Galdon	183
199	et l' eve par ou vos passastes a non Galede	e el agua|que pasastes galide	184|185
200|201	Ensi parolent tant|qu' il sont venu jusqu' al chastel	Asi fueron fablando fasta el castillo	186
202	si le voit Boors bien seant	Que hera muy fuerte	187
203	et fort	e muy bien asentado	188
204|205	Et quant il montent ! le tertre|si voient de laiens issir dames	e desque fueron entrados enel castillo luego vinieron contraellos muchas danças	189
206	et damoiseles a grant plenté	e corros de Dueñas	190
207	dont les unes karolent	e de donçellas	191
208	et les autres dancent	e otros dançaban	192
		e bailauan	193
209	et les autres joent de divers geus;	e otros jugauan|e façian juegos de muchas maneras	194|195
210|211	si estoient acesmees|et vestues richement	e todos andauan vestidos muy Ricamente entonçe vinieron contraellos	196
212|213	et avec venoient chevaliers jusqu' a X|qui molt faisoient grant joie;	mas de diez caualleros faziendo muy gran [	197
214	et quant il voient Boort	]	198
215	si crient tuit encontre lui Bien viengniés sire	e deçian todos avna voz vien venga el mejor cauallero	199
216	qui nostre dame avez delivres de mort	que anuestra señora libro de muerte	200
217|218	et rescosse des mains a ses enemis|Et lors font descendre lor dame	e libro anos denuestros enemigos entonçe los desçendieron a muy gran gozo	201
219|220	et lui avec :|si ne vos porroit nus conter la joie	e alegria façiendo con boores	202
221|222	qui li fu fete|A tel joie	asi que el se marauillaua ende mucho	203
223|224	et a tel feste enmainent Boort jusqu' al palés del chastel|si le font desarmer ou il volsist ou non	e las Mesas fueron puestas	204
225	et il le fist a envis	e asentaronse a comer	205
226	kar il n' estoit encore mie tens de herbergier	ca mucho lo auian menester	206
227|228	Ensi remist Boors laiens|si li firent grant joie li un	e desque ovieron comido la donçella le pregunto	207
229	et li autre a	e dixo le señor	208
230	Et quant il orent mengié	si vos pluguiere querria saber vuestro nombre	209
231|232	a damoisele demande a Boort comment il avoit non ét ¡l dist|qu' il avoit non Boors li Essilliés	porque sepa dezir quien me fiço tanto bien donçella dixo boores yo he nombre boores el deseredado	210
233	Et vos fet il	e vos donzella dixo el	211
234	damoisele quels est li vostre nons		
235|236	? — Sire fet ele|je ai non Blevine de Glocedun issi a non cist chastials ou nos somes	como auedes nombre señor dixo la donçella yo he nombre velniña de glaçendo	212
237|238	A ces paroles|qu' il disoient es vos I escuier	que asi a nombre el castillo enque estamos Ellos	213
239	qui laiens entre	ansi fablando llego vn escudero porla puerta	214
240	si s' agenoille devant la damoisele	e finco los ynojos ante la donçella	215
241	Dame fet il la damoisele de Honguefort vostre cosine vos salue	e dixole señora la donçella de hongeforte vos ymbia a saludar	216
242	et vos mande	e ymbiavos deçir	217
243|244	qu' ele vient herbergier o vos|Et quant cele l' entent	que esta noche ven conbusco albergar	218
245	si saut sus		
246	si liee		
247|248	et si joiose|que nule plus	e quando la donçella esto oyo fue muy alegre	219
249	et demande al vaslet ou ele est	e pregunto al escudero	220
250|251	Dame|fet il a mains de demie lieue pres de ci	do era señora dixo el escudero yo la dexe a media legua de aqui	221
252|253	Et ele fet maintenant sa sele metre|et dist	e la donçella mando luego ensillar	222
254|255	qu' ele ira encontre li;|si monte	e fuese con seis caualleros ala rreçebir	223
256	et maine o li		
257	VI		
258	chevaliers		
259	et Illl		
260	en laisse		
261|262	por fere compaignie a Boort ;|si se part atant de laiens	e dexo a boores con quatro caualleros porle fazer conpaña	224
263	Mes Boors		
264|265	qui les noveles a of̈es de cele de Honguefort|si ne set	e quando boores sopo quela donçella de ongeforte venia no sabia	225
266	que fere	que façer	226
267	kar se il remaint laiens ne puet estre		
268|269	que l' en nel conoisse|et ce ne voldroit il	ca no queria aquelo conoçiese	227
270	por rien:	si pudiese ser	228
271|272	si pense longuement a ceste chose|Quant il ot une piece pensé	e penso	229
273	si se drece en estant	asi enesto mucho	230
274|275	et demande ses armes tost|et isnel	e a cabo de Pieça demando sus armas señor dixeron los caualleros	231
276	Sire font cil		
277	qui avec lui estoient	que conel estauan	232
278	qu' en volés vos fere	que para	233
279|280	? — Je me vueil|fet il un poi aler esbatre jusqu' a cel boschel	que las queria yo me Quiero armar dixo boores Porme yr a solazar a aquel montezillo	234
281	si revendrai orendroit	e luego me tornare	235
282	Cil n' osent son commandement refuser	e ellos no osaron su voluntad contradeçir	236
283	si aportent ses armes		
284	et il les prent	e truxeronselas	237
285|286	Et quant il est armés|si monte en son cheval a	e el se armo	238
287	si se part de laiens par une posterne par devers le boschel ne ne velt	e desque fue armado salio porvn postigo	239
288	que nus li face compaignie	que estaua contrael monteçillo	240
289	Et quant il est l	e no quiso|que fuese conel ninguno	241|242
290|291	poi eslongiés del chastel|si torne a destre vers une forest	e desque fue vn poco alongado Metiose porvna floresta	243
292	qu' il voit haute	que vido muy espesa	244
293	et espesse	quanto el cauallo lo pudo lleuar	245
294|295	et s' en vet al ferir des esperons;|si se fiert en la forest	e el	246
296|297	et eirre tant|qu' il li anuite ;	ansi yendo oyo vna canpana tañer	247
298|299	et lors escote|si ot une cloche soner	e luego cuido quela tañian en alguna hermita	248
300	et il sot bien tantost	e el fue alla	249
301|302	que c' estoit hermitages:|si s' en torne cele part	e desque llego ala hermita llamo fastaque el hermitaño le vino a abrir	250
303	et descent a l' uis	e acogiolo	251
304	si apele	porque vido	252
305|306	et li hermites li oevre son huis|si a le reçoit a bele chiere	que hera cauallero andante	253
307	et le desarme il meismes	e el mesmo lo ayudo a desarmar	254
308|309	puis vet cueillir [d) de l' erbe al cheval|et por fere lit al chevalier	e desque lo ovo desarmado cogio dela yerua Parael cauallo	255
310	Ensi est Boors remés chiés l' ermite	Ansi finco enla hermita	256
311|312	et la damoisele de Glocedun chevalcha tant a|qu' ele encontra cele de Honguefort;	e la donçella de glaçedon andubo tanto fastaque encontro ala señora de ongeforte	257
313	si s' entresaluent	e ellas se saluaron	258
314	mais molt se merveille cele de Glocedun	e la donzella De glazedon se marauillo mucho	259
315	quant ele voit sa cosine	quando vido	260
316	si atornee	asi venir asu parienta	261
317	et tote sa maisnie:	e a todas su conpaña	262
318	si li demande l' acheison	e preguntaronle la Razon	263
319|320	et cele li conte de chief en chief|et dist	porque hera aquello	264
321	que jamés ne finera d' errer jusqu' el ait le chevalier trové	asi e la donzella de ongeforte selo conto todo de cabo a cabo Como le contesçio conel cauallero	265
322	et bien sachiés fet ele bele cosine	e mi buena parienta bien sabed	266
323	que c' est li plus bials chevaliers	que el es el|mas fermoso cauallero	267|268
324	et li mieldres		
325	que je onques mes veisse	que nunca vi	269
326	et si est encore jovenes enfés;	e nunca quedare de andar|asi fasta quelo falle	270|271
327	si ai tel duel	ca sabed	272
328	quant il me membre de la vilenie	que el es el mejor cauallero Del mundo	273
329	que je fis	e mas cortes	274
330	qu' a poi	e es muy niño	275
331	que li cuers ne me part el ventre	e quando me mienbro dela descortesia	276
332	— En non Dieu bele cosine fet cele de Glocedun s' il vos avint bele aventure il ne m' est pas hui avenue mains bele	e dela villania|que contrael fiz el corazon seme quiere quebrar enel cuerpo Pardios mi buena parienta dixo la dueña de glozendo mucho vos a acasesçido buena ventura	277|278
333	Si li conte tot ensi com il li estoit avenu	e ami non a venido menor	279
334	et dist	e luego le conto	280
335	qu' ele a le chevalier herbergié	como auia acaesçido conel Cauallero|que conella albergara	281|282
336	mais bien sachiés fet ele	mas bien sabed	283
337	que c' est li plus bials chevaliers	que es el|mas fermoso cauallero	284|285
338	que je onques mes veisse	Que Nunca vi	286
339	et jovenes durement ;	e es muy mançebo	287
340	si li devise sa façon		
341|342	et son grant|et sa mesure tant	e luego le conto las façiones del tanto quela dueña de ongeforte entendio	288
343	qu' a cele de Honguefort est avis	que hera el cauallero	289
344|345	que c' est cil|qu' ele quiert	que ella andaua buscando	290
346|347	si li tarde molt|qu' ele le voie	e mucho sele tardaua delo ver	291
348	Ensi chevalchent jusqu' al chastel	asi fueron ental manera fablando|Que llegaron al castillo	292|293
349	si descendent la damoisele molt honorement	e rresçibieron todos ala donçella de ongeforte muy honrradamente	294
350	et molt font grant joie de li a	e fizieron gran gozo conella	295
351|352	Et lors sont montees el palés;|si demande cele de laiens ou ses ostes est	e la donçella del castillo pregunto luego porsu huesped	296
353	Par foi font	Por buena fee dixeron los caualleros	297
354	si chevalier ¡l s' en vet orrendroit tos armés fors de cest chastel	que auian fincado conel tomo sus armas|e fuese a deportar a aquel montezillo	298|299
355	mais il nos dist	mas luego dixo	300
356|357	qu' il revendroit tantost; n' onques|por nul pooir ne volt soffrir	que se vernia Mas nunca	301
358	que nus de nos alast avec lui		
359	—		
360|361	Quel part s' en ala il|? fet ele	por alguna manera Podimos	302
362	— Dame font il vers cel boschel		
363	— Or tost fet ele montés alés aprés lui		
364	si le nos ramenés	que nos sufriese	303
365	Lors sont monté li X		
366|367	chevalier|et vienent jusqu' al boschel	que fuesemos conel a qual parte fue dixo la donçella del castillo aquel montezillo dixeron ellos	304
368|369	si le cerchent amont|et aval mes del chevalier ne pueent riens trover	e luego mando alos diez caualleros quelo fuesen alla a buscar	305
370	si en sont molt irié	e ellos lo fiçieron	306
371|372	et dolent|et mandent a lor dame	ansi ca anduuieron todo el mon teçillo arriba	307
373|374	qu' il ne le pueent trover|En non Dieu fet ele ensi ne remandra il pas	e ayuso Mas nunca lo pudieron fallar	308
375	Si monte	e tornaron	309
376	et tote sa maisnie	e contaronselo	310
377|378	et commande a cerchier le bois de totes pars|et il en font son commandement	ansi asu señora Pordios dixo la donçella ni poresto no fincara	311
379	Mais tot ce ne lor valt riens	e luego Caualgo con toda su conpaña|e fuese Al montezillo	312|313
380	kar il n'em puent avoir nul asenement a	e fizolo çercar de todas partes|mas nunca lo pudieron fallar	314|315
381|382	Quant ele vit ce|si s' en retorne en son chastel dolente	e quando ella aquello vido tornose asu castillo muy triste	316
383	et corociee	e muy sañuda	317
384	et conte a cele de Honguefort comment ses ostes s' en estoit alez	e contolo|ansi ala donzella de hongeforte Como su huesped hera ydo	318|319
385	puis demande a cels de laiens Bials seignors	e la donzella les pregunto	320
386	quant s' em parti il — Par foi dame font il	quando se fue Pordios buena señora luego	321
387|388	si tost com il vos en vit aler|et dist	que vos de aqui partistes Mas dixonos	322
389	qu' il revendroit tost	que luego venia	323
390	— Par foi fet ele gabez nos a	Por buena fee dixo ella bien nos a engañado	324
391	Lors demanda cele de Honguefort quels armes il portoit	Que armas traia dixo la donçella de hongeforte	325
392|393	et ele li devise|En non Dieu fet ele je te trovai hui matin a l' entree d' une forest mes il ne portoit mie tel escu com cil	e la donçella selas deuiso Pordios dixo ella yo lo falle oy demañana envna floresta	326
394	que je quier	mas no traia el tales armas Como	327
395		aquel que yo ando buscando Buena Parienta dixo la donçella del castillo el las puede auer bien trocado	328
396	et je vos di al mien cuidier	e yo vos digo ami cuidar	329
397	que ce est cil	Que este es	330
398	que vos querez :	el que bos buscades	331
399	si vos prie	e Ruego vos	332
400|401	que vos me laissiés o vos aler|tant que trové l' aions	que me dexedes convos yr fasta Quelo fallemos	333
402	et lors savrai l' acheison	e sepa la rrazon	334
403|404	por quoi il laissa mon ostel a tel ore|— Il m' est molt bel fet cele de Honguefort	Porque se fue demi castillo ental manera Mucho me Plaze dixo la donzella de ongeforte	335
405|406	que vos i viegniés|puis qu' il vos plest	Que vengades Pues vos plaze	336
407|408	Ensi remistrent la nuit laiens|et al matin	ansi fincaron toda aquella noche enla mañana tanto Como fue de dia se leuantaron	337
409	si tost com eles ! virent le jor		
