832	si que li bras a tote l' espaule chiet desus le pavement b	e el cauallero conel gran dolor cayo luego en tierra amorteçido	657
833	Et lors sont molt esmaié li autre troi	e los otros desque aquel golpe vieron fueron muy desmayados	658
834|835	si font molt malvés samblant d' els deffendre|por le grant cop	e fiçieron mal senblante dese defender porlos grandes golpes	659
836	qu' il ont veu	que façia	660
837	et por l' espee	e porla espada	661
838	que chescuns d' els a ja sentie jusqu' al sanc	que auia sentido cadavno enlas carnes	662
839	Et Lancelos lor cort sus	e lançarote no cato	663
840	et en fiert I	mas aquel	664
		que derribo ante dio al otro vn tal golpe	665
841|842	el hialme|si qu' il le fet flatir a terre d' ambesdeus les paumes	por çima del yelmo quele fiço dar con anbas manos en tierra	666
843	Et quant li autre dui voient ce	e desque los otros esto vieron començaron a foir	667
844	si tornent en fuies vers l' uis a garison;	por guaresçer	668
845	et Lancelos vint ataignant le deerrain	e lançarote alcanço	669
846	si le fiert par entre l' escu	aquel que yua de tras	670
847	et le bras	e firiolo	671
848|849	si qu' il li trenche le poing|et li escus chiet a terre	asi duramente entre el onbro y el escudo	672
850	et cil torne en fuies		
851	qui maheignié se sent	que tenia enbraçado	673
852	Et Lancelos vient a l' autre	que el braço conel escudo le fiço bolar en tierra	674
853	qui ja se relevoit sel fiert de l' espee	e el cauallero fuese fuyendo|ansi llagado	675|676
854	si grant cop	como estaua	677
855	qu' il li fet le hialme voler en la place	e lançarote fuese enpos el otro|que auia fincado	678|679
		e firiolo	680
		asi enlo alcançado ençima del yelmo	681
856	Et quant cil sent son chief nu	que selo fiço volar dela cabeza	682
		e el cauallero desque vido su cabeça desarmada Con pauor de muerte	683
857	si cria merci	que ovo pidio le merçed	684
858|859	et dist|qu' il ne l' ocie pas	e dixole ay buen cauallero no me matedes	685
860|861	kar il est pres de sa volenté fere|Or te covient donc fet Lancelos fiancer	que yo fare toda vuestra voluntad tu me juraras dixo lançarote	686
862	que tu le cors mon seignor Galehout conduiras a la Dolerose Garde	que llebes el cuerpo demi señor galeote ala dolorosa guarda	687
863	et iluec le feras garder	e desque y fueres	688
864	tant que je i viegne;		
865|866	et se l' en te demande|qui t' i envoie	si te preguntaren quien te ymbia tu les diras	689
867	si diras « cil		
868	qui ot les ames blanches le jor	que el cauallero delas armas blancas	690
869	que li chastials fu conquis	que el castillo conquisto te ymbia alla	691
870	Et il li fiance	e el cauallero selo juro	692
871	que tot ensi le fera il	asi façer	693
872	Lors prent Lancelos la lame par le plus gros chief	e lançarote se fue luego parala tumba|e tomo a manos el cobertor Porel Cabo	694|695
873|874	si tire de grant force|qu' a pou	que mas hera grueso	696
875|876	qu' il ne se deront tos|si que li sans li vole par mi le nes	asi afuerça porlo leuantar quela sangre le quebro porla cabeça	697
877|878	et par mi la boche|et li cors li sue d' anguoisse	e porlas narizes quelas açerdas de todo el cuerpo se le estendieron muy fuertemente	698
879	Mais por tote la destrece ne remaint	asi que	699
880|881	qu' il n' ait la tombe levee en haut à; mes nule dolors|qu' il eust onques ne monte rien a cele dolor	por fuerça ovo el cobertor a leuantar maguer Mucho hera pesado Mas nunca el tal duelo ovo	700
882	qu' il ot	como estonçe	701
		e tal Pesar	702
883	quant il vit le cors Galehout tot ensi armé com il estoit;	quando el vido el cuerpo de Galeote|e estaua armado de todas armas	703|704
884	si trova s' espee delés lui	e tenia su espada cabe	705
885|886	qui molt estoit|et bone	si que hera muy buena	706
887	et clere;	e clara	707
888	et sans faille de l' espee meesmes se fust il IId) ocis se la damoisele ne li eust tolue erraument b	e sin falta el se ouiera conella muerto|si la donçella	708|709
889	Lors fist Lancelos une biere fere de fust	Que del lago auia venido delas manos no sela tirara|e luego fiço façer lançarote vnas andas	710|711
890|891	et la fist covrir des plus riches pailes de laiens|et quant il l' ot atornee al plus richement	e cobrir de muy Ricos paños	712
892	qu' il pot li chevaliers prisons li dist Sire fet il se l' en movoit tot de nuis ce seroit sens	e poner enellas el cuerpo de Galeote|e el cauallero Dixo a lançarote señor yo vosloaria	713|714
893	—	si vos plugiese|que luego Mouiese de aqui conel cuerpo de galeote	715|716
894|895	Por quoi|? fet il	Porque dixo lançarote	717
896	—	porque señor dixo el cauallero	718
897	Por ce que se li chevalier de cest païs savoient	porque si los caualleros desta tierra lo supieren	719
898	que l' en len deust porter il feroient gaitier les trespas	que de aqui lo queredes llebar faran guardar los tres pasos	720
899	si qu' il seroit arestés en alcun lieu ;	asi que sera detenido en algund lugar	721
900	et por ce vos loeroie je	e poresto seria bien	722
901	qu' il meust orendroit		
902|903	kar il seroit bien eslongiés ains|qu' il fust jors XX	que nos alongasemos de aqui esta noche vnas diez leguas bien acordades Dixo lançarote	723
904	lieues englesches		
905	Et il s' i acorde bien;		
906|907	si met la litiere sor Il|palefrois amblans	e luego fiço poner las andas sobre dos palafrenes muy andadores	724
908|909	et enportent ensi Galehout fors de sa region;|si en font li frere grant duel	e lleuarlo	725
910|911	et molt en sont corocié|et dolenta de ce	asi Mas mucho ouieron gran pesar los frailes	726
912	que l' en l' enporte	quando asi lo vieron lleuar	727
913	Et Lancelos le convoie grant piece de nuis plorant	e lançarote fue gran pieça llorando conel cuerpo de Galeote	728
914	et regretant sa proesce	e diçiendo sus proezas	729
915	et sa valor	e su valor	730
916	et se ne fust la damoisele	e si no fuese porla donçella	731
917|918	qui avec lui estoit molt en eust plus fet|qu' il ne fist	que del lago auia venido Mucho fiziera mayor duelo	732
919	mais ele l' en detorna	mas ella selo estoruaua	733
920	et il deffendi al chevalier	e anteque lançarote del cuerpo se tornase Dixo al cauallero yo vos defiendo	734
921	que il nel feist en terre metre devant	Que el Cuerpo demi señor galeote no fagades enterrar fastaque yo mesmo alla vaya	735
922	que il fust venus	e el Cauallero dixo	736
923	Si se part atant li uns de l' autre	que asi lo faria entonçe se partio dellos lançarote	737
924	et il retorne a l' abeie	e tornose al abadia	738
925	si se couche c' onques la nuit ne volt mengier ne boivre	mas en toda aquella noche no quiso comer ni veuer	739
926	por chose	por cosa	740
927	que l' en li deist ains plora	que le dixesen|e non fazia sino llorar	741|742
928	et dolosa tot adés;	e mucho se quexaua	743
929|930	si li anuioit molt li jors|qui tant demoroit a venir	Porque tanto aquella noche le duraba	744
931|932	a|Al matin	e luego	745
933|934	si tost com li jors aparut se leva|et oi messe entre lui	Que el dia aparesçio lançarote se leuanto	746
935	et la damoisele	e la donzella otrosi	747
936	et puis s' arma	e fueron a oyr misa	748
937	Lors li dist ele les noveles de Boort	e desque la misa fue aCabada Armose|e despidiose del fraile	749|750
		e entro ensu camino conla donzella	751
		e ellos	752
		asi yendo la donçella le conto nuebas de boores	753
938	et ce	e de	754
939	qu' ele en avoit veu devant Honguefort	como le contesçiera enel castillo de ongeforte	755
940	et il en fu molt liés	e el fue dello muy alegre	756
941	Et ele li dist Sire il vos vet querant ne jamés ne finera tant	e ella le dixo sabed señor	757
942	qu' il vos avra trové	que vos a buscado	758
943	— Damoisele fet il se vos le cuidiés trover ains de moi je vos voldroie proier	e nunca jamas quedara fastaque vos falle Ay donçella dixo lançarote|si vos lo cuidades fallar yo vos querria rrogar	759|760
944	que vos feissiés tant		
945|946	por moi|que vos li portissiés ceste espee	que fiziesedes tanto pormi quele llebasedes esta espada	761
947	qui fu mon seignor Galehout	que fue demi señor galeote	762
948|949	et li dites|qu' il la DOrt de par moi	e dezilde quela traiga pormi amor	763
950	que molt est bone	ca mucho es buena	764
951	Et ele dist		
952	qu' ele le trovera par tens		
953|954	et bien fera cest message;|si s' en part atant de lui	e fermosa yo lo fare dixo la donçella de grado Luego se partio el vno del otro	765
955	et il s' en vet droit vers le chastel de Floego	e lançarote se fue contra el castillo de florenga	766
		e andubo tanto	767
956	si i vint a hore de prime	que llego alla ante de prima	768
957|958	Et il esgarde es pres defors la vile|si voit molt grant gent entor le feu ou l' en devoit ardoir la suer Meleagan	e vio ante la villa gran jente alrrededor de vn fuego	769
959|960	et quant il aperçoit le feu|si a poor de la damoisele	e en aquel fuego auian de quemar ala hermanade meliangas	770
961	Lors broche le cheval	e lançarote	771
962	et vint errant cele part tant com il puet del cheval traire	que aquello vido dio delas espuelas al cauallo	772
963	Et quant il est venus jusque la	e llego alla	773
964	si esgarde	ca bien cuidaua	774
965	et voit la damoisele		
966	qui ja estoit amenee al feu	que ya quemauan la donçella	775
967	por destruire		
968|969	si estoit en pure sa chemise|et le tenoient	e quando el y llego vio la donçella estar ante el fuego envna muy pobre camisa	776
970|971	VI|pautonier trois d' une part	e tenianla seis billanos tres dela vna parte	777
972	et trois d' autre;	e tres dela otra	778
973	si n' atendoient a geter le el feu fors le commandement as juges	e no esperauan al sino el mandamiento delos juezes parala hechar enel fuego	779
974	et ele ploroit trop durement	e la donzella lloraua muy fuertemente	780
975	et regretoit Lancelot:	e llamaua a lançarote	781
976	Ha gentilx chevaliers Lancelos	e deçia ay mi buen cauallero	782
977	kar pleust ore a nostre Salveor	e pluguiese agora anuestro señor	783
978	que vos seuissiés ceste novele	que supiesedes estas nuebas	784
979	si fuissiés pres de ci a demie lieue! Certes a l' aide de Dieu	e estubiesedes çerca de aqui media legua|e conla ayuda de dios	785|786
980	et de la vostre seroie je encore anuit rescosse malgré tos mes enemis	e conla vuestra seria yo aCorrida|e librada	787|788
981	Mais vos ne le savés pas a	e mas vos no lo sabedes	789
982|983	si me covendra ore morir|por la vie	e asi me conuerna a morir	790
984	que je vos sauvai emprés Dieu;		
985	mais certes il ne m' en poise pas tant	mas no me pesa tanto pormi	791
986	por moi com il fet	como porel pesar	792
987	por le coros		
988	que vos en avrois	que vos abredes	793
989|990	quant vos le savrois|Mais ce me reconforte molt	Quando lo supieredes Mas esto me conorta mucho	794
991|992	que je sai bien|que les damoiseles gaaigneront tant en ma mort	que yo se quelas donçellas ganaran mucho enla my muerte	795
993	que jamés nule ne vos requerra d' aide	que jamas donzella no vos rrequirira de ayuda	796
994	que vos li faillois tant com il vos remenbre de moi	que le vos non fagades tanto|que vos acuerde demi	797|798
995	kar vostre cuers est	ca vos sodes tan noble	799
996	si frans	e tan franco	800
997	qu' il ne puet estre sans trop grant merites rendre a totes celes	que siempre dareis buen galardon a todos aquellos	801
998	qui de par moi se reclaiment:	que demi se lamentaren	802
999|1000	si m' est avis|qu' il m' est molt miels a m' ame de morir	e mucho me sera buena al alma esta muerte	803
1001	por loialté fere	que Resçibire	804
1002|1003	et por geter de prison|si vaillant home comme vos	porque saque de prision atan noble ome Como vos	805
1004	que vos fuissiés mors par la desloialté de Meleagan	que vos fuerades muerto porla deslealtad de meliangas	806
1005	qui en prison vos avoit mis par traïson	que en prision vos tenia|por su gran traiçion	807|808
1006	Ensi disoit la damoisele molt tendrement plorant	e esto deçia la donçella llorando muy dolorosamente	809
1007	et lors vint Lancelos poignant cele part ou il la vit:	e lançarote vino luego aquella parte	810
1008	si dist a cels	do la donçella tenian	811
1009	qui le tenoient Laissiés la damoisele! —	e dixo aquellos|que la tenian dexadla donçella	812|813
1010|1011	Por quoi sire fet J|chevaliers armés	Porque señor dixo vn cauallero	814
1012	qui avant saut le lairons nos	que delante salio la dexaran ellos	815
1013|1014	? —|Por ce fet il	Porque dixo lançarote	816
1015	que vos n' avés droit en li	Porque no auedes derecho	817
1016|1017	por fere mal|—	Porque la matar	818
1018|1019	Si avons fet cil|si grant	si auemos dixo el muy grande	819
1020|1021	que nos l' avons atainte de murdre|dont je l' apelai	ca ella fue acusada de muerte	820
1022	et ele s' en offri a deffendre	e ella se ofreçio a defender porvn cauallero	821
1023	mais ele ne trova onques	mas nunca fallo cauallero	822
1024	qui por li en prist escu	que porella quisiese tomar escudo	823
1025	et ce n' est pas mer [ al veille	e no es marauilla	824
1026	que chescuns set bien quele en a desloialment ovré	ca cadavno sabe su deslealtad	825
1027|1028	— De quoi|? fet Lancelos	e que es Esta deslealtad dixo lançarote	826
1029	— De ce fet il	Que es dixo el Cauallero	827
1030|1031	qu' ele delivra Lancelot|por Meleagan ocirre son frere	que solto De Prision a lançarote Para matar a meliangas su hermano	828
1032	— Se vos fet Lancelos osiés mostrer	si vos dixo lançarote osaredes mostrar	829
1033	qu' ele eust fet traïson ne murdre je seroie pres del deffendre	que hizo deslealtad o traiçion enlo soltar yo so presto dela defender Quien sodes vos dixo el cauallero vn cauallero dixo Lançarote so	830
1034|1035	—|Qui estes vos	que vengo aqui poresta donçella defender	831
1036|1037	? fet cil|— Uns chevaliers sui fet Lancelos	Por buena fee dixo el cauallero	832
1038	qui vieng ceste part	si yo quisiere no me conbatiria	833
1039	por ceste damoisele deffendre	mas sobre esta rrazon	834
1040	— Par foi fet cil se je voloie il ne m' en covendroit ja combatre	que ayer se cumplio el plazo enque ella se auia de defender	835
1041	kar des ier en est ! ele atainte	mas yo se	836
1042|1043	puis qu' ele ne pot trover|qui la deffendist	que no fallo quien la defendiese	837
1044	mais je sent ma querele a	mas yo se|que ella es	838|839
1045|1046	si loial|et si droituriere	asi enesto desleal	840
1047|1048	qu' il n' a chevalier el monde vers cui je ne l' osaise bien prover au|? grant droit	que no a cauallero enel mundo conquien no me osare conbatir sobre esta Razon	841
1049|1050	que je i ai|— En non Dieu fet Lancelos or i parra	ansi me esfuerço enmi gran derecho enel nombre de dios dixo lançarote agora paresçera	842
1051|1052	que je sui pres|que je la desfende vers vos	que yo so presto dela defender de verdad dixo el cauallero porla mi caueza vos moriredes porende	843
1053	— Voire fet cil par mon chief		
1054	et vos en morrois comme traitres	como traidor	844
1055	et desloials	e desleal	845
1056	Lors traient la damoisele loins del feu	e luego tiraron la donçella del fuego	846
1057|1058	et li chevalier s' entreslongent li uns de l' autre|si s' entrevienent	e los caualleros se dexaron correr el vno contrael otro	847
1059	si tost com li cheval pueent aler	quanto los cauallos los pudieron lleuar	848
1060|1061	et s' entrefierent des glaives|si durement	e firieronse delas lanças tan fieramente	849
1062	qu' il les font voler en pieces;		
1063|1064	puis s' entrehurtent|si des cors	asi que las lanças fiçieron bolar en pieças	850
1065|1066	et des visages|qu' il n' i a celui	e toparon envno delos cuerpos	851
1067	qui tos ne soit estordis		
1068	et desconreez	e delos yelmos	852
1069	Mais li chevaliers par est		
1070|1071	si estonés|qu' il ne se puet tenir en sele ains vole jus del cheval	que el caballero no se pudo tener enla silla ante cayo del caballo en tierra	853
1072|1073	et al parchaoir feri li quins del hialme en la terre|si qu' a bien pou	e al caer ouierasele el pesqueço de quebrar	854
1074	qu' il n' a le col brisié	ca dio de cabeça del yelmo en tierra	855
1075|1076	Et quant Lancelos a fet son tour|si descent	e quando lançarote torno desçendio	856
1077	kar honte li seroit de requerre a cheval celui	ca el lo no queria acometer de Cauallo	857
1078	qui est a pié;	porque el estaua de pie	858
1079|1080	si trait l' espee|et cort sus a celui	e metio mano al espada	859
		e fuese parael	860
1081	qui ja se relevoit	que ya hera leuantado	861
1082|1083	si li done par mi le hialme tel cop|qu' il le fet a terre flatir des paumes	e diole tal golpe ençima del yelmo quele fiço dar de manos en tierra	862
1084	et des genols ;	e el|que se yua	863|864
1085|1086	puis recuevre I|autre cop	por leuantar diole otro golpe dela espada	865
1087|1088	et le fiert|si qu' il le fet tot parchaoir	que dio luego conel atordido en tierra	866
1089	et le prent par le hialme	e tomolo Porel yelmo	867
1090	si le traine jusqu' al feu	e tiro tan Reçiamente|que selo arranco dela cabeza	868|869
1091|1092	et le gete dedens|Et cil estoit	E el finco muy estordido	870
1093	si estordis	e sin fuelgo	871
1094	et tant avoit perdue la force del cors	e asi auia perdido la fuerça del cuerpo	872
1095	que relever ne se pot	Que se no podia rreboluer	873
		e lançarote tomolo porlos braços	874
1096	si le covint remanoir el feu	e dio conel enel fuego	875
1097	et morir en tel maniere	e dexolo ay morir ental manera	876
1098|1099	Et lors vienent avant cil|qui le champ gardoient	e luego vinieron a lançarote los quela guardauan	877
1100|1101	si dient a Lancelot|qu' il en a assés fet	e dixeronle señor asaz auedes fecho	878
1102	et li rendent la damoisele saine		
1103	et haitiee	e los	879
		que tenian la donçella traxeronsela delante	880
1104	et il la fet vestir	e el fizo la vestir	881
1105	puis li demande	e dixole donçella	882
1106	qu' ele velt	que queredes	883
1107|1108	qu' il face mes|Sire fet ele	mas que faga señor dixo ella	884
1109|1110	que vos me menés a salveté a mon chastel|Et il dist	que vaiades con migo fasta mi castillo Donçella muy de Grado dixo lançarote	885
1111|1112	que volentiers:|si le fet monter	e luego se fueron parael castillo	886
1113|1114	et le conduit jusqu' al chastel ou ele l' ot gardé maint jor|Li chastials avoit non Galefort	e aquel castillo auia nombre galeforte	887
1115	et seoit sor une petite riviere	e estaua ençima devna pequeña Ribera	888
1116	si estoit molt aaisiés de totes choses	e estaua bien asentado de todas partes	889
1117	et fors a merveille	e fuerte amarauilla	890
1118	Et quant Lancelos vint la il ne fet pas a demander se l' en li fist joie	e quando lançarote y llego no cale demandar|si conel fizieron gran alegria	891|892
1119	kar cil del chastel savoient ja bien	ca los del castillo sabian muy bien	893
1120|1121	que lor dame estoit delivree par I|chevalier	como su señora hera ya librada Porvn cauallero	894
1122	qui o li venoit	que auia venido	895
1123|1124	Et quant il le virent|si le reçurent a	e quando los del castillo los vieron venir a lançarote	896
1125	si grant joie com se ce fust Damedieu meismes	ansi lo Reçiuieron con gran alegria|como si la madre de dios Mesma fuese	897|898
1126	et s' agenoillent tuit devant lui	e fincaban los ynojos|por do el venia	899|900
1127	et crioient a une vois tuit ensamble Sire sor tos cels del monde soiés vos bien venus	e deçian todos avna voz bien venga el buen cauallero sobre todos los omes del mundo	901
1128	qui nostre grant duel avés torné en grant joie A tel feste ont laiens Lancelot receu	Que nuestro duelo torno en alegria A tal Plazer y a tal alegria fue lançarote rrescebido enel castillo	902
		como vos digo	903
1129|1130	et quant il ont la damoisele descendue devant son mestre palés|si s' en volt aler maintenant	e desque la donçella desçendio antesu gran palaçio luego se quiso yr don lançarote	904
1131	kar il n' estoit mie encore plus de tierce	que aun no hera|mas de terçia	905|906
1132	Mais ele le prist al frain	mas ella lo tomo porel freno	907
1133	et le fist descendre a fine force a	e lo fiço decender a fina fuerça|e dixole	908|909
1134|1135	et dist Par Sainte Crois|vos ne m' eschaperois mie ensi	Por sancta cruz don cauallero vos no me escaparedes	910
1136	Lors le commande a desarmer	ansi e luego lo mando desarmar	911
1137	et vaslet saillent avant	e los escuderos	912
1138	por fere son commandement a;	que y estauan fizieron luego su mandado	913
1139|1140	et tantost com il ot son hialme osté|et ele le conut	e luego quele tiraron el yelmo la donzella corrio ael	914
1141	si li cort les bras tendus		
1142	et le volt baisier en la boche		
1143	quant il li guenchist		
1144|1145	et ele li baise la face|et le col	e echole los braços al cuello	915
1146	et le menton	e enla faz	916
1147|1148	puis que autre chose n' em puet avoir b;|si plore de pitié	e començo a llorar con piedad	917
1149	et li dist Ha gentilx chevaliers tant vos avoie desirré a veoir ains	e dixo ay señor|quanto vos deseaua ver anteque muriese	918|919
1150	que je moreuisse!		
1151|1152	Mais comment l' avez vos|puis fet	e como vos a ydo despues	920
1153|1154	?|Et il li dist Bien Dieu merci	que vos vi muy bien dixo lançarote merçed a dios señor dixo la donçella	921
1155	—		
1156	Et ceste part fet ele comment venistes vos	como vos auino de venir|asi contraesta parte	922|923
1157	qui avant ier vos en partistes	que aun tan poco|a que vos partistes demi	924|925
1158	? — Par foi fet il une grant acheison	por buena fee dixo lançarote|Por buena auentura	926|927
1159	m' i amena	que me auino	928
1160|1161	Si li conte comment|I	e luego le Conto	929
1162|1163	chevalier o unes armes vermeilles l' avoit apelé de traïson a la cort le roi Artu|por la mort de Meleagan;	como vn cauallero le Recto de traiçion enla corte del Rey artur Porla muerte de meliangas	930
1164|1165	si l' en covient a deffendre en la cort le roi Baudemagu|Ha fet ele je sai bien	e heme a defender enla corte del Rey bandemagus ay señor dixo ella yo se quien es cauallero	931
1166	qui il est		
1167|1168	C' est Argodras li Ros|et li chevaliers	Ca es argodras el Rubio hermano del cauallero	932
1169	que vos avés hui ocis	que agora matastes	933
1170|1171	et ars estoit ses freres;|si ne sai	mas señor no se	934
1172	que vos puissiés fere	que vos faga|ca e miedo	935|936
1173	kar se mes peres set	que si mi padre sabe	937
1174	que vos aiés ocis Meleagan [b) je criem	como matastes a meliangas	938
1175|1176	qu' il ne vos face ocirre|por le grant duel	que vos faga matar porel gran pesar	939
1177	qu' il avra des noveles	que abra destas nuebas	940
1178|1179	— Coment|? fet Lancelos nel set il mie encore	como dixo lançarote no lo sabe	941
1180	? — Certes sire nenil;	ansi me ayude dios dixo ella no maguer	942
1181|1182	si est Meleagans en cest païs aportés plus a de XV|jors	que a quinze dias	943
1183|1184	et est el chastel des Illl|Pierres	que an traido aesta tierra el cuerpo de meliangas	944
1185	et le gardent iluec		
1186|1187	si celeement|que li rois n' en set encore riens:	mas tienenlo enel castillo delas quatro piedras muy encubiertamente quelo no sepa su Padre	945
1188|1189	si en covendra esploitier al plus sagement|que vos porrois	e ansi vos conuiene de vos encubrir muy sabiamente	946
1190|1191	Mes a|quant est li jors	mas quando es el dia	947
1192|1193	que vos vos en devés deffendre|?	que vos auedes de defender el dia dela magdalena dixo lançarote	948
1194|1195	Et il dist|que c' est le jor de la Magdalaine	si dios me ayude dixo la donçella yo he gran miedo	949
1196	Or vos en conseut Diex fet ele	que vos el faga matar algodras	950
1197|1198	kar j' ai grant poor|que Argodras ne vos face anui par traïson	por Alguna traiçion deso dixo lançarote no ayais Miedo	951
1199	— De ce fet il n' aiés ja garde! Tot son pooir en face	e el faga todo su poder|Ca yo me guardare deGuisa	952|953
1200	que je n' en avrai ja poor	Que no aya del pabor Conel ayuda de dios	954
1201	Assés parlerent cele nuit de maintes choses a	Asi fablaron toda aquella noche de muchas cosas	955
1202	et molt firent cil del chastel grant joie de lor dame	e Mucho façian gran alegria los del castillo|porque asi auian cobrado a su señora	956|957
1203|1204	qu' il cuidoient avoir perdue|et or l' ont saine	Que ayudauan ental manera Perder	958
1205|1206	et haîtie b|Et al matin	e enla mañana en	959
1207	si tost com li jors parut cler se leva Lancelos	quanto el dia aparesçio claro se leuanto lançarote	960
1208	et se parti de la damoisele	e se partio dela donçella	961
1209	quant il fu armés;	e des|que fue armado	962|963
1210|1211	et ele le commande molt a Dieu|et li pria	e la acomendo a dios Señor dixo la donçella yo vos Ruego	964
1212	qu' il s' en revenist par li al repairier;	Que al tornar vengades|Por aqui de Grado dixo lançarote	965|966
1213	et il dist	si pudiere	967
1214	que si feroit il s' il pooit		
1215	Si se remet en son chemin	e luego se metio enel camino	968
1216|1217	et eirre tot le jor jusqu' al vespre|et lors aproche d' une riviere	e andubo todo aquel dia porvna rribera ayuso fasta visperas	969
1218	que l' en apeloit Aglonde		
1219|1220	si en estoit l' eve molt parfonde|et molt noire	e el agua hera fonda y negra	970
1221|1222	Et quant il vint pres de l' eve|si vit trois paveillons tendus pres de la rive;	e desque fue çerca del agua vio tres tiendas çerca dela rribera	971
1223	si en estoit li uns grans	e la vna hera muy grande	972
1224	et bials		
1225	et li autre dui estoient moien	e muy fermosa|e las dos heran	973|974
1226|1227	Et lors issi del greignor paveillon I|chevaliers tos desarmés	mas pequeñas	975
1228	qui li dist	e luego	976
1229	que bien soit il venus	que ay llego lançarote vio salir dela mayor tienda vn cauallero desarmado quele dixo señor vien vengades	977
1230|1231	et il li rent maintenant son salu|Ha sire fet il vos me samblés chevaliers errans	e lançarote le torno sus saludes buen señor dixo el cauallero dela tienda vosme semejades Cauallero andante	978
