410	si leverent		
411|412	et se partirent del chastel|et entrerent en la queste de lor chevalier	e fueronse del castillo enla demanda del buen cauallero Agora dexa el cuento de fablar dellas	338
413	Mais or laisse atant li contes a parler d' eles		
414	et de Boort	e de boores	339
415	et retorne a parler de Lancelot la ou il est entrez en la forest de Sarpenic	e torna A Lançarote|Que entro enla floresta Serpentina	340|341
416	si com li contes a devise ariers	Asi como el cuento lo a deuisado Dize el cuento	342
417	XLIX		
418	Or dist li contes		
419	qu' il fist grant chaut le jor	que gran calentura façia el dia	343
420	que Lancelos entra en la forest de Sarpenic	que lançarote entro enla floresta|mas poreso no finco	344|345
421|422	et por ce ne remest il mie|qu' il ne chevalchast jusqu' à none;	que el no andubiese todo el dia fasta nona	346
423|424	si li avint ensi|qu' il n' encontra home ne feme jusqu' al vespre;	que no encontro ome ni muger	347
425	mais lors sans faille	mas a hora de visperas sin falta	348
426|427	si com il dut issir de ta|forest	quando queria salir dela floresta	349
428	qui tot le jor li ot duré encontra une damoisele	que todo el dia le auia durado encontro vna donzella	350
429	qui molt faisoit grant duel	que mucho façia gran duelo	351
430|431	et chevalchoit I|palefroi noir a molt riehe lorain	e andaua envn palafren morçillo	352
432	et a molt cointe sele de l'oevre d' Engleterre	que traia vna muy Rica silla y freno	353
433	Il salue la damoisele	e el saluo la donçella	354
434	et ele lui		
435|436	Damoisele fet il|kar me dites s' il vos plest	e ella ael donzella dixo lançarote deçidme	355
437	por quoi vos plorés	porque llorades	356
		si vos plaze çierto dixo la donçella	357
438	Ial — Certes sire fet ele se je i' cuidoie avoir preu je le vos diroie	si yo supiese|que me vernia Prouecho enello yo voslo diria muy de grado çierto dixo donçella enmelo deçir no aueredes vos daño	358|359
439	— Damage fet il ll' i avrez vos ja se Dieu plest	si auos pluguiere|e vos dezidmelo	360|361
		por conuenençia	362
		que vos ayude yo a todo mi Poder en todas las cosas	363
		que hubieredes menester	364
440	mais dites le moi par covent que se je vos	e espeçialmente enesta|por que vos llorades	365|366
441	puis aidier a vos esleecier je vos aiderai a mon pooir	Ca yo porne enello el mejor Remedio|que puede ser	367|368
442	— En non Dieu sire fet ele	si es cosa|que vos pueda ayudar Enel nombre de dios dixo la donçella pues vos os afincades tanto	369|370
443|444	donc le vos dirai je|ll est voirs	que vos diga enque manera es	371
445	que Meleagans li fiz al roi Baldemagu ala a la cort le roi Artu	e que cosa es lo	372
446	por la roine Genievre conquerre s' il peust;	porque yo lloro yo voslo dire	373
447	et endementiers fist tant une damoisele	asi es|que fiço tanto vna donçella	374|375
448|449	qui estoit|? sa suer	Que hera hermana de Meliangas	376
450	qu' ele geta Lancelot d' une tor ou Meleagans l' avoit mis en prison ne sai	que saco dela prision a lançarote quelo tenia envna torre Meliangas no sabia	377
451	por quoi	porque e	378
452|453	Quant ele l' ot delivré|si le tint avec li tant	quando el fue libre ella lo tubo en su poder fastaque fue guarido	379
454	qu' il fu garis		
455	kar molt avoit eu mesaise en la prison	ca mucho auia enpeorado dela prision|e des	380|381
456	et puis l' envoia a la cort le roi Artu ou il ocist Meleagan ce savons nos or bien	que fue guarido fuese ala corte del Rey Artur|e Mato alla a meliangas segund cuido	382|383
		que oystes	384
457	Mais si tost com li parent sorent	mas tan ayna|como sus parientes lo supieron	385|386
458|459	qu' ele avoit Lancelot osté de la prison|si distrent	que ella auia hechado dela prision a lançarote Dixeron quelo auia fecho	387
460|461	qu' ele l' avoit fait|por Meleagan ocirre;	por amor de Meliangas delo matar	388
462	si le pristrent a force	e tomaronla afuerça	389
463	et l' acheisonerent de sa mort	e pusieronla en prision|e dixeron	390|391
464|465	et distrent que s' ele ne trovoit|qui l' en desfendist	que si no fallare quien la defender de aquesto	392
466|467	qu'il feroient de lui justice|si grant com l' en doit fere de cele	que farian della grand justiçia Como deuen de fazer de muger	393
468	qui son frere ocist	que asu hermano auia muerto	394
469	Et ele dist	e ella dixo	395
470|471	qu' ele troveroit bien|qui la desfendroit:	que bien fallaria quien la defendiese	396
472	si mist jor d' amener I	e luego pusieronle dia señalado Parase defender	397
473	chevalier	Por cauallero	398
474|475	por li desfendre|si s' est	e ella ymbio a buscar	399
476	puis porchaciee en Pluisors liex	por muchos lugares quien le defendiese	400
477	mais onques ne trova chevalier	mas nunca a podido fallar Cauallero	401
478	qui ses armes en osast prendre contre celui	que armas quiera tomar contra aquel Cauallero	402
479	qui apelee l' avoit	que deste pleito la a Reptado	403
480|481	Or|si est tant la chose alee	e el Plazo se cumple Mañana ental manera	404
482|483	que li jors est aterminés a hui ;|si n' a trové la pucele nul desfendeor	que si fasta ora de terçia no falla defensor tomaran della luego vengança	405
484|485	et por ce dient li un|et li autre	e la vengança sera tal	406
486	qu' ele est atainte del meffet		
487|488	que l' en li met sus :|si l' ont jugiee ce m' est vis a ardoir le matin	que la Quemaran	407
489|490	et por ce|qu' il m' en membroit or em ploroie je	e poresto lloro yo	408
491	si durement	asi tan fuertemente	409
492|493	kar certes ele estoit une des plus cortoises damoiseles ! del monde|et une des plus vaillans	porque aquella es vna delas altas donzellas del mundo agora me deçid donçella dixo lançarote	410
494	— Or me dites damoisele fet Lancelos		
495	et s' ele trovoit demain		
496|497	qui la deffendist|dont ne seroit ele quite del jugement	si ella fallase tras quien la defendiese seria ella quita del todo señor dixo ella no se	411
498	que l' en a fet		
499	? — Sire fet ele je ne sai		
500	—		
501|502	Et est ce fet il gaires loing|que ele est	E es muy lexos de aqui ado ella esta dixo lançarote señor dixo ella no ay	412
503	? — Sire		
504	fet ele il n' i a que		
505|506	VI|lieues englesches	mas de aqui alla de seis leguas ynglesas	413
507|508	Se vos leviés demain matin vos i seriés ains prime|— Ou le porrai je fet il trover	e si quisieredes Bien podedes yr alla a ora de Prima Ado la podre fallar dixo lançarote enla floresta de donseglorega dixo la donçella	414
509	? — Al chastel a fet ele de Floego		
510	et cis chemins vos i menra droit se vos le volés tenir	e este camino vos lleuara alla	415
511|512	— Or vos commant a Dieu damoisele fet il|Si s' em part atant	si lo supieredes guardar Pues a dios vos encomiendo dixo el	416
513	et cele s' en vet faisant son duel	e luego se partio el vno del otro|e la donçella yua llorando	417|418
514|515	Et il chevalche tant|qu' il vint fors de la forest	e la donçella yua agora tanto porsu camyno fastaque salio dela floresta	419
516	si vit devant lui une maison de religion	e llego avna casa de Religion	420
517	et il torne cele part	e el fue alla	421
518	por herbergier	por aluergar	422
519	Et quant il i vint		
520|521	si trueve a la porte IlII|des freres	e fallo ala puerta dos frailes	423
522	qui ja avoient chanté complie	que auian dicho conpletas	424
523	et estoient venu hors	e estauan al ayre	425
524	? al serain;		
525|526	si saillent encontre lui|por fere descendre	e ellos fueron contrael porlo ayudar a desçender	426
527	et dient	e dixeron	427
528	que bien soit il venus;	que vien fuese venido	428
529	si le font entrer laiens	e Metieronlo enel monesterio	429
530|531	et li demandent s' il a mengié|et Les gardiens de la tombe de Galebout (XLIX )	e los frailes le dixeron señor auedes	430
532|533	¡l dist|que nenil	oy comido no señores dixo el	431
534	et il font erraument mettre la table a	e luego mandaron ellos quele pusiesen la mesa	432
535|536	mais il dist|qu' il ne mengera devant	mas lançarote no quiso luego comer ante dixo	433
537	qu' il ait esté al mostier b lar il n' i entra hui		
538	Lors entre en l' eglise	que entraria enla yglesia	434
539	por orer	por fazer oraçion	435
540|541	et en ce|qu' il se fu agenoilliés	e desque el entro enla yglesia finco los ynojos	436
542	si regarde a destre	e el façiendo oraçion cato asu diestro	437
543	et voit unes prones d' argent trop richement fetes a floretes d' or	e vio vnos arcos de plata muy Ricamente fechos a flores de oro	438
544|545	et a oisials|et a bestes	e a bestias de diuersas maneras	439
546	et dedens avoit V		
547	chevaliers armés les hialmes es testes les espees es mains ausi apresté de deffendre	e ante ellos estauan çinco caualleros armados de todas armas elos yelmos enlas cabezas|e las espadas enlas manos	440|441
548|549	que se l' en les volsist asaillir|De ce se merveilla molt Lancelos ;	como si quisiesen defender de algunos quelos quisiesen acometer Desto se marauillo mucho lançarote	442
550	si se drece erraument	e fue alla contraellos	443
551|552	et vet cele part|si salue les chevaliers	e ellos le dixeron señor bien seades venido	444
553|554	et il dient|que bien soit il venus	e el les rrindio sus saludes	445
555|556	Et il entre dedens les prones par un petit huisselet a|et esgarde les prones	e lançarote cato vn poco los arcos	446
557	qui tant sont riches	Porque heran muy Ricos	447
		e muy fermosos	448
558	qu' il ne cuide pas	que vien cuidaua	449
559	que nus rois les peust esligier;	Que vn Rey No los podia tales façer|e el	450|451
560|561	puis voit delés les chevaliers une tombe la plus riche|qui onques fust fete par home	asi Catando vio dentro enlos arcos vna muy Rica tumba qual nunca tal viera el ni ome del mundo	452
562	kar ele ert tote d' or fin a chieres pierres precioses	que hera toda de oro fino|e de piedras preçiosas	453|454
563	qui molt valoient miels d' un grant roialme	que estaua toda labrada de diuersas maneras	455
564	Se la tumbe fu de grant bialté nient ne monte la bialtés envers la richece	e de muy muchas cosas de figuras	456
565	dont ele estoit	e de otras cosas	457
566	et avec ce estoit ele la greignor	que tal tumba de tal manera nunca viera ni ome del mundo|que la non ouiese visto no podria asmar la fermosura	458|459
567	que Lancelos eust onques veue :	que enella auia de tales cosas|como enella estauan	460|461
568	si se merveille molt	e don lançarote se marauillo	462
569	qui puet estre li princes	e dixo entresi mesmo Quien podria ser el prinçipe	463
570	qui dedens fu mis	que enella yaçia	464
571	Il demande as chevaliers	e lançarote pregunto alos caualleros	465
572	qui sont iluec	e dixo señores	466
573|574	Sire font il nos gardons le cors|qui en ceste tumbe est	que estades aqui façiendo señor dixeron los caualleros nos guardamos el cuerpo	467
575|576	qu'il n' en soit portez fors de çaiens;|si somes	que yaze enesta tumba quelo no lleuen dende aqui	468
577|578	V|por garder le de jors par nuit en i a autres	e nos lo guardamos çinco caualleros de dia	469
579|580	V|qui font autretel servise comme nos faisons de jors	e otros çinco de noche	470
581|582	—|Et por quoi fet Lancelos avez vos poor	que no façemos y al Auedes miedo dixo Lançarote	471
583|584	qu' il n' en soit portés|? — Sire font il	que voslo lleuen de aqui señor dixeron ellos	472
585|586	por ce|que uns des freres de çaîens	si que vn fraile de aqui	473
587	qui molt est preudom	que mucho es buen ome	474
588	et de sainte vie nos dist n' a encor gaires	e de sancta vida nos a dicho	475
589	que uns chevaliers vendroit ceste part	que vn cauallero vernia aesta tierra	476
590|591	qui a force l' en osteroit|et fors de cest païs l' en feroit porter	que por fuerça lo lleuaria desta tierra	477
592	Et nos gens de ceste terre voldrions miels morir	e las gentes desta tierra querrian antes ser muertos	478
593	qu' il fust remués d' entre nos :	que el fuese lleuado de entre nos	479
594	por ce		
595	si le gardons issi com vos veez lar li preudom i nos dist	e poreso lo guardamos|asi como vedes	480|481
596	que li chevaliers ne demoreroit	ca el ome bueno nos dixo	482
597|598	? pas|qu' il ne venist a	que no tardaria mucho el buen cauallero	483
599|600	— Or me dites|fet Lancelos ne fu cil molt haus princes a cui l' en fist	Que no viniese alo sacar Agora me deçid dixo lançarote quien fue este tan Rico prinçipe	484
601|602	si haute sepulture|? — Sire font cil haus hom fu il	que yaze entan rrica sepultura Señor Dixeron ellos Mucho fue alto ome	485
603	et riches; avec ce	e el|mas noble	486|487
604|605	qu' il fu haus hom fu il li plus preudom|qui onques fust a son tens	Que nunca fue visto ay dios dixo lançarote quien fue señor dixeron ellos	488
606	— Ha Diex fet Lancelos		
607|608	qui fu il|?— Sire font il se vos conoissiés letres veoir le porriés	si sabedes leer vien podedes saber quien es	489
609	kar ses nons est escris el chief de cele lame	el que aqui yaze|que ala cabezera dela su tumba lo fallaredes escrito	490|491
610	Lors va Lancelos cele part	e lançarote se fue ala cabeça dela tunba	492
611	si regarde les letres	e fallo las letras	493
612	qui dient Ci gist Galehout li fiz a la Jaiande li sires des Lointaignes Isles a	que deçian aqui yaze galeote el fijo dela fermosa Jaiana	494
613	qui por l' amor de Lancelot morut	que por amor de lançarote murio	495
614	Et quant il vit ce	e quando lançarote ovo las letras leydo cayo amorteçido en tierra	496
615	si chiet pasmés	e estubo	497
616	et gist grant piece a terre sans mot dire;	ansi gran pieça|que no pudo fablar	498|499
617	et li chevalier le corent relever	e los caualleros fueron ael porlo leuantar	500
618	si se merveillent molt	e mucho se marauillauan	501
619	qu' il puet estre	que podia Aquello ser	502
620	Et quant il revint de pasmison	e quando lançarote acordo començo a dar vozes	503
621	si s' escrie Ha las!	e a dezir ay	504
622	Quel dolor	que duelo	505
623	et quel damage	e que daño	506
624	Et lors fiert l' un poing en l' autre	e luego començo a dar del vn puño enel otro	507
625	et esgratine son viaire	e a rrascar el Rostro	508
626	si qu' il en fet le sanc salir de totes pars	asi que la sangre le salia|por todas partes	509|510
627	si se prent as chevels	e a mesar sus fermosos cabellos	511
628	et se fiert grans cops del poing en mi le front	e a darse puñadas grandes enel rrostro	512
629	et en mi le pis	e enlos pechos	513
630|631	et crie|si durement	e a dar tales vozes	514
632|633	qu' il n' i a celui|qui tote pitiés n' en preigne;	que todos auian piedad del	515
634	si Douleur de Lancelot (XLIX ) se laidenge		
635	et maldit l' ore	e maldeçia el dia en	516
636	qu' il fu nes	que fuera nasçido	517
637	et dit Ha Diex !	e deçia ay	518
638	Quel damage	que duelo	519
639|640	quel perte del plus preudome del monde|qui mors est	e que daño morir el mejor ome del mundo porel	520
641	por le plus vil chevalier	mas mal Cauallero	521
642	et por le plus malvés	e mas malauenturado	522
643|644	qui onques fust ! b i|Tant fet Lancelos grant duel	que enel es Mucho fiço lançarote gran llanto	523
		e daua tales vozes	524
645	que tuit cil de laiens le vienent regarder a merveille;	que todo el mundo lo cataua|e se marauillaua del	525|526
646	si li demandent	e preguntaronle	527
647	qui il est	como auia nombre	528
648	et il ne puet mot dire ains crie totes voies	mas el no podia Responder Ante daua vozes	529
649	et se debat	e gritos todavia	530
650|651	et descire|Quant il a son duel demené grant piece	e desque el fiço su duelo gran pieça cato las letras otra vez	531
652	si regarde les letres	e quando vio	532
653	qui dient	que deçia	533
654|655	que por lui est mors Galehout;|si dist	Que Porel hera Muerto dixo	534
656	que or seroit il trop malvés s' il ausi ne moroit	que asaz seria mal auenturado|si porel no muriese	535|536
657|658	por lui:si saut maintenant jus des prones|et pensa	e luego se partio dende	537
659|660	qu' il iroit querre s' espee|et qu' il s' en ocirroit	e fuese buscar su espada	538
661|662	kar ausi avoit ele esté Galehout a|Et maintenant	para se matar conella	539
663|664	qu' il fu issus del mostier|si encontra une des damoiseles del Lac cele	e luego el sabiendo Dela yglesia encontro con vna donzella dela dueña del lago aquella	540
665	qui a Boort avoit parlé devant le chastel de Honguefort	que fallo con Boores ante el castillo de ongeforte	541
666	et ele le conuit bien	e ella lo conoçio	542
667	si le prent par le pan de la cote	e trauole dela mano	543
668|669	et l' areste|Qu' est ce	e tirolo contrasi	544
670|671	? fet ele|Ou alés vos ensi	e dixole ado ydes vos	545
672	? — Ha damoisele fet il laissiés moi mes dolors finer lkar jamés n' avroie joie ne repos en cest siecle	asi ay donçella dixo lançarote dexadme mis dolores acabar	546
673	— Parlés fet ele a moi	que jamas no abre plazer ni folgura eneste mundo fablad conmigo dixo la donçella	547
674|675	Et il ne li dit mot ains se lance outre|si qu' il li eschape des mains	e el no le rrespondio palabra antese escapo dela mano	548
676	Et quant ele l' en vit aler	e se fue	549
677|678	si li crie Je vos deffent fet ele par la rien|que vos plus amez en cest monde	e quando la donçella esto vido dixole señor yo vos defiendo porla cosa del mundo	550
679	que vos n' ailliés avant	que mas amades|que no vaiades	551|552
680	tant que vos aiés parlé a moi	mas adelante fastaque fabledes conmigo	553
681|682	Et il s' areste|si la regarde	e lançarote se detubo luego	554
683	et quant il la conut	e la cato tanto	555
684	si li dist	que la conoçio	556
685|686	que bien soit ele venue|En non Dieu fet ele vos me deuissiés fere plus bele chiere	e dixole donçella vien seades venida Pardios dixo ella vos deuedes fazer	557
687	que vos ne me fetes al mains	mas alegre cara de	558
688	por ce	Quanto façedes	559
689|690	que je sui messages vostre dame del Lac|— Ha damoisele fet il	Por quanto yo so mensaxera devuestra señora la donçella del lago dixo el non vos pese	560
691|692	por Dieu ne vos poist certes je ai tant de dolor|que nus for Diex ne me porroit conforter ne a ne cuidiés	ca no cuidedes	561
693	que jamés aie joie	que jamas aya yo plazer ni alegria	562
694	por aventure	por auentura	563
695|696	qui me puist avenir|— En non Dieu fet ele	que me venga Pordios dixo la donçella	564
697|698	si avrois|Escotez	si aueredes agora sabed	565
699|700	que ma dame vos mande|— Or dites fet il	que mi señora vos ymbia a deçir	566
701	— Ele velt fet ele		
702	que vos ostés le cors Galehout de caiens	que vos tiredes el cuerpo de galeote de aqui	567
703	et le fetes porter en litiere en la Dolerose Garde	e lo fagades lleuar al castillo dela dolorosa guarda	568
704	et iluec soit mis en la tombe meismes ou vos trovastes vostre non escrit;	e lo fagades meter en aquella tumba mesma ado fallastes su cuerpo escripto	569
705|706	et ele le velt ensi|por ce	ca ella lo quiere	570
707|708	qu' ele set bien|que en cel lieu sera vostre cors enterrez	ansi Ca el vuestro cuerpo mesmo sera y enterrado conel	571
709|710	Et quant il l' ot|si en est molt liés	e quando el esto oyo fue muy alegre	572
711	et dist	e dixola	573
712	que molt li sont ces noveles plaisans	que Mucho heran aquellas nuebas plazenteras	574
713|714	kar tot ensi le fera il ;|puis demande comment sa dame le fet	que asi lo faria Puesque ella lo ymbiaua a mandar	575
715	Par foi fet ele ele a esté	Por buena fee dixo la donçella vien a ocho dias	576
716|717	VIlI|jors deshaitiee trop durement	Que vuestra señora esta muy triste	577
718	kar ele trova en son sort	porque ella vido ensus suertes segund	578
719	si com ele meismes me dist puis	que me ella dixo	579
720	que si tost com vos troveriés la tombe Galehout	que asi|como fallasedes la tumba de Galeote	580|581
721	que vos vos ocirriés de duel se vos n' estiés destornez	que luego vos matariades sino ouiesedes quien vos esforçase	582
		e quien vos estoruase	583
722|723	Por ce m' envoia ele ça a grant besoing|si vos mande	e poresto me ymbio ella aca a gran priesa	584
724	que vos laissiés le duel ester	e vos manda dexar este duelo	585
725	qu' il ne vos puet fere se nuire non		
726	et vos prie par la rien	e vos Ruega|por la cosa del mundo	586|587
727	que vos plus amés	que mas amades	588
728	que vos al plus bel	que vos conortedes lo mejor	589
729	que vos porrois vos reconfortés	que pudieredes	590
730	et se vos ensi ne le fetes bien sachiés	e que|si lo no fiçieredes	591|592
731	que al premier besoing		
732|733	que vos avrois de li ele vos faudroit|Et il dist	que ella vos tirara el ayuda	593
734	qu' il se confortera	que della auedes	594
735|736	puis qu' ele le velt|Or vos covient fet ele vos armes prendre	asi lo fare dixo lançarote puesque aella plaze agora vos conuiene dixo la donçella de armar	595
737	kar je voi [ cl bien	ca yo se bien	596
738|739	qu' il ne le vos en lairont mie en pes porter tant com il le porront deffendre|Et il dist	que aquellos caualleros no voslo dexaran llebar en	597
740|741	qu' il i morroit ançois|qu' il ne l' ostast de laiens;	quanto lo pudieren defender o yo morire dixo lançartoe o yo lo tirare donde esta	598
742	si se vet armer	E luego se fue armar	599
743|744	et la damoisele vient tantost as chevaliers|qui gardoient la tombe	e la donçella se fue alos caualleros quela tumba guardauan	600
745|746	si lor dist Seignor fet ele volés vos destorner ce|qu' il covient estre a force	e dixoles señores queredes vos defender aquello	601
747	?		
748	et demandent		
749|750	por quoi ele le dist a|Je le di fet ele	Que conuiene a ser afuerça yo lo digo dixo ella Porel cuerpo	602
751	por le cors		
752	que vos gardez	que guardades	603
753	et si savés bien	ca sabed	604
754|755	qu' il en sera ostez|— Non sera font il	que vos sera tomado non sera dixeron ellos en	605
756|757	que nos puissons|— En non Dieu fet ele	quanto nos pudieremos Pardios dixo ella	606
758	si iert	si sera	607
759	et bien sachiés fet ele		
760|761	que cil est venus|qui l' en ostera	que aqui es venido quien voslo tolera	608
762	Et se vos le contredites vos en morrois tuit:	e si lo quisieredes contradeçir a todos conuiene morir	609
763	por ce vos vendroit il miels		
764	que vos le laississiés atant ains		
765	que vos vos en façois ocirre		
766|767	Et cil dient|que ja tant com il soient vif n' en sera portés	e poresto querria quelo dexasedes anteque vos matasen porende ya enquanto nos fueremos vibos dixeron los caualleros No sera de aqui llebado	610
768	Et bien sache font il li chevaliers	e bien sepa el cauallero	611
769|770	qui venus est|por avoir le	que porel es venido	612
771	que s' il estoit encore plus preus	que aunque fuese mejor ome	613
772|773	que Lancelos n' est|si n' en menra il point	que lançarote quelo no moueria de aqui vn punto agora vere dixo la donçella	614
774	— Or verrons fet ele comment il vos en avendra	como vos auerna Ellos	615
775	A ces paroles vint laiens Lancelos tos armés	asi fablando llego ay lançarote Armado de todas armas	616
776	et quant li chevalier le voient venir	e los caualleros	617
777	si li demandent	que lo vieron preguntaron	618
778|779	qu' il velt fere|Je vueil fet il avoir le cors	Que que queria fazer yo quiero dixo el el cuerpo	619
780|781	qui laiens est|— Par foi font il vos ne l' avrois mie	que alla esta Pordios dixeron ellos vos no lo aueredes	620
782|783	por nient|Nos ¡ morrons ançois tuit	que ante seremos aqui todos muertos	621
784	que vos l' enportois	que vos	622
785	— A morir fet il en estes		
786|787	donc tuit|puis que a mains ne vos en volés soffrir	asi lo lleuar a morir vos conuiene Dixo lançarote pues no vos queredes sofrir	623
788	Si saut dedens les prones		
789|790	et il li corent sus|kar arrieres le cuident fere sailir	e luego salieron los Caualleros delos arcos	624
791|792	por poor de morir;|si le fierent par la ou il le pueent ataindre	do estauan con miedo de ser Muertos	625
793	et il ot el poing l' espee nue ;	e començaronlo a ferir|por do	626|627
794	si lor done grans cops	mas mal lo podian fazer	628
795	et pesans	e lançarote metio mano ala espada	629
796	et fiert le premier	e firio al primero	630
797	qu' il encontre	que fallo	631
798	si durement	asi duramente	632
799|800	que por le hialme ne|por la coife de fer ne remaint	que porel yelmo ni Porel almofar no finco quele no metiese la espada porla Cabeça	633
801	qu' il ne li mete l' espee jusqu' al test;		
802|803	et il le hurte de soi|Si l' abat a terre	e dio conel en tierra	634
804|805	Et lors saillent molt irieement tuit li autre|si depiecent son escu	e los otros lo començaron a ferir muy rreçia mente porel escudo	635
806	et son hialme	e porel yelmo	636
807	et son hauberc	e porla loriga	637
		asi que selo quebrantaron	638
808	et le blecent en pluisors lieus	e Ronpieron|Por muchos lugares	639|640
809	Mais il ne li chaut de rien	mas el no daua cosa	641
810|811	qu' il li facent|kar tant est dolens	por aquello quele façian tanto estaua de sañudo	642
812|813	que nus plus;|si lor laisse corre par grant ire	e dexo de correr aellos Con gran yra	643
814|815	et lor done de l' espee|si grans cops	e dauales dela espada tales Golpes	644
816	que tos les fet guenchir avant lui	asi quelos façia de|si arredrar	645|646
817	Et lors esgarde celui des IllI	e Lançarote Paro mientes en	647
818	qui plus li faisoit mal	aquel que mas mal le façia	648
819	et cil estoit molt grans	que hera muy grande	649
820	et molt fors;	e muy fuerte	650
821	et Lancelos	e diole	651
822|823	qui le vient ataignant li done par mi le hialme|si grant cop	asi vn golpe tan grande ençima del yelmo	652
824	qu' il en fet le feu saillir	que el fuego fiço salir del	653
825|826	et l' espee glace|qui de droit ne fu pas ferue	e el golpe desçendio al honbro	654
827	si descent desus la senestre espaule		
828|829	Li cops fu grans|et par ire ferus	e Como fue dado de gran fuerça	655
830|831	et bien i parut|que l' espee cola par mi l' espaule a al chevalier	asi que porla loriga no finco quele no derribase el braço conla espada en tierra	656
