0	avoir trové. » 	auoir trouue. 	0
1269|1270	Mais ele le prist al frain |et le fist descendre a fine force a 	mais elle le print au fraing et le fist descendre a fine force 	1025
1271|1272	et dist: « |Par Sainte Crois. 	et luy dist par saincte croix 	1026
1273	vos ne m’eschaperois mie ensi. » 	sire cheualier uous ne meschaperez pas ainsi. 	1027
1274	Lors le commande a desarmer 	Lors le commande a desamer. 	1028
1275	et vaslet saillent avant 	et uarletz saillent 	1029
1276	por fere son commandement a; 	pour faire son commandement 	1030
1277|1278	et tantost com il ot son hialme osté |et ele le conut,	Et tantost quil a oste son heaume elle le cognoist. 	1031
1279	si li cort les bras tendus 	si luy coure les braz tenduz 	1032
1280	et le volt baisier en la boche, 	et le uoult baiser en la bouche. 	1033
1281	quant il li guenchist, 	et il guenchist. 	1034
1282	et ele li baise la face et le col et le menton, 	et elle luy baille la face et le coul et le menton. 	1035
1283	puis que autre chose n’em puet avoir ; 	puis quautre chose nen puet auoir. 	1036
1284	si plore de pitié 	si pleure de pitie 	1037
1285	et li dist: « 		
1286|1287	Ha, |gentilx chevaliers, 	et luy dist haa gentil cheualier 	1038
1288	tant vos avoie desirré a veoir 	tant uous auoye desire a ueoir auant 	1039
1289	ains que je moreuisse! 	que ie mourusse. 	1040
1290|1291	Mais comment l’avez vos puis fet?, |Et il li dist : « 	mais comment lauez uous puys fait.	1041
1292	Bien, 		
1293|1294	Dieu merci. — |Et ceste part, 	et il luy dist. bien dieu merey. 	1042
1295|1296	fet ele, |comment venistes vos, 	et comment estes uous uenu ceste part 	1043
1297|1298	qui avant ier vos en partistes ? — |Par foi, 	qui auant hier uous en partistes. 	1044
1299|1300	fet il, |une grant acheison. 	Par foy fait il une grande achoison me y amena. 	1045
1301	m’i amena. »	si luy compte 	1046
1302	Si li conte comment. I. chevalier o unes armes vermeilles l’avoit apelé de traïson a la cort le roi Artu 	comment ung cheualier unes armes uermeilles lauoit appelle de traison a la court du roy artus 	1047
1303	por la mort de Meleagan; 	pour amour de meleagant 	1048
1304|1305	si l’en covient a deffendre en la cort le roi Baudemagu. « |Ha, 	si luy en conuient deffendre en la court du roy bandemagu. 	1049
1306	fet ele, 		
1307|1308	je sai bien |qui il est. 	Haa sire fait elle ie scay bien quil est. 	1050
1309	C’est Argodras li Ros et li chevaliers 	cest arqodras le roux. |et le cheualier 	1051|1052
1310	que vos avés hui ocis et ars estoit ses freres; 	que uous auez huy occis |et ars estoit son frere. 	1053|1054
1311	si ne sai 	si ne scay 	1055
1312	que vos puissiés fere, 	que uous puissez faire. 	1056
1313	kar se mes peres set 	car se mon pere sceit de uray 	1057
1314|1315	que vos aiés ocis Meleagan, |je criem 	que uous auez occis meleagant iay paour 	1058
1316	qu’il ne vos face ocirre 	quil uous face occire 	1059
1317	por le grant duel 	pour le grant deul 	1060
1318|1319	qu’il avra des noveles. |— 	quil aura des nouuelles. 	1061
1320|1321	Coment ? fet Lancelos, |nel set il mie encore ? — 	Comment fait lancelot ne le sceit il encores pas 	1062
1322|1323	Certes, |sire, 	Si maist dieu fait elle nennil. 	1063
1324|1325	nenil; |si est Meleagans en cest païs aportés plus a de XV. jors 	si a este meleagant apporte en ce pays plus de .xx. iours a. 	1064
1326	et est el chastel des Illl. Pierres 	et est ou chastel des quatre pierres. 	1065
1327	et le gardent iluec si celeement 	et le gardent ilec si celeement 	1066
1328	que li rois n’en set encore riens: 	que le roy nen scait ores riens 	1067
1329	si en covendra esploitier al plus sagement 	Si uous conuiendra esploicter au plus sagement 	1068
1330	que vos porrois. 	que uous pourrez. 	1069
1331	Mes a quant est li jors 	mais quant est le iour 	1070
1332	que vos vos en devés deffendre? » 	que uous uous en deuez deffendre. 	1071
1333	Et il dist 	et il luy dit 	1072
1334	que c’est le jor de la Magdalaine. « 	que cest le iour de la magdalene. 	1073
1335|1336	Or vos en conseut Diex, |fet ele. 	Or uous en conseille dieu fait elle. 	1074
1337	kar j’ai grant poor 	car iay grant doubte 	1075
1338	que Argodras ne vos face anui par traïson. — 	que argodras uous face ennuy par traison. 	1076
1339|1340	De ce, fet il, |n’aiés ja garde! 	De ce fait il face tout son pouoir. 	1077
1341	Tot son pooir en face, 		
1342	que je n’en avrai ja poor. » 	car ie nen auray ia paour ne doute. 	1078
1343	Assés parlerent cele nuit de maintes choses a 	Assez parlerent celle nuyt de maintes chosss. 	1079
1344	et molt firent cil del chastel grant joie de lor dame 	et moult firent ceulx du chastel grant ioye de leur dame 	1080
1345	qu’il cuidoient avoir perdue, 	quilz cuidoient auoir perdue. 	1081
1346	et or l’ont saine et haîtie 	et ores lont saine et haitie. 	1082
1347|1348	Et al matin, |si tost com li jors parut cler, 	Et au matin si tost que le iour esclarsit se leua lancelot. 	1083
1349	se leva Lancelos 		
1350	et se parti de la damoisele, 	si se party de la damoisele 	1084
1351	quant il fu armés; 	quant il fu arme. 	1085
1352	et ele le commande molt a Dieu 	et elle le commanda moult a dieu 	1086
1353|1354	et li pria |qu’il s’en revenist par li al repairier; 	et le pria quil sen reuenist par lie. 	1087
1355	et il dist 	et il dist 	1088
1356|1357	que si feroit il, |s’il pooit. 	qui si feroit il sil pouoit. 	1089
1358	Si se remet en son chemin et eirre tot le jor jusqu’al vespre 	si se mect en son chemin |et erre toute iour iucquau uespre. 	1090|1091
1359	et lors aproche d’une riviere 	Et lors aprouche dune riuiere 	1092
1360	que l’en apeloit Aglonde, 	que len appelloit aglunde. 	1093
1361	si en estoit l’eve molt parfonde et molt noire. 	si estoit leaue moult parfonde et moult noire 	1094
1362	Et quant il vint pres de l’eve, 	et quant il uint pres de leans 	1095
1363	si vit trois paveillons tendus pres de la rive; 	si uit pres de la riue troys paueillons tenduz 	1096
1364	si en estoit li uns grans et bials 	si y en auoit ung grant et beau. 	1097
1365	et li autre dui estoient moien. 	et les autres deux estoient moyens. 	1098
1366	Et lors issi del greignor paveillon I. chevaliers tos desarmés 	Et lors issy du plus grant des paueillons ung cheualier tout desarme 	1099
1367	qui li dist 	qui luy dist 	1100
1368	que bien soit il venus, 	que bien soit il uenu. 	1101
1369	et il li rent maintenant son salu. « 		
1370	Ha, 		
1371	sire, 		
1372	fet il, 		
1373|1374	vos me samblés chevaliers errans |et je aim tos cels 	et il luy rend son salu. haa sire fait il uous me semblez cheualiers errans et iayme tous ceulx 	1102
1375	qui en tel mestier usent lor vie, 	qui en tel mestier leur uie usaent. 	1103
1376	kar je meismes sui chevaliers errans 	Car ie mesmes suys cheualier errant. 	1104
1377	et por ce vos vueil je proier 	et pour ce uous uoudroye ie prier 	1105
1378	que vos herbergiés anuit mes o moi; 	que uous herbregez mais huy auec moy. 	1106
1379|1380	kar se vos passés avant de ci, |vos ne troverois se forest non, 	car se uous passez plus auant uous ne trouuerez mais huy 	1107
1381	si salvages 	que fourests si sauuages 	1108
1382	que vos i porrois tost desvoier. 	que uous y porez tost desuoyer. 	1109
1383	Et il est bien tens de herbergier, 	et il est bien temps de herbreger 	1110
1384|1385	ce veés vos bien : |por ce vos lo 	comme uous uoyez par ce uous loue 	1111
1386	que vos remanois 	ie que uous demourez. 	1112
1387|1388	et vos avrois ostel bel et buen tot a vostre voloir. |— 	et uous aurez houstel bel et bon tout a uostre uouloir. 	1113
1389|1390	Bials sire, |fet Lancelos, 	Beau sire fait lancelot 	1114
1391	puis qu’il vos plest, 	puis quil uous plaist 	1115
1392|1393	je remaindrai |et por vostre proiere 	ie demourray. et pour uostre priere. 	1116
1394	et por ce que vos dites 	et aussi par ce que uous dictes 	1117
1395	que vos estes chevaliers errans. a, 	que uous estes cheualier errant Lors descent. 	1118
1396|1397	Lors descent et vaslés saillent des autres paveillons, |si le desarment 	et uarletz saillent des autres paurillons 	1119
1398|1399	et li aportent I. mantel |de samit legier a afubler por le chaut 	si le desarment et luy apportent ung legier mantel de samit a affubler pour le chaut 	1120
1400	qui grans estoit ; 	qui estoit grant. 	1121
1401	si le mainent el grant paveillon avec l’autre chevalier. 	si le mainent ou grant paueillon luy et le cheualier. 	1122
1402|1403	Et lors parlerent ensamble |et s’entracointierent 	lors parlent ensembles ce sentracointent 	1123
1404	et demanda li uns a l’autre de son estre ». 	et demandent lun et lautre de son estre. 	1124
1405	Li chevaliers enquiert a Lancelot 	Si enquiert le cheualier a lancelot 	1125
1406	dont il vient 	dont il uient 	1126
1407	et ou il vet 	et ou il uait. 	1127
1408	et quele aventure le maine si sol, 	et quelle auanture le mainne seul 	1128
1409|1410	et il li conte une partie de son estre |et autre l’en çoile e; 	et il luy en compte une partie et luy en cele l autre. 	1129
1411	et totes voies li dist 	Et touteuoyes dist il 	1130
1412	que en la cort al roi Baudemagu voldroit estre 	qu en la court du roy bandemagu uoudroit il estre 	1131
1413	por soi deffendre vers un chevalier 	pour soy deffendre uers ung cheualier 	1132
1414	qui l’a apelé de traïson. 	qui la apelle de traison 	1133
1415|1416	En ce qu’il parloient ensi, |orent li escuier mise la table, 	Ainsi quilz parloient mistrent les escuiers la table 	1134
1417	si vont laver; 	si uont lauer. 	1135
1418	si s’asiet Lancelos et li chevaliers et une damoisele 	puis sassiet lancelot et le cheualier. et une damoisele 	1136
1419	qui molt ert bele 	qui moult estoit belle 	1137
1420	et estoit amie al seignor de laiens; 	et estoit amyx au seigneur de leaus. 	1138
1421	si mengierent tuit troi ensamble. 	si mangerent tous troys ensemble. 	1139
1422	mes cele qui Lancelot esgarde ne se puet saoler de lui veoir, 	Mais celle |qui regarde lancelot ne se puet saouler de le ueoir. 	1140|1141
1423	Kar tant li samble bials 	Car tant luy sembla beau 	1142
1424	qu’ele ne prisa onques mes bialté d’ome envers cesti : 	que oncquez ne pasa beaute domme enuers ceste 	1143
1425	si l’esgarde si viselment 	si le regarda si auiseement 	1144
1426|1427	que tot en laisse le mengier |n’a autre chose n’entent. 	que tout en laisse le manger. 	1145
1428	fors a lui remirer. 		
1429	Si ont li escuier osté le premier mes de sor la table 	si ont les escuiers ouste le premier mies de dessus la table 	1146
1430	c’onques la damoisele n’en tasta, 	que oncques la damoisele nen tasta. 	1147
1431	ains pensa totes voies. 	ains peust tousiours. 	1148
1432	Et en cel pensé li descent el cuer une si grant amor 	et ce penser luy descent ou cuer 	1149
1433	qu’ele aime Lancelot 	tant quelle arme lancelot 	1150
1434	outre ce que feme n’ama mes home; 	plus que femme nama iamais home 	1151
1435	si li est avis 	si luy est bien aduis 	1152
1436|1437	que s’il l’amoit |qu'ele seroit beneuree. 	que selle lamoit elle seroit bieneuree. 	1153
1438	Mais ci endroit n’em parole plus li contes, 	Mais cy cy endroit |pour deuiser une auanture 	1154|1155
1439	kar ça avant le devisera 	qui leur aduint ou paueillon endroit |nen parle plus le comte 	1156|1157
1440	et comment ele l’ama merveillosement 	car apres le uous deuisera bien |comment elle lama merueilleusement 	1158|1159
1441	et comment ele le proia et la merveille 	et comment elle le pria et la merueille 	1160
1442	que ses amis en fist, 	que son amy en fist 	1161
1443|1444	quant il sot |qu’ele l’amoit, 	quant il scet quelle lamoit. 	1162
1445	et comment cele morut 	et comment cy endroit 	1163
1446	por ce qu’il la refusa, 		
1447	tot ce vos trespassera li contes ci endroit 		
1448	por deviser une aventure 	pour deuiser une aunture	1164
1449	qu’il lor avint el paveillon 	qui leur aduint ou paueillon elle mourut 	1165
1450	ou il estoient. 	par ce quil la refusa. 	1166
1451|1452	Ci dist li contes |que, quant il orent le secont mes eu, 	Tout ce uous trepassera le conte Cy dit listoire 	1167
1453|1454	es vos un chevalier armé d’unes armes vermeilles |qui vint corant par devant le paveillon o grant compaignie de chevaliers. 	qui quant ilz eurent le segond mes ung cheualier arme dunes armes uermeilles uint courant deuant le paueillen o grant compaignie de cheualiers. 	1168
1455	Et cil as armes vermeilles 	Et cil es armes uermeilles 	1169
1456|1457	qui devant venoit entre el paveillon a |et voit. I. escuier 	qui uenoit deuant entre ou paueillon et uoit ung escuier 	1170
1458	qui servoit a la table, 	qui seruoit a la table 	1171
1459	si estoit freres al chevalier de laiens. 	qui estoit frere au cheualier de leans 	1172
1460	Et il cort maintenant cele part, 	si court maintenant celle part 	1173
1461	si le prent par les espaules 	et le prent par les espaules 	1174
1462	et le lieve devant lui sor l’arçon de la sele, 	et le lieue deuant luy sur larcon de la sele. 	1175
1463	si s’en torne a tot. 	si sen tourne atant. 	1176
1464	Et quant cil del paveillon voit ce. 	Et quant cil du paueillon uoit ce 	1177
1465	si crie a Lancelot: « 	si crie a lancelot. 	1178
1466|1467	Ha, |bials sire, 	Haa beau sire 	1179
1468|1469	je sui mors, |se cil enporte ensi mon frere, 	ie suys mort sil emporte ainsi mon frere 	1180
1470|1471	kar il l’ocirra, |s’il n’est secors: 	Car il loccira sil nest secouru. 	1181
1472	si vos pri por Dieu 	si uous pry pour dieu 	1182
1473	que vos i metés paine. » 	que uous mectez et ung escuier uient a luy |si luy dist. 	1183|1184
1474	Et Lancelos saut de la table 	Certes fait il. 	1185
1475	et demande ses armes, 	uoz armes et demourra 	1186
1476|1477	et I. escuiers vint avant, |si li dist : « 	que ie ne les suyue. 	1187
1478	Par foi, 	Lors uient hors du paueillon. 	1188
1479	sire, 	et les peine a le rauoir et lancelot sault de la table 	1189
1480|1481	vos armes et vostre cheval enmainent il ! |— 	et demande ses armes 	1190
1482	Voire, 	uostre cheual emmainent ilz. 	1191
1483	fet il. par mon chief, 	uoire fait il. |Par mon chief 	1192|1193
1484|1485	ja por ce ne remaindra |que je nes sieve.» 	pour ce ne cheualiers o luy. 	1194
1486	Lors vient fors del paveillon 		
1487	et li chevaliers o lui 		
1488	et il esgarde cels 	et il regarde ceulx 	1195
1489	qui s’en vont 	qui sen uont 	1196
1490	qui ja avoient passé l’eve par J. pont de fust; 	qui auoient ia passe leaue par ung pont de fust. 	1197
1491|1492	et Lancelos demande al chevalier |s’il remaindra. « 	Et lancelot demande au cheualier sil demourra. 	1198
1493|1494	Sire, |fet il, 	sire fait il nennil. 	1199
1495|1496	nenil, |ains vos ferai compaignie 	ains uous feray compaignie 	1200
1497	tant que nos aions trové 	tant que nous ayons trouue 	1201
1498	qui armes vos baut. » 	qui nous preste armes. 	1202
1499	Lors acueillent lor voie tot a pié 	Lors acceillent leur uoye tout a pie 	1203
1500	et vienent au pont, 	et uiennent au pont 	1204
1501	si passent outre 	si passerent oultre 	1205
1502	et s’adrecent a I. tertre 	et sadrecent au chemin 	1206
1503	par ou li chevalier s’en vont; 	par ou les cheualiers sen uont. 	1207
1504	si n’ont gaires alé 	si nont gueres alle 	1208
1505	quant il encontrent I. chevalier armé d’unes armes noires 	que ilz encontrent ung cheualier arme dunes armes noires 	1209
1506	qui venoit al pont par I. chemin de travers. 	qui uenoit au pont par ung chemin de trauers. 	1210
1507	Et quant il voit Lancelot, 	et quant il uoit lancelot 	1211
1508	si s’areste por ce que bien le conoissoit, 	si se arreste |par ce que bien le cognoissoit. 	1212|1213
1509	si li demande 	si luy demande 	1214
1510|1511	ou il vet |ensi a pié tos desammés. « 	ou il ua ainsi a pie et tout desarme. 	1215
1512|1513	Qui estes vos, |sire chevaliers, 	Qui estes uous fait lancelot sur cheualier. 	1216
1514	fet Lancelos, 		
1515|1516	qui me demandés |ou je vois ? — 	qui me denandez ou ie uoys. 	1217
1517	Je sui, 		
1518|1519	fet il, |I. chevaliers d’estrange païs, 	Ie suys fait il ung cheualier estrange. 	1218
1520	mais molt me merveil 	mais moult me merueille 	1219
1521	de ce que je vos voi ensi aler. » 	de ce que ie uous uoy ainsi aller. 	1220
1522	Et Lancelos li conte 	et lancelot luy comte 	1221
1523	comment il estoit herbergiés 	comment il estoit herberge. 	1222
1524|1525	et comment I. chevaliers vint laiens |ou il menjoit, 	et comment ung cheualier uint leans 	1223
1526	qui prist a force I. vaslet 	qui print a force ung uarlet 	1224
1527	et le mist sor le col de son cheval. « 	et le mist sur le coul de son cheual. 	1225
1528	Et encore m’a il plus meffet, 	et encor ma il plus meffait. 	1226
1529|1530	fet Lancelos, |kar cil qui avec lui vindrent enporterent mes armes 	Car ceulx qui uindrent auec luy emporterent mes armes 	1227
1531|1532	et enmenerent mon cheval. |— 	et emmenerent mon cheual 	1228
1533|1534	Quel guerredon, |fet cil, 	Quel guerdon pourroye ie actendre de uous. 	1229
1535	porroie je atendre de vos, 		
1536	se je 		
1537|1538	por vos me desarmoie |et vos bailloie mes armes et mon cheval ? 	si ie pour uous me desarmoye et uous balloye mes armes et mon cheual. 	1230
1539	— 		
1540|1541	Certes, |fet Lancelos, 	Certes fait lancelot 	1231
1542|1543	tel com vos deviseriés. |— 	tel comme uous deuiseriez 	1232
1544|1545	Se vos, |fet il, 	Se uous me creancez 	1233
1546	el premier lieu 	que ou premier lieu 	1234
1547	ou je vos troverai armé, 	que ie uous trouueray arme par 	1235
1548	por que je soie desarmés, 	ainsi que ie soye desarme 	1236
1549	me creantés a doner vos armes » 	que uous me baillerez uoz armes 	1237
1550|1551	Ie vos bailleroie les moies. |— 	ie uous bailleray les moyes. 	1238
1552|1553	Certes, |fet Lancelos, 	Certes fait lancelot 	1239
1554	si ferai je, 	si feray ie 	1240
1555	por que vos ne me truisiés combatant. » 	mais que uous ne me trouuez combatant. 	1241
1556	Et cil descent maintenant, 	Et il descent 	1242
1557	si se desarme 	si se desarme 	1243
1558	et baille a Lancelot tot son hernois, 	et baille a lancelot tout son harnoys. 	1244
1559	et il s’en appareille 	et il sappareille 	1245
1560	et monte en son cheval, 	et monte a cheual 	1246
1561	puis dist a son oste 	puis dist a son hoste 	1247
1562	qu’il s’en retort; 	quil sen retourne. 	1248
1563	Imes il dist 	mais il dit 	1249
1564	que non fera. « 	que non fera 	1250
1565|1566	Si ferois, |fet Lancelos a lar 	si ferez fait lancelot, 	1251
1567	je conoistrai bien les armes a celui 	car ie cognoistray bien les armes de ceulx 	1252
1568	que je vois querant en quelque lieu je les truisse. 	que ie uoys querant en quelque lieu |que ie les trouue. 	1253|1254
1569|1570	Et cil dist, |puis qu’il velt, 	Et il dit 	1255
1571	s’en retornera: 	quil retournera 	1256
1572	si s’en vet et enmaine o lui le chevalier 	puis quil le ueult. |si sen ua et emmaine auec luy le cheualier 	1257|1258
1573	qui molt est liés 	qui est moult lie 	1259
1574	de ce que Lancelos li doit I. guerredon. 	de ce que lancelot luy doit ung. guerdon. 	1260
1575	Et Lancelos aquelt son chemin aprés cels 	Et lancelot preut son chemin apres ceulx 	1261
1576|1577	que ? il sieut |tant qu’il est venus el tertre en haut 	quil suyt tant quil est uenu ou tertre en hault. 	1262
1578	et lors voit devant lui la forest 	Et lors uoit deuant luy la fourest 	1263
1579	que l’en apele la forest des Trois Perilx, 	quon appelle la fourest des troys perilz. 	1264
1580	et ce por quoi ele fu ensi apelee devisera bien li contes ça avant. 	Et pour quoy elle fu |ansi appellec uous deuisera bien le comte cy apres. 	1265|1266
1581	Quant il fu amont el tertre, 	Quant il fu amont ou tertre 	1267
1582	si esgarde devant lui, 	si regarde deuant luy. 	1268
1583|1584	mais il ne voit nul de cels |que il queroit, 	et il ne uoit nul de ceulx quil queroit. 	1269
1585	kar il s’estoient ja ferus en la forest. 	car ilz sestoient ia feruz en la foueest. 	1270
1586	Et totes voies sieut il les esclos des chevals 	a touteuoyes suyt il les escloz Des cheuaux 	1271
1587	tant que il vient a l’entree de la forest; 	tant quil uient a lentree 	1272
1588	et lors encontre une damoisele tote chenue 	Et lors encontra une dame toute chenue 	1273
1589|1590	qui chevalchoit molt cointement |et estoit tote deslie, 	qui cheuauchoit moult cointement. 	1274
1591|1592	ses treces par ses espaules |comme pucele 	et estoit toute desliee les treces sur les espaules comme pucelle. 	1275
1593	et avoit en son chief l. chapel de roses, 	et auoit en son chef ung chapel de soucique 	1276
1594	kar c’estoit entor la Saint Johan. 	car cestoit entour la saint iehan 	1277
1595	Il le salue 	Il la salue. 	1278
1596	et ele li dist 	et elle luy dist 	1279
1597|1598	que bone aventure li doinst Diex. « |Damoisele, 	que bonne auanture luy doint dieu damoisele 	1280
1599|1600	fet il, |me savriés vos a dire 	fait il me scauriez uous 	1281
1601|1602	quel part uns chevaliers o unes armes vermeilles |s’en vet ? 	a dire quelle part sen ua ung cheualier a unes armes uermeilles	1282
1603	— 		
1604|1605	En non Diex, |fet ele, 	Certes fait elle 	1283
1606	je le vos enseigneroie bien, 	ie le uous enseigneroye bien 	1284
1607|1608	se je voloie. |— 	si ie uouloye. 	1285
1609|1610	Dites le moi, |fet il, 	Dictez le moy fait il par conuent 	1286
1611|1612	par covent |que je soie vostre chevaliers el premier lieu 	que ie soye uostre cheualier ou premier lieu 	1287
1613|1614	ou vos me requerrois. |— 	que uous me requerrez. 	1288
1615|1616	Se vos me creantés, |fet ele, 	Se uous me creancez fait elle 	1289
1617|1618	que vos me sievrois |de quel hore 	que uous me suyurez a quelque heure 	1290
1619	que vos en semoigne, 	que ie uous semondray. 	1291
1620	je le vos enseignerai. »	ie le uous enseigneray. 	1292
1621	Et cil li creante, 	Et il luy creance. 	1293
1622|1623	dont il se repenti puis molt durement tel hore fu. « |Or alés, 	dont il se repenty puis moult fort. 	1294
1624|1625	fet ele, |tot cest chemin», 	Se allez fait elle tout ce chenin. 	1295
1626	si li mostre I. sentier estroit 	si luy monstre ung sentier moult estroit 	1296
1627	qui aloit al travers de la forest. « 	qui aloit a trauers de la fourest. 	1297
1628	Si ne tornés, 	et luy dist 	1298
1629|1630	fet ele, |de nule part 	quil ne tourne ca ne la. 	1299
1631|1632	et quant vos avrois alé entor demie lieue, |si verrois delés I. vivier trois paveillons tendus. 	Et quent uous serez fait elle alle entour demye lieue si uerrez de la ung mont quatre paueillons tenduz. 	1300
1633	La dedens troverois le chevalier 	La dedans trouuerez le cheualier 	1301
1634	que vos querés 	que uous querez 	1302
1635	que l’en apele Arramant le Gros; 	que len appelle arramant le grec. 	1303
1636	si le conoistrois a ces enseignes 	si le cognoistrez a ces enseignes 	1304
1637	qu’il a en mi le front II. plaies. 	quil a deux playes enmy le front. 	1305
1638	Or vos en poés aler, 	Se uous en pouez aller 	1306
1639	mais que vos m’aiés dit vostre nom. » 	mais |que uous mayez dit uostre nom. 	1307|1308
1640	Et il se nome molt a envis 	Et il se nomme a moult grant peine. 	1309
1641	et totes voies li dist 	Et toutesuoyes luy dit il 	1310
1642	qu’il a non Lancelot del Lac. « 	quil a nom lancelot du lac. 	1311
1643	Alez a Dieu », 	Et il sem part a tant 	1312
1644|1645	fet ele. |Atant s’en part et s’en vet tot le chemin 	et sen uait tout le chemin 	1313
1646|1647	qu’ele li avoit enseigné, |si grant aleure 	quelle luy auoit enseigne si grant aleure 	1314
1648	com il plus puet del cheval traire, 		
1649	tant que il atainst les chevaliers 	tant quil ataint les cheualiers 	1315
1650	que il sievoit. 	qu il suyuoit. 	1316
1651	Et cil lor i escrie si haut 	Et il leur escrie si hault 	1317
1652	que bien porent oîr, 	que bien le peurent ouyr 	1318
1653|1654	et maintenant li vient acorant li uns d’eus, |l’escu al col, 	Et adonc luy uient courant lun deulx lescu au coul la lance ou poing. 	1319
1655	le lance el poing, 		
1656	et fu armés de totes armes. 	et fu arme de toutes armes 	1320
1657	Et Lancelos le fiert 	Et lancelot le fiert 	1321
1658	si que pour le hauberc ne remaint 	si que pour le haubert ne demeure 	1322
1659	qu’il ne li met par mi le cors le fer del glaive 	quil ne luy mecte le fer du glayue parmy le corps. 	1323
1660|1661	si l’empaint bien |com cil 	Il lempanit bien comme cil 	1324
1662	qui assés ot et cuer et force: 	qui auoit assez cuer et force 	1325
1663	si le porte del cheval a terre 	si le porte du cheual a terre 	1326
1664	et retrait son glaive a lui; 	et retraict son glaiue a luy 	1327
1665	si voit I. autre venir tot appareillié de joster 	Si uoit ueniir ung autre tout appareille de iouster. 	1328
1666	et il nel refuse pas, 	et il ne li refuse pas 	1329
1667	ains li torne le chief del cheval, 	ains luy tourne le chief du cheual. 	1330
1668	et cil qui vint acorant li done tel cop en l’escu 	et cil qui uient courant luy donne tel cop sur lescu 	1331
1669	que tote sa lance vole en pieces. 	que toute sa lance uole en pieces 	1332
1670	Et Lancelos, 	Et lancelot 	1333
1671|1672	qui un poi porta sa lance bas. |l'ataint par desus l’arcon de la sele, 	qui ung pou porta sa lance bas lactant par dessus larcon de la sele 	1334
1673	si le fiert si	si le fiert 	1335
1674	que les mailes del hauberc ne pueent soffrir le grant cop 	si que les mailles du haubert ne peuent souffrir le grant coup. 	1336
1675	que li glaives ne li voist par mi le cors 	Et le glayue luy ua parmy oultre le corps. 	1337
1676	si que li fers pert d’autre part; 	si que le fer pert de lautre part. 	1338
1677	si l’empainst si durement 	et il lempaint si fort 	1339
1678	qu’il le porte a terre et lui et le cheval. 	quil porte a terre luy et le cheual ensemble. 	1340
1679	Et lors dient cil 	Et lors dient ceulx 	1341
1680	qui devant s’en aloient 	qui deuant sen aloient 	1342
1681	que molt joste bien li chevaliers, 	que moult iouste bien le cheualier 	1343
