0	avoir trové. » 	auoir trouue. 	0
860|861	fet ele, |volés vos destorner 	Seigneurs fait elle uoulez uous destourner 	687
862	ce qu’il covient estre a force ?» 	ce qͥl conuient estre a force. 	688
863	et demandent 	Et ilz demandent 	689
864|865	por quoi ele le dist. « |Je le di, 	pour quoy elle le dit. 	690
866|867	fet ele, |por le cors 	et ie le dy fait elle pour ce corps 	691
868	que vos gardez et si savés bien 	que uous gardez. |et uous scauez bien 	692|693
869	qu’il en sera ostez. 	quil en sera oste. 	694
870	— 		
871|872	Non sera, |font il, 	Non sera font ilz pas 	695
873	que nos puissons. — 	que nous puissons. 	696
874|875	En non Dieu, |fet ele, 	Certes fait elle 	697
876|877	si iert, et bien sachiés, |fet ele, 	si sera et bien sachez 	698
878	que cil est venus 	que cil est uenu 	699
879	qui l’en ostera. 	qui len oustera 	700
880|881	Et se vos le contredites, |vos en morrois tuit: 	et se uous le contredictes uous en morez tous. 	701
882	por ce vos vendroit il miels 	par ce uauldroit il mieulx 	702
883	que vos le laississiés atant, 	que uous le laississez auant 	703
884	ains que vos vos en façois ocirre. » 	que uous faire occire. 	704
885	Et cil dient 	Et ilz dient 	705
886	que ja tant com il soient vif 	que ia tant qͥlz soient uifs 	706
887	n’en sera portés. « 	nen sera il porte. 	707
888|889	Et bien sache, |font il, 	Et bien sachez font ilz 	708
890|891	li chevaliers |qui venus est 	que si le cheualier 	709
892|893	por avoir le, |que s’il estoit encore plus preus 	qui est uenu estoit encor plus preu 	710
894	que Lancelos n’est, 	que nest lancelot 	711
895|896	si n’en menra il point. |— 	si ne lemmenera il point. 	712
897|898	Or verrons, |fet ele, 	Or uerrons fait elle 	713
899	comment il vos en avendra. » 	comment il uous en prendra 	714
900|901	A ces paroles |vint laiens Lancelos tos armés 	A ces paroles uient leans lancelot tout arme. 	715
902	et quant li chevalier le voient venir, 	et quant les cheualiers le uoyent uenir 	716
903|904	si li demandent |qu’il velt fere. « 	si luy demandent quil ueult faire. 	717
905	Je vueil, 		
906|907	fet il, |avoir le cors 	Ie uueil auoir fait il le corps 	718
908	qui laiens est. 	qui est leans. 	719
909	— 		
910	Par foi, 		
911|912	font il, |vos ne l’avrois mie 	Certes font ilz uous ne laurez pas	720
913|914	por nient. |Nos ¡ morrons ançois tuit 	pour neant nous y mourrons auant tous 	721
915	que vos l’enportois. 		
916	— 		
917|918	A morir, |fet il, 	que uous lemportez Mourir uous en fault 	722
919|920	en estes donc tuit, |puis que a mains ne vos en volés soffrir !» 	puis qui a moons ne uous en pouez soufrir. 	723
921	Si saut dedens les prones 	Si sault dedans les prones 	724
922	et il li corent sus, 	et il luy courent sus. 	725
923|924	kar arrieres le cuident fere sailir |por poor de morir; 	Car arriere le cuident faire flatir pour paour de mourir. 	726
925|926	si le fierent par la |ou il le pueent ataindre 	si le fierent par la ou ilz le peuent actaindre. 	727
927	et il ot el poing l’espee nue ; 	et il eut ou poing lespee nue 	728
928	si lor done grans cops et pesans 	si leur donne grans coups et pesans 	729
929	et fiert le premier 	Et fiert le premier 	730
930	qu’il encontre si durement 	quil encontre si fort. 	731
931	que por le hialme ne por la coife de fer ne remaint 	car pour le heaume |ne pour la coiffe de fer ne demeure 	732|733
932	qu’il ne li mete l’espee jusqu’al test; 	quil ni luy mecte lespee iucquau test. 	734
933|934	et il le hurte de soi, |Si l’abat a terre. 	Et il le hurte de soy si labas a terre. 	735
935	Et lors saillent molt irieement tuit li autre, 	Et lors lassaillent moult ireement tous les autres. 	736
936	si depiecent son escu et son hialme et son hauberc et le blecent en pluisors lieus. 	Si luy depecent son escu et son heaume et son haubert |et le blecent en plusieurs lieux. 	737|738
937	Mais il ne li chaut de rien 	mais il ne luy chault de riens 	739
938	qu’il li facent, 	quil luy facent. 	740
939	kar tant est dolens 	car tant est doulent 	741
940	que nus plus; 	qui plus ne puet 	742
941	si lor laisse corre par grant ire 	si leur laisse courre de grant ire. 	743
942|943	et lor done de l’espee |si grans cops 	et leur donne de lespee si grans coups 	744
944	que tos les fet guenchir avant lui. 	que tous les fait guenchir auant luy 	745
945	Et lors esgarde celui des IllI. 	Lors regarde celuy des quatre 	746
946	qui plus li faisoit mal 	qui luy faisoit plus de mal a son adius. 	747
947	et cil estoit molt grans et molt fors; 	et il estoit moult grant et moult fort. 	748
948|949	et Lancelos |qui le vient ataignant li done par mi le hialme si grant cop 	et lancelot lactaint par le heaume si grant coup 	749
950	qu’il en fet le feu saillir, 	quil en fait saillir le fer. 	750
951	et l’espee glace 	et lespee glace 	751
952	qui de droit ne fu pas ferue. 	qui de droit ne fu pas ferue 	752
953	si descent desus la senestre espaule. Li cops fu grans et par ire ferus, 	si luy descend dessoubz la senestre espaule |le coup fu grant et feru par yre. 	753|754
954	et bien i parut 	et bien y parut. 	755
955	que l’espee cola par mi l’espaule a al chevalier, 	car lespee coula parmy lespaule au cheualier 	756
956	si que li bras a tote l’espaule chiet desus le pavement. 	si qui le braz a toute lespaule chey dessus le pauement. |et il trebuche a terre 	757|758
		et se pasme de langoisse 	759
		qu il sent. 	760
957	Et lors sont molt esmaié li autre troi, 	et lor sont moult esmayez les autres troys. 	761
958	si font molt malvés samblant d’els deffendre 	si font moult mauuaiz semblant de deffedre 	762
959	por le grant cop 	pour le grant coup quilz ont eu. 	763
960	qu’il ont veu et por l’espee 	et pour lespee 	764
961	que chescuns d’els a ja sentie jusqu’al sanc. 	que chascun a sentie icquau sanc Et lancelot |qui oncquez ne recroit leur court sus 	765|766
962|963	Et Lancelos lor cort sus et en fiert I. |el hialme 	et en fiert lun amont ou heaume 	767
964|965	si qu’il le fet flatir a terre |d’ambesdeus les paumes. 	si quil le fait flatir a terre des deux paumes 	768
966	Et quant li autre dui voient ce, 	Et quant les autres deux uoyent ce 	769
967	si tornent en fuies vers l’uis a garison; 	si tournent uers luys |pour fouir a garison. 	770|771
968	et Lancelos vint ataignant le deerrain, 	Et lancelot actaint le derrain 	772
969	si le fiert par entre l’escu et le bras 	si le fiert entre lescu et le braz 	773
970	si qu’il li trenche le poing 	si quil luy trenche le poing. 	774
971	et li escus chiet a terre, 	et lescu chiet a terre 	775
972	et cil torne en fuies 	a cil tourne en fuye 	776
973	qui maheignié se sent. 	qui se sent mehaigue 	777
974	Et Lancelos vient a l’autre 	Et lancelot reuient a lautre 	778
975	qui ja se relevoit, 	qui se releuoit. 	779
976	sel fiert de l’espee si grant cop 	si le fiert de lespee |si grant coup quil luy. 	780|781
977	qu’il li fet le hialme voler en la place. 	fait uoler le heaume en la place.	782
978	Et quant cil sent son chief nu, 	Et quant il sent son chief nu 	783
979	si cria merci 	si me mercy 	784
980	et dist 	et dit 	785
981	qu’il ne l’ocie pas, 	quil ne loccie pas 	786
982	kar il est pres de sa volenté fere. « 	car il est prest de faire sa uolente. 	787
983	Or te covient donc, 	Or te conuent donc fiancer 	788
984	fet Lancelos, 		
985|986	fiancer |que tu le cors mon seignor Galehout conduiras a la Dolerose Garde 	que tu conduyras le corps de monss galehot a la douloreuse garde. 	789
987	et iluec le feras garder 	Et ilecquez le feras garder 	790
988	tant que je i viegne; 	tant que ie y uiegne. 	791
989	et se l’en te demande 	Et se len te demande 	792
990	qui t’i envoie, 	qui te y enuoye. 	793
991	si diras « 	tu diras cil 	794
992	cil qui ot les ames blanches le jor que li chastials fu conquis. » 	qui eut les armes blanches le iour |que le chasteau fut conquis. 	795|796
993	Et il li fiance 	et il luy fiance 	797
994	que tot ensi le fera il. 	que ainsi le fera il. 	798
995	Lors prent Lancelos la lame par le plus gros chief, 	Lors prent lancelot la lame par le plus gros bout 	799
996|997	si tire de grant force |qu’a pou 	si tire de si grant force qua pou quil ne se derompt tout. 	800
998|999	qu’il ne se deront tos, |si que li sans li vole par mi le nes et par mi la boche 	si que le sang luy uole par le nes et par la bouche. 	801
1000	et li cors li sue d’anguoisse. 	et le corps luy sue dangoesse. 	802
1001	Mais por tote la destrece ne remaint 	mais pour toute la destrece ne demeure pas 	803
1002	qu’il n’ait la tombe levee en haut à; 	quil ne leue la tombe en hault. 	804
1003	mes nule dolors 	ne nulle douleur 	805
1004	qu’il eust onques ne monte rien a cele dolor 	quil eut oncquez |mais ne fu rien a celle douleur 	806|807
1005	qu’il ot, 	quil eut 	808
1006	quant il vit le cors Galehout tot ensi armé 	quant il uu le corps galehot |tout ainsi arme 	809|810
1007	com il estoit; 	comme il estoit. 	811
1008	si trova s’espee delés lui 	si trouua lespee pres de luy 	812
1009	qui molt estoit et bone et clere; 	qui moult estoit bonne et bele 	813
1010	et sans faille de l’espee meesmes 	Et sans faille de lespee mesmes 	814
1011	se fust il ocis, 	se fust il occis 	815
1012	se la damoisele ne li eust tolue erraument. 	se la damoiscle ne luy eust tollue erraument. 	816
1013	Lors fist Lancelos une biere fere de fust 	Lors fist lancelot faire une litiere de fust. 	817
1014	et la fist covrir des plus riches pailes de laiens, 	et la fist couurir des plus riches pales de leans. 	818
1015	et quant il l’ot atornee al plus richement 	Et quant il leut atournee au plus richement 	819
1016	qu’il pot, 	quil peut. 	820
1017|1018	li chevaliers prisons li dist: « |Sire, 	le cheualier prisonnier luy dist. 	821
1019	fet il, 		
1020|1021	se l’en movoit tot de nuis, |ce seroit sens. — 	sire fait il se len mouuoit de nuyt ce seroit grant sens. 	822
1022|1023	Por quoi ? |fet il. — 	pour quoy fait il. 	823
1024	Por ce que, se li chevalier de cest païs savoient 	par ce que si les cheualiers de ce pays sauoient 	824
1025|1026	que l’en len deust porter, |il feroient gaitier les trespas 	que len le deust la porter ilz feroient guecter les trepas 	825
1027	si qu’il seroit arestés en alcun lieu ; 	si quil seroit arreste en aucun lieu. 	826
1028	et por ce vos loeroie je qu’il meust orendroit, 	et pour ce uous loueroye |ie quil meust maintenant 	827|828
1029	kar il seroit bien eslongiés, 	car il sera bien esloigne 	829
1030	ains qu’il fust jors, XX. lieues englesches. 	auant quil soit iour de uingt lieues anglesches. 	830
1031	Et il s’i acorde bien; 	Et il si accorde bien. 	831
1032	si met la litiere sor Il. palefrois amblans 	si mect la litierie sur deux palefroys amblans. 	832
1033	et enportent ensi Galehout fors de sa region; 	et emportent ainsi galehot hors de la religion 	833
1034	si en font li frere grant duel et molt en sont corocié et dolenta 	si en font les freres grant deul. |et sont moult corroucez et doulans 	834|835
1035	de ce que l’en l’enporte. 	de ce qui len lemporte. 	836
1036|1037	Et Lancelos le convoie grant piece de nuis, |plorant et regretant sa proesce et sa valor 	Et lancelot li conuoye grant piece de nuyt plourant et plaignant et regretant sa prouesce et sa ualeur. 	837
1038	et se ne fust la damoisele 	et se ne fust la damoisele 	838
1039	qui avec lui estoit molt 	qui auec luy estoit. 	839
1040	en eust plus fet 	moult en eust plus fait 	840
1041	qu’il ne fist, 	quelle ne fist 	841
1042	mais ele l’en detorna, 	mais elle len destourna 	842
1043	et il deffendi al chevalier 	et il deffendy au cheualier 	843
1044	que il nel feist en terre metre 	quil ne le fist mectre en terre uicquez 	844
1045	devant que il fust venus. 	a ce que luy mesmes y fust. 	845
1046|1047	Si se part atant li uns de l’autre |et il retorne a l’abeie, 	Si se part atant lun de lautre et lancelot retourne a labaye 	846
1048|1049	si se couche, |c’onques la nuit ne volt mengier ne boivre por chose 	si si couche ne oncquez la nuit ne uoult boyre ne manger pour chose 	847
1050	que l’en li deist, 	quon luy dist 	848
1051	ains plora et dolosa tot adés; 	ains pleura et dolousa 	849
1052	si li anuioit molt li jors 	si luy ennuyoit moult le iour 	850
1053	qui tant demoroit a venir. 	qui tant demouroit a uenir. 	851
1054	a Al matin, 	Au matin si tost 	852
1055	si tost com li jors aparut, 	que le iour apparu se leua lancelot 	853
1056	se leva et oi messe entre lui et la damoisele 	et ouy misse luy et la damoisele 	854
1057	et puis s’arma. 	et puis sarma. 	855
1058	Lors » li dist ele les noveles de Boort 	et lors luy dist elle les nouueles de boort. 	856
1059	et ce qu’ele en avoit veu devant Honguefort, 	et ce quelle en auoit ueu deuant hunguefort. 	857
1060	et il en fu molt liés. 	et il en fut moult lie 	858
1061	Et ele li dist: « 	si luy dist. 	859
1062|1063	Sire, |il vos vet querant ne jamés ne finera tant 	Sire il uous uait querant ne iamais ne finera iucqua 	860
1064|1065	qu’il vos avra trové. |— 	ce quil uous ait trouue. 	861
1066	Damoisele, 		
1067|1068	fet il, |se vos le cuidiés trover ains de moi, 	Haa damoistle fait il se uous le cuidiez trouuer auant moy 	862
1069	je vos voldroie proier 	ie uous uoudroye prier 	863
1070	que vos feissiés tant por moi 	que uous feissez tant pour amour de moy 	864
1071	que vos li portissiés ceste espee 	que uous luy portassee ceste espee 	865
1072	qui fu mon seignor Galehout, 	qui fu a messire galehot 	866
1073	et li dites 	et luy dices 	867
1074	qu’il la DOrt de par moi, 	quil la porte de par moy 	868
1075	que molt est bone. » 	car moult est bonne. 	869
1076	Et ele dist 	Et elle dit 	870
1077	qu’ele le trovera par tens 	quelle le trouuera tantost 	871
1078	et bien fera cest message; 	et que bien fera ce message. 	872
1079	si s’en part atant de lui 	si se part atant de luy. 	873
1080	et il s’en vet droit vers le chastel de Floego, 	et il sen ua tout droit. |uers le chastel de fleogo 	874|875
1081	si i vint a hore de prime. 	si y uint a heure de prime. 	876
1082	Et il esgarde es pres defors la vile, 	et il regarde es prez dehors la uille. 	877
1083|1084	si voit molt grant gent entor le feu |ou l’en devoit ardoir la suer Meleagan», 	si uoit moult grant gent entour ung feu. 	878
1085	et quant il aperçoit le feu, 	Et quant il aparceut le feu 	879
1086|1087	si a poor de la damoisele. Lors broche le cheval |et vint errant cele part 	si a paour de la damoisele 	880
1088	tant com il puet del cheval traire. 		
1089	Et quant il est venus jusque la, 		
1090	si esgarde et voit la damoisele 		
1091	qui ja estoit amenee al feu por destruire, 	qui ia estoit amenee au feu pour destruire. 	881
1092	si estoit en pure sa chemise 	si estoit en sa pure chemise 	882
1093	et le tenoient. VI. pautonier, trois d’une part et trois d’autre; 	et la tenoient six pautonniers dune part et troys dautre 	883
1094	si n’atendoient a geter le el feu 	si nactendoient a la gecter ou feu 	884
1095	fors le commandement as juges, 	fors le commandement des uiges. 	885
1096	et ele ploroit trop durement 	Et elle plouroit merueilleusement 	886
1097	et regretoit Lancelot: « 	et regretoit lancelot. 	887
1098|1099	Ha, |gentilx chevaliers Lancelos, 	Haa lancelot gentilz cheualier 	888
		De celle mesmes matiere. 	889
1100	kar pleust ore a nostre Salveor 	que pleust ores a nostre |seigneͬ 	890|891
1101	que vos seuissiés ceste novele, 	que uous sceussez ceste nouuelle 	892
1102	si fuissiés pres de ci a demie lieue! 	et que feussez a demye lieue pres de cy. 	893
1103	Certes a l’aide de Dieu et de la vostre seroie je encore anuit rescosse malgré tos mes enemis. 	et certes a maide de dieu et de la uostre seroye |ie encor ennnuyt rescousse malgre tous mes ennemys. 	894|895
1104	Mais vos ne le savés pas a, 	et si ne li scauez pas. 	896
1105|1106	si me covendra ore morir |por la vie 	si me conuiendra ores mourir pour la uie 	897
1107	que je vos sauvai emprés Dieu; 	que ie uous sauuay. 	898
1108|1109	mais certes il ne m’en poise pas tant |por moi 	mais certes il ne men poist pas tant pour moy 	899
1110|1111	com il fet |por le coros 	comme il fait pour le corroux. 	900
1112	que vos en avrois, 		
1113	quant vos le savrois. 		
1114	Mais ce me reconforte molt 	Mais ce me reconforte moult. 	901
1115	que je sai bien 	car ie scay bien 	902
1116	que les damoiseles gaaigneront tant en ma mort 	que les damoiseles |qui queront tant en ma mort 	903|904
1117	que jamés nule ne vos requerra d’aide 	que iamais nulle ne uous requerra daide. 	905
1118	que vos li faillois 	a qui uous faillez 	906
1119	tant com il vos remenbre de moi, 	tant quil uous rememberra de moy. 	907
1120	kar vostre cuers est si frans 	Car uostre cuer est si franc 	908
1121	qu’il ne puet estre sans trop grant merites rendre a totes celes 	quil ne puet estre |sans trop grant merite rendre a toutes celles 	909|910
1122	qui de par moi se reclaiment: 	qui de par moy uous reclament. 	911
1123|1124	si m’est avis |qu’il m’est molt miels a m’ame de morir 	Si mest adius quil est moult mieulx a ma uie de mourir 	912
1125	por loialté fere et por geter de prison 	pour si hault affaire et pour gecter de prison 	913
1126	si vaillant home 	si uaillant homme 	914
1127	comme vos 	comme uous estes 	915
1128	que vos fuissiés mors par la desloialté de Meleagan 	que uous feussez mort par la desleaute de meleagan 	916
1129	qui en prison vos avoit mis par traïson. » 	qui en prison uous auoit mis par traison. 	917
1130	Ensi disoit la damoisele molt tendrement plorant 	Ainsi disoit la damoisele moult tendement plourant. 	918
1131	et lors vint Lancelos poignant cele part 	Et lors uint lancelot |poiguant celle part 	919|920
1132	ou il la vit: 	ou il la uit. 	921
1133	si dist a cels 	si dist a ceulx 	922
1134|1135	qui le tenoient: « |Laissiés la damoisele! — 	qui la tiennent laissez la damoisele par courtoisie. 	923
1136	Por quoi, 		
1137|1138	sire, |fet J. chevaliers armés 	Et ung cheualier arme sault auant 	924
1139	qui avant saut, 		
1140|1141	le lairons nos ? |— 	et dist. 	925
1142|1143	Por ce, |fet il, 	pour quoy la lairrons nous. 	926
1144|1145	que vos n’avés droit en li |por fere mal. 	par ce fait il queͥ uous nauez droit de la faire mourir. 	927
1146	— 		
1147|1148	Si avons, |fet cil, si grant 	Si auons fait il car ie lay actainte dung meurtre 	928
1149	que nos l’avons atainte de murdre 		
1150	dont je l’apelai, 	dont ie lapellay. 	929
1151	et ele s’en offri a deffendre, 	et elle sen offry deffendre 	930
1152	mais ele ne trova onques 	mais elle ne trouua oncquez 	931
1153	qui por li en prist escu 	qui pour lie en prist escu. 	932
1154	et ce n’est pas merveille, 	et ce nest pas de merueilles. 	933
1155	que chescuns set bien 	car chascun sceit bien 	934
1156|1157	quele en a desloialment ovré. |— De quoi ? 	quelle en a desloyaument ouure 	935
1158|1159	fet Lancelos. |— 	de quoy fait lancelot. 	936
1160	De ce, 		
1161|1162	fet il, |qu’ele delivra Lancelot 	De ce fait il quelle deliura lancelot 	937
1163	por Meleagan ocirre, son frere. 	pour occire meleagant son frere. 	938
1164|1165	— Se vos, |fet Lancelos, 	Se uous ousiez monstrer fait lancelot 	939
1166	osiés mostrer 		
1167	qu’ele eust fet traïson ne murdre, 	quelle ait fait traison ne murmure. 	940
1168|1169	je seroie pres del deffendre. |— 	ie suys prest du deffendre. 	941
1170|1171	Qui estes vos? |fet cil. — 	Oui estes uous fait il. 	942
1172|1173	Uns chevaliers sui, |fet Lancelos, 	Ie suys ung cheualier fait il 	943
1174	qui vieng ceste part 	qui uiens ceste part 	944
1175|1176	por ceste damoisele deffendre. |— 	pour deffendre ceste damoisele. 	945
1177|1178	Par foi, |fet cil, 	par foy sire fait il. 	946
1179|1180	se je voloie, |il ne m’en covendroit ja combatre, 	il ne men conuiendroit ia combatre 	947
1181	kar des ier en est ! ele atainte, 	si ie uouloye. |Car ia pieca en est elle ataincte 	948|949
1182	puis qu’ele ne pot trover 	puis quelle na peu trouuer 	950
1183	qui la deffendist, 	qui la deffende. 	951
1184	mais je sent ma querele a si loial et si droituriere 	mais ie sens ma querele a si loyal et si droiturier 	952
1185	qu’il n’a chevalier el monde 	quil ny a cheualier ou monde uers 	953
1186	vers cui je ne l’osaise bien prover au ? grant droit 	qui ie ne losasse bien prouuer au grant droit 	954
1187|1188	que je i ai. |— 	que ie y ay. 	955
1189|1190	En non Dieu, |fet Lancelos, 	Certes fait lancelot ores y parra 	956
1191|1192	or i parra, |que je sui pres que je la desfende vers vos. — 	car ie suys prest de la defendre uers uous uoire fait il. 	957
1193|1194	Voire, |fet cil, par mon chief, 	par mon chef uous en mourres 	958
1195|1196	et vos en morrois |comme traitres et desloials. » 	comme traistre et desleal 	959
1197	Lors traient la damoisele loins del feu 	Lors tirent la damoisile au dessus du feu. 	960
1198|1199	et li chevalier s’entreslongent li uns de l’autre, |si s’entrevienent 	et les cheualiers se esloiguent si tost 	961
1200	si tost com li cheval pueent aler 	que les cheuaux peuent courre 	962
1201	et s’entrefierent des glaives si durement 	et sentrefierent des glayues si fort 	963
1202	qu’il les font voler en pieces; 	quilz les font uoler en pieces. 	964
1203	puis s’entrehurtent si des cors et des visages 	puis sentrehurtent des corps et des uisages 	965
1204	qu’il n’i a celui 	si quil ny a celuy 	966
1205	qui tos ne soit estordis et desconreez. 	qui ne soit tout estourdy et estonne. 	967
1206	Mais li chevaliers par est si estonés 	mais le cheualier est si estonne 	968
1207	qu’il ne se puet tenir en sele, 	qu il ne puet tenir en sele. 	969
1208	ains vole jus del cheval et al parchaoir feri 	ains uole ius du cheual. |et au choir fery 	970|971
1209	li quins del hialme en la terre, 	li quint du heaume en terre 	972
1210|1211	si qu’a bien pou |qu’il n’a le col brisié. 	si qua pou quil na le coul froisse 	973
1212|1213	Et quant Lancelos a fet son tour, |si descent, 	Et quant lancelot a fait son tour si descent. 	974
1214	kar honte li seroit de requerre a cheval celui 	car honte luy seroit de requerre a cheual celuy 	975
1215	qui est a pié; 	qui est a pie. 	976
1216	si trait l’espee et cort sus a celui 	si trait lespee et court sus a celuy 	977
1217	qui ja se relevoit, 	qui ia se releuoit. 	978
1218	si li done par mi le hialme tel cop 	si luy donne si grant cop par my le heaume 	979
1219	qu’il le fet a terre flatir des paumes et des genols ; 	quil le fait flatir des paumes et des genoux a terre 	980
1220	puis recuevre I. autre cop 	puis recueuure ung autre cop 	981
1221	et le fiert 	et le fiert 	982
1222	si qu’il le fet tot parchaoir 	si quil le fait tout choir 	983
1223	et le prent par le hialme, 	Et lors le prent par le heaume 	984
1224	si le traine jusqu’al feu et le gete dedens. 	et le trayne iucquau feu |si le gecte dedans 	985|986
1225	Et cil estoit si estordis 	Et il estoit si estourdy 	987
1226	et tant avoit perdue la force del cors 	et tant auoit perdu la force du corps 	988
1227	que relever ne se pot, 	quil ne se peut releuer. 	989
1228|1229	si le covint remanoir el feu |et morir en tel maniere. 	si luy conuint demourer ou feu et mourir en telle maniere. 	990
1230	Et lors vienent avant cil 	et lors uiennent auant ceulx 	991
1231	qui le champ gardoient, 	qui le champ gardoient. 	992
1232	si dient a Lancelot 	si dient a lancelot 	993
1233|1234	qu’il en a assés fet |et li rendent la damoisele saine et haitiee, 	quil en a assez fait et luy rendent la damoisele saine et haitie 	994
1235	et il la fet vestir, 	et il la fait uestir 	995
1236	puis li demande 	puis luy demande 	996
1237|1238	qu’ele velt |qu’il face mes. « 	quelle ueult quil luy face 	997
1239|1240	Sire, |fet ele, 	mais Sire fait elle 	998
1241	que vos me menés a salveté a mon chastel. » 	que uous memmenez en mon chastel. 	999
1242	Et il dist 	et il luy dit 	1000
1243	que volentiers: 	que uoulentiers 	1001
1244	si le fet monter 	si la fait monter 	1002
1245	et le conduit jusqu’al chastel	et la conduit iucquau chastel 	1003
1246	ou ele l’ot gardé maint jor. 	ou elle lauoit garde maint iout |De celle mesmes matiere dessusdicte. 	1004|1005
1247	Li chastials avoit non Galefort 	Le chasteau auoit nom galefort 	1006
1248	et seoit sor une petite riviere, 	et seoit sur une petite riuiere. 	1007
1249|1250	si estoit molt aaisiés de totes choses |et fors a merveille, 	si estoit moult aise de toutes choses et fort a merueilles 	1008
1251	Et quant Lancelos vint la, 	Et quant lancelot uint la 	1009
1252	il ne fet pas a demander 	il ne fait pas a demander 	1010
1253	se l’en li fist joie, 	si len luy fait ioye. 	1011
1254|1255	kar cil del chastel savoient ja bien |que lor dame estoit delivree par I. chevalier 	car ceulx du chastel scauoient bien que leur dame estoit deliuree par ung cheualier 	1012
1256	qui o li venoit. 	qui uenoit o lie 	1013
1257	Et quant il le virent, 	Et quant ilz le uirent 	1014
1258	si le reçurent a si grant joie 	si le receurent a si grant ioye 	1015
1259	com se ce fust Damedieu meismes 	comme se ce fust dieu. 	1016
1260	et s’agenoillent tuit devant lui 	et sagenoillent tous deuant luy. 	1017
1261|1262	et crioient a une vois tuit ensamble : « |Sire, 	et crient a une uoix tous ensemble Sire sur tous ceulx du monde. 	1018
1263	sor tos cels del monde soiés vos bien venus, 	soyez uous le bien uenu 	1019
1264	qui nostre grant duel avés torné en grant joie !» 	qui nostre grant deul auez toͬne en grant ioye telle feste 	1020
1265	A tel feste ont laiens Lancelot receu 	ont leans receu lancelot. 	1021
1266	et quant il ont la damoisele descendue devant son mestre palés, 	Et quant il eut descendu la damoisele deuant son maistre palays. 	1022
1267	si s’en volt aler maintenant, 	si sen uoult maintenant aller. 	1023
1268	kar il n’estoit mie encore plus de tierce. 	car il nestoit pas encor plus de tierce. 	1024
