1279|1280	si li cort les bras tendus |et le volt baisier en la boche, 	et le corut acoler et baisier le volt elle 	1042
1281	quant il li guenchist, 	mais il guenchist. 	1043
1282	et ele li baise la face et le col et le menton, 	Et elle li baise le col et la face et le menton 	1044
1283	puis que autre chose n’em puet avoir ; 		
1284	si plore de pitié 	et pleure de pitie. 	1045
1285|1286	et li dist: « |Ha, 	Et dist. Ha : 	1046
1287	gentilx chevaliers, 	gentiex cheualiers. 	1047
1288	tant vos avoie desirré a veoir 	tant vous auoie desire a ueoir 	1048
1289	ains que je moreuisse! 	aincois que iou morusse. 	1049
1290	Mais comment l’avez vos puis fet?, 	Mais comment laues vous puis fait 	1050
		et comment uenistes vous ceste part. 	1051
1291	Et il li dist : « 	Et il li dist. 	1052
1292|1293	Bien, |Dieu merci. — 	bien dieu merci. 	1053
1294|1295	Et ceste part, |fet ele, 	et vne ocoison mi amena. 	1054
1296	comment venistes vos, 		
1297	qui avant ier vos en partistes ? — 		
1298|1299	Par foi, |fet il, 	Si dist 	1055
1300	une grant acheison. 		
1301|1302	m’i amena. »|Si li conte comment. I. chevalier o unes armes vermeilles l’avoit apelé de traïson a la cort le roi Artu 	comment vns cheualiers a vnes armes uermeilles lauoit apele de traison en la cort le roy artu 	1056
1303	por la mort de Meleagan; 	pour la mort melyagant. 	1057
1304|1305	si l’en covient a deffendre en la cort le roi Baudemagu. « |Ha, 	si men conuient a desfendre en la cort le roy baudemagu. 	1058
1306|1307	fet ele, |je sai bien 	ha y fait elle iou sai bien 	1059
1308|1309	qui il est. |C’est Argodras li Ros et li chevaliers 	qui il est Cest argondrass li rous. 	1060
1310	que vos avés hui ocis et ars estoit ses freres; 	Et li cheualiers |que vous aues ochis et ars estoit ses freres. 	1061|1062
1311	si ne sai 	si ne sai 	1063
1312	que vos puissiés fere, 	que vous puissies faire. 	1064
1313	kar se mes peres set 	Car se mes peres set vraiement 	1065
1314	que vos aiés ocis Meleagan, 	que vous aues melyagant ocis. 	1066
1315	je criem 	Iou criem 	1067
1316	qu’il ne vos face ocirre 	quil ne vous face ocirre. 	1068
1317|1318	por le grant duel |qu’il avra des noveles. 	pour le grant doel quil en aura. 	1069
1319	— 		
1320|1321	Coment ? fet Lancelos, |nel set il mie encore ? — 	Comment fait lancelot ne le set il mie encore. 	1070
1322|1323	Certes, |sire, 	Si mait diex fait elle nenil. 	1071
1324|1325	nenil; |si est Meleagans en cest païs aportés plus a de XV. jors 	Si est melygant amenez er cest pais. XV. iors a passes. 	1072
1326	et est el chastel des Illl. Pierres 	si gist el castel des. iiij. pierres. 	1073
1327	et le gardent iluec si celeement 	Et le gardent illueques si celeement 	1074
1328	que li rois n’en set encore riens: 	que li roys nen set encore noient. 	1075
1329|1330	si en covendra esploitier al plus sagement |que vos porrois. 	Si vous en conuendra esploitier au plus tost que vous porres. 	1076
1331	Mes a quant est li jors 	Mais a quant est li iors. 	1077
1332	que vos vos en devés deffendre? » 	que vous en baes a desfendre. 	1078
1333	Et il dist 	Et il dist 	1079
1334	que c’est le jor de la Magdalaine. « 	que chou est le ior de la magdalaine. 	1080
1335|1336	Or vos en conseut Diex, |fet ele. 	Or vous en consaut diex fait elle. 	1081
1337	kar j’ai grant poor 	quar iou ai grant doute 	1082
1338	que Argodras ne vos face anui par traïson. — 	que argondras ne vous face anui ou traison 	1083
1339|1340	De ce, fet il, |n’aiés ja garde! 	De chou fait il naies ia garde 	1084
1341	Tot son pooir en face, 	mais tout son pooir en face 	1085
1342	que je n’en avrai ja poor. » 	quar iou nen aurai ia paour . 	1086
1343	Assés parlerent cele nuit de maintes choses a 	lele nuit fu lancelot moult a aise 	1087
1344	et molt firent cil del chastel grant joie de lor dame 	et moult firent cil del chastel ioie de lui et de lor dame. 	1088
1345	qu’il cuidoient avoir perdue, 	que il quidoient auoir perdue. 	1089
1346|1347	et or l’ont saine et haîtie |Et al matin, 	Et au matin si tost	1090
1348	si tost com li jors parut cler, 	com li iors apparut 	1091
1349	se leva Lancelos 	se leua lancelot et sarma 	1092
1350|1351	et se parti de la damoisele, |quant il fu armés; 	et prist congie a la damoisele. 	1093
1352	et ele le commande molt a Dieu 	et elle le commande a dilelu 	1094
1353	et li pria 	et li pria 	1095
1354	qu’il s’en revenist par li al repairier; 	quil reuenist par li au repairier. 	1096
1355	et il dist 	Et il li dist 	1097
1356	que si feroit il, 	que si feroit il 	1098
1357	s’il pooit. 	se il pooit. 	1099
1358	Si se remet en son chemin et eirre tot le jor jusqu’al vespre 	si se met en son chemin |et esra toute iour iusques au soir. 	1100|1101
1359	et lors aproche d’une riviere 	Et lors aproche dune riuiere 	1102
1360	que l’en apeloit Aglonde, 	que on apeloit agloride. 	1103
1361	si en estoit l’eve molt parfonde et molt noire. 	si en estoit laigue moult parfonde. |et moult noire, 	1104|1105
1362	Et quant il vint pres de l’eve, 	Quant lancelos vint pres de laiglule 	1106
1363	si vit trois paveillons tendus pres de la rive; 	si y uit. iij. paueillons tendus. 	1107
1364	si en estoit li uns grans et bials 	dont li vns estoit blans. 	1108
1365	et li autre dui estoient moien. 	et li autre doi moien estoient de autre color. 	1109
1366	Et lors issi del greignor paveillon I. chevaliers tos desarmés 	Et lors issi del pauellon vns cheualiers tous armes. 	1110
1367	qui li dist 	qui li a dit 	1111
1368	que bien soit il venus, 	que bien soit il uenus 	1112
1369|1370	et il li rent maintenant son salu. « |Ha, 	Et il li rent son salu. 	1113
1371|1372	sire, |fet il, 	Biau sire ce dist li cheualiers del paueillon 	1114
1373	vos me samblés chevaliers errans 	vous me sambles vns cheualiers errans. 	1115
1374	et je aim tos cels 	et iaim tous chiaus 	1116
1375	qui en tel mestier usent lor vie, 	qui en tel maniere usent lor vie. 	1117
1376	kar je meismes sui chevaliers errans 	Car iou meismes sui cheualiers errans. 	1118
1377	et por ce vos vueil je proier 	et pour chou vous voeil iou proier 	1119
1378	que vos herbergiés anuit mes o moi; 	que vous vous herbergies hui mais auec moi. 	1120
1379|1380	kar se vos passés avant de ci, |vos ne troverois se forest non, 	Car se vous vous partes de ci vous ne trouueres hui 	1121
1381	si salvages 	mais se fores non saluages. 	1122
1382	que vos i porrois tost desvoier. 	si que vous y porrois bien foruoier. 	1123
1383|1384	Et il est bien tens de herbergier, |ce veés vos bien : 	Et il est pres del uespre 	1124
1385|1386	por ce vos lo |que vos remanois 	si vous lo que vous remaignies 	1125
1387|1388	et vos avrois ostel bel et buen tot a vostre voloir. |— 	et vous el aurois ostel tout a uostre uolente. 	1126
1389|1390	Bials sire, |fet Lancelos, 	iau sire fait lancelot 	1127
1391|1392	puis qu’il vos plest, |je remaindrai 	puis que il vous plaist iou remandrai. 	1128
1393|1394	et por vostre proiere |et por ce que vos dites 	Lors descentas Dde son cheual 	1129
1395|1396	que vos estes chevaliers errans. a, |Lors descent et vaslés saillent des autres paveillons, 	Et uallet saillent des autres paueillons. 	1130
1397|1398	si le desarment |et li aportent I. mantel 	si le desarment demaintenant. 	1131
1399|1400	de samit legier a afubler por le chaut |qui grans estoit ; 	puis li aportent vn mantel de samit por affubler. 	1132
1401|1402	si le mainent el grant paveillon avec l’autre chevalier. |Et lors parlerent ensamble 	et lors sen uont el grant paueillon entre lui et le cheualier. 	1133
1403|1404	et s’entracointierent |et demanda li uns a l’autre de son estre ». 	et cil li demande 	1134
1405	Li chevaliers enquiert a Lancelot 		
1406|1407	dont il vient |et ou il vet 	ou il aloit. 	1135
1408	et quele aventure le maine si sol, 		
1409	et il li conte une partie de son estre 		
1410|1411	et autre l’en çoile e; |et totes voies li dist 	Et lancelot li dist 	1136
1412	que en la cort al roi Baudemagu voldroit estre 	quil volroit estre a la cort le roy baudemagu 	1137
1413	por soi deffendre vers un chevalier 	pour combatre a. j. cheualier 	1138
1414	qui l’a apelé de traïson. 	qui lauait apele de traison. 	1139
1415	En ce qu’il parloient ensi, 	Et en chou quil a parloient 	1140
1416	orent li escuier mise la table, 	ensi orent li escuier mises lez tables. 	1141
1417	si vont laver; 	si vont lauer 	1142
1418	si s’asiet Lancelos et li chevaliers et une damoisele 	si sassistrent li cheualier au mangier |Et vne damoisele 	1143|1144
1419	qui molt ert bele 	qui moult estoit bele 	1145
1420	et estoit amie al seignor de laiens; 	qui estoit amie au cheualier de laiens. 	1146
1421	si mengierent tuit troi ensamble. 	si mangerent tout. iij. ensamble 	1147
1422	mes cele qui Lancelot esgarde ne se puet saoler de lui veoir, 	mais moult regarde la damoisele lancelot. |et ne se puet de lui regarder saouler. 	1148|1149
1423|1424	Kar tant li samble bials |qu’ele ne prisa onques mes bialté d’ome envers cesti : 	Si ne prisa onques mais la biaute domme vers la soie. 	1150
1425	si l’esgarde si viselment 	Si le regarde si ententieument 	1151
1426	que tot en laisse le mengier 	que tout en laisse le boire et le mangier. 	1152
1427	n’a autre chose n’entent. 	si que a autre chose nentent. 	1153
1428	fors a lui remirer. 	fors ca lui remirer. 	1154
1429	Si ont li escuier osté le premier mes de sor la table 	Si ont li escuier oste le premier mes. 	1155
1430	c’onques la damoisele n’en tasta, 	mais onques la damoisele nen gousta. 	1156
1431	ains pensa totes voies. 	Ains pensa toutes voies a la grant biaute lancelot. 	1157
1432	Et en cel pensé li descent el cuer une si grant amor 	Et en celui pense li descendoit au cuer vne si grant amor : 	1158
1433	qu’ele aime Lancelot 	que elle ama lancelot outre chou 	1159
1434	outre ce que feme n’ama mes home; 	que femme nama onkes si homme. 	1160
1435	si li est avis 	Si li est auis 	1161
1436	que s’il l’amoit 	que sil lamoit 	1162
1437	qu'ele seroit beneuree. 	que elle seroit bone euree. 	1163
1438	Mais ci endroit n’em parole plus li contes, 	Mais chi endroit nen parole plus li contes. 	1164
1439	kar ça avant le devisera 	mais cha auant vous deuisera 	1165
1440	et comment ele l’ama merveillosement 	comment elle lama merueilleusement. 	1166
1441	et comment ele le proia et la merveille 	Et comment elle li pria. |et la meruelle 	1167|1168
1442	que ses amis en fist, 	que sez amis en fist. 	1169
1443	quant il sot 	quant il sot 	1170
1444	qu’ele l’amoit, 	que elle lama. 	1171
1445	et comment cele morut 	Et comment elle morut 	1172
1446	por ce qu’il la refusa, 	por chou quil le refusa, 	1173
1447	tot ce vos trespassera li contes ci endroit 	out ce vous trespassera li contes |chi endroit 	1174|1175
1448	por deviser une aventure 	pour deuiser vne autre auenture	1176
1449	qu’il lor avint el paveillon 	qui lor auint el pauellon 	1177
1450	ou il estoient. 	ensi com vous orres. 	1178
1451	Ci dist li contes 	ANsi entendi la damoisele 	1179
1452|1453	que, quant il orent le secont mes eu, |es vos un chevalier armé d’unes armes vermeilles 	a regarder lancelot 	1180
1454	qui vint corant par devant le paveillon o grant compaignie de chevaliers. 	que onques ne manga |Et tant que on dut seruir du secont mes : 	1181|1182
1455	Et cil as armes vermeilles 	Et quant il orent le secont mes es vous. j. cheualier arme dunes armes uermeilles 	1183
1456	qui devant venoit entre el paveillon a 	qui vint corant par deuant le paueillon 	1184
1457	et voit. I. escuier 	et vit el paueillon. j. escuier 	1185
1458	qui servoit a la table, 	qui seruoit a la table 	1186
1459	si estoit freres al chevalier de laiens. 	qui estoit freres au cheualier de laiens. 	1187
1460	Et il cort maintenant cele part, 	Et il cort mainte nant 	1188
1461	si le prent par les espaules 	si le prent par les espaulles 	1189
1462	et le lieve devant lui sor l’arçon de la sele, 	et le met par deuant lui sor le col de son cheual. 	1190
1463	si s’en torne a tot. 	si sen torne a tout. 	1191
1464	Et quant cil del paveillon voit ce. 	Et quant li cheualiers del paueillon vit chou 	1192
1465|1466	si crie a Lancelot: « |Ha, 	si crie a lancelot. 	1193
1467	bials sire, 		
1468|1469	je sui mors, |se cil enporte ensi mon frere, 	Sire iou sui mors sil emporte ensi mon frere. 	1194
1470|1471	kar il l’ocirra, |s’il n’est secors: 	quar il locirra sil nest secorus 	1195
1472	si vos pri por Dieu 	Si vous pri pour dieu 	1196
1473	que vos i metés paine. » 	que vous metes paine en lui rescorre. 	1197
1474	Et Lancelos saut de la table 	Lors saut maintenant lancelot doutre la table. 	1198
1475	et demande ses armes, 	si demande ses armes 	1199
1476	et I. escuiers vint avant, 	Et vns escuiers vint a lui. 	1200
1477|1478	si li dist : « |Par foi, 	si li dist Par foy 	1201
1479|1480	sire, |vos armes et vostre cheval enmainent il ! 	sire vos armes et vostre cheual enmainent il 	1202
1481|1482	— |Voire, 	voire fait il : 	1203
1483|1484	fet il. par mon chief, |ja por ce ne remaindra 	par mon chief por chou ne remandra il mie 	1204
1485	que je nes sieve.» 	que ams iou ne lez sieue. 	1205
1486	Lors vient fors del paveillon 	Et lors sen ist hors del paueillon. 	1206
1487	et li chevaliers o lui 	et li cheualiers aueques lui. 	1207
1488	et il esgarde cels 	et il regarde chiaus 	1208
1489	qui s’en vont 	qui sen vont 	1209
1490	qui ja avoient passé l’eve par J. pont de fust; 	qui auoient passe laigue par. j. pont de fust. 	1210
1491|1492	et Lancelos demande al chevalier |s’il remaindra. « 	Et lancelot demande au cheualier sil remandra 	1211
1493	Sire, 		
1494	fet il, 		
1495|1496	nenil, |ains vos ferai compaignie 	Sire fait il nenil ains vous tendrai compaignie 	1212
1497	tant que nos aions trové 	tant que vous aies troue 	1213
1498	qui armes vos baut. » 	qui armes vous volsist baillier. 	1214
1499|1500	Lors acueillent lor voie tot a pié |et vienent au pont, 	Lors acoillent lor chemin droit au pont 	1215
1501	si passent outre 	et passent outre. 	1216
1502	et s’adrecent a I. tertre 	Et sadrecent a vn tertre 	1217
1503	par ou li chevalier s’en vont; 	par ou li cheualier vont. 	1218
1504	si n’ont gaires alé 	Si nont gaires ale 	1219
1505	quant il encontrent I. chevalier armé d’unes armes noires 	quant il ont encontre. j. cheualier a vnes armes noires 	1220
1506	qui venoit al pont par I. chemin de travers. 	qui venoit au pont par. j. Chemin de trauers. 	1221
1507	Et quant il voit Lancelot, 	Et quant il vit lancelot si sarreste por chou 	1222
1508	si s’areste por ce que bien le conoissoit, 	quil le connut bien.	1223
1509	si li demande 	Si li demande 	1224
1510|1511	ou il vet |ensi a pié tos desammés. « 	ou il aloit ensi tout a pie et desarmes. 	1225
1512|1513	Qui estes vos, |sire chevaliers, 	Qui estes vous fait lancelot 	1226
1514	fet Lancelos, 		
1515|1516	qui me demandés |ou je vois ? — 	qui me demandes ou ie vois. 	1227
1517	Je sui, 		
1518|1519	fet il, |I. chevaliers d’estrange païs, 	Iou sui fait il vns cheualiers destrange pais 	1228
1520	mais molt me merveil 	qui moult mesmerueil de chou 	1229
1521	de ce que je vos voi ensi aler. » 	que iou vous voi ensi aler. 	1230
1522	Et Lancelos li conte 	Et lancelot li conte 	1231
1523	comment il estoit herbergiés 	comment il estoit herbergies. 	1232
1524	et comment I. chevaliers vint laiens 		
1525	ou il menjoit, 		
1526	qui prist a force I. vaslet 		
1527	et le mist sor le col de son cheval. « 		
1528	Et encore m’a il plus meffet, 		
1529	fet Lancelos, 		
1530|1531	kar cil qui avec lui vindrent enporterent mes armes |et enmenerent mon cheval. 	et comment li valles fu pris et sez armes et ses cheuals emportees. 	1233
1532	— 		
1533|1534	Quel guerredon, |fet cil, 	Quel guerredon fait cil porroie iou de vous atendre : 	1234
1535	porroie je atendre de vos, 		
1536|1537	se je |por vos me desarmoie 	se ie por vous me desarmoie 	1235
1538|1539	et vos bailloie mes armes et mon cheval ? |— 	et vous bailloie mes armes et mon cheual. 	1236
1540|1541	Certes, |fet Lancelos, 	Certes fait lancelot 	1237
1542|1543	tel com vos deviseriés. |— 	tel comme vous deuiseres. 	1238
1544	Se vos, 		
1545|1546	fet il, |el premier lieu 	Se vous fait cil el premier lieu 	1239
1547|1548	ou je vos troverai armé, |por que je soie desarmés, 	ou iou vous trouerai arme me creantissies a baillier vos armes 	1240
1549	me creantés a doner vos armes » 		
1550|1551	Ie vos bailleroie les moies. |— 	Iou vous bailleroie lez moies 	1241
1552|1553	Certes, |fet Lancelos, 	Certes fait lancelot volentiers par ensi 	1242
1554|1555	si ferai je, |por que vos ne me truisiés combatant. » 	que vous ne me truisies combatant. 	1243
1556	Et cil descent maintenant, 	Et cil descent maintenant 	1244
1557	si se desarme 	si se desarme 	1245
1558	et baille a Lancelot tot son hernois, 	et baille a lancelot tout son harnois. 	1246
1559	et il s’en appareille 	Et il sen appareille tout maintenant 	1247
1560	et monte en son cheval, 	et monte sor le cheual 	1248
1561	puis dist a son oste 	et dist a son oste 	1249
1562	qu’il s’en retort; 		
1563	Imes il dist 		
1564|1565	que non fera. « |Si ferois, 	quil sen retort 	1250
1566|1567	fet Lancelos a lar |je conoistrai bien les armes a celui 	quar iou connistera bien lez armes a celui 	1251
1568	que je vois querant en quelque lieu je les truisse. 	qui iou vois querant. 	1252
1569	Et cil dist, 	Etr cil dist 	1253
		que dont sen retornera il 	1254
1570	puis qu’il velt, 	puis quil le veult. 	1255
1571	s’en retornera: 	Si sen retorne atant 	1256
1572	si s’en vet et enmaine o lui le chevalier 	et enmaine |aueques lui le cheualier 	1257|1258
1573|1574	qui molt est liés |de ce que Lancelos li doit I. guerredon. 	qui moult est lies de ce que lancelot! doit. j. guerredon. 	1259
1575	Et Lancelos aquelt son chemin aprés cels 	Et lancelot si acuelle son chemin 	1260
1576	que ? il sieut 	por aler apres chiaus quil sieut. 	1261
1577	tant qu’il est venus el tertre en haut 	Tant quil est uenus el tertre en haut. 	1262
1578|1579	et lors voit devant lui la forest |que l’en apele la forest des Trois Perilx, 	Et lors uoit deuant lui la forest dez. iij. perieus:. 	1263
1580	et ce por quoi ele fu ensi apelee devisera bien li contes ça avant. 	Et chou porcoi elle est |ensi apelee deuisera bien li contes cha auant. 	1264|1265
1581	Quant il fu amont el tertre, 	Quant lancelot fu amont el tertre 	1266
1582	si esgarde devant lui, 	si regarda deuant lui 	1267
1583	mais il ne voit nul de cels 	mais il ni uit nul de ceaus 	1268
1584	que il queroit, 	que il queroit 	1269
1585	kar il s’estoient ja ferus en la forest. 	quar il sestoient ia feru en la forest. 	1270
1586	Et totes voies sieut il les esclos des chevals 	Et toutes voies sieut il lez esclos dez cheuaus 	1271
1587	tant que il vient a l’entree de la forest; 	tant quil est uenus a lentree de la ; forest. 	1272
1588	et lors encontre une damoisele tote chenue 	Et lors encontra vne damoisele toute kenue 	1273
1589|1590	qui chevalchoit molt cointement |et estoit tote deslie, 	qui cheualchoit moult noblement. 	1274
1591|1592	ses treces par ses espaules |comme pucele 	et auoit sez treches toutes desloies par sez espaulles comme pucele. 	1275
1593	et avoit en son chief l. chapel de roses, 	Et auoit en son chief chapel de roses 	1276
1594	kar c’estoit entor la Saint Johan. 	quar ce estoit entor la saint iehan : 	1277
1595	Il le salue 	Il le salue maintenant quil la uit. 	1278
1596	et ele li dist 	Et elle dist 	1279
1597|1598	que bone aventure li doinst Diex. « |Damoisele, 	que diex li donnast boine auenture. 	1280
1599|1600	fet il, |me savriés vos a dire 	Damsolisele fait sil me sauries vous enseignier 	1281
1601|1602	quel part uns chevaliers o unes armes vermeilles |s’en vet ? 	quel part vns cheualiers sen uait 	1282
1603	— 	qui porte vnes armes uermeilles. 	1283
1604|1605	En non Diex, |fet ele, 	Enon dieu fait elle iou 	1284
1606|1607	je le vos enseigneroie bien, |se je voloie. 	le vous enseigneroie bien se iou voloie. 	1285
1608	— 		
1609|1610	Dites le moi, |fet il, 	Dites le moi fait il par tel couuent 	1286
1611	par covent 		
1612|1613	que je soie vostre chevaliers el premier lieu |ou vos me requerrois. 	que iou soie vos cheualiers el premier lieu ou vous me requerres. 	1287
1614	— 		
1615|1616	Se vos me creantés, |fet ele, 	Se vous me creantes fait elle 	1288
1617|1618	que vos me sievrois |de quel hore 	que vous me sieurres el premier lieu 	1289
1619	que vos en semoigne, 	ou iou vous en semondrai. 	1290
1620	je le vos enseignerai. »	iou le vous enseignerai. 	1291
1621	Et cil li creante, 	Et il li creante maintenant : |dont il fu puis corocies 	1292|1293
1622|1623	dont il se repenti puis molt durement tel hore fu. « |Or alés, 	et moult se repenti tele heure fu. 	1294
1624|1625	fet ele, |tot cest chemin», 	Ore ales fait elle tout chest chemin 	1295
1626	si li mostre I. sentier estroit 	si li moustre. j. sentier estroit 	1296
1627	qui aloit al travers de la forest. « 	qui aloit dentrauers la forest. 	1297
1628|1629	Si ne tornés, |fet ele, 	si ne tornes nulle part. 	1298
1630|1631	de nule part |et quant vos avrois alé entor demie lieue, 	Et quant vous aures erre demie lieue. 	1299
1632	si verrois delés I. vivier trois paveillons tendus. 	si troueres. iiij. pauellons sor. j. uiuier tendus. 	1300
1633	La dedens troverois le chevalier 	et la dedens troueres le cheualier 	1301
1634	que vos querés 	que vous queres 	1302
1635	que l’en apele Arramant le Gros; 	que on apele atramant le gros. 	1303
1636	si le conoistrois a ces enseignes 	si le connistres a ces enseignes 	1304
1637	qu’il a en mi le front II. plaies. 	quil a en mi le front. ij. plaies. 	1305
1638	Or vos en poés aler, 	Or vous en poes aler fait elle 	1306
1639	mais que vos m’aiés dit vostre nom. » 	mais que vous me dites vostre non. 	1307
1640	Et il se nome molt a envis 	Et il se nomme moult a enuis. 	1308
1641	et totes voies li dist 	mais toutes voies li dist 	1309
1642	qu’il a non Lancelot del Lac. « 	il quil a a non lancelot del lac. 	1310
1643	Alez a Dieu », 		
1644	fet ele. 		
1645	Atant s’en part et s’en vet tot le chemin 	A tant sen uait lancelot tout le chemin 	1311
1646	qu’ele li avoit enseigné, 	que elle li ot enseignie. 	1312
1647	si grant aleure 	si grant aleure 	1313
1648	com il plus puet del cheval traire, 	comme il puet del cheual traire. 	1314
1649|1650	tant que il atainst les chevaliers |que il sievoit. 	tant quil ataint lez cheualiers as quil sieuoit. 	1315
1651	Et cil lor i escrie si haut 	si lor escrie si haut 	1316
1652	que bien porent oîr, 	que tout le porent bien oir. 	1317
1653	et maintenant li vient acorant li uns d’eus, 	Et maintenant li vint a lencontre 	1318
1654|1655	l’escu al col, |le lance el poing, 	li vns daus a cheual lescu au col la lance el poing 	1319
1656	et fu armés de totes armes. 	et fu bien armes de toutes armes. 	1320
1657	Et Lancelos le fiert 	Et lancelot le fiert si durement. 	1321
1658	si que pour le hauberc ne remaint 	que por le hauberc ne remaint il mie 	1322
1659	qu’il ne li met par mi le cors le fer del glaive 	quil ne li mete parmi le cors le fer del glaiue. 	1323
1660|1661	si l’empaint bien |com cil 	si lempaint bien comme cil 	1324
1662	qui assés ot et cuer et force: 	qui ot asses cuer et force. 	1325
1663	si le porte del cheval a terre 	si le porte del cheual a terre. 	1326
1664	et retrait son glaive a lui; 	puis traist son glaiue a soi. 	1327
1665	si voit I. autre venir tot appareillié de joster 	si en reuoit vn autre venir tout apreste de iouster. 	1328
1666|1667	et il nel refuse pas, |ains li torne le chief del cheval, 	et il li torne le cheual. 	1329
1668	et cil qui vint acorant li done tel cop en l’escu 	et cil qui uenoit acorant li donne tel cop sor son escu 	1330
1669	que tote sa lance vole en pieces. 	que sa lance vole em pieces. 	1331
1670|1671	Et Lancelos, |qui un poi porta sa lance bas. 	Et il aporte la soie j. poi plus bas 	1332
1672	l'ataint par desus l’arcon de la sele, 		
1673	si le fiert si	si le fiert si durement 	1333
1674	que les mailes del hauberc ne pueent soffrir le grant cop 	que lez mailles del hauberc ne porent soffrir le cop. 	1334
1675	que li glaives ne li voist par mi le cors 	que li glaiues ne li voist parmi le cors. 	1335
1676	si que li fers pert d’autre part; 	si quil pert de lautre part. 	1336
1677	si l’empainst si durement 	Et il lempaint si durement 	1337
1678	qu’il le porte a terre et lui et le cheval. 	quil porte lui et le cheual a terre tout en. j. mont. 	1338
1679	Et lors dient cil 	Lors dient cil 	1339
1680	qui devant s’en aloient 	qui deuant sen uont 	1340
1681	que molt joste bien li chevaliers, 	que bien iouste li cheualiers 	1341
1682	quant. Il. de lor meillors compaignons a ensi abatus. 	qui. ij . de lor compaignons a abatus. 	1342
1683	Et Lancelos laisse corre a els tos 	Et lancelot laisse corre a 	1343
1684	qui encore estoient nuef; 	aus tous quencore estoient. xij. 	1344
1685	si ot l’espee traite, 	Si trait lespee 	1345
1686	por ce que ses glaives estoit brisiés al chevalier 	quar ses glaiues iert brisies au cheualier 	1346
1687	qu’il ot derrainement abatu ; 	quil auoit daarrainement abatu. 	1347
1688|1689	si lor detrenche lor escus|et lor depiece lor hialmes 	Si lor detrence escus et lor pechoie heaumes. 	1348
1690	et lor ront les haubers sor les bras et sor les espaules; 	et derront haubers. 	1349
1691	si fet tant par sa proesce 	si fait tant par sa proece 	1350
1692	que tuit cil 	que tuit cil 	1351
1693	qui le voient s’en merveillent. 	qui Ie voient sen esmerueillent. 	1352
1694	Et la ou il voit le chevalier as armes vermeilles, 	Et la ou il voit le cheualier as armes uermeilles 	1353
1695	si nel mesconoist pas, 	si ne le mesconnut mie 	1354
1696	ains li adresce par mi els tos 	ains li adrece le cheual parmi euls tous. 	1355
