877|878	fet ele, |que cil est venus 	si sera quar cil est uenus 	696
879	qui l’en ostera. 	qui len ostera 	697
880|881	Et se vos le contredites, |vos en morrois tuit: 	Et se vous le contredites vous en morres tout. 	698
882	por ce vos vendroit il miels 	Et por chou vous uenist il miex. 	699
883	que vos le laississiés atant, 	que vous le laississies 	700
884	ains que vos vos en façois ocirre. » 	atant enmener lque uous vous en feissies ocirre. 	701
885	Et cil dient 	Et cill dient 	702
886	que ja tant com il soient vif 	que ia tant comme il soient vif : 	703
887	n’en sera portés. « 	nen sera portes. 	704
888|889	Et bien sache, |font il, 	Et bien sache font il li cheualiers 	705
890	li chevaliers 		
891|892	qui venus est |por avoir le, 	qui uenus est pour sauoir 	706
893	que s’il estoit encore plus preus 	quel sil estoit plus preu encore 	707
894	que Lancelos n’est, 	que la lancelot ne soit. 	708
895|896	si n’en menra il point. |— 	si ne lenmenroit il point 	709
897|898	Or verrons, |fet ele, 	Or uerrois fait elle 	710
899	comment il vos en avendra. » 	comment il vous en lauenra. 	711
900|901	A ces paroles |vint laiens Lancelos tos armés 	ces paroles uient laiens lancelot tous armes 	712
902	et quant li chevalier le voient venir, 	Et quant li cheualier le uoient uenir 	713
903	si li demandent 	si li denandent 	714
904|905	qu’il velt fere. « |Je vueil, 	que il ueullt. 	715
906|907	fet il, |avoir le cors 	ie ueul fait il auoir le cors 	716
908|909	qui laiens est. |— 	qui llaiens est. 	717
910	Par foi, 		
911|912	font il, |vos ne l’avrois mie 	Par foi font il vous ne laures mie 	718
913|914	por nient. |Nos ¡ morrons ançois tuit 	pour noient nous y morrons 	719
915|916	que vos l’enportois. |— 	aincois que vous lenportes. 	720
917|918	A morir, |fet il, 	Au morir fait il estes vous tout uenu 	721
919|920	en estes donc tuit, |puis que a mains ne vos en volés soffrir !» 	puis que a mainz nen voles passer. 	722
921	Si saut dedens les prones 	Cil sont dedens les prones. 	723
922	et il li corent sus, 	et il lor cort sus maintenant. 	724
923	kar arrieres le cuident fere sailir 	Et cil a lui quar arriere le quiderent faire flatir 	725
924	por poor de morir; 	pour paor de morir. 	726
925	si le fierent par la 	si le fierent la 	727
926	ou il le pueent ataindre 	ou il le porent ataindre. 	728
927	et il ot el poing l’espee nue ; 	Et il auoit en la main lespee toute nue. 	729
928	si lor done grans cops et pesans 	si lor doune grans cops et pesans. 	730
929|930	et fiert le premier |qu’il encontre si durement 	Et fiert si le premier quil encontre 	731
931	que por le hialme ne por la coife de fer ne remaint 	que por coiffe ne pour heaume ne remainst 	732
932	qu’il ne li mete l’espee jusqu’al test; 	que il ne li mete lespee iusques au tesstje. 	733
933	et il le hurte de soi, 	Et il le hurte 	734
934	Si l’abat a terre. 	si labat a terre. 	735
935	Et lors saillent molt irieement tuit li autre, 	Et li autre as lassalent moult ireement. 	736
936	si depiecent son escu et son hialme et son hauberc et le blecent en pluisors lieus. 	et le fierent sor son heaume et sor son hauberc. |si quil li derrompent en pluisours lieus. 	737|738
937	Mais il ne li chaut de rien 	Mais il ne li chaut de chose 	739
938	qu’il li facent, 	quil li fachent. 	740
939	kar tant est dolens 	quar tant est dolans 	741
940	que nus plus; 	que nus plus. 	742
941	si lor laisse corre par grant ire 	si lor laisse corre par grant ire 	743
942|943	et lor done de l’espee |si grans cops 	lor donne de lespee grans cops 	744
944	que tos les fet guenchir avant lui. 	si que tous les fait guenchir deuant lui. 	745
945	Et lors esgarde celui des IllI. 	lors esgarde |et voit vn dez. iiij. 	746|747
946	qui plus li faisoit mal 	qui plus li fait mal a son essient. 	748
947|948	et cil estoit molt grans et molt fors; |et Lancelos 	Et il estoit moult grans et moult fors. et lancelos 	749
949	qui le vient ataignant li done par mi le hialme si grant cop 	qui le vient ataignant li donne sor le heaume tel cop 	750
950	qu’il en fet le feu saillir, 	quil en fait le fu saillir. 	751
951	et l’espee glace 	et lespee glache 	752
952	qui de droit ne fu pas ferue. 	qui ne fu mie de droit ferue. 	753
953	si descent desus la senestre espaule. Li cops fu grans et par ire ferus, 	si descent sor la droite espaulle au cheualier. |si que li bras kai a tout lespee sor le pauement. 	754|755
954	et bien i parut 	Et cil trebuche a terre 	756
955	que l’espee cola par mi l’espaule a al chevalier, 	qui se pasme de langoisse 	757
956	si que li bras a tote l’espaule chiet desus le pavement. 	quil sent. 	758
957	Et lors sont molt esmaié li autre troi, 	Et lors sont moult esmaie li autre troi. 	759
958	si font molt malvés samblant d’els deffendre 	et font moult maluais samblant daus desfendre 	760
959	por le grant cop 	pour le grant cop 	761
960	qu’il ont veu et por l’espee 	quil ont veu. |et pour lespee 	762|763
961|962	que chescuns d’els a ja sentie jusqu’al sanc. |Et Lancelos lor cort sus et en fiert I. 	que cascuns de euls a sentue iusques au sanc. Et lancelot 	764
963	el hialme 	qui pas ne se recroit en fiert vn amont sor le heaume. 	765
964|965	si qu’il le fet flatir a terre |d’ambesdeus les paumes. 	quil le fait flatir a terre dambes. ij. lez paumes. 	766
966	Et quant li autre dui voient ce, 	Et quant li autre doi voient chou. 	767
967	si tornent en fuies vers l’uis a garison; 	si tornent en fuies. 	768
968	et Lancelos vint ataignant le deerrain, 	Et lancelot ataint le daarrain 	769
969	si le fiert par entre l’escu et le bras 	si le fiert par entre se lescu et le col. 	770
970	si qu’il li trenche le poing 	Si quil li trenche le bras 	771
971	et li escus chiet a terre, 	et li escus chiet a terre. 	772
972	et cil torne en fuies 	Et cil torne en fuies 	773
973	qui maheignié se sent. 	qui mahaignies se sent. 	774
974	Et Lancelos vient a l’autre 	Et lancelot reuient a lautre 	775
975	qui ja se relevoit, 	qui ia se releuoit. 	776
976	sel fiert de l’espee si grant cop 	si li donne si grant cop 	777
977	qu’il li fet le hialme voler en la place. 	que il li fait voler le heaume de la teste en le place. 	778
978	Et quant cil sent son chief nu, 	Et|quant il sent son chief descouuert. 	779|780
979	si cria merci 	si li crie merci 	781
980	et dist 	et dist 	782
981	qu’il ne l’ocie pas, 	quil ne lochie mie 	783
982	kar il est pres de sa volenté fere. « 	quar il est prest de sa volente faire. 	784
983	Or te covient donc, 	Lors te couuient 	785
984	fet Lancelos, 	dont fai lancelot afiancer 	786
985	fiancer 	fait il 	787
986	que tu le cors mon seignor Galehout conduiras a la Dolerose Garde 	que tu le cors monseignor Galeholt conduiras a la ioieuse garde 	788
987	et iluec le feras garder 	Et y soies 	789
988	tant que je i viegne; 	tant que iou y uiengne. 	790
989	et se l’en te demande 	Et se on te demande 	791
990	qui t’i envoie, 	qui ti envoie. 	792
991	si diras « 	Si di |que cil ti envoie 	793|794
992	cil qui ot les ames blanches le jor que li chastials fu conquis. » 	qui ot lez blanches armes le iour |que li castiaus fu conquis 	795|796
993	Et il li fiance 	Et cil li fiance 	797
994	que tot ensi le fera il. 	que ensi le fera il AN tel maniere 	798
		com vous oies conquist lancelot le cors Galeholt.	799
995	Lors prent Lancelos la lame par le plus gros chief, 	Et lors y quant il ot au cheualier fait fianchier a faire sa volente. |si prent le lame par le gros chief. 	800|801
996	si tire de grant force 	si le tire par si grant force. 	802
997|998	qu’a pou |qu’il ne se deront tos, 	que a poi quil ne sest tous derrompus. 	803
999	si que li sans li vole par mi le nes et par mi la boche 	Si que li sans vole parmi le nes. et parmi la bouche 	804
1000	et li cors li sue d’anguoisse. 	Et li cors li tressue de langoisse 	805
1001|1002	Mais por tote la destrece ne remaint |qu’il n’ait la tombe levee en haut à; 	que il en a. 	806
1003	mes nule dolors 	Mais nulle dolors 	807
1004	qu’il eust onques ne monte rien a cele dolor 	quil ait eue ne monte riens a celi 	808
1005	qu’il ot, 	quil ot 	809
1006	quant il vit le cors Galehout tot ensi armé 	quant il vit le cors Galeholt arme tout 	810
1007	com il estoit; 	ensi com il estoit. 	811
1008	si trova s’espee delés lui 	Si troua lespee deles lui 	812
1009|1010	qui molt estoit et bone et clere; |et sans faille de l’espee meesmes 	qui tant estoit bele et boine et sans faille de lespee se fust il ocis 	813
1011	se fust il ocis, 	se la damoisele ne li eust desfendu 	814
1012	se la damoisele ne li eust tolue erraument. 	quar elle li osta lespee de sez mains. 	815
1013	Lors fist Lancelos une biere fere de fust 	Lors fist lancelot vne biere de fust. 	816
1014	et la fist covrir des plus riches pailes de laiens, 	et le fist courir del plus riche paile de laiens 	817
1015|1016	et quant il l’ot atornee al plus richement |qu’il pot, 	Et quant il lot atorne au plus richement quil pot. 	818
1017	li chevaliers prisons li dist: « 	si li dist li cheualiers |qui le deuoit mener, 	819|820
1018|1019	Sire, |fet il, 	Sire fait il. 	821
1020	se l’en movoit tot de nuis, 	che seroit boin. |que nous mouissons de nuit. 	822|823
1021	ce seroit sens. — 	pourcoi fait lancelot. 	824
1022|1023	Por quoi ? |fet il. — 	pour chou fait il 	825
1024	Por ce que, se li chevalier de cest païs savoient 	que se li cheualier de chest pais le sauoient 	826
1025	que l’en len deust porter, 	que on len deust emporter. 	827
1026	il feroient gaitier les trespas 	il feroient gaitier lez trespas 	828
1027	si qu’il seroit arestés en alcun lieu ; 	Si quil seroit arrestes en aucun lieu. 	829
1028	et por ce vos loeroie je qu’il meust orendroit, 	Et pour chou vous loeroie iou |quil meust orendroit. 	830|831
1029	kar il seroit bien eslongiés, 	Car il seroit eslongies. 	832
1030	ains qu’il fust jors, XX. lieues englesches. 	X. lieues |ains quil fust iors. 	833|834
1031	Et il s’i acorde bien; 	Et il si acorde bien. 	835
1032	si met la litiere sor Il. palefrois amblans 	si fait mettre le litiere sor. ij. palefrois. 	836
1033	et enportent ensi Galehout fors de sa region; 	Et emportent ensi Galeholt hors de la maison 	837
1034	si en font li frere grant duel et molt en sont corocié et dolenta 	Si en ont li frere grant doel 	838
1035	de ce que l’en l’enporte. 	de ce que on lemporte. 	839
1036|1037	Et Lancelos le convoie grant piece de nuis, |plorant et regretant sa proesce et sa valor 	Et lancelot le conuoie grant piece de la nuit plaignant et plorant sa valour. 	840
1038	et se ne fust la damoisele 	Et se ne fust la damoisele 	841
1039	qui avec lui estoit molt 	qui auec lui estoit. 	842
1040|1041	en eust plus fet |qu’il ne fist, 	moult en eust plus fait. 	843
1042	mais ele l’en detorna, 	mais cele len destorna. 	844
1043	et il deffendi al chevalier 	Et il commanda au cheualier 	845
1044|1045	que il nel feist en terre metre |devant que il fust venus. 	quil ne fust enterres deuant chou quil venist a lui. 	846
1046	Si se part atant li uns de l’autre 	A tant sen part de lui lancelot 	847
1047	et il retorne a l’abeie, 	et retorne a labbaye 	848
1048	si se couche, 	si se couche 	849
1049	c’onques la nuit ne volt mengier ne boivre por chose 	Ne onques la nuit ne volt mangier ne boire pour chose 	850
1050	que l’en li deist, 	que on li deist. 	851
1051	ains plora et dolosa tot adés; 	ains ploret dolosa tout ades. 	852
1052	si li anuioit molt li jors 	Si li anoia moult li iors 	853
1053	qui tant demoroit a venir. 	qui tant demoroit : 	854
1054	a Al matin, 	Et au matin 	855
1055	si tost com li jors aparut, 	si tost com li iors apparut. 	856
1056	se leva et oi messe entre lui et la damoisele 	se leua et oy messe entre lui et la damoisele. 	857
1057|1058	et puis s’arma. |Lors » li dist ele les noveles de Boort 	lors li dist elle lez noueles de bohort. 	858
1059	et ce qu’ele en avoit veu devant Honguefort, 	comment elle lauoit veu deuant hongrefort 	859
1060	et il en fu molt liés. 	et il en fu moult lies. 	860
1061	Et ele li dist: « 	Et elle li dist. 	861
1062|1063	Sire, |il vos vet querant ne jamés ne finera tant 	Sire il vous ua querant. 	862
1064|1065	qu’il vos avra trové. |— 	ne iamais ne finera deuant ce quil vous aura trouue. 	863
1066|1067	Damoisele, |fet il, 	Damoisele fait lancelot 	864
1068	se vos le cuidiés trover ains de moi, 	se vous le quidies auant trouuer de moi. 	865
1069	je vos voldroie proier 	iou vous voldroie proier 	866
1070	que vos feissiés tant por moi 		
1071	que vos li portissiés ceste espee 	que vous li portissies ceste espee 	867
1072	qui fu mon seignor Galehout, 	qui fu monseignor Galeholt, 	868
1073	et li dites 	Et li dites 	869
1074	qu’il la DOrt de par moi, 	quil le port de par moi. 	870
1075	que molt est bone. » 	quar elle est moult bone et moult bele. 	871
1076	Et ele dist 	elle dist 	872
1077	qu’ele le trovera par tens 	que elle le trouuera bien par tamps 	873
1078	et bien fera cest message; 	et bien fera ce dist cest message. 	874
1079	si s’en part atant de lui 	Si sen part atant de lui. 	875
1080	et il s’en vet droit vers le chastel de Floego, 	Et il sen vait uers le castel de florega. 	876
1081	si i vint a hore de prime. 	Si y uin entor prime. 	877
1082	Et il esgarde es pres defors la vile, 	Et il regarde en mi lez pres dehors la vile 	878
1083	si voit molt grant gent entor le feu 	Si vit moult grant gent entor vn fu. 	879
1084	ou l’en devoit ardoir la suer Meleagan», 	ou on deuoit ardoir le suer melyagant, 	880
1085	et quant il aperçoit le feu, 		
1086	si a poor de la damoisele. Lors broche le cheval 		
1087|1088	et vint errant cele part |tant com il puet del cheval traire. 	CNuant lancelot aperchut le fu 	881
1089|1090	Et quant il est venus jusque la, |si esgarde et voit la damoisele 	si ot moult grant paour de la damoisele 	882
1091	qui ja estoit amenee al feu por destruire, 	qui y ia estoit menee au fu pour destruire. 	883
1092	si estoit en pure sa chemise 	Si estoit en vne poure chemise 	884
1093	et le tenoient. VI. pautonier, trois d’une part et trois d’autre; 	et le tenoient. vi. pautonnier. iij. dune part. et. iij. dautre. 	885
1094	si n’atendoient a geter le el feu 	Si natendoient a geter le el fu 	886
1095	fors le commandement as juges, 	fors le commandement as iuges 	887
1096	et ele ploroit trop durement 	et elle ploroit moult tendrement 	888
1097	et regretoit Lancelot: « 	et regretoit lancelot 	889
1098	Ha, 	et disoit ha : 	890
1099	gentilx chevaliers Lancelos, 	gentiex hom lancelot 	891
1100	kar pleust ore a nostre Salveor 	quar pleust ore a dieu 	892
1101	que vos seuissiés ceste novele, 	que vous seussies ceste nouele 	893
1102	si fuissiés pres de ci a demie lieue! 	et puis vous fuissies |chi a demie lieue. 	894|895
1103|1104	Certes a l’aide de Dieu et de la vostre seroie je encore anuit rescosse malgré tos mes enemis. |Mais vos ne le savés pas a, 	Certes a laide de dieu et de la uostre fuisse iou encore anuit rescousse malgre mes anemis 	896
1105	si me covendra ore morir 	si men conuendra ore a morir 	897
1106	por la vie 	pour la vie 	898
1107	que je vos sauvai emprés Dieu; 	que iou vous saluai apres dieu. 	899
1108|1109	mais certes il ne m’en poise pas tant |por moi 	Mais il ne me poise mie tant pour moi 	900
1110|1111	com il fet |por le coros 	comme il fait pour le corous 	901
1112	que vos en avrois, 	que vous en aures 	902
1113	quant vos le savrois. 	quant vous saures ma mort. 	903
1114	Mais ce me reconforte molt 	Mais ce me conforte moult 	904
1115	que je sai bien 		
1116	que les damoiseles gaaigneront tant en ma mort 	que les puceles gaaigneront en ma mort. 	905
1117	que jamés nule ne vos requerra d’aide 	quar iamais nulle ne vous requerra dayde 	906
1118	que vos li faillois 	que vous ne li aidies 	907
1119	tant com il vos remenbre de moi, 	tant comme il vous sousuiegne de moi. 	908
1120	kar vostre cuers est si frans 	Car vostre cuers est si grans 	909
1121	qu’il ne puet estre sans trop grant merites rendre a totes celes 	quil ne puet estre |sans grant merite rendre a toutes celes 	910|911
1122	qui de par moi se reclaiment: 	qui de par moi vous reclameront 	912
1123	si m’est avis 	Si mest auis 	913
1124	qu’il m’est molt miels a m’ame de morir 	que il mest moult miex a lame 	914
1125	por loialté fere et por geter de prison 	pour la loiaute faire |et pour geter de prison 	915|916
1126	si vaillant home 	si uaillant homme 	917
1127	comme vos 	comme vous estes. 	918
1128	que vos fuissiés mors par la desloialté de Meleagan 	que vous fuissies mors |pour la desloiaute melyagant 	919|920
1129	qui en prison vos avoit mis par traïson. » 	qui en prison vous auoit mis. 	921
1130	Ensi disoit la damoisele molt tendrement plorant 	ANsi disoit la damoisele moult tenrement plorant. 	922
1131	et lors vint Lancelos poignant cele part 	Et lancelot vint durement poignant la 	923
1132	ou il la vit: 	ou il le vit ester. 	924
1133	si dist a cels 	Si dist a chiaus 	925
1134	qui le tenoient: « 	qui le tenoient. 	926
1135|1136	Laissiés la damoisele! — |Por quoi, 	Laissies ester la damoisele laissies. 	927
1137|1138	sire, |fet J. chevaliers armés 	pourcoi fait vns cheualiers armes 	928
1139|1140	qui avant saut, |le lairons nos ? 	qui auant saut le lairoit on. 	929
1141	— 		
1142|1143	Por ce, |fet il, 	pour chou fait il 	930
1144|1145	que vos n’avés droit en li |por fere mal. 	que vous naues droit de li faire morir. 	931
1146	— 		
1147|1148	Si avons, |fet cil, si grant 	Si auons fait cil si grant 	932
1149	que nos l’avons atainte de murdre 	que nous lauons atainte de murdre. 	933
1150	dont je l’apelai, 	dont iou lapelai 	934
1151	et ele s’en offri a deffendre, 	et elle sen offri a desfendre. 	935
1152	mais ele ne trova onques 	mais elle ne trouua onques 	936
1153	qui por li en prist escu 	qui zs escu en portast por li. 	937
1154	et ce n’est pas merveille, 	Et chou nest mie de meruelle. 	938
1155	que chescuns set bien 	quar cascuns set bien 	939
1156	quele en a desloialment ovré. 	que elle a desloiaument oure. 	940
1157|1158	— De quoi ? |fet Lancelos. 	De coi fait lancelot. 	941
1159|1160	— |De ce, 	De chou fait cil 	942
1161|1162	fet il, |qu’ele delivra Lancelot 	que elle deliura lancelot de prison. 	943
1163	por Meleagan ocirre, son frere. 	por ocirre melyagant son frere. 	944
1164|1165	— Se vos, |fet Lancelos, 	Se vous fait lancelot voles moustrer 	945
1166|1167	osiés mostrer |qu’ele eust fet traïson ne murdre, 	que elle ait fait traison et murdre. 	946
1168|1169	je seroie pres del deffendre. |— 	de che seroie iou tous pres de la desfendre 	947
1170|1171	Qui estes vos? |fet cil. — 	Qui estes vous fait cil. 	948
1172|1173	Uns chevaliers sui, |fet Lancelos, 	Iou sui vns cheualiers fait lancelot 	949
1174|1175	qui vieng ceste part |por ceste damoisele deffendre. 	qui chi sui venus por rescorre ceste damoisele. 	950
1176	— 		
1177|1178	Par foi, |fet cil, 	Desfendre fait cil. 	951
1179	se je voloie, 	par foy se iou voloie. 	952
1180	il ne m’en covendroit ja combatre, 	il ne men conuendroit pas desfendre. 	953
1181	kar des ier en est ! ele atainte, 	Car des hier estoit elle atainte 	954
1182	puis qu’ele ne pot trover 	puis quele ne pot desfendeor trouuer 	955
1183	qui la deffendist, 	qui la desfendist. 	956
1184	mais je sent ma querele a si loial et si droituriere 	Mais iou y senc ma droiture si loial. 	957
1185	qu’il n’a chevalier el monde 	quil na cheualier el monde uers 	958
1186	vers cui je ne l’osaise bien prover au ? grant droit 	qui iou ne losaisse bien moustrer au droit 	959
1187|1188	que je i ai. |— 	que iou y ai. 	960
1189|1190	En non Dieu, |fet Lancelos, 	En non dieu fait lancelot. 	961
1191|1192	or i parra, |que je sui pres que je la desfende vers vos. — 	Ore y para quar iou sui tous pres que iou la desfende uers vous. 	962
1193	Voire, 	voire fait cil. 	963
1194	fet cil, par mon chief, 	Et par mon chief 	964
1195	et vos en morrois 	et vous y morres 	965
1196	comme traitres et desloials. » 	comme traitres et desloiaus. 	966
1197	Lors traient la damoisele loins del feu 	Lors traient la damoisele loing del fu. 	967
1198	et li chevalier s’entreslongent li uns de l’autre, 	et li cheualiers seslongent li vns de lautre. 	968
1199	si s’entrevienent 	puis sentrelaissent corre li vns vers lautre. 	969
1200	si tost com li cheval pueent aler 	quanque il porent des cheuax traire. 	970
1201	et s’entrefierent des glaives si durement 	si sentrefierent si durement 	971
1202	qu’il les font voler en pieces; 	que lor glaiues volent en pieces. 	972
1203	puis s’entrehurtent si des cors et des visages 	puis sentrehurtent des cors et des uisages si durement 	973
1204	qu’il n’i a celui 	quil ni ot celui 	974
1205	qui tos ne soit estordis et desconreez. 	quil ne fust desconrees. 	975
1206	Mais li chevaliers par est si estonés 	Mais li cheualiers fu si estordis 	976
1207	qu’il ne se puet tenir en sele, 	quil ne se pot tenir es archons de sa sele 	977
1208	ains vole jus del cheval et al parchaoir feri 	Ains uole ius de son cheual, 	978
1209	li quins del hialme en la terre, 	Et au fn el chair feri li coins de son heaume en terre. 	979
1210|1211	si qu’a bien pou |qu’il n’a le col brisié. 	si qua poi quil not le col brisie. 	980
1212	Et quant Lancelos a fet son tour, 	Et quant lancelot ot fait son tor 	981
1213|1214	si descent, |kar honte li seroit de requerre a cheval celui 	si descent quar hontes li samble s de requerre a cheual celui 	982
1215	qui est a pié; 	qui estoit a pie. 	983
1216	si trait l’espee et cort sus a celui 	Si trait lespee et corut sus a celui 	984
1217	qui ja se relevoit, 	qui ia se releuoit. 	985
1218	si li done par mi le hialme tel cop 	Si li donne parmi le heaume tel cop 	986
1219	qu’il le fet a terre flatir des paumes et des genols ; 	quil le fait a la terre flatir des palmes et des genouls. 	987
1220	puis recuevre I. autre cop 	puis recoeure. j. autre cop 	988
1221	et le fiert 	si le fiert par tel air 	989
1222	si qu’il le fet tot parchaoir 	si que il labat a terre tout estordi. 	990
1223	et le prent par le hialme, 	puis le prent au heaume 	991
1224	si le traine jusqu’al feu et le gete dedens. 	si le traine uers le fu |et le gete dedens. 	992|993
1225	Et cil estoit si estordis 	et cil estoit si estordis. 	994
1226	et tant avoit perdue la force del cors 	et si uoit perdu la force de son cors 	995
1227	que relever ne se pot, 	quil ne se pot releuer. 	996
1228	si le covint remanoir el feu 	si le conuint remanoir el fu 	997
1229	et morir en tel maniere. 	et morir en tel maniere. 	998
1230	Et lors vienent avant cil 	Lors vienent auant cil 	999
1231	qui le champ gardoient, 	qui le camp gardent 	1000
1232	si dient a Lancelot 	et dient a lancelot. 	1001
1233	qu’il en a assés fet 	quil en a asses fait. 	1002
1234	et li rendent la damoisele saine et haitiee, 	si li rendent la damoisele saine et salue. 	1003
1235	et il la fet vestir, 	Et il la fait uestir: 	1004
1236	puis li demande 	puis li demande 	1005
1237	qu’ele velt 	que eler veult 	1006
1238	qu’il face mes. « 	que il face plus. 	1007
1239|1240	Sire, |fet ele, 	Sire ce dist la damoisele 	1008
1241	que vos me menés a salveté a mon chastel. » 	ie Voel que vous me metes a saluete en mon castel. 	1009
1242	Et il dist 	Et il dist 	1010
1243|1244	que volentiers: |si le fet monter 	que chou fera il moult volentiers. 	1011
1245	et le conduit jusqu’al chastel	puis le conduit au castel 	1012
1246	ou ele l’ot gardé maint jor. 	ou elle voloit aler. |et la ou elle lauoit autre sois garde maint ior. 	1013|1014
1247	Li chastials avoit non Galefort 	Et li castiaus auoit non Galafort 	1015
1248	et seoit sor une petite riviere, 	et seoit sor vne petite riuiere. 	1016
1249	si estoit molt aaisiés de totes choses 	et estoit moult bien assis de toutes choses. 	1017
1250	et fors a merveille, 	Et estoit fors a merueilles. 	1018
1251	Et quant Lancelos vint la, 	Et quant lancelot vint 	1019
1252	il ne fet pas a demander 	la il ne fait mie a demander 	1020
1253	se l’en li fist joie, 	Se on li fist grant ioie 	1021
1254	kar cil del chastel savoient ja bien 	quar cil del castel sorent ia bien 	1022
1255	que lor dame estoit delivree par I. chevalier 	comment lor dame estoit deliuree par. j. cheualier 	1023
1256	qui o li venoit. 	qui aueques li venoit. 	1024
1257|1258	Et quant il le virent, |si le reçurent a si grant joie 	Et il firent a lui si grant ioie 	1025
1259	com se ce fust Damedieu meismes 	comme se chou fust diex meismes. 	1026
1260	et s’agenoillent tuit devant lui 	et sagenoillent par deuant luj par la 	1027
1261	et crioient a une vois tuit ensamble : « 	ou il uenoit. |et crioient 	1028|1029
1262|1263	Sire, |sor tos cels del monde soiés vos bien venus, 	Is iet al tuit a vne vois. Sire sour tous chiaus del monde soies vous li bien uenus 	1030
1264|1265	qui nostre grant duel avés torné en grant joie !» |A tel feste ont laiens Lancelot receu 	qui nostre grant doel aues torne a ioie tel feste et a tel ioie ont laiens receu lancelot. 	1031
1266	et quant il ont la damoisele descendue devant son mestre palés, 	Et quant il ot la dame PA descendu deuant son maistre palais 	1032
1267	si s’en volt aler maintenant, 	si sen volt 	1033
1268	kar il n’estoit mie encore plus de tierce. 	aler quar il nestoit mie plus de tierce. 	1034
1269	Mais ele le prist al frain 	mais elle le prist au frain 	1035
1270	et le fist descendre a fine force a 	et li dist par sainte 	1036
1271	et dist: « 	crois 	1037
1272	Par Sainte Crois. 	sire 	1038
1273	vos ne m’eschaperois mie ensi. » 	cheualiers vous ne mescaperes mie ensi. 	1039
1274|1275	Lors le commande a desarmer |et vaslet saillent avant 	Si llele fist descendre et desarmer 	1040
1276	por fere son commandement a; 		
1277|1278	et tantost com il ot son hialme osté |et ele le conut,	et tantost comme il fu desarmes le connut elle 	1041
