697	Lors conmance la criee trop mervilleuse, 	entonçes començaron los gritos y las vozes 	590
698	car tuit cil de Norgales s’enfuient 	que todos los de norgales 	591
699|700	et cil de Gorre les anchaucent |et les prannent a lor volenté. 	quanto los Cauallos los podian lleuar fuian y los de gorra yban enpos dellos Matando y prendiendo dellos quantos querian 	592
701	Et quant Lanceloz voit	y quando don lançarote vio 	593
702	qu’il sont del tout torné a desconfiture 	que todos heran vençidos 	594
703|704	et qu’il n’i a mes nul recouvrier, |si se fiert en la forest 	y que ya no podian Cobrar metiose enla floresta y fuese quanto el cauallo lo pudo lleuar 	595
705	et s’en vait grant oirre, 		
706	car il ne velt estre arestez de nelui. 		
707	Assez fu quis et demandé, 	y mucho fue buscado 	596
708|709	mais il n’i ot celui |qui le poïst trouver. 	mas nunca del puderion sauer parte 	597
710|711	Et|quant li rois Bademaguz vit 	y quando el Rey bandemagnus vio 	598
712	qu’il s’en estoit tornez en tel manniere»	que ansi sele fuera |e que el del no podia sauer parte ouo tan gran pesar 	599|600
713|714	qu’il ne set |qu’il doie dire ne faire, 	que Cuido de sandezer 	601
715|716	et dist |que voirement est il li plus maleurez hom 	y començo a dezir agora soy yo el mas mal auenturado Rey del mundo 	602
717|718	qui onques fust, |quant il avoit ore o soi le meillor chevalier dou monde 	quando agora tube el mejor Cauallero 	603
719	qui il deust faire joie 	que enel mundo ay ni se puede allar 	604
720|721	et feste |et ore l’a perdu par sa mauvestié. 	y aquien deuiera fazer quanta onrra y seruiçio pudiera 	605
722|723	Et Galehodin|que Lanceloz ot abatu fu remontez 	y agora ansi lo perdi pormi maldad Como galeot fijo de galeote entro enla floresta en busca de don Lançarote Galeot 	606
724|725	si com il pot |et vient au roi Baudemagu 	que ya se leuantara fue al Rey bandemagus 	607
726	et se fait connoistre a lui; 	y fizosele Conoçer 	608
727|728	et quant il le connoist, |si li fait molt grant joie 	y quando el Rey lo conoçio plugole mucho conel y galeot le dixo 	609
729	et li dist: « Sire, je sui venuz a vos, 	señor yo vos Ruego 	610
730|731	que vos me diez |qui li chevaliers est 	que me digades quien fue el Cauallero 	611
732	qui si bien l'a hui fait par deça. — Biaux douz sire, fet Baudemaguz, 	que agora fue tan bueno enel torneo |que paso atodos los nuestros y los vuestros de bondad 	612|613
		y estaua devuestra parte mi buen 	614
733	por quoi le me demandez vos ? — Sire, fait il, 	señor dixo el |porque lo preguntades señor 	615|616
734	por ce que je sui jones hom 	porque aun yo soy muy niño 	617
735|736	et sai encore poi des ames: |si avroie mestier d’acointier moi d’.l. 	y se poco de cauallero y se que baldria muy mucho 	618
737|738	si prodome|com il est, 	por yo hauer su Compañia de tal Cauallero 	619
739|740	por ce qu’il m’en apreist |et por ce que j’en amanderoie de lui et de sa compaingnie. — 	que porel podria mucho mejorar en mi façienda 	620
741	Certes, sire, 	señor dixo el Rey 	621
742|743	s’il vos quenoissoit, il vos avroit molt chier, |car il ama molt mon signor vostre oncle? 	si vos el Conoçiese mucho vos amaria como amo avuestro padre 	622
744	et vostre oncle? le rama molt, 		
745	que onques hom n’ama plus autre. 	que nunca tanto amo vno ome a / otro 	623
746	Si vos di por voir 	e bien saued 	624
747	que ce est mes sires Lanceloz del Lac. — Lanceloz ? fait il. 	que este es don lançarote de lago |Como dixo el 	625|626
748	Ne cuidoie je mie vraiement 	este es don lançarote yo Cuidaua 	627
749	qu’il fust morz? 	por mi hera muerto 	628
750	Mais puis qu’il est vis, je creant a Dieu 	mas puesque el es viuo yo juro a dios y a sancta maria 	629
751	que jamais ne finerai de chevauchier, 	que yo no quede delo buscar 	630
752|753	se morz ou pris|ou malades ne sui, 	fasta quelo falle sino fuere preso o enfermo 	631
754	tant que je l’avrai trové. 	que no sea enmi poder |y si lo fallare Rogarlehe 	632|633
755	Et quant je le verrai, 	que me Resçiua en su Compañia 	634
756	si li prierai por l’amor de mon oncle 	por amor demi padre don galeot 	635
757|758	qu’il tant ama |qu’il me retiengne avec lui 	que el tanto amo de Corazon 	636
759	et me lest aler par les estranges terres cerchier les estranges aventures o lui. 	y que me dexe andar Consigo las estrañas hauenturas 	637
760	Et se il ce ne velt, totes voies m’aidera il mielz a conseillier 	y si esto no quisiere fazer toda uia me aConsejare mejor 	638
761	que uns autres ne feroit. » 	que otro me podra Consejar 	639
762	Atant s’em part del roi Baudemagu 	entonçes se partio galeot ansi Como estaua 	640
763|764	et s’en vaît ainsi armez |com il estoit 	y metiose enla floresta tan enCubiertamente 	641
765	qu’il nel fait savoir a cestui ne a cest autre, 	que ome del mundo nunca del sopo Parte 	642
766	ne n’anmainne avec lui escuier ne garçon; 	y non quiso lleuar consigo escudero ni donzel 	643
767|768	si se fiert en la forest aprés Lancelot |et chevauche toute jor ajornee 	e andubo todo el dia que no fallo ome ninguno ni muger 	644
769	qu’il n’ancontre home ne fame 	que ningunas nuebas le diese del |Mas agora dexa el Cuento de fablar de galeot 	645|646
770	qui noveles li die de ce 	y torna a Contar de don lançarote y delo quele auino |despues que se partio del torneo 	647|648
771	qu’il quiert.	Agora dexa el Cuento de fablar de galeot |y torna a don lançarote	649|650
