0|1	Einsi fu Lanceloz III. jorz laienz, |si adolez 	y estando alli tres dias ydos 	0
2|3	qu’il em perdi le boivre et le mangier. |Si em pesoit moult a une damoisele de laienz 	que alli se fallo ouo tan gran pesar 	1
4|5	qui chascun jor li aportoit à mengier |et li avoient baillie a servir et a garder. 	que perdio el comer y el beuer y el dormir 	2
6|7	Et ele li faisoit touz les biens|qu’ele pooit el monde 	y quando esto vio vna donzella quelo seruia ouo muy gran pesar 	3
8	et li pesoit molt de son courrouz. Au quart jor aprés furent venu li chevalier de laienz d’un tornoiement 	y al quarto dia despues de visperas llegaron ay todos los Caualleros dela Reyna devn torneo 	4
9|10	qui le jor devant avoit esté; |si enconmancerent tant a parler 	ado fueran 	5
11|12	et ça et la |que Lanceloz l’antandi bien 	y tanto fablaron ende los vnos y los otros 	6
13	qu’il venoient d’un tornoiement. 	quelo oyo don lançarote 	7
14	Lors conmance a penser et a correcier soi a lui meismes et dist 	y vbo ende muy gran pesar |y començose a quexar 	8|9
15	qu’il ne fu onques nus 	y deçia asi mismo 	10
16	si maleurous chevaliers 	ay mezquino 	11
17|18	com il est, |car quant il est sains et haitiez 	y como so Cauallero de mala uentura que quando so sano e ledo 	12
19|20	et il devroit aler par tout le monde |et achever les perilleuses aventures 	e abia de dar cauo alas auenturas 	13
21	que li autre n’osent atandre et il avroit bien pooir de mener les a chief, 	quelos otros no osan aCometer |ni las pueden acauar 	14|15
22	lors le metent deable em prison 	entonçes me meten los diablos en persecuçion 	16
23	si qu’il n’est nul tans qu’il ne soit malades ou emprisonnez. 	e so enfermo |e Comenzo a fazer muy gran duelo 	17|18
24	Lors regrete ses mescheances 	e a contar sus malas andanças 	19
25	dont il avoit trop souvant; 	quele venian a menudo 	20
26	si conmance a faire trop mervilleux duel. 		
27|28	Lors vient laienz la damoisele |qui de lui se prenoit garde; 	y la donzella quelo seruia 	21
29|30	et quant ele l’i vit tel duel mener, |si en est trop dolente. « 	quando esto le vio fazer entro ael e dixole 	22
31|32	Ha, sire, fait ele, |que avez vos 	señor como fazeis tal duelo 	23
33	qui tel duel menez ? — Damoisele, ja ne devroie je mie duel mener, 	donzella dixo el |yo no debria fazer este duelo 	24|25
34	mes moi occirre, 	mas antes me debria matar con mis manos 	26
35	car je sui li plus mescheanz chevaliers del monde. — Sire, fait ele, par la riens 	Ca so el mas malandante Cauallero del mundo Señor dixo ella |dezidme quien sodes 	27|28
36	que vos plus amez, dites moi 	non fare |dixo el 	29|30
37	qui vos estes 	si faredes |dixo ella 	31|32
38	et conment vos avez non 	yo vos Ruego porla fee |que deuedes ala Cosa del mundo 	33|34
39	et je vos creant 	que mas amades |que yo vos juro lealmente 	35|36
40	que je ne vos descouverrai 	que vos yo no descubra 	37
41	ne ci ne aillors. — Damoisele, fait il, 	mientras vos no quisieredes donzella |Dixo el 	38|39
42	tant m’avez conjuré 	tanto me Conjurades 	40
43	que je le vos dirai. Sachiez 	que Voslo dire sabed 	41
44	que je sui li plus maleureus chevaliers 	que yo so el mas mal andante Cauallero del mundo 	42
45	qui onques portast armes 	de quantos nunca trajeron armas enla gran bretaña 	43
46	ne ma mescheance ne comance mie ore premierement, 	y no lo començo agora 	44
47|48	mais des|lors que je estoie en bercel ; 	mas yasiendo enel braço 	45
49	car je perdi en une matinee mon pere 	que yo perdi envna montaña my padre 	46
50	qui molt estoit vaillanz et prodom et bons chevaliers	que hera muy buen Cauallero de armas |y muy buen ome 	47|48
51	et fui desheritez de toute ma terre 	entonzes perdi mi tierra toda 	49
52	donc je eusse a grant planté, 	deque hubiera mucha honrra 	50
53	s’ele m’eust loialment esté gardee. 	si lealmente me fuera guardada 	51
54|55	Si puis dire loiaument |que j’ai a non Lancelot del Lac li mescheanz.» 	e Con verdad vos puedo dezir que yo he nombre don lanzarote de lago el mal auenturado 	52
56|57	Quant ele entant |que ce est Lanceloz, cil 	Como la donzella saco a don lançarote dela prision 	53
58	que l’an tient au millor chevalier dou monde, 	y como le prometio de le ayudar 	54
59	si est tant liee 	Quando la donzella quelo seruia le / oyo dezir |que hera don lanzarote de lago fue muy alegre 	55|56
60	que nule plus; 	porque muchas vezes oyera dezir |que hera el mejor Cauallero del mundo 	57|58
61	et lors li dist: « Sire, ceste prison vos anuie molt, je le sai bien, 	y dixole señor yo se bien |que esta prision vos enoja 	59|60
62	et que vos en isteriez volentiers, 	y que saldriades della de buena gana 	61
63	se vos poiez. — 	si pudiesedes verdad es dixo lançarote 	62
64	Certes il n’est riens 	y no ay cosa 	63
65|66	que je poïsse faire |que je ne feisse, 	que yo non fiçiese ental que no fuese mi gran verguença 	64
67	par couvant que j’an fusse hors. — 	Por quien me ansi sacase 	65
68	Par foi, fait ele, 	Pordios dixo la donzella 	66
69	et je vos en osterai, 	yo vos sacare dende 	67
70|71	se vos |por moi volez faire ce 	si por mi quisieredes fazer vna Cosa 	68
72	que je vos conmanderai. — Dites, fait il, 	que vos yo dire Pordios dixo lançarote 	69
73	car je le ferai, 	yo la fare 	70
74	se j’en ai le pooir?, —	si es cosa |que pueda o deua 	71|72
75	Or mescoutez 	Pues señor yo voslo dire 	73
76	dont, fait ele. Il est voirs 	dixo ella |señor saued 	74|75
77|78	que la roine de Sorestan, la dame de cest chastel |ou vos estes, m’a tenue longuement avec li 	que hera Reyna de floresta señora deste castillo enque agora sodes me tubo eneste castillo gran tiempo consigo 	76
79	et si vos dirai comment. Il avint, bien a passé X. anz 	y dire uos en qual guisa ansi fue 	77
80	que j’estoie petite 	que puede hauer doze años 	78
81|82	que mes peres, li dus de Rocedon, conmança guerre contre le roi? de Sorestan |qui fu seingnor a la roine de ceanz. 	que mi padre el duque Comenzo su guerra conel Rey de floresta su marido desta dueña 	79
83|84	Mais au darrien firent pais, |por ce que mes peres me donna en mariage a I. petit fil le roi 	mas ala çima fizo paz 	80
85|86	qui n’avoit mie plus de VI. anz |et je estoie en l’aage de V. anz. 	por tal Pleito 	81
87|88	Aprés ce ne demoura gueres |que mes peres morut et ma mere ausi, 	que mi padre me diese 	82
89|90	si que ma terre remest a garder a ceste roine. |Oan ot VIll. jorz devant Noël, 	por muger a un su fijo del Rey que hauia siete años 	83
91|92	s’esmut li chevaliers |qui fiancie m’avoit a la cort 	e yo no hauia mas de çinco 	84
93	por estre chevaliers noviax, 	y despues murio el Rey mi padre 	85
94	si nos an mesavint	ansi que finque yo 	86
95	tant qu’il fu occis a l’issue de la forest de Karlion. 	y toda mi tierra en poder dela Reyna y agora fue de aqui el donzel a Casa del Rey artur 	87
96	Quant je soi 	porse fazer Cauallero 	88
97	qu’il fu morz, 	y murio alla 	89
98	si m’an vos de ceanz aler et li demandai 	y yo quando lo supe quiseme yr de aqui 	90
99|100	qu’ele me randist ma terre. |Mais la roine 	y demande mi tierra ala Reyna 	91
101	si n’en volt riens faire, 	y ella no mela quiso dar 	92
102|103	ainz dist, |se je l’angoissoie I. poi, je n’an tandroie jamés plain pié por pooir 	y agora poco a demandome vnsu hermano por muger 	93
104	que je eusse. 	y ella mele otorgo 	94
105	Si le laissai atant, 	e fizome jurar Conel alma demi grado |e otorguele toda mi tierra 	95|96
106|107	que plus n’en osai dire |et tant qu’il avint avant ier n’a mie III. semainnes 	e auemos a fazer las vodas de aqui a veinte dias 	97
108	que J. suens freres me demanda a fame	mas çierto de poco seso se trabaja 	98
109	et ele m’i donna. 	anteme matare con mis manos mesmas 	99
110	Ele le me fist fiancier maugré mien, 	que no casar conel |que es el peor Cauallero 	100|101
111|112	si le revesti de toute ma terre |et an doivent estre les noces de diemanche an VIII. jorz. 	y el mas desleal del mundo 	102
113	Mes certes por noiant, 	y porende Vos Ruego Señor |que en Enmienda del seruiçio 	103|104
114	car je ne l’avrai ja a mari ne a seingnor, 	que vos yo puedo fazer |que me libredes del 	105|106
115	car j’ai bien raison, 	que antes morire |que me ayuntar conel 	107|108
		donzella dixo don lançarote 	109
		si porvos puedo ser librado de prision 	110
116	qu’il est li plus desloiaux chevaliers et li plus couarz 	yo vos prometo |como leal Cauallero de fazer todo mi poder porvos librar este enogoço 	111|112
117	qui onques fust.	y de ser convos el dia |que hauedes de Resçeuir las bendiçiones 	113|114
118|119	Et se vos por moi voliez tant faire |que a celui jor venissiez touz armez 	si muerte o dolençia o prision no melo estoruare 	115
120	pour contredire ces espousailles en ce chastel 	muchas merçedes dixo ella ca yo non pido 	116
121	et feissiez	mas ca bien çierta soy |que si vos ponedes y todo vuestro poder 	117|118
122	tant que cist mariages fust desfaiz, je vos geteroie anuit de ceste prison 	que muy ayna sere yo librada de suxeçon |y agora señor non vos deseñorades dixo ella 	119|120
123	et vos donroie bon cheval et bonnes armes. — 	que yo vos dare armas y Cauallo |y vos sacare de aqui 	121|122
124	En non Deu, damoisele, fait li, 	enmanera que lo non puedan entender los 	123
125	se vos ce volez faire, je vos creanterai comme loiax chevaliers 	que el castillo guardan 	124
126	que je a celui jor revanroie en cest chastel	Pues yd ayna dixo don lançarote 	125
127	et feroie 	e dios vos ayude |entonzes se fue la donzella 	126|127
128|129	que je vos deliverroie de cel chevalier |et avriez vostre terre quite, 	y llamo a vn moço su ermano de leche 	128
130|131	s’il n’i a autre arest |que vos m’avez dit. —	e dixole 	129
132|133	Certes, fait ele, il n’i a autre arest. — |Dont vos craant je, fait il, 	buen hermano Este Cauallero 	130
134	que je cest couvenant vos tandrai. — 		
135|136	Et je vos craant loiaument |que je anuit vos giterai fors de ceanz.» 	que la Reina tiene preso me a prometido deme librar deste mal cauallero 	131
137|138	Ensi aseure li uns l’autre : |si s’em part atant la damoisele et Lanceloz remest liez 	si lo saco dela prision 	132
139	et joianz de ce 	e se çierto 	133
140	que la damoisele li promet	que lo fara 	134
141|142	Quant il fu auques anuitié |et cil de laienz furent couchié et endormi, la damoisele ouvre l’uis de la chambre 	Ca el es el mejor Cauallero del mundo 	135
143|144	et vint a Lancelot|et li dist: « Sire, venez aprés moi. » 	e porende me quiero trauajar delo sacar dela prision 	136
145	Et il se lieve, 	y es menester 	137
146|147	si la siut |et ele l’enmoinne en une chambre de laienz pres d’un vergier ; 	que guardedes 	138
148	si le fait mengier, 	quando todos estubieren sosegados a çenar 	139
149	puis li baille bonnes armes et bon cheval. 	y que ensilledes vno delos mejores Cauallos 	140
150	Et quant il est apparilliez comme de monter, il dist a la damoisele: e Dites moi 	que aqui ay y que lo saquedes 	141
151	de quel tornoiement li chevalier 	por aquel postigo detras el Castillo 	142
152|153	de ceanz parloient anuit aprés vespres. — Sire, fait ele, volentiers. Il est voirs |que li rois Baudemaguz et li rois de Norgales fiancerent I. tornoiement li uns encontre l’autre, de gent contre gent: 	y esperadme ay 	143
154	si ont hui esté assemblez en une praerie 	e yo terne armas aparejadas 	144
155	qui est a JI. liues loing de ci 	para el Cauallero |e sacarlo eys 	145|146
156	si que cil de ceanz 	enguisa que ninguno lo entienda ca en otra guisa seriamos escarnidos muy de grado dixo su hermano |entonçes se partio la donzella desu hermano 	147|148
		e fuese a vn palaçio 	149
		donde hauia muchas armas 	150
		para defendimiento del Castillo y escogio las mejores 	151
		que ay fallo 	152
157	a cui vos en oïstes parler an sont anuit venu. — 	y desque vio |que todos çenauan 	153|154
158	Et liquel, fait il, en ont le peor ? — 	e que lo non podrian ver fuese a don lanzarote 	155
159	Par foi, fet ele, li rois Baudemaguz en a esté chaciez de place, 	y dixole |señor tomad estas armas y armadvos ayna 	156|157
160	car il n’avoit mie tant de gent amené de la moitié comme li rois de Norgales. 	y agora vos podre de aqui sacar en 	158
161	Mais il ont pris terme d’assembler juedi. » 	quanto la compaña çena 	159
162	Et il n’avoit c’un jor entre II. 	y don lanzarote fue muy alegre 	160
163	Quant il oit 	quando esto oyo y armose muy ayna y la donzella le ayudo lo mejor que pudo |y desque fue armado sacolo dela Camara 	161|162
164	que li rois Baudemaguz en a esté chaciez de champ, 	y llebolo al postigo del castillo en manera 	163
165	si est molt dolanz, 	que lo non vido ninguno 	164
166	car ce est un des homes del monde 	y fallo ay su hermano que la estaua esperando 	165
167	qui plus li a fait honor, 	y tenia el Cauallo porla Rienda 	166
168	si est molt dolanz de ce 	que hera vno delos fermosos Cauallos del mundo 	167
169	qu’il n’i a esté; 	y dixo la donçella a don lançarote |señor subid en ese cauallo 	168|169
170	car s’il i fust, a ce	y enComiendo vos a dios 	170
171|172	qu’il se sent sain et haitié |et desirrant de porter armes, il ne cuide mie 	que vos guarde e vos defienda e vos encamine 	171
173	que li rois en eust le peor 	pero señor vengavos en miente de lo 	172
174	si com il a eu. 	que me prometistes 	173
175|176	Lors monte en son cheval |et conmande la damoisele a Deu 	en Como seades enel Castillo el dia del plaço 	174
177|178	et ele li dist |qu’il ne l’oublist pas des couvant	deso non dubdedes dixo don lanzarote 	175
179	que il i a. — 	que yo aqui sere 	176
180	Si m’aïst Diex, fet il, no ferai je. » 	si me dios guarda de mal e de ocasion |entonçes se partio don lançarote dela donzella y ella y su hermano Entraron al Castillo 	177|178
181	Si s’en vait atant 	enmanera que lo no entendio ninguno |mas agora dexa el Cuento de fablar dela Reina dela floresta 	179|180
182	et entra en I. vergier et del vergier entra en une petite praerie. 	y dela donzella que saco a don lançarote del castillo |e torna a Contar de don lançarote 	181|182
183	Lors trueve I. estroit sentier	por contar |delo que le auino conel Cauallero 	183|184
184|185	qui le mena droit a une forest |ou il avoit I. pavillon tandu devant J. grant orme. Il torne cele part son cheval, 	que allo durmiendo enla tienda agora dexa el quento de fablar dela Reyna dela floresta e dela donzella 	185
186	por ce 	e torna a don Lanzarote 	186
187	que genz i cuidoit trouver, 	Agora dize el quento 	187
188|189	si descent a l’entree |et voit dedanz III. cierges ardanz et I. grant lit couvert d’un samit porpre. Il vait au lit, 	que quando don lanzarote se partio dela donzella del Castillo dela carreta 	188
190|191	mes il n’i troeve home ne fame, |ne el pavillon ausi. 	que anochesçia ya 	189
192|193	Et quant il voit ce, |si vient a son cheval 	y metiose porla floresta 	190
194	et oste ! le frain et la sele et le moinne pestre, 	por no ser conoçido |e andubo tanto porella 	191|192
195|196	puis se desarme |et met l’espee a son chevez, 	que de grado albergara 	193
197	si se despoille 	y si fallara 	194
198|199	et dit |qu’il se couchera anz. 	do y el yendo 	195
200	puis qu’il n’i trueve ame;	asi fallo çerca del camino vna tienda armada 	196
201	puis estaint les cierges 	y plugole Mucho Conella 	197
202|203	por la clarté |qui mal ne li feist;	porque Cuido y fallar quien lo aluergase 	198
204	si se couche 	y desçendio del cauallo 	199
205|206	et s’andort tout maintenant. |Aprés ce ne demora gueres	y tirole el freno y la silla 	200
207|208	que laienz vint I. chevalier, |celui cui li pavillons estoit; 	y dexole paçer y entro enla tienda por paçer 	201
209|210	et quant il vit les cierges estains, |si cuida bien 	que de al no hauia cura 	202
211|212	que sa fame fust endormie |et qu’ele eust les cierges estainz por la clarté. Il estoit sanz espee et sanz armeure, 	y tiro de su espada e desus armas 	203
213|214	si se fu tost despoilliez |et se couche errant delez Lancelot 	y fuese a echar envna cama 	204
215|216	et se trest pres de lui |et l’acole	que ay estaua enla tienda enque estaua durmiendo vn cauallero 	205
217|218	et le conmance a baisier, |car il cuidoit vraiement 	e quando lo vido don lançarote penso 	206
219	que ce fust sa fame. 	que hera algund seruiente 	207
220|221	Quant Lanceloz sant celui |qui einsint le baisoit, 	que guardaua la tienda 	208
222|223	si saut sus touz desvez |et cuide bien 	y tomolo porlos braços 	209
224	que ce soit dame ou damoisele : 		
225	si l’aert a JI. braz. 	y echolo en tierra 	210
226	Et cil s’aperçoit tantost et cuide	y el Cauallero acordo e Cuido 	211
227	que ce soit li lichierres sa fame. 	que hera algund amigo de su muger 	212
228|229	si se desvoleppe de lui et l’aert i a Il. braz |et le sorprant 	y leuantose y trauo de don lanzarote 	213
230	si que ainz		
231|232	qu’il se fust pris garde, |l’ot il geté desouz lui a la terre ; 	y dio conel en tierra 	214
233	si dist: « 	e dixo 	215
234	Certes, lerres, mar me venistes faire honte	çierto don traidor en mal hora aqui venistes 	216
235	et mar vos couchastes avec ma fame en mon pavillon meismes. 	porme desonrrar y echarvos conmi muger enmi tienda 	217
236	Puis li donne del poing en mi les denz 	y diole tan gran puñada enlos dientes 	218
237|238	si que a poi|que il ne li a brisiez en la bouche, 	que selos hubiera quebrado enla boca 	219
239	et li sans en saut 		
240|241	si qu’il en a le menton tout sanglant. |Quant Lanceloz se sent si mal mener, 	e quando don lançarote se vio tan mal ferido tomolo con ambas manos porla garganta 	220
242	si l’aert a la gorge et le fait voler par dessus lui 	y alçolo de tierra |e dio conel gran golpe en tierra 	221|222
243|244	et le fait flatir a L. chaillou|qui en mi le pavillon estoit. Li chevaliers ot une grant plaie au chaoir 	y fizole vna gran llaga enla Caueça 	223
245|246	qu’il fist |et Lanceloz se relieve 	y luego fue a tomar su espada y su cota 	224
247|248	et vait cele part|ou il ot s’espee laissie, 	y fue enpos del 	225
249	si l’a traite del fuerre toute nue. La lune luisoit cler 		
250	si que l’am pooit auques veoir par mi le pavillon; 		
251|252	et quant li chevaliers voit venir Lancelot l’espee traite, |si ne l’ose atandre, 	y quando el otro cauallero lo vio yr enpos desi la espada enla mano ouo miedo 	226
253	ainz s’an torne fuiant toz nuz 		
254|255	et s’en vet vers la forest. |Et Lanceloz le siut 	e començo a fuir porla floresta 	227
256|257	qui atant nel velt mie laissier ; |si le chace tant sanz robe 	y don lançarote en pos del 	228
258	qu’il l’aconsielt, 	fastaque lo alcanço 	229
259|260	si le fiert par mi la teste de l’espee |si qu’il le fant tout dusqu’es danz 	e diole tan gran golpe porçima de la Caueza 	230
261|262	et cil chiet morz a terre. |Et Lanceloz revient el pavillon 	que sela fendio pormedio 	231
263|264	et se couche |et s’andort dusqu’au matin; 	y don lançarote se torno ala tienda y echose a durmir 	232
265|266	mais molt se sant bleciez del cop |que cil li ot doné en mi les danz. A l’andemain 	fastaque fue de dia 	233
267|268	quant li oisel enconmancerent a chanter, |si se leva et vesti 	y otro dia demañana leuantose 	234
269|270	et prist ses armes |et monta en son cheval, 	y armose y caualgo en su cauallo 	235
271|272	puis se parti de laienz, |qu’il ne sot pas a cele foiz 	y fuese 	236
273|274	qui li chevaliers fut |qu’il ot occis. 	y de aquella vez no supo quien hera aquel cauallero que matara 	237
275|276	Quant il est antrez en la forest,|si encontre IlII. escuiers 	e desque entro enla floresta fallo quatro escuderos 	238
277|278	qui menoient en destre IIlI. destriers toz blans|et avoit chascuns couvertures blanches; 	que traian quatro cauallos de diestro 	239
279|280	et aprés venoient dui autre |qui portoient le hernois a J. chevalier, haubert et hiaume et chauces de fer et genoillieres 	y heran todos blancos 	240
281	et cote a armer de blanc samit; et li autres portoit I. escu blanc comme nois. Il salue les escuiers 	como niebe y las coberturas y las sillas heran blancas otrosi |y enpos dellos benian dos escuderos 	241|242
282	et lor demande 	que traian guisamiento de vn caballero loriga quixotes e canillotes e yelmo juuete de ermiño |mas devn xamet blanco y enpos destos venia otro 	243|244
283	cui cil hernois est. « Sire, font il, a l. chevalier	que traia vn escudo blanco |y vna lança toda blanca 	245|246
		y don lanzarote les pregunto Cuios heran 	247
284	qui demain velt estre a J. tornoiement de Il. rois. — 	señor dixeron ellos |nos somos de vn Cauallero que mañana a de ser en vn torneo de dos Reyes 	248|249
285	Et	y es cauallero nouel |e como a nombre dixo el / 	250|251
286|287	conment a il non, cil chevaliers ? fait Lanceloz. — Sire l'an l’apele Galehoudin |et fu niés i Galehot, le sire des Lointaingnes Illes. — 	señor dixeron ellos a nombre galeodi y es señor fijo de don galeodi el señor delas luengas ynsolas 	252
288	Et a quels aidera il ? fet Lanceloz. — Il aidera au roi de Norgales, 	e fizolo el veliena fija del Rey de norgales |aquien querra el ayudar dixo don lanzarote 	253|254
289	por ce que ses aieux est. — 	señor dixo el al Rey de norgales su aguelo 	255
290	Et cil tornoiemenz 	y el torneo 	256
291	ou sera il, biaux frere? — En une praerie par	ado a de ser señor en vnos prados 	257
292	ou vos avez orendroit passé. » 	por do antes pasastes 	258
293|294	Lors les conmande lanceloz a Deu,|si s’em part atant. 	Como don lançarote prometio ala fija del Rey bendemagus que lo ayudaria Enel torneo ENtonçes los enComendo a dios don lançarote 	259
295	Et quant il a I. poi alé, 	e fuese su Camino |e no andubo mucho 	260|261
296	si oit a destre sonner une cloche; il s’adrece cele part 	quando oyo tañer vna campana 	262
297	et troeve une abaie de nonains. Il descent a l’entree 	y el fue alla y fallo vna abadia de monjes blancos 	263
298	et baille son cheval a garder a J. garçon, 	e desçendio del Cauallo 	264
299	puis entre el moustier tout armé fors d’iaume et d’escu et de glaive. 	e dexo el escudo e la lança 	265
300	Et quant il est laienz entrez,	por fazer oraçion enel portal y el yelmo y entro 	266
301|302	si troeve la seror Meleagant, cele |qui l’ot geté de la dolerouse prison 	e vido la hermana de meliagas la quelo saco dela dolorosa prision 	267
303|304	ou il ot esté mis. Ele resgarde |et avise 	enque estaua 	268
305|306	tant qu’ele quenoist |que ce est Lanceloz, 	e catolo tanto quelo conoçio 	269
307	mes molt se merveille 	mas mucho se marauillo 	270
308	que li bel chevol sont devenu 	que fuera desus fermosos cauellos 	271
309|310	qu’il selt avoir, |et panse qu’il ait esté malades.	que solia tener pero penso que el fuera doliente 	272
311	et que par ce li soient chaoit: 	e oyeron misa 	273
312	si se sueffre de parler a lui dusque aprés vespres. 	e desque fue dicha la misa salieron fuera dela iglesia don lançarote |e la donzella enpos 	274|275
313|314	Quant li freres ot chanté |et Lanceloz fu issuz del moustier, la damoisele vet aprés lui 	e el fuelo a abraçar 	276
315	et li dist: « Sire, vos soiez li bien venu ! — Ma douce damoisele, vos soiez la bien venue ! 	e dixole señor bos seades el bienvenido |e dixo 	277|278
316	Comment l’avez vos puis fait 	el vos seades la bien fallada 	279
317|318	que je ne vos vi ? — Sire, fait ele, bien, |Deu merci et la vostre. — 	e que fue devos deque vos non vi 	280
319|320	Et quele aventure vos a amené ça ? — Sire, je ving por i. tornoienent |qui demain sera pres de ci; 	y que auentura vos traxo aqui 	281
321|322	si l’a empris mes sires li rois Baudemaguz contre le roi de Norgales |mais il en a ja esté vaincuz I. foiz, 	Señor dixo ella yo vine aqui 	282
323|324	car trop a gent li rois de Norgales, » |Et il dist 	por ver vn torneo 	283
325|326	que|ausi i est il venuz 	que a de ser aqui 	284
327	por veoir le. « Voire, sire, fet ele, 	y fazelo mi padre el Rey bandemagus 	285
328	et i irez vos demain? — 	y el Rey de norgales 	286
329	Oil, fait il, 	y mi padre a sido vençido vna vez e dixo don lançarote 	287
330	se je puis. — 	yo poreso vine aqui 	288
331|332	Dont vos voldroie je prier por Deu et par amors|que vos aidissiez as noz. » 	señor dixo la donzella 	289
333	Et il dist 	yo vos Ruego 	290
334|335	que si fera il volentiers de tout son pooir. « Sire, fait ele, C. mile merciz de Deu. |Dont sai je bien 	que por amor de mi querades ayudar alos nuestros de grado 	291
336|337	que li rois de Norgales i perdra le tout |et mes peres en avra l’onor. 	dixo el Señor muchas merçedes 	292
338	Et je vos pri 	que agora se vien 	293
339	que vos huimais demorez o moi 	que el Rey de norgales non podra durar contralos nuestros 	294
340	et demain mouvroiz a aler au tornoiement. 	y agora habra mi padre la honrra 	295
341	Et vos le devez bien fere, 	e Ruego vos señor 	296
342	car se vos orandroit vos esmouviez, 	que aluerguedes aqui comigo esta noche |y enla mañana yrnoshemos al torneo 	297|298
343	vos ne troveriez meshui nul si bon ostel pres del tornoiement. 	que aunque querades yr adelante non fallaredes buena posada 	299
344	Et sachiez 	e aqui folgaredes 	300
345	que vos seroiz bien serviz et aaisiez de toutes les choses 	e serades bien seruido 	301
346|347	que l’an porra. » |Et il dist 	donzella dixo el 	302
348|349	que il remaindra, |puis qu’il li plest; 	puesque vos queredes ami plaze 	303
350	si se fait desarmer maintenant 	estonçes lo fizo ella desarmar 	304
351	et ele prant I. vallet, 	e fizole dar muy nobles paños 	305
352	si li dist: « Va t’an droit au chastel de la Herpe 	que vistiese 	306
353	ou tu trouveras le roi Baudemaguz mon pere; 	e luego llamo vn donzel en puridad 	307
354	si li di 	e dixole 	308
