656	Quels merveilles i a il ? fait Mordrez. — 	quex merueilles y a il fet mordret : 	673
657	Par foi il i a l. chevalier a unes blanches armes, I. deable, L. aversier 	Par foi il y a .i. cheualier. a unes armes blanches .i. dyable .i. auresier. 	674
658	qui plus occirroit ancui de gent	qui plus ocirroit encui de gent 	675
659	que l’an ne porroit d’omes morz enterrer en Il. arpanz de terre. N’alez mie cele part, 	que len ne porroit enterrer domes mors. en .ii. arpenz de terre. |Ne nalez mie cele part. 	676|677
660	se vos ne volez morir. 	se uous ne uolez morir. 	678
661	Que ja Diex ne m’aïst se encontre 	que ia diex ne mait. 	679
662	s’espee puet durer fers ne aciers!» 	se encontre sespee puet durer fer ne acier. 	680
663	Lors relacent lor hiaumes li III. i compaignon 	Lors relacent lor hialmes li .iii. compaignon. 	681
664	et montent es chevax 	et montent es cheuaux. 	682
665	et prannent escuz et lances 	et prennent escuz et lances. 	683
666	et laissent corre a Lancelot devant 	Et lessent corre a lancelot. 	684
667	que cil de Norgales fuient ainsi comme li lievres devant les chiens. 	deuant que cil de norgales fuient. aussi comme lieures deuant chiens. 	685
668	Et Lanceloz ot lance recouvree 	Et lancelot ot lance recouree. 	686
669	qu’il toli a J. de ceaux 	quil toli a .i. de cels 	687
670|671	qui s’anfuioient, |si s’adrece vers l’un de cels III. chevaliers, 	qui sen fuioit. si sadresce uers lun des .iii. compaignons. 	688
672	et ce estoit Mordrez, 	Et ce estoie |Mordret.et le fiert 	689|690
673|674	et le fiert |si qu’il li met par mi l’espaule senestre le fer a tout le fust; il s’ampaint bien 	si quil li met parmi lespaulle senestre le fer o tout le fust. il lempaint bien.	691
675	et le porte a terre tot anferré. 	et le porte a terre tout enferre 	692
676	Et li rois Bademaguz 	Et li rois badem̃. 	693
677	qui derrier lui estoit li baille I. autre glaive 	qui derriere lui estoit. li baille .i. autre glaiue. 	694
678	et li dist: « Sire, tenez, monstrez nos encore conment vos savez lances brisier. » 	Et li dit tenez. sire moustrez nos encore |comment uous sauez lances brisier. 	695|696
679	Et il lesse maintenant corre vers Mador de la Porte, 	et il lesse maintenant corre uers mador de la porte. 	697
680	et cil li brise son glaive en mi le piz, 	et cil li bruise le glaiue contre le piz. 	698
681	et Lanceloz 	Et lanc̃. 	699
682	qui la soue porte bas le fiert 	qui la seue porte bas. le fiert. 	700
683	si qu’il li met par mi la cuisse le fer o tout le fust, sì porte lui et le cheval a terre tout en I. mont	si quil li met parmi la cuisse le fer otout le fust. |si porte lui et le cheual a terre tout en .i. mont. il sen passe outre 	701|702
684|685	et s’em passe outre |et trest l’espee 	et tret lespee. 	703
686	et fiert Galehodin en l’escu blanc 	et fiert galehodin en lescu blanc. 	704
687	si qu’il en a abatus I. grant chantel : 	si quil en abat ius .i. grant chaucel. 	705
688	et l’espee descent jus sor le cheval 	Et lespee descent ius sor le cheual. 	706
689	si qu’il li coupe le col par devant les espaules 	si quil li colpe le col par deuant les espaulles . 	707
690|691	et abat en I. mont chevalier et cheval. |Quant li rois de Norgales 	et abat en .i. mont cheual et cheualier. QUant li Rois de norgales 	708
692	qui ot ja assez resgardé Lancelot por les merveilles 	qui ot ia assez regarde lanc̃. pour les merueilles 	709
693	qu’il faisoit voit celui cop, 	quil fesoit. uoit celui cop. 	710
694	si ne l’ose plus atandre, 	si ne lose plus atendre.	711
695	ainz torne en fuie 	ainz sen torne en fuie 	712
696	quanque li chevaux pot aler. 	quanque li cheuals puet aler. 	713
697	Lors conmance la criee trop mervilleuse, 	Lors commence la criee trop merueilleuse. 	714
698	car tuit cil de Norgales s’enfuient 	Car ctuit cil de norgales senfuient. 	715
699	et cil de Gorre les anchaucent 	Et cil de gorre les enchaucent 	716
700	et les prannent a lor volenté. 	et les prennent a leur uolente. 	717
701	Et quant Lanceloz voit	Et quant lanc̃. |uoit 	718|719
702	qu’il sont del tout torné a desconfiture 	quil sont del tot torne a desconfiture. 	720
703	et qu’il n’i a mes nul recouvrier, 	et quil ni a mes nul recourier. 	721
704	si se fiert en la forest 	Si se fiert en la forest. 	722
705	et s’en vait grant oirre, 	et sen uait grant erre. 	723
706	car il ne velt estre arestez de nelui. 	Car il ne uelt estre arrestez de nullui. assez fu quis 	724
707	Assez fu quis et demandé, 	et demandez. 	725
708	mais il n’i ot celui 	Mes il ni ot cil 	726
709	qui le poïst trouver. 	qui le poist trouer. 	727
710|711	Et|quant li rois Bademaguz vit 	Et quant li rois badem̃. uit 	728
712	qu’il s’en estoit tornez en tel manniere»	que il sen estoit alez en tel man̾e. |et quil ne seroit mie trouuez. 	729|730
		si est si dolenz 	731
713	qu’il ne set 	quil ne set 	732
714	qu’il doie dire ne faire, 	que il doie fere ne dire. 	733
715	et dist 	Et dist	734
716	que voirement est il li plus maleurez hom 	que uoiremet est il li plus maleureus home 	735
717	qui onques fust, 	qui onques fust. 	736
718	quant il avoit ore o soi le meillor chevalier dou monde 	quant il auoit ore o soi le meillor cheualier del monde. 	737
719	qui il deust faire joie 	A qui il deust fere ioie 	738
720	et feste 	et feste. 	739
721	et ore l’a perdu par sa mauvestié. 	et or la perdu par sa mauuestie. 	740
722	Et Galehodin	Et Galehoudin 	741
723	que Lanceloz ot abatu fu remontez 	que lanc̃. ot abatu. fu remontez 	742
724	si com il pot 	si comme il pot. 	743
725	et vient au roi Baudemagu 	et uient au roy badem̃. 	744
726	et se fait connoistre a lui; 	et se fet connoistre a lui.	745
727	et quant il le connoist, 	Et quant il le connoist 	746
728|729	si li fait molt grant joie |et li dist: « Sire, je sui venuz a vos, 	si li fet molt grant ioie et li dit. Sire ge sui uenuz a uous. 	747
730	que vos me diez 	que uous me diez.	748
731	qui li chevaliers est 	qui li cheualiers. est. 	749
732	qui si bien l'a hui fait par deça. — Biaux douz sire, fet Baudemaguz, 	qui la hui si bien fet par deuers uus. |Biaux douz sire fet badem̃. 	750|751
733	por quoi le me demandez vos ? — Sire, fait il, 	pour quoi le me demandez uous: Sire fet il 	752
734	por ce que je sui jones hom 	pour ce |que ge sui genties hom. 	753|754
735	et sai encore poi des ames: 	Et sai en encore poi des armes. 	755
736|737	si avroie mestier d’acointier moi d’.l. |si prodome	Si auroie mestier dacointier moi dun si preudome 	756
738	com il est, 	comme il est. 	757
739	por ce qu’il m’en apreist 	pour ce |quil men apreist 	758|759
740	et por ce que j’en amanderoie de lui et de sa compaingnie. — 	Et pour ce|que ge amenderoie de lui et de sa compaignie. 	760|761
741|742	Certes, sire, |s’il vos quenoissoit, il vos avroit molt chier, 	Certes sire sil uous connissoit il uous auroit molt chier. 	762
743	car il ama molt mon signor vostre oncle? 	Car il ama molt monseignor uostre pere. 	763
744	et vostre oncle? le rama molt, 	Et uostre pere le rama 	764
745	que onques hom n’ama plus autre. 	tant que onques home nama plus autre. 	765
746	Si vos di por voir 	Si uous di pour uoir. 	766
747	que ce est mes sires Lanceloz del Lac. — Lanceloz ? fait il. 	que ce est misire lancelot del lac. Lanc̃. 	767
748	Ne cuidoie je mie vraiement 	fet il ge quidoie uraiement 	768
749	qu’il fust morz? 	quil fust morz.	769
750	Mais puis qu’il est vis, je creant a Dieu 	Mes puis quil est uis. ge creant a dieu. 	770
751	que jamais ne finerai de chevauchier, 	que iames ne finerai de cheualcher 	771
752	se morz ou pris	se mort ou pris. 	772
753	ou malades ne sui, 	ou malades ne sui. tant	773
754	tant que je l’avrai trové. 	que ie laurai troue. 	774
755	Et quant je le verrai, 	Et quant ge le uerrai 	775
756	si li prierai por l’amor de mon oncle 	si li prierai pour lamour de mon pere 	776
757	qu’il tant ama 	quil tant ama. 	777
758	qu’il me retiengne avec lui 	quil me retiengne auec lui. 	778
759	et me lest aler par les estranges terres cerchier les estranges aventures o lui. 	et me lest aler par les estranges terres cercher les auentures aueuc lui. 	779
760	Et se il ce ne velt, totes voies m’aidera il mielz a conseillier 	Et se il ce ne uelt touteuoies maidera il mielz a conseillier 	780
761	que uns autres ne feroit. » 	que uns autres ne feroit. 	781
762	Atant s’em part del roi Baudemagu 	Atant sempart del roy badem̃.	782
763	et s’en vaît ainsi armez 	et sen uait einssi armez 	783
764	com il estoit 	comme il estoit. 	784
765	qu’il nel fait savoir a cestui ne a cest autre, 	quil nel fet sauoir a cestui na cest autre. 	785
766	ne n’anmainne avec lui escuier ne garçon; 	Ne nemmainne |auec lui escuiier ne garcon.	786|787
767	si se fiert en la forest aprés Lancelot 	Si se fiert en la forest apres lanc̃. 	788
768	et chevauche toute jor ajornee 	Et cheuauche toute iour a iornee 	789
769	qu’il n’ancontre home ne fame 	quil nencontre home ne fame 	790
770	qui noveles li die de ce 	qui nouele li die de ce 	791
771	qu’il quiert.	que il quiert.	792
