0	Einsi leissierent celui jor et toute la semainne 	Ainsi laisserent tout le iour et tote la cemainne. 	0
1	tant que Lanceloz fu gariz 	et tant que lanc̃ fu gatris 	1
2	et vient au chevalier 	et uient au cheualier 	2
3	qui avoit a non Carmadam et le mercie moult de ce 	qui ot non carmadans et le mercie mout |de ce 	3|4
4	qu’il li avoit fait. « 	qu il li auoit fait Sire fait il 	5
5	Si m’aïst Diex, je ne fuisse mie 	si maist diex ne fusse pas si liez 	6
6	si liez por le millor chastel 	qui me donast le millor chastel 	7
7	que li rois Artus ait comme de ce 	que li rois artus ait. |comme ie sui de ce 	8|9
8	que vos estes gariz. 	que uos estes garis. 	10
9	Si m’an est grant honors avenue. 	Si men est grans honors auenuee de ce 	11
10	quant tant avez demoré en mon ostel. « Biax sire, fait Lanceloz, je m’en voldrai demain aler, 	que uos estes tant demores auec moi. |Biax sire fait lanc̃ Ie men uodrai le matin aler. 	12|13
11	si vos demant congié. — Sire, fet il, jel vos otroi, 	et por ce uos demant congie. Sire fait cil 	14
12	puis qu’il vos plaist,	puis quil uos plait gel uos otroi. 	15
13	car outre vostre volenté ne vos retanroie je mie. 	Car contre uostre uolente |ne uos retenroie ie mie. 	16|17
14	Et alez, fait il, 	et ales uos en quant il uos plaira. 	18
15	que Nostre Sires vos conduie en quel que leu 	que nostres sires uos conduie en quel que lieu	19
16|17	que vos ailliez. — |Diex le face », fait Lanceloz. 	qu il uous plaira. Diex le face Sire fait lanc̃. 	20
18	Cele nuit fist li chevaliers plus grant feste 	Cele nuit fist li cheualiers grignor feste 	21
19	qu’il n’avoit fait devant. Au matin 	quil nauoit fait deuant. |Et au matin	22|23
20	quant Lanceloz fu levez, la pucele vint a lui, 	si tost com lañc. fu leuez uint la damoisele a lui. 	24
21	et quant il la vit,	Et|quant il lauoit 	25|26
22	si li dist: « Bele douce amie, bien puissiez vos venir! je m’en voil aler a vostre congié. — Sire, fait ele, vos savez bien les couvenances 	si li dit bele douce amie |bien puissiez uos uenir. Ie men uoil aler a uostre congie Sire fait ele uos sauez bien les couenances 	27|28
23	qui sont entre moi et vos 	qui sont entre moi et uous. 	29
24	et je ne sai 	et ie ne sa quant ie uos uerrai 	30
25	quant je vos reverrai mes. 	mais diex le saiche 	31
26	Et por ce vos demant je J. de voz joiaux 	et por ce weil ie |que uos me donez un de uos Iouiaus 	32|33
27|28	que je puisse garder |por l’amor de vos,	que ie puisse garder por amour de uous 	34
29	quant vos en serez 	quant uos en cerez ales.	35
30|31	alez,si que je vos en aie plus en remanbrance. — |Certes, damoiselle, fait il, volentiers. » 	et por ce que ie uos aie plus souant en remembrance Damoisele fait lanc̃ uolentiers. 	36
32|33	Lors prant une soie ceinture a membres d’or |qu’il avoit çeinte 	Lors prant unes Sainture a manbres doir 	37
34	que la roine li avoit donnee 	que la roine li auoit done 	38
35	et dist: « Damoisele, tenez. Sachiez 	et li dit. tenez damoisele |et sachiez uraiement	39|40
36	qu’il n’a el monde dame ne damoisele 	quil na el monde dame ne damoisele fors celi 	41
37	a cui je la donnasse. » 	qui la me dona |a cui ie la donaisse. 	42|43
38	Et cele l’an mercie moult, 	et cele len mercie mout. 	44
39	si la prant joieuse et liee, 	si en est mout lie |et mout Ioians. 	45|46
40	puis li donna J. fermail d’or 	puis li done .I. fermail dor 	47
41	et li prie 	et li dit 	48
42|43	qu’il le port a son col |por l’amor de lui, 	qui le port por amour de li. et il dit 	49
44	et il dist 		
45|46	que si fera il volentiers. |Lors demande ses armes 	que si fera il uolentiers por amour de li LOrs demande lanc̃ ses armes 	50
47	et l’an li aporte; 	et len li aporte 	51
48	et quant il fu armez bien et bel, 	Et quant il est armes bien et bel 	52
49	si prant congié a touz cels de laienz 	si prent congie a tous ceus de laiens.	53
50	et puis monte en son cheval 	et puis monte en son cheual. 	54
51	et s’em part entre lui et Lyonel et la vielle 	et part atant deus entre lui et lyonnel et la uielle 	55
52	qui les mainne tant amont et aval 	qui le mainne. |et les mainne tant et amont et aual 	56|57
53	qu’il vindrent au chastel 	que le mainne au chastel 	58
54	que li. V. frere tenoient 	que li .u. frere tenoient. 	59
55	que li dus Karles lor peres guerreoit, cil a cui Gaheriez aidoit. 	qui guerrioient kalles le duc leur pere. |Celui a cui Gaheries aidoit. 	60|61
56	Et quant Lanceloz i vint, il avoient ja perdu toute lor terre ne mes I. chastiax 	et quant lanc̃ i uint |si auoient tote lor terre perdue. ne mais .I. chastel 	62|63
57	dont il n’osoient issir 	ou il estoient 	64
58	et a la derrienne bataille avoient il perdu la moitié de lor homes. 	dont il nosoient Issir. et a la dairainne bataille |quil auoient eux auoient il la moitie de lor gent perdue. 	65|66
59	Et quant la vielle ot laienz mené Lancelot, il demande la verité de la guerre; 	quant la uielle ot amene laiens lanc̃. |si demanda la uerite de la guerre. 	67|68
60	se li conte l’an les greingnors mençonges del monde 	et cil li conterent les grignors mensonges dou monde 	69
61	et blasment le duc a merveilles 	et blasment Le duc de tout lor pooir. 	70
62	et Lanceloz cuida	Et lanc̃ cuida 	71
63	que ce fust voirs: 	quil deissent uerite. 	72
64	si jura son sairement 	si Iura 	73
65	qu’il ne lairoit jamés les V. freres devant 	quil ne lairoit les .u. freres deuanent 	74
66	que li dus fust deseritez, 	que li dus fust desserites. 	75
67	et ansi fist Lioniax. 	et ausi fit lyonnias. 	76
68	Quant la vielle vit 	Qnent la uielle sot 	77
69	qu’il l’orent ainsi juré, 	quil orrent ainsi iure 	78
70	si vint as V. freres 	si uient au .u. freres.	79
71	et lor dist: « 	et lor dit. 	80
72	Biax signor, il vos est mielz avenu 	Signor il uos est miex auenu 	81
73	que vos ne cuidiez, 	qu il nauint onques mais a cheualiers. 	82
74	car je vos ai ceanz tels Il. chevaliers amenez 	Car ie uos ai amene tex .ii. homes	83
75	qui mestront vostre guerre a fin ainz I. mois. »	qui metront uostre guerre a fin : dedens .I. mois. 	84
76	Et cil demandent 	et cil demandent 	85
77	qui il sont. « 	qui il sont. 	86
78	Par foi, fait il, les nons ne poez vos ore pas savoir par moi, 	par foi fait |ele le non dax ne poez uos mie bien ore sauoir par moi 	87|88
79	car il le m’ont desfandu ; 	car il le mont desfandu. 	89
80	mais itant vos di je bien 	Mais li uns est li mieudues cheualiers del monde. |et por ce uos loie 	90|91
81	que vos ailliez a aux 	que uos alliez a eus. 	92
82	et lor faites si grant feste 	et leur faites si grant ioie 	93
83	com l’an doit faire a II. si prodomes. » 	q len doit faire a .ii. preudomes. 	94
84	Et cil les vont maintenant veoir et lor font la greingnor joie del monde 	maintenant les uont li dui frere ueoir |et leur font la grignor feste del monde.	95|96
85	et se prometent i del tout a lor servise; 	et se presentent del tout en lor seruisse. 	97
86	si firent la nuit moult grant feste a l’un et a l’autre. 	Cele nuit fu mout grans la feste |que len fist a lanc̃ et a lyonnial son cousin. 	98|99
87	Et au matin les menerent oîr messe a une chapele 	Et au matin 	100
88|89	qui laienz estoit. l. |poi aprés prime conmancerent a crier par le chastel : « 	quant il furent leue et uestu et aparilliet.	101
90	Or as armes ! Montez, seingnor chevalier,	Si les menerent oir messe a une chapede |qui laiens estoit. .I. pou ap̾s messe comancerent a crier or as armes. signor cheualier 	102|103
91	car nostre annemi sont ja a noz murs. » 	car nos anemis sont ia a nos murs. 	104
92	Et li V. frere sont venu a Lancelot 	et li .u. frere sont uenu a lanc̃. 	105
93	et li demandent 	et li demandent 	106
94	s’il voldra porter armes	se il uodroit porter armes. 	107
95	et il dist 	et il dit 	108
96	qu’il nel lairoit en nule manniere 	qu il ne leiroit en nule maniere 	109
97	qu’il n’alast veoir	qu il nalast ueir 	110
98	conment cil defors sevent jouster, « 	comment cil de bois Ioustent. 	111
99	mais je voil, fet il 	Mais ie ueil fait il 	112
100	que vos ailliez avant, 	que uos ailliez auant 	113
101|102	et se? je voi |que vos aiez mestier de mon cors, je vos secorrai. » 	et ce uos auez mestier de moi: Ie uous cecorrai au plus tost 	114
103	Lors fait aporter ses armes, 	que ie porrai tant fait aporter ses armes enmi la place. 	115
104|105	et|quant il est armez et bien et bel, 	et quant il fu armez et bien et bel.	116
106	si s’an vait dusqu’a la porte del chastel 	Si sen ua deuant la porte del chastel. 	117
107	et fait mener encoste lui son destrier, 	et fait mener deuant soi son destrier 	118
108	puis monte as creniax 	Si monte as creniax 	119
109	por veoir 	por ueoir 	120
110	conment cil defors assembleront a ceaux dedenz,	comment cil dehors assanblerent a ciax dedens. 	121
111	et avez lui Lionnel. 	et auec lui furent li .u. frere 	122
112	Et li V. frere orent fait armer lor genz au mielz 	qui orrent fait lor gent armer. |et lyonnel au miex 	123|124
113	qu’il pueent, 	quil port̶rent. si en issent hors. 	125
114	puis issent fors contre lor ennemis et les reçurent assez bien 	et requierent lor anemis. |et le fissent assez bien a ce 	126|127
115	a ce qu’il estoient poi de gent, 	quil auoien pou de gent. 	128
116	et li autre en avoient moult; 	et li autre en auoient grant plante. 	129
117	si conmancerent la mellee moult dolereuse 	et commancerent la mellee mout fellenesse. et mout dolereuse 	130
118	dont il i ot maint chevalier mort et anversé a terre. 	dont maint preudome et maint cheualier chairent a terre tuit enuers 	131
119	Si s’anfoïrent cil del chastel 	Si soufrirent tant |et andurerent cil del chastel. 	132|133
120	tant que Gueheriez 		
121	et si dui frere vindrent a la bataille a tout grant planté de gent. 	que gaheries et si dui frere uindrent a la bataille. |atot grant compaingni de gent. 	134|135
122	Si tost com il furent assemblé, 	Si tost comme il furent entre en la mellee 	136
123	conmancerent a ferir et a abatre 	si commancerent a ferir tout entor eus. et abatre |quanquil ataingnent. 	137|138
124	ne onques puis ne se tindrent li .V. frere, 	Ne conques puis ne se porrent tenir li .u. frere. 	139
125	ainz les couvint foir, 	ains Les en couint foir. 	140
126	ou il volsissent ou non : 	ou il uosisent ou non. 	141
127	si ont assez perdu a cele empainte. 	Si i perdirent assez de lor homes a cel enpointe. 	142
128	Et quant Lanceloz vit 	quant lanc̃. uit 	143
129	que li .V. frere furent desconfit, 	que li .u. frere estoient desconfit 	144
130	si dist a Lion	si uint a lyonnel.|et li dit 	145|146
131	que or a il trop atendu ; 	que or a il assez atandu. 	147
132	si descent des creniax et monte en son cheval 	Lors descent des creniax |et monte en son cheual. 	148|149
133	et Lion ausinc; 	et Lyonnias monte el cien. 	150
134	si s’an issent par mi la porte. 	si sen issent par laporte. 	151
135	Et Lanceloz ne resgarde onques fors la 	et lanc̃. ni regarde onques ne mais |que la 	152|153
136	ou il voit la greingnor presse ; 	ou il uoit la plus grant presse 	154
137|138	si torne cele part |et se fiert entr’aux	si ce fiert et se torne entr eus. 	155
139	et si fiert le premier 	si fiert le premier si durement 	156
140|141	qu’il ataint |qu’il le rue mort, 	quil le geste mort contre terre. 	157
142	puis point outre 	Puis point outre 	158
143	et en abat I. autre, 		
144|145	ausi fait Lion. |Et Lanceloz ot mise la main a l’espee 	et abat .i. autre. et ausi fait lyonnias. LOrs a mis lanc̃. la main a lespee. et fu entalentes de faire darmes. 	159
146	et il ert entalantez de faire d’armes, 	et demoustre mout grant proesce et hardement.	160
147	car grant pieça n’en avoit riens fait; 	Car piesa ne sen nestoit entremis. 	161
148	si conmance a ferir granz cox tout entor lui 	Si coumance a ferir de lespee tout entour lui. 	162
149	et abat chevaliers et chevaux? 	et ocit cheuaus et cheualiers 	163
150	et occist	et abat 	164
151	quanqu’il encontre; 	quanqu il ataint. 	165
152	si fait tant em poi d’ore 	Si fait tant en petit de terme 	166
153	que nus ne l’ose atandre, 	que nus |qui le uoie ne lose atandre a cop. 	167|168
154	car il occist 	Car il uoient bien |qu il mehaingne 	169|170
155|156	quanqu’il ataint. |Et la ou il encontre par aventure Gaheriet, 	quanqu il ataint. 	171
		Si auint par auanture 	172
		qu il encontra Gaheriet.	173
157	si li done tel cop par mi le hiaume 	Si li done en son uenir si grant cop en son hiaume	174
158	qu’il li fait santir dusque el test, 	quil li fait sentir sespee iuques en test. 	175
159	mais ne l’a mie navré a mort. 	Mais ne la mie naure a mort. 	176
160	Et cil vole des arçons, 	et il uole ius des arsons |que del cop que de la plaie. 	177|178
		Dont il estoit si angoisseus 	179
161	qu’il cuide bien morir. 	qu il en cuidoit bien morir. 	180
162	Et Lanceloz s’em passe outre, 	et lanc̃. sen passe outre 	181
163	que plus nel resgarda, 	que plus nel regarde.	182
164	si choisi le duc en son venir, 	Lors choisit le duc en son uenir 	183
165	que l’en li ot bien monstré, 	que len li ot |moustre.et	184|185
166	et il li vient l’espee adrecie contremont 	ciz li uient lespee contremont drecie. 	186
167	et le fiert 	et le fiert si durement 	187
168	si que anz el hiaume li fait le branc d’acier entrer plus de Il. doie, 	que dedens le hiaume li fait lespee entrer. plus de deus doies. 	188
169	mes ne l’a blescé mie en char. 	Mais en char ne la mie blecie. 	189
170	Et Lanceloz ne l’espargne de riens, 	et lanc̃ ne lespargne de riens.|ains le fiert si durement de toute sa force 	190|191
171	ainz le fiert desus la destre espaule 	sor la destre espaule |quil li tranche le haubert 	192|193
		et lespee li descent sor le bras. 	194
172	si qu’il li tranche l’espaule et le poing senestre a tout l’escu. Il recuevre l. autre cop 	si li cope le poing destre atout lescu. |Puis le refiert Si durement 	195|196
173	et li fait la teste voler 	quil li fait la teste uoler. 	197
174	et cil chiet morz, 	et ciz chiet mors	198
175	dont il ert granz domages. 	dont ce fu grans damages. 	199
176|177	Et quant li autre voient le duc mort, |si tornent en fuie, 	et quant la gent le duc le uoient si tornet en fuie. 	200
178	que plus n’i osent arester; 	que plus ni osent arester. et lanc̃.	201
179	et Lanceloz et lij sien les enchaucent, 	et li sien les enchaucent. 	202
180|181	si prannent Guerehet et Agravain |qu’il ne voloient torner del champ por lor frere Gaheriet 	et prannent agrauain et gaheriet por le frere 	203
182|183	qu’il i laissoient; |si pristrent tant des autres	quil cuidoient 	204
184|185	com il voldrent. |Et li V. frere 	quil fust mors. et li .u. frere 	205
186	qui orent veu Gueheriet cheoir	qui orrent ueu gahient cheoir. 	206
187	et qui bien connoissoient 	et qui bien lo quenoissoient 	207
188|189	qu’il avoient le tout perdu par sa prouesce le prannent |et le font mener en lor chastel. 	et que mout auoient perdu par sa proesce: le prannent et mout dautres auec lui. et les font mener el chastel. 	208
190	Si ne fu onques si grant feste 	Si ne fu onques si grans feste	209
191	com il firent de Lancelot, 	com cil de laiens font a lanc̃. 	210
192	car il crioient tuit, 	Car il crioient tuit a une uois 	211
193|194	si com il passoit: « |Bien veingne li mieldres a chevaliers del monde!» 	si comme il paissoit parmi les rues: bien uaingne la flors de la cheualerie del monde. 	212
195	Ensi crioient tuit grant et petit contre Lancelot 	Bien uaingne li mieudres des bons	213
196	et il avoit moult grant honte de ce 	Et il a grant honte de ce 	214
197	qu’il disoient 	quil dient. 	215
198	et moult a li pesoit 	et mout li poise de ce 	216
199|200	qu’il le seingnorisoient tant, ja soit ce |qu’il l’eust bien deservi.	qu il lonorent 	217
201	Quant Lanceloz vient en mie la rue, 	.si quant il uiennent parmi les rues 	218
202|203	si la trouva toute portandue de dras de soie et de pailles |et fu toute encortinee contre lui por honor de lui. 	si les trueue totes couertes de cendax. et de pailes. et toute la uille encontre lui. 	219
204	Si le reçoivent a si grant feste	Si le resoiuent a si grant honor	220
205	com il pueent plus, 	comme il porrent plus. 	221
206	et il l’orent desarmé, 	et quant il lorrent desarme 	222
207	si li aportent I. robe de cendal vermeille tote fresche. 	si li aportent Robe de cendal tote fresche 	223
208	Et quant il est vestuz et apparilliez, il demande a veoir les III. 	Qnent lanc̃ fu uestus et aparilliez si demanda a ueoir les .iii. chrl̃s 	224
209	qui pris estoient, cels 	qui furent orains pris. Cex 	225
210	qui estoient armé tuit d’unne manniere 	qui estoient tuit arme dune maniere. 	226
211	et il les avoit toute jor trop couvoitiez a veoir, 	Car i les auoit le Ior mout counoitiez a ueoir 	227
212	car moult l’avoient bien fait en la bataille, 	car il lauoient. mout bien fait le Ior a la bataille. 	228
213|214	et|ce estoient li III. frere. 	et cestoient li .iii .frere. 	229
215	Et l’an les vait ! querre maintenant	et len les uait maintenant	230
216	et quant il les vit venir, 	querre.et si tost comme il les uit 	231
217	si les connut bien, 	si les connut bien de loing. 	232
218	mais por ce 	et pour ce 	233
219	qu’il ne voloit mie 	quil ne uoloit mie 	234
220	qu’il le conneussent, les fist metre arriere.	quil le queneussent les fist il remener ariere. 	235
221	Si est tant dolanz de ce 	Mais il est si dolent |et si courreciez de cen 	236|237
222	qu’il a esté contre els en ceste bataille 	quil a este contre eus en la bataille 	238
223	que il ne set 	quil ne set 	239
224	qu’il doie faire: 	quil doie dire |ne faire del courrous 	240|241
225	car moult amoit Gaheriet de grant amor, 	quil en a|car mout amomoit Gaherret de grant amor. 	242|243
226	et d’autre part il l’am poise moult 	et dautre part il len pesoit mout 	244
227	por amor de Gauvain lor frere: 	por amor monsignor .G. lor frere. 	245
228	puis conmande a cels de laienz 	si commande a ciax de laiens 	246
229	qu’il lor ? facent tant d’onor 	quil leur facent donor 	247
230	com il porront, « 	tant comme il pueent. 	248
231	car je vos di, fait il, 	Car ie uos di fait il loiaument 	249
232	qu’il sont moult prodome et de haut lignage et bon chevaje 	que il sont mout preudome et de haut lignage. |et si uos di uraiement 	250|251
233	n’i eusse ja escu font cil oster de la prison	que ce ie cuidaisse |que il fussent contre uous. Ie ni eusse ia escu pris 	252|253
234	et les font a metre en l por aux grever. » 	ne cop feru |por eus greuer. 	254|255
235	Lors les oriez les en avoit. 	Lors les font li frere mestre hors de prison. |et mener en une chambre mout bele et mout riche. et font regarder la plaie Gaheriet. 	256|257
236	Cele nuit fu la joie et la feste moult grant el demander ; 	et li font tout le bien |que il pueent 	258|259
237	si le couchent a aise et a moult grant onor. 	Si le uirent mout honorablement |por ce que lanc̃. lauoit commande. 	260|261
238	Et l’andemain 	Car proiez les en ni auoit |Cele nuit fu mout grans la feste et la Ioie el chastel. 	262|263
		et ce lanc̃ fu bien seruis et honores de tout Lor pooir ce ne fait mie a demander. 	264
		et le coucherent mout souef et mout a aise. A landemai,	265
239	qu’il ot oïe messe, vint a vielle 	quant il ot messe |oie il uint a la uielle 	266|267
240	qui laienz l’avoit amené 	qui laiens lauoit amene. 	268
241	et li dist: « Dame, je e sui vers vos aquitez. il, par la riens 	et li dit dame |sui ie bien aquites enuer uous.	269|270
242	que vos plus amez Sire, fait ele, ofl. — 	Certes sire fait ele oil mout bien. 	271
243	Or vos quue vos a home 	Or uos pri ge donc fait il par la riens |que uos plus amez an cest monde	272|273
244	qui demant de moi 	que uos a nelui 	274
245	ne dioiz mon non ie ne faites savoir 	qui de moi demant ne dites mon non.|ne 	275|276
246	qui je sui. 	qui Ie sui. 	277
247	Et savez vos 	et sauez uos 	278
248	por quoi je le di ? Cil III. chevalier prison sont frere mon signor Gauvain 	por quoi gel di. Cil troi cheualier prison |que Ie mandai er soir sont frere monsignor .G.	279|280
249	et tant les aim	Si les ain tant de bone amor 	281
250	que je ne voudroie mie 	que ie ne uoroie por rien 	282
251	qu’il seussent 	quil seussent 	283
252	que je eusse esté contre aux, 	que ie eusse este contre eus en ceste bataille.	284
253	car il m’an harroient par aventure; 	Car il me harroient par auanture. 	285
254	et por ce ne voil je mie 	et |por ce ne ueil ie mie 	286|287
255	qu’il sachent mon non. » 	quil saichent mon non. 	288
256	Et ele dist 	ni |qui ie sui. et la uielle dit 	289|290
257	qu’ele nel descouverra ja a nul home. Il vient as .V. freres 	qu ele ne le descouuera Ia a home ne. |et lors uint lanc̃ a .u. 	291|292
258	et lor dit 	freres.et lor dit 	293
259	que li III. chevalier soient quite et mis fors de prison	quil wet |que li cheualier soient cuite et mis hors de prison. 	294|295
260	et cil dient 	et cil dient 	296
261	qu’il le feront tot a sa volenté; « 	quil en feront sa uolente. 	297
262	et ancore vos pri je, fait il, 	et encor uos pri ge fait lanc̃. 	298
263|264	que quant je m’en serai alez,|que vos retaingniez les III. freres çaienz 	que si tost comme ien ferai ales les tenes trois Iours ou quatre. 	299
265	et lor faites tant d’amor et d’onor 	et les ceiornes tout a ais |et lor faites tant donor 	300|301
266	que je vos en saiche gré; 	que ie uos en saicle gre. 	302
267	car bien sachiez 	Car bien saichiez uos uraiement 	303
268	qu’il sont mi ami. » 	qu il sont mout mi ami. 	304
269	Et il dient 	et cil respondent |quil en soit tout asseur 	305|306
270	que si feront il sanz faille. 	que|si feront il. 	307|308
271	Lors demande Lanceloz ses armes 	Atant demande lancelos ses armes. 	309
272	et cil dient? 	et cil dient 	310
273	qu’il demort encore,	que il demoure encor laiens 	311
274	car trop a poi demoré avec aux; mes il dist 	que tͦp petit i a ceiorne. |mais il dit 	312|313
275	qu’il ne remaindroit en nule mannierea; 	quil ne demorroit plus en nulle maniere. 	314
276	si s’em part entre lui et Lion. 	Si sen part atant entre lui et lionnel. 	315
277|278	Et|quant il sont monté, li V. frere viennent a Gaheriet 	et quant il fuostret ale li .u. frere uinrent a gaher 	316
279	et le metent fors de prison 	et losterent de prison. 	317
280	et li font toute la joie 	et lor firrent tote la feste 	318
281	qu’il li pueent faire a lui et a ses freresb. 	quil porrent. 	319
282	Et il demande maintenant	et lor demandent a ciax de laiens 	320
283	qui li chevaliers est 	que li cheualier̾s estoit 	321
284	par cui il ont esté desconfit 	qui les auoit ainsi desconfis en la bataille. 	322
285	et il dient 	et cil dient 	323
286|287	qu’il ne sevent, |se Diex lor aïst. — 	qu il nen seuet riens. 	324
288	Par foi, fait Gaheriez, 	Certes fait Gaher. 	325
289	ce ne puet estre, 	ce ne puet estre. 	326
290	car des voz fu il et avec vos vint il çaienz. — 	car de uos gens cuideroie ge bien |quil fust. 	327|328
291	Par foi, font ? il, de notre gent ne fu? il pas, 	Sachiez font il uraiement |que non lestoit. 	329|330
292	mais il nos aidoit por l’amor d’une dame 	Mais cest uerites |qu il nous aidoit por amour une dame 	331|332
293	qui ceanz est, 	qui saian est 	333
294	ne onques son non 	et saichiez |que son non	334|335
295	ne nos vost dire	ne nous uout il onques dire. 	336
296	ne onques ne le veismes. 	ne soi descourir. 	337
297	Mais il nos pria tant de vos servir et de faire toute l’onor 	Mais il nous pria au departir |que nous nus pennissiens de uos ceruir. 	338|339
298	que nos porrions, 	et donorer a nostre pooir. 	340
299	car il dist	Car il nous dit 	341
300	que vos estiez moult si ami. » 	que uos estiez mout ci ami. 	342
301	Lors se merveillent trop 	quant cil oirent ceste nouelle |si se meruillerent mout 	343|344
302	qui ce puet estre, 	que li cheualiers pooit estre. 	345
303	si demandent de quel corsage ! il estoit 	Si demandent de quel corage il estoit. 	346
304	et de quel façon. « 	et de quel sanblant. 	347
305	Par foi, fait il, ce est J. des plus biaux chevaliers del monde 	Si maist diex font il cest li plus biax cheualiers dou monde. 	348
306	et est I. poibrunez 	et est 	349
307|308	et ne puet pas avoir plus de XXVI. anz |et est tonduz de novel. »	Et si est tousez tout de nouel. 	350
309	Et quant il oient cels paroles, 	quant il entandent ceste nouelle 	351
310	si sont plus desvoié que devant,	si sont plus esbahi que deuant. 	352
311|312	si ne sevent que dire, |si demorent laienz une semainne entiere et	Si demorerent laiens une cemainne. toute entiere. 	353
313	tant que Gueheriez fu auques gariz. 	tant que Gaher. fu tous sains. et|quant il fu garis 	354|355
314|315	Lors s’am partirent tuit III. et demandent |quelz armes li chevaliers emporta, 	si sen partirent tui troi et au departir demanderent ques armes li cheualiers en porta 	356
316	quant il s’em parti 	quant il sen parti. 	357
317	et il dient « unes noires 	et il dient unes totes noires 	358
318	et un escu blanc a I. lion noir. » 	et .i. noir escu et .i. blanc haubert. |et en son escu apoint .i. escu blanc. 	359|360
319	Et il se metent aprés tot le chemin 	et il sen tornent apres si grant aleure 	361
320	que cil lor enseingnierent, 	que il porrent plus. 	362
321|322	car il le cuident bien trouver as enseingnes |que il porte.	Car il cuidoient bien trouer a s ensangnes des armes. 	363
323	Et Lanceloz a tant chevauchié, 	et lanc̃ auoit cheuauchiet le premier Ior 	364
324|325	quant il s’en fu partiz |et il et Lion, sanz aventure trover 	quil sen estoit partis tout entierement entre lui et lyonnel. sans auanture trouer 	365
326	qui a conter face, 	qui a conter face. 	366
327	qu’il jurent la nuit chies une veve dame 	et furent la nuit chiez une ueue dame mout cortoise et mout uaillant. |qui mout bien les herbreia 	367|368
328	qui bien les herberja. Au matin 	et aisa de tout son pooir. |Car ele estoit mout genti fame. Au matin 	369|370
