1057|1058	quant ceste damoisele voliez honir a force. » |Lors hauce l’espee 	por buena fee non vos valdra oy nada su ayuda dellos 	955
1059|1060	et cil velt foïr, |mais il ne puet, 	ca vos moriredes antes como traidor 	956
1061|1062	car Lanceloz le fiert |si de l’espee	que queriades desonrrar ala mejor donzella del mundo 	957
1063|1064	qu’il li tranche l’espaule senestre, |et cil chiet a la terre 	y entonzes alzo la espada porlo ferir 	958
1065|1066	qui navrez se sent a mort. |Et li autre acourent 	y el Cauallero quiso fuir 	959
1067	por lui aidier	mas non pudo 	960
1068|1069	et Lanceloz lor laisse corre. l’espee traite, |si en occist IlI. tantost a ce 	y don lanzarote lo firio ansy quele Corto toda la espalda siniestra conel braço 	961
1070	qu’il les troeve desarmez; 	y cayo luego muerto en tierra 	962
1071	et li autre tornent an fuie a ce 	y los otros quisieronlo acorrer 	963
1072	qu’il ont paor de morir 	mas don lançarote quelos fallo desarmados 	964
1073|1074	et s’an vont plus |que le pas vers la montaingne. 	mato luego los dos dellos y los otros fueron poresas montañas 	965
1075	Et Lanceloz prant le millor des III. chevax 	e desque esto ouo fecho don lançarote tomo vn cauallo de los mejores 	966
1076	por ce qu’il avoit le suen perdu 	que ay fallo 	967
1077	et lesse les autres aler par la 	y torno ala donzella 	968
1078	ou il vuelent; 	que estaua asentada y espantada 	969
1079	puis vient a la damoisele	y quando lo ella vio le dixo 	970
1080	qui ert toute esbahie 	vos me librastes señor 	971
1081	dont Lanceloz pooit venir 	y sodes vos don lançarote 	972
1082	et li demande: « Biaux sire, 	si sin falla dixo el 	973
1083|1084	qui rescousse m’avez, estes vos Lanceloz ? » |Et il dist oil 	Entonçes 	974
1085	et oste son hiaume, 	se quito el yelmo 	975
1086	por ce qu’ele le quenoisse mielz.	porque lo conoçiese 	976
1087|1088	Et quant ele set |que ce est il, 	y quando lo ella Conoçio fue tan alegre 	977
1089	si est tant liee	quanto enel mundo 	978
1090	que nule plus ; 	mas no podia ser 	979
1091|1092	si li giete les braz au col et li fait la greingnor joie |qu’ele puet 	e Comenzolo de abrazar muchas vezes 	980
1093	et li demande 	y dixole 	981
1094	quele aventure l’a illuec amené et a quel ore. 	señor qual auentura vos traxo aqui a tal tiempo 	982
1095	Et il li conte? 	quando vos vbe tanto menester |y ella Conto lo que le acaesçiera conla fija del Rey peles 	983|984
1096|1097	conment il avoit perdu son cheval |ne ne pooit el chastel entrer, 	y como perdiera su Cauallo entrante enel Castillo 	985
1098|1099	et|por ce estoit il venuz souz les arbrisiaux 	y poreso vine aqui 	986
1100	tant que il fust jorz. » Sire, fait ele, vos ne manjastes anuit 	fastaque fuese de dia señor dixo ella 	987
1101	ne ier par aventure. — 	creo que anoche ni oy no hauedes comido 	988
1102	Vos dites voir, fait il. — 	verdad es dixo el |pues señor dixo ella 	989|990
1103	Or vos dirai, fait ele, 	yo vos dire 	991
1104	que nos ferons. Montons sor noz chevax 	que fagamos Caualguemos 	992
1105	et alons chies une moie cousine 	y vaiamos a Casa devna mi hermana 	993
1106	qui ci pres maint a pres de demi liue et illec trouverons a mengier et a boivre 	que esta çerca de aqui |y fallaremos 	994|995
1107	et biaux liz a noz voloirs. » 	y todo quanto hubieredes menester mucho me plaze 	996
1108	Et il dist 	dixo el 	997
1109|1110	que ce velt il bien, |car ausint ne feroient il riens illuec. 	que ya non tenemos aqui que fazer 	998
1111	Quant il sont monté, 	Como don lançarote aluergo conla hermana desu amiga |Entonzes Caualgaron 	999|1000
1112	si tornent a destre del chemin 	y fueron porsu camino 	1001
1113	et vont tant 	y andubieron tanto 	1002
1114	qu’il viennent a l’entree d’un petit boschet, 	que llegaron auna Casa 	1003
1115	si voient illuec une maison batillie close de fossez 	que hera muy fermosa 	1004
1116|1117	et troevent le pont levé. La damoisele huche le portier |et cil 	y desque llegaron aella fallaron vna puerta hechadiza 	1005
1118|1119	qui bien le connoissoit ist fors em braies et an chemise, |si avale le pont. 	Por do pasauan la puente 	1006
1120	Et la damoisele li dist: « Va tost, 	y la donzella començo a llamar al portero 	1007
1121|1122	si esveille ma cousine |et li di 	y desque la conoçio salio luego fuera 	1008
1123|1124	que je li amaing I. chevalier |de qui ele sera molt liee, 	y alço la puerta dela puente 	1009
1125|1126	quant ele le connoistra». |Cil cort por faire son conmandement 	y entro luego y dixole la donzella ve ayna 	1010
1127|1128	et Lancelot entre lui et la damoisele passent le pont|et descendent en mi la cort. 	y dile ami cormana 	1011
1129|1130	Et ne demora gueres |que li sires de laienz et la dame furent revestu et apparillié; 	que le traio vn huesped 	1012
1131|1132	si issent fors de la chambre |et font cierges alumer 	con que sera muy alegre 	1013
1133|1134	por veoir cler. |Si viennent a la damoisele 	desque lo conoçiere 	1014
1135|1136	et li font trop grant joie |et ele dist a sa cousine 	y el portero fizo luego su mandado y don lançarote y la donzella entraron 	1015
1137	qu’ele la lest ester 	y desçendieron enel Corral 	1016
1138|1139	et face joie au chevalier |qu’ele a amené, « 	y el señor dela Casa y su muger salieron aellos 	1017
1140	car bien saichiez, fait ele, 	y Resçiuieronlos muy bien 	1018
1141|1142	que a plus prodome de lui ne poez vos servir. » |Et cele demande	y la dueña del Castillo dixo asu cormana 	1019
1143	qui il est 	quien es este cauallero 	1020
1144|1145	et ele dist |que c’est Lanceloz del Lac. 	y ella dixo sabed que este es don lanzarote de lago 	1021
1146|1147	Lors li font tuit molt grant joie |et le font desarmer. 	y quando ella lo oyo fue muy alegre 	1022
1148|1149	Et la damoisele dist |que l’an lor apareille a mengier, 	y desque lo conoçieron fizieron conel mucha alegria conel todos 	1023
1150|1151	car il ne mangierent anuit, |et li sires de laienz le dist a ses genz 	y desarmaronlo y dieronle muy bien de Comer 	1024
1152|1153	qui bien en firent son conmandement, |car il distrent 	y fizieronle muy buen lecho 	1025
1154|1155	que tout ert prest.|Si fait mestre les tables 	e durmio fasta otro dia de mañana 	1026
1156|1157	et mengierent |tant com lor plost; 	que mucho le hera menester y otro dia de mañana preguntaron el huesped y la huespeda Ala donzella amiga 	1027
1158|1159	puis s’alerent couchier |et dormirent. Au matin J. 	que auentura vos traxo aqui anoche 	1028
1160|1161	poi aprés prime se leverent cil de laienz |et demanderent a la pucele 	y ella selo conto todo 	1029
1162	quele aventure l’avoit ersoir amenee a tele ore, 	ansi como el Cuento voslo a deuisado 	1030
1163	et cele lor conta 	Pordios dixeron ellos 	1031
1164	conment il lor estoit avenu 	bos fuistes bien andante 	1032
1165|1166	et conment I. chevaliers l’eust honnie, |se ne fust Lanceloz 	E don lançarote desque desperto vistiose 	1033
1167|1168	qui l’an garda |et li dist 	e vinose al palaçio 	1034
1169	que moult li a Diex aidié selonc les aventures 		
1170|1171	qui avenues li sont. |Quant Lanceloz fu vestuz 	e demando sus armas 	1035
1172|1173	et apparilliez, il vint en la sale |et salua son oste et dist 	y armose y subio ensu caballo y el huesped le dixo 	1036
1174|1175	que bon jor li donnast Diex. « Sire, fait Lanceloz, faites moi mes armes aporter, |car je ne voil plus demorer. » 	señor Do queredes yr aqui a vn castillo 	1037
1176	Et cil commande		
1177	que a l’an les aport, 	que esta enesta Montaña 	1038
1178|1179	mais ainz le fist mangier tout par loisir; |aprés li fait baillier ses armes 	dios vos ende guarde 	1039
1180	et il les prant »,	dixo el huesped 	1040
1181|1182	Ét quant il fu armez, li sires li demande |ou il velt aler 	que çinco años a que vn cauallero guarda la entrada 	1041
1183|1184	et il dist |qu’il voldroit estre au chastel 	y es tan buen Cauallero 	1042
1185|1186	qui est laissus en I. montaingne. « De la aler, fait li sires, vos garde Diex ! je nel vos loeroie en nule manniere, |car plus a de V. 	que por ay nunca paso Cauallero 	1043
1187|1188	anz |que chevaliers n’i pot antrer 	quelo non mastase 	1044
1189	qui ne moreust ou fust emprisonnez. — 	o lo non metiese en prision 	1045
1190	Comment fu ce dont? fait Lanceloz. Il covient 	que amarauilla es de gran bondad de armas 	1046
1191	que vos le me diez. — 	e porende vos consejo 	1047
1192	Et jel vos dirai volentiers. Il a I. an 	que no vayades alla en ninguna guisa del mundo 	1048
1193	et plus c’uns chevaliers garde l’antree 	Porçierto 	1049
1194	que nus n’i antre	dixo don lançarote 	1050
1195|1196	qu’il a ne conqueist par prouesce d’armes, |et por ce ne vos loeroie je en nule manniere a aler cele part, 	no dexaria de yr alla 	1051
1197|1198	car vos n’am porriez partir sanz bataille. — Enon Deu, fait Lanceloz, je ne lairoie en nule maniere |que je n’i alasse, 	por auentura 	1052
1199	car je i perdi mon cheval ersoir ne sai en quele manniere. — 	que me ende viniese ca yo perdi ay mi cauallo |e no se como 	1053|1054
1200	Puis que vos avez si grant talant d’aler i, fait li chevaliers, g’irai o vos et verrai l’onor 	Como el Cauallero Contaua a don lançarote |que estor de Mares hera su hermano 	1055|1056
1201	que Diex vos fera 	Pues ansi es dixo el huesped que todavia quereis yr alla yo quiero yr conbusco 	1057
1202	et vos conterai entre ci et la tel chose 	y tales cosas vos dire porel Camino 	1058
1203	par coi ceste bataille devroit remanoir. 	que vos plazera de dexar la vatalla 	1059
1204|1205	Lors dist a ses sergenz |qu’en li aport ses armes, 	y luego pidio sus armas y cauallo y armose y caualgo y fuese conel 	1060
1206	car il voldra a mon signor Lancelot faire compaingnie dusque au chastel. 	y la donzella dixo a don lançarote 	1061
1207|1208	Et quant il est armez|et il sont andui monté, la damoisele dist a Lancelot: « Sire, je ai oï dire 	señor ocho dias despues del dia de sancta maria magdalena 	1062
1209	qu’il avra I. tornoiement a Kamaalot. I serez vos ? — 	a de hauer vn gran torneo en Camalot 	1063
1210|1211	Por quoi le demandez vos ? — |Por ce	y porque dezides eso dixo el 	1064
1212|1213	que se je vos i cuidoie veoir, je ne lairoie en nule manniere |que je n’i alasse. — 	señor dixo ella 	1065
1214	Et je vos di, faît il,	porque si yo supiese 	1066
1215	que g’i serai, 	que vos fuesedes 	1067
1216	se je sui en ma lige poesté. — 	y non dexaria |por cosa del mundo de yr alla yo vos digo dixo el 	1068|1069
1217|1218	Or alez |dont, fait ele, a Dieu, 	que si dios me guarda y me da salud 	1070
1219	car je vos i verrai, 	que yo sere 	1071
1220	se merveille n’est.» Il s’em partent maintenant. 	y pues agora vos acomiendo a dios dixo la donzella 	1072
1221|1222	Quant il sont I. poi esloingnié del chastel, |si dist li chevaliers a Lancelot : « Sire, vos estes de la meson le roi Artu et compaingnon de la Table Reonde 	y fuese luego don lanzarote Consu huesped 	1073
1223|1224	et par ce cuit je bien |que vos quenoissiez cels 	y yendo ambos porel gran camino 	1074
1225	qui en sont conpaingnon. » 	dixo el huesped 	1075
1226	Et il dist 	a don lanzarote 	1076
1227	qu’il ne repaire mie a cort moult, e 	vos sodes dela casa del Rey artur 	1077
1228	et par ce nes? 	y compañero dela tabla Redonda 	1078
1229|1230	puis je pas connoistre touz, mais les plus erranz |et cil 	e porende conosçeredes los mas delos caualleros 	1079
1231	qui plus quierent aventures cuit je bien connoistre ; 		
1232	et si en i a il maint 	que y son todos los mas 	1080
1233|1234	que je ne connoiz mie, |ce poise moi, 	que demandan las auenturas 	1081
1235|1236	car il n’en i a nul|qui assez ne soit prodom et vaillanz ».	conozco yo dixo don lanzarote	1082
