694	de ceste flor perdue fu restorez Galaad, li virges, li tres bons chevaliers, 	que porla perdida de aquella flor fue cobrado don galas 	658
695	cil 	El muy noble cauallero 	659
696|697	qui les aventures del saint Graal mist a fin |et s’asist el perilleus siege de la Table Reonde	aquel que se asento enla silla Peligrosa dela sancta tabla de josep abarymatia 	660
698	ou onques chevaliers ne s’estoit assis 	enla qual no se asento Caballero 	661
699	qui ne fust morz. 	que muerto o tullido no fuese donde no escapase 	662
700	Et tout	y poreste don galas hubieron çima todas las hauenturas del sancto greal 	663
701	ainsi com li nons de Galaad avoit esté perduz en Lancelot par eschaufement de luxure, 	e ansi como el nombre de galas fue perdido en don lanzarote |porel pecado de su padre 	664|665
702	tout ansi fu recouvrez en cestui par atenance de char : 	asi fue Cobrado eneste |porla muy sancta uida desu madre 	666|667
703|704	car il fu virges en volenté et en oevre jusqu’a la mort, |si com l’estoire le devise. 	y della el fue siempre virgen ansi en corazon como en obra segund su historia lo deuisa 	668
705	Einsine fu recouvree flor pour flor, 	y ansi fue cobrada flor por flor 	669
706	car en sa nessance fu flor de pucelage estainte et maumise: cil 	ca ensu conçibimiento fue la flor dela donzella perdida 	670
707	qui puis fu flor et mireor de chevalerie, il fu restorez par le conmun assamblement; 	mas porella fue cobrada otra flor que fue flor dela caualleria 	671
708	et se virginitez fu empirie en ce 	e si alli fue flor perdida 	672
709	qu’il fu conceuz, bien en fu li mesfaiz amandez en sa vie par sa virginité 	mucho bien fue cobrado |ca el fue tal entoda su vida 	673|674
710	qu’il randi sainne 	que porlos bienes 	675
711	et antiere a son Sauveor, 	que el fizo ensu vida fue ende el pecado perdonado 	676
712|713	quant il trespassa del siecle, |et par les granz biens 	Como don lançarote quiso matar ala fija del Rey peles 	677
714	qu’il fist en sa vie, 	porque lo hauia engañado 	678
715	Si se taist ores li contes de lui 	y el la perdono |Agora dize el quento 	679|680
716|717	et retorne a Lancelot |qui toute la nuit jut o la damoisele ; 	que don lançarote yugo toda aquella noche con aquella(noche con aquella) donzella 	681
718	se li toli le non 	y fizole perder vn tal nombre 	682
719	a cui ele ne pot puis vraiement recouvrer, 	qual nunca despues lo cobro 	683
720	car	enquanto se echo hera donzella 	684
721|722	se l’an la poïst au soir apeler pucele, |cil nons li fu i changiez en damoisele a l’andemain. 	y enla mañana fallose dueña y alli le fue cambiado el nombre de donzella en nombre de dueña 	685
723	Quant » li jorz aparut, 	y otro dia demañana 	686
724|725	si s’esveilla Lanceloz |et resgarda entor lui, 	quando don lançarote desperto cato alRededor desi 	687
726|727	mes il ne vit point de clarté, |car toutes les fenestres estoient si estoupees 	y no pudo ver ny punto porque todas las finiestras heran çerradas 	688
728	que li soulauz n’i pooit entrer poi ne grant. 	y fue marauillado ado hera |ca el hera ya en su seso 	689|690
729|730	Lors se merveille |ou il est et taste tout entor lui 	y atento çerca desi conla mano 	691
731	et troeve la damoisele; 	y fallo la dueña 	692
732|733	se li demande |qui ce est, 	y dixole amiga quien sodes vos señor 	693
734|735	et il estoit ja revenuz en son mimoire, |car la force de la poison estoit faillie, 	dixo ella 	694
736|737	des lors que il connut la damoisele charnelment. |Et ele li dist: « Sire, je sui J. damoisele, fille au roi Pellés de la Terre Foreinne. , 	yo soy la fija del Rey peles dela tierra forana 	695
738	Quant il l’antant,	y quando el esto oyo 	696
739	si perçoit maintenant 	luego entendio 	697
740|741	comment il a esté deceuz; |si saut dou lit tant dolanz 	que hera engañado y encantado 	698
742|743	que nus plus |et prant sa chemise et ses braies	y salio luego dela cama muy triste 	699
744|745	et se vest |et chauce 	y visitiose y calzose 	700
746	et prant ses armes. 	y fue tomar sus armas 	701
747|748	Quant il fu touz |armez, il vient a la chambre 	y armose y torno Ala camara 	702
749|750	ou il avoit geu et ouvre les fenestres ; |et quant il voit cele 	y abrio las finiestras 	703
751	par cui il a esté deceuz, 		
752|753	si est tant dolanz |qu’il cuide bien issir del sans ; si panse 	y quando vio a aquella porquien fue engañado fue tan sañudo 	704
754|755	qu’il s’en vengera orandroit sanz plus atandre. |Lors traist l’espee 	que fue marauilla como no ensandeçio 	705
756|757	et vient vers la damoisele |et dist trop durement iriez: « Damoisele. vos m’avez mort: 	y dixo 	706
758	si couvient 		
759|760	que vos en muiriez, |car je ne voil 	por buena fee detan gran mal 	707
761|762	que jamais decevoiz home en tel manniere |com vos m’avez deceu. » 	como este luego me quiero vengar estonzes metio mano al espada y fue contra la dueña 	708
763	Lors dresce l’espee contremont 		
764	et cele 	y dixole 	709
765	qui grant paor a de morir li crie merci a jointes mains 	sy me dios ayude vosme hauedes muerto 	710
766	et dist: «	y quiero que vos murades 	711
767	Ha, frans chevaliers, ne m’oci mie por cele pitié 	Porello que no quiero |que engañedes jamas a otro 	712|713
768	que Diex out de Marie Madelainne !» 	como engañastes ami y luego alço la espada parala ferir |y ella ouo muy gran pauor 	714|715
769	Et il s’areste touz trespensez 	y junto las manos |y finco los ynojos anteel 	716|717
770	et la voit la plus bele riens 	y pidiole merçed y dixole 	718
771	qu’il onques mais veist 	ay buen cauallero no me matedes 	719
772	et il trambloit si durement d’ire et de mautalant 	Por aquella piedad |que jhesu xpisto ouo de sancta maria madalena 	720|721
773	que a poinnes pooit il tenir s’espee	y el estando quedo |y penso vn poco 	722|723
774	et se test 	y parola mientes |y vidola tan fermosa que hera marauilla 	724|725
775	et pense 	y penso 	726
776	qu’il fera, 	que faria 	727
777	ou s’il l’ocirra 	si la mataria o si la dexaria 	728
778	ou s’il le laira vivre. 	y el tenia la espada enla mano 	729
779|780	Et cele li crie toutes voies merci |et est devant lui a genouz toute nue en chemise 	y ella estaua en camisa ante el pidiendole merçed los ynojos fincados muy omildosamente 	730
781	et il resgarde ses ieuz et son vis et sa bouche 	y el paro mientes al Rostro y alos ojos y ala boca 	731
782	et voit en lui tant de biauté 	y viola tan hermosa 	732
783	qu’il en devient touz esbahiz. 	que fue Ende espantado 	733
784	Lors dist tant dolanz que nus plus: « Damoisele. je m’en irai 	y dixole |Dueña yo me quiero yr por vençido y por Rentado 	734|735
785	si vaincuz et si recreanz com cil 	como aquel que se no osa vengar detan gran mal 	736
786	qui ne s’ose de vos vengier, 	como feçistes 	737
787|788	car trop seroie cruex et desloiax, |se si grant biauté destruioie 	que yo faria gran crueldad en destruir tanta beldad como dios envos puso 	738
789	com il a en vos.	y Ruego vos que me perdonedes |Por quanto saque el espada contravos 	739|740
790	Si vos pri 	quela yra 	741
791	que vos me pardoingniez ce 	y el mal talante melo fizo fazer |señor dixo ella 	742|743
792	que je tres m’espee sor vos, 	yo vos perdonare por tal que vosme perdonedes todo el vuestro mal talante 	744
793	car ire et mautalant le me fist faire. — Sire, fait ele, je le vos pardoing 	e que nunca jamas ayades demi saña |yo lo otorgo dixo don lançarote 	745|746
794	par si que vostre courouz me pardoingniez. » 	entonçes metio su espada enla baina 	747
795	Et il li otroie, 	y encomendo la dueña a dios 	748
796	puis qu’il voit 	y partiose dende 	749
797	que dire li couvient; 	e fallo enel corral su cauallo ensillado 	750
798	si remet s’espee el fuerre 	que brisaina selo mandara tener presto 	751
799	et la commande a Deu. 	que sabia ella 	752
800	Quant il vient a la cort aval, 	que enquanto conoçiese la dueña 	753
801	si troeve son cheval enselé ;	que por cosa del mundo no estaria 	754
802	si le fist Brisane apareillie celoz le trouvast, 	y mas y despues que caualgo tomo su escudo y su lança 	755
803	quant il vandroit aval,	que fallo acostada envn arbol |y partiose dende muy triste y sañudo y entro ensu camino pensando muy fuertemente 	756|757
804|805	quar ele savoit |por ce que Lanbien 	e tanto que el Rey peles supo 	758
806	qu’il ne remandroit s’apercevroit de la decevance. 	que hera ydo lançarote fue ver asu fija |y quando la vio fallo la muy espantada del gran miedo que hubiera 	759|760
807	Quant il est montez et laienz, 	que hera marauilla |y contole quanto le acontesçiera 	761|762
808	si tost com il Il a pris son escu et I. gl. arbre, 	y quando el Rey sopo todo el fecho plugole ende muy mucho 	763
809	si s’em part dolanz et courrouciez 	y mandola seruir y guardar mas que de antes fazia |y ante de dos meses entendieron 	764|765
810	et entre en 	que estaua preñada |e quando lo supo el Rey su padre fue tan alegre 	766|767
811|812	qu’il trova apuié a I. son chemin |et vait pansant si durement 	que fue vna marauilla el y todos los dela tierra otrosi 	768
813|814	qu’il ne set de lui conroi.|Et li rois de la Quasse por veoir sa fil s fu matin venuz au chastel conté 	mas agora dexa el cuento de fablar del Rey peles 	769
815|816	conment Lanceloz s’en estoit alez. |Quant il vint 	e su fija 	770
817|818	que l’an li avoit ja la, |si la troeve malade 	e torna a don lançarote del lago 	771
819|820	et deshaitie de la paor |que Lanceloz li ot faite 	Agora dexa el quento de fablar del Rey Peles 	772
821	qu’il ne l’oceist;		
822|823	si conta son pere. einsi |com il li 'estre de li 	y desu fija 	773
824|825	et de Lancel. pit avenu. |Quant il sot vraiement rement et plus honorer que devant. 	y torna a lanzarote 	774
826	Et ne demora pas ist garder molt chieIII. 		
827|828	mois |qu’il sot 	Dize el quento 	775
829	qu’ele estoit enceinte et par les usiciens 		
830|831	qui li ue ce ert voirs : |si en furent si lié 	que quando don lanzarote se partio dela fija del Rey peles 	776
832|833	que nul plus et strent et par la damoisele |qui dist ll del païs en firent grant joie. 	que andubo todo aquel dia muy triste y con gran pesar 	777
834|835	Quant Lanceloz |se fu partiz de la damoisele, si erra tout le jor entier molt dolanz et courouciez et toz jorz aloit demandant nouveles de Lion son cousin. 	e todauia demandaua por lionel 	778
836	Quant il ot erré i dusqu’aprés vespres, il resgarda devant lui 	e quando fue ora de visperas cato antesi 	779
837|838	et vit en I. montaigne l. molt bel chastel; il torne cele part, |car il ert tans de herbergier. 	e vido ençima devn monte vn castillo muy fermoso e fuese alla por aluergar 	780
839|840	Quant il est venuz dusqu’au chastel, |si troeve I. chevalier 	y quando ay llego fallo vn Cauallero armado 	781
841	qui li dist: « Sire chevaliers, 	que le dixo 	782
842	par ci ne poez vos passer, 	señor cauallero vos por aqui non podedes pasar 	783
843	se vos ne volez jouster. » Lanceloz pensoit si durement 	si ante no justades conmigo |y don lançarote que yba pensando 	784|785
844	qu’il n’antandi pas a ce 	no entendio 	786
845|846	qu’il dist; |si s’an vait sus le pont 	lo quele dixo el Cauallero 	787
847	ne onques ne laisse son penser. 	y entro porvna puerta 	788
848	Et cil chevaliers li vient son glaive aloingnié	que estaua sobrela Caua del Castillo |que estaua llena de agua devn Rio 	789|790
849	et le fiert si durement 	que por ay pasaua |y quando el cauallero vido 	791|792
850	qu’il li fait la sele widier 	quelo non fablaua dexose yr ael 	793
851	et le porte tout envers dedenz le fossé. 	y diole tal lançada enlos pechos |que dio conel enel agua 	794|795
852	Et Illl. vallez 	y quatro escuderos 	796
853	qui estoient sus la bretesche li conmancent a crier: « 	que estauan sobrela puente dixeron a don lançarote 	797
854	Ha, sire chevaliers, or vos poez bien baingnier ! » 	agora vos podedes bien bañar apesar 	798
855	Et li chevaliers del chastel prant le destrier Lancelot, 	y el Cauallero tomo el Cauallo de don lançarote 	799
856	si entre dedanz la vile; 	y metiolo al castillo 	800
857	et maintenant fu la porte close. 	y çerro la puerta 	801
858|859	Et quant Lanceloz voit |qu’il est chaüz en l’eve, 	y quando don lançarote se vio enel agua marauillose 	802
860|861	si est touz esbahiz, |car il ne set 	ca no sauia 	803
862	comment il est chaoiz, 	como ay caiera 	804
863	si sant 	y echo las manos envn arbol 	805
864	qu’il afonde. 	que ay estaua 	806
865	Lors aert a Il. poinz J. arbre 	y salio fuera su escudo al cuello y la lança enla mano 	807
866	qui devant lui estoit 	y fuese al castillo 	808
867|868	et fait tant |qu’il est issuz del fossé et venuz a terre seche, son escu a son col, son glaive en son poing. 	y llamo ala puerta 	809
869|870	Et cil de la bretesche li dient: « Sire chevaliers, aillors vos couvient querre ostel, |car çaienz ne metrez vos huimais le pié,	y los que estauan sobrela puerta le dixeron a otra parte vos conuiene de yr a buscar posada que aqui no la abredes 	810
871|872	mais demain |se vos reveniez 	mas sy mañana aqui vinieredes 	811
873	et nos poons recevoir chevalier pescheor, nos vos recevrons volentiers. » 	e ouieredes a Resçeuir Caualleros pescadores Resçiuiremos avos 	812
874	Quant il voit 	y quando el oyo 	813
875|876	que cil le vont i einsi gabant, |si est molt dolanz; 	que escarneçian del ouo muy gran pesar y dixoles 	814
877	lors lor dist: « 	buenos señores 	815
878	Biau seingnor, et de mon cheval 	dezidme nuebas de aquel cauallo 	816
879|880	car me dites nouveles, |se vos les savez. — 	sy sabedes pordios dixeron ellos 	817
881	Par foi, font il, de vostre cheval ne savons nos riens, mais de celui 	de vuestro cauallo 	818
882	que vos avez perdu savons nos bien. 	no sabemos |que vos perdistes 	819|820
883|884	qu’il est çaienz et dahaiz ait |qui cheval vos donna, 	mas de que es aca dentro y mala ventura aya quien vos cauallo diere 	821
885	car certes il nel poïst noauz amploier. » 	que no lo podia peor emplear |en cauallero del mundo 	822|823
886	Quant il voit 	que envos |Como la donzella 	824|825
887|888	qu’il n’i prandra plus, |si est assez plus dolanz 	que guaresçio a don lançarote del agua emponçoñada se Razonaba conel cauallero 	826
889	que devant 	Quando don lanzarote vio |que non podia al fazer fue muy triste 	827|828
890	et vient desouz en la valee	e fue ayuso del valle 	829
891	et s’asiet auques pres dunne fontainne desouz IlII. arbrisiax, 	y asentose çerca devna fuente so vnos arboles 	830
892	si met son glaive delez lui 	y arrimo su lança a vn arbol 	831
893	et s’asiet desus son escu; 	y acostose sobre su escudo alli 	832
894|895	si est tant dolanz|et courrouciez 	fasta la noche 	833
896|897	tant que la nuiz soit venue. |Quant li tans fu aprés ce J. poi acoisiez 	y quando fue ya noche 	834
898	et la lune fu levee, 	y la luna muy clara 	835
899|900	si resgarde Lanceloz |et voit venir IlI. chevaliers armez, 	y estando ansi vio venir tres caualleros armados e desçendieron delos cauallos 	836
901	si descendent a la fontainne		
902|903	et ostent lor armes, |si s’asieent desus l’erbe vert. 	y asentaronse sobrela yerba verde 	837
904	Aprés ce ne demora mie granment que IIII. escuier vindrent 	y luego apoca del ora vio venir tres escuderos 	838
905	qui amenerent la damoisele avec aux qui Lancelot avoit gari de l’anvenimement 	que traian vna donzella aquella misma 	839
906	qu’il avoit pris l’autre jor a la fontainne 	quelo habia guaresçido dela enfermedad quando veuio el agua dela fuente |do salieron las dos Culebras 	840|841
907	et an plouroit molt durement 	y ella lloraua Muy fuertemente 	842
908	et les clamoit larrons et traïtres. 	y llamabalos traidores ladrones 	843
909|910	Quant Lanceloz le voit plourer, |si est molt dolanz, 	e ([^ y]) 	844
911|912	car il n’amoit nule fame plus de li fors la roine. Il se pense |qu’il li aideroit sauve s’onor, 	quando esto vio don lançarote pesole de Corazon Ca el la amaba 	845
913|914	quant il se porpense |qu’il atandra encore 	sobre todas las cosas del mundo 	846
915|916	tant qu’il voie |que cil voldront faire. 	saluo ala Reina 	847
917	Quant il l’ont descendue del cheval, 	y desçendieronla en tierra 	848
918|919	si se lievent li III. i chevalier |et dient 	y los caualleros se leuantaron aella 	849
920|921	que bien. soit ele venue |et ele lor dist 	y dixeronla donzella vos seades vien venida Mala uentura vos de dios 	850
922	que mal soient il trové comme desloiaux chevaliers et larrons. « 	como traidores ladro-nes dixo ella 	851
923	Ha, damoisele, fait li uns, vos direz ce 	donzella dixo el |vno dellos vos diredes 	852|853
924	que vos voudrez, 	lo que vos plazera 	854
925|926	mais desloiaux ne larrons ne somes nos mie. — |Si estes voir, fait ele. 	mas nos no somos traidores ni ladrones si sodes ca vos me tomastes por fuerça 	855
927|928	Quel greingnor desleauté poez vos faire |que prandre damoisele en murtre et an repost et de mestre main a li estre son gré ? 	y a traiçion de cauo de mi hermano contrami voluntad 	856
929|930	Ne greingnor larrecin ne poez vos faire |et tout ce avez vos fait de moi 	y lleuadesme por fuerça 	857
931|932	qui en murtre et en traïson |me venistes prandre en la meson mon frere 	que no saue el ende nada 	858
933|934	et m’en avez amené sanz le seu de lui. |Et cuidiez vos 	y Podiades fazer mayor ladroniçio que esto y cuidades 	859
935|936	por ce |que je sui en vostre saisine 	que por tenerme envuestro poder 	860
937	que je vos aimme plus tost ? 	que vos quiero |porende mejor 	861|862
938|939	Certes nenil, |ainz voudroie mielz 	por buena fee no lo Cuidedes 	863
940	que vos fussiez trainez a la queue de mon roncin; 		
941|942	car trop seroie avillie, |se je laissoie le millor chevalier del monde 	ca yo seria muy vilmente alaxada dexar el mejor cauallero del mundo 	864
943|944	et le plus prodome a|cui j’ai m’amor donnee por I. si vil chevalier et si recreant	por tan vil Cauallero Cobarde 	865
945	com vos estes. — Damoisele, fait il, 	como vos donzella vil ni couarde non so 	866
946	se vos n’estes amee, 	mas si por ventura non vos ama aquel 	867
947	que vos vaut ? 	que vos amades 	868
948	Certes ce ne porroit pas estre 	que provor tiene quanto |y mas que no es de creer 	869|870
949|950	que li mieldres chevaliers del monde |et li plus prodom eust mise s’amor en vos,	que el mejor Cauallero del mundo vos otorgase su amor 	871
951|952	car trop la porroit mielz amploier. — |Certes, fait ele, sire chevaliers, cil 	que en mas alto lugar lo podia emplear çierto don mal cauallero dixo la donzella 	872
953	qui est ore le millor chevalier dou monde ne tient pas	aquel que es agora el mejor cauallero del mundo me prometio 	873
954|955	s’amor a mal emploie en moi, |ainz m’aimme bien 	que nunca amaria donzella saluo ami 	874
956	et amera tant	y no lo tiene 	875
957|958	com il me savra en vie, |et je l’an serai si vraie	por malempleado su amor enmi e yo se bien 	876
959	que ja chevalier tant? 	que siempre me sera leal 	877
960	conme je vive, ne se porra venter 	e yo ael en toda mi vida 	878
961	que jou li face compaigniea; 	Ca nunca tomare compañia de otro Cauallero 	879
962	et se je bien voloie faire si grant desloiauté 	y en Caso que yo lo ouiese de tomar yo lo escogeria 	880
963|964	que j’en vousisse I. mestre en son leu, |ja 	tal que me tubiese aderecho 	881
965|966	si m’aïst Diex si mauvais chevalier |com vos estes n’i metroie, 	mas no tomaria tan mal cauallero ni tan Cobarde como vos entonçes se ensaño el cauallero 	882
967	ainz i mestroie tel 	y dixole donzella 	883
968|969	dont l’an ne me devroit mie blasmer.» |Lors se courrouce li chevaliers 	pordios dezidme quien es ese Cauallero 	884
970|971	et dist a la damoisele : « |Et por Deu, 	que tan lealmente vos ama 	885
972|973	car nos dites or |qui est cil chevaliers 	çierto 	886
974|975	qui tant est prodom et|qui si loiaument vos aimme ? — 	dixo la donzella 	887
976	Certes, fait ele, il ne faît mie a nommer devant 	el no se deue nombrar 	888
977	si noiant home 	ante tan bil cauallero como vos 	889
978|979	com vos estes et neporquant por vos grever plus, vos dirai je |qui il est: 	mas por vos quebrantar el corazon yo voslo dire Saued 	890
980|981	ce est mes sire Lanceloz del Lac, |c’est cil 	que este es don lanzarote del lago 	891
982	que vos n’oseriez atandre a cop pour tout le reaume de Logres. — 	al qual vos no osariades attender en Campo |por todo el Reyno de londres 	892|893
983|984	Celui? fait li chevaliers. |A mal eur soit il ore le millor chevalier dou monde!	Como dixo el cauallero ese es el que tanto loades en mal punto sea 	894
985	Certes il ne le porroit pas estre, 	si esto puede ser en ninguna guisa 	895
986	car il fu filz au plus mauvais roi et au plus failli de cuer 	ca el es fijo del Peor Rey |que nunca traxo armas 	896|897
987|988	qui onques portast couronne et bien monstre en la fin |qu’il estoit noianz ; 	y mas Cobarde y bien lo mostro el asu muerte 	898
989	car li rois Claudas mes cousins le deserita de toute sa terre 	que mi Cormano el Rey claudes lo deseredo de toda su tierra 	899
990	si	y lo fizo fuir 	900
991|992	qu’il s’anfor et morut de duel. |Et por ce di je 	e yendo fuiendo murio con pesar y porende digo 	901
993	que de si mauvés roi ne porroit pas issir le millor chevalier del monde. — 	que de tan mal Rey no podia salir el mejor cauallero del mundo |Como vos dezides 	902|903
994	Ha, dant mauvais chevaliers, fait ele, 	ay don mal Cauallero |dixo ella 	904|905
		yo creo que si ante el estubiesedes non osariades esto dezir 	906
		Por todo el Reyno del Rey artur donzella 	907
995	si m’aïst Diex, 	dixo el Cauallero |dezidlo que vos pluguiere 	908|909
996	s’il fust ja ci. 	mas yo vos Ruego |que fagades my Plazer devuestro grado 	910|911
997	ja ceste parole 	e yo agradezerlohe ante quelo fagades por fuerça 	912
998	ne vos issist mais de la goule, 	Ca entonçe non voslo agradezere 	913
999	car vos n’eussiez cuer del dire por tote la terre le roi Artu. — Damoisele, fait il, vos diroiz ce 	e dixo ella |andad a mala uentura 	914|915
1000	que vos plaira	que vos de dios 	916
1001	et je vos escouterai, 		
1002|1003	mais toutes voies vos di je |que vos façoiz ma volenté debonnairement 	que antes querria ser quemada o afogada envn Rio 	917
1004|1005	et ne soiez pas si vilainne |qu’il vos couviengne faire force, 	que no ser escarneçida devn tan mal ome 	918
1006	car je ne vos ameroie ja puis ; 	Entonzes mando el Cauallero alos otros dos Caualleros 	919
1007	et vos veez bien 	e alos escuderos 	920
1008|1009	qu’il estuet |que vos le façoiz, 	que se fuesen dende y ellos ansi lo fizieron 	921
1010	car la force n’est pas vostre 	Como don lançarote libro ala donzella su amiga 	922
1011	et mes voloirs i est. — 	que queria forçar el Cauallero 	923
1012	Fi, fait ele, par male aventure 	Despues que ellos se partieron dende |dixo el Cauallero 	924|925
1013	ainz fusse je arse ou noie 	ala donzella yo vos Ruego 	926
1014	que je par si mauvais home fusse honnie, 	que fagades mi voluntad de vuestro grado |o uoslo fare fazer afuerça 	927|928
1015|1016	quar si m’aïst Diex, |pis ne porroie je faire. » 	entonzes començo la donzella de se Rascuñar 	929
1017	Et il conmande as chevaliers et as escuiers 	y de llorar |y dezir 	930|931
1018	qu’il se traient en sus, 	ay my buen señor don lanzarote si vos fuesedes agora çerca demi 	932
1019	car il velt touz seus remanoir avec cele	como me vengariades desta desonrra 	933
1020|1021	qu’il aimme |et dont il cuide bien faire sa volenté sanz contredit.	que este traidor ladron me quiere fazer 	934
1022|1023	Quant cil s’an sont d’iluec alé, il prant la damoisele et la giete souz lui |et dist 	y entonzes trauo della el Cauallero 	935
1024|1025	qu’il li fera a force, |s’ele ne li veult otroier debonnairement. 	y echola en tierra y ella se defendia quanto podia 	936
1026	Et ele s’escrie: « 		
1027	Ha, gentils hom Lanceloz,		
1028|1029	por quoi n’estes vos ci ? |Si vengissiez moi et vos de la honte 	y quando vio 	937
1030	que cil lerres vos velt faire. » 		
1031|1032	Lors conmance a guenchir et a detordre soi au plus |qu’ele ! puet 	que el Cauallero la afincaua començo a dar muy grandes vozes 	938
1033|1034	et il la tient molt estroit entre lui et la terre. |Et cele se rescrie: « 	e dezia 	939
1035	Ha, Lanceloz, biaux douz amis, li vostre secors me tardera moult, 	ay mi señor don lanzarote |que mucho me tarda vuestra ayuda 	940|941
1036|1037	ce m’est avis. » |Et Lanceloz 	y quando don lançarote esto oyo entendio 	942
1038|1039	qui bien ot veu ce|qu’il orent fait 	quela donzella estaua en gran peligro 	943
1040|1041	et antandues toutes les paroles |qu’il disoient se dresce? en estant, 	y leuantose muy ayna ansi armado 	944
1042	ce li est avis 	como estaua 	945
1043	que trop porroit huimais demorer; sì prant son escu 		
1044|1045	et traist s’espee |et dist a cele 	y tomo su escudo y metio mano ala espada 	946
1046	qui le regrete : « Damoisele, n’aiez paor, 		
1047|1048	car je ne sui mie trop loing de vos |et mal vos a li chevaliers courroucie, 	y Respondio ala donzella non ayades pauor 	947
1049|1050	qu’il en morra. » |Lors s’en vait vers aux grant pas, 	ca non so lexos devos 	948
1051|1052	et quant cil le voit venir, |si a grant paor de mort 	y en tan mal punto se leuanto el traidor 	949
1053	et crie: « Aide aide! — 	que vos quiere desonrrar 	950
1054	Par mon chief, fait il, aide ne vos avra mestier, 	ca el morira ay amis manos como mal traidor 	951
1055	car vos en morrez 	y entonçes se dexo yr aellos a gran paso |y quando el cauallero lo vio venir contrasi / ouo muy gran pauor de muerte y Començo a llamar alos otros caualleros 	952|953
1056	et il est bien droiz, 	e dixo don lançarote 	954
