1151	et li sires de laienz le dist a ses genz 		
1152	qui bien en firent son conmandement, 		
1153	car il distrent 		
1154	que tout ert prest.		
1155	Si fait mestre les tables 		
1156	et mengierent 		
1157	tant com lor plost; 		
1158	puis s’alerent couchier 		
1159	et dormirent. Au matin J. 		
1160	poi aprés prime se leverent cil de laienz 		
1161	et demanderent a la pucele 		
1162	quele aventure l’avoit ersoir amenee a tele ore, 		
1163	et cele lor conta 		
1164	conment il lor estoit avenu 		
1165	et conment I. chevaliers l’eust honnie, 		
1166	se ne fust Lanceloz 		
1167	qui l’an garda 		
1168	et li dist 		
1169	que moult li a Diex aidié selonc les aventures 		
1170	qui avenues li sont. 		
1171	Quant Lanceloz fu vestuz 		
1172	et apparilliez, il vint en la sale 		
1173	et salua son oste et dist 		
1174	que bon jor li donnast Diex. « Sire, fait Lanceloz, faites moi mes armes aporter, 		
1175	car je ne voil plus demorer. » 		
1176	Et cil commande		
1177	que a l’an les aport, 		
1178	mais ainz le fist mangier tout par loisir; 		
1179	aprés li fait baillier ses armes 		
1180	et il les prant »,		
1181	Ét quant il fu armez, li sires li demande 		
1182	ou il velt aler 		
1183	et il dist 		
1184	qu’il voldroit estre au chastel 		
1185	qui est laissus en I. montaingne. « De la aler, fait li sires, vos garde Diex ! je nel vos loeroie en nule manniere, 		
1186	car plus a de V. 		
1187	anz 		
1188	que chevaliers n’i pot antrer 		
1189	qui ne moreust ou fust emprisonnez. — 		
1190	Comment fu ce dont? fait Lanceloz. Il covient 		
1191	que vos le me diez. — 		
1192	Et jel vos dirai volentiers. Il a I. an 		
1193	et plus c’uns chevaliers garde l’antree 		
1194	que nus n’i antre		
1195	qu’il a ne conqueist par prouesce d’armes, 		
1196	et por ce ne vos loeroie je en nule manniere a aler cele part, 		
1197	car vos n’am porriez partir sanz bataille. — Enon Deu, fait Lanceloz, je ne lairoie en nule maniere 		
1198|1199	que je n’i alasse, |car je i perdi mon cheval ersoir ne sai en quele manniere. — 	ch’io non gli conosco mica: ciò pesa a me, 	151
1200	Puis que vos avez si grant talant d’aler i, fait li chevaliers, g’irai o vos et verrai l’onor 		
1201|1202	que Diex vos fera |et vos conterai entre ci et la tel chose 	ché non ve n’à nullo 	152
1203	par coi ceste bataille devroit remanoir. 		
1204	Lors dist a ses sergenz 		
1205	qu’en li aport ses armes, 		
1206	car il voldra a mon signor Lancelot faire compaingnie dusque au chastel. 		
1207	Et quant il est armez		
1208	et il sont andui monté, la damoisele dist a Lancelot: « Sire, je ai oï dire 		
1209	qu’il avra I. tornoiement a Kamaalot. I serez vos ? — 		
1210	Por quoi le demandez vos ? — 		
1211	Por ce		
1212	que se je vos i cuidoie veoir, je ne lairoie en nule manniere 		
1213	que je n’i alasse. — 		
1214	Et je vos di, faît il,		
1215	que g’i serai, 		
1216	se je sui en ma lige poesté. — 		
1217	Or alez 		
1218	dont, fait ele, a Dieu, 		
1219	car je vos i verrai, 		
1220	se merveille n’est.» Il s’em partent maintenant. 		
1221	Quant il sont I. poi esloingnié del chastel, 		
1222	si dist li chevaliers a Lancelot : « Sire, vos estes de la meson le roi Artu et compaingnon de la Table Reonde 		
1223	et par ce cuit je bien 		
1224	que vos quenoissiez cels 		
1225	qui en sont conpaingnon. » 		
1226	Et il dist 		
1227	qu’il ne repaire mie a cort moult, e 		
1228	et par ce nes? 		
1229	puis je pas connoistre touz, mais les plus erranz 		
1230	et cil 		
1231	qui plus quierent aventures cuit je bien connoistre ; 		
1232	et si en i a il maint 		
1233	que je ne connoiz mie, 		
1234	ce poise moi, 		
1235|1236	car il n’en i a nul|qui assez ne soit prodom et vaillanz ».	ch’assai non sia produomo e valentre.	153
