5025	si li sambla qu ele veist le roi Ban de Benoyc	si l è aviso|ch ella vedesse il re Bando di Benoic	3736|3737
5026	car il n a home el monde s il eust veu le roi Ban	ch egli non è huomo s egli avesse veduto il re Bando	3738
5027	et puis Lancelot qu il ne deist qu il fust ses filz	e veduto Lancelotto|che non dicesse	3739|3740
5028	Et quant ele voit celut qu ele ot tant desirré	che fusse suo figliuolo|che tanto est disiderato	3741|3742
5029	si li baise la bouche	si gli bacia la bocca	3743
5030	et les ieuz	e gli occhi	3744
5031	et plore de joie	e piange di gioia	3745
5032	et de pitié	e di piatà	3746
5033	et l enmoinne en son maistre palais	e mena in su' palagio	3747
5034	et li dist tout em plourant Certes sire ne! me merveil je mie se vos estes bons chevaliers	e lli disse tutto piangendo	3748
5035|5036	et preuz|car vos estes filz au millor chevalier	e pro' ché vo foste figliuol del miglior cavaliere	3749
5037	que je onques veisse de son aage ce fu li rois Bans de Benoïc	ch i' unque vedessi ciò fu il re Bando di Benoic	3750
5038|5039	Lors s asiet sus l erbe vert|dont la sale estoit jonchie :	donde il palagio fu tutto giuncato	3751
5040	si parolent ensemble	si parlano insieme	3752
5041|5042	et il li prient|por Deu qu ele li die verité de lui	ch ella li dica la verità di lui	3753
5043	et d Estor	e d Astore schéll uomo m à fatto intendere	3754
5044	car l an m a fait antandant fait il qu il est mes freres	ch egli è mio fratello	3755
5045	et s il est voirs je n oi onques	: s jelli è vero e' non ebi unque mai	3756
5046	si grant joie com je avroie de ceste chose	si gran gioia com io avrei di questa cosa	3757
5047	—	—	3758
5048|5049	Si m aïst Diex fait ele il est vostre freres|car li rois Ban de Benoyc l engendra	e me m aiuti lddio diss ella egli è vostro fratello ché il re Bando di Benoic lo ngenerò	3759
5050|5051	Et lors li conte conment|et li dist tout ce	: li disse tutto ciò	3760
5052|5053	que ses ostes li avoit dit|et en tele maniere tant qu il set vraiement	che su oste li disse in tal maniera tanto	3761
		ch elli seppe veracemente	3762
5054	que ce est voirs	che cciò era vero	3763
5055	Et encor sire fait ele vos en mousterrai je tel chose	Ancora sire diss ella vo mosterò tal cosa	3764
5056	que vos connoistroiz bien	che vo' conoscerete benes	3765
5057	Lors vait en sa chambre	Allor se ne va in sua camera	3766
5058|5059	et desferme J|suen escrin	e diserra un forziere	3767
5060	et en trest fors I		
5061|5062	sien annel d or a J|safir ou il avoit entaillié II	e ne trae fuori un suo anello d oro con un zaffiro ov egli avien tagliati tre serpantegli	3768
5063|5064	serpentiax ;|si vient a Lancelot	e se ne viene a Lancelotto	3769
5065	et li dist Sire veez vos	e gli disse|: edete voi ciò	3770|3771
5066	que je tieng	ch io tegno	3772
5067	? — Dame oül	? —Oil	3773
5068	fait il		
5069|5070	—|Si m arst Diex fait ele li rois Bans le me donna	— Se Dio m aiuti diss ella il re Bando il mi donò quand e'	3774
5071	quant il parti de cest païs	si parti di questo paese	3775
5072	et me dist	e mi disse	3776
5073	que la roine vostre mere li donna	che lla reina vostra madre gliel donò	3777
5074	et que ele en avoit I	ch ella n avea uno di tal fazione	3778
5075	de tel façon	:|e sso bene	3779|3780
5076|5077	Et je sai bien qu il me dist voir|car il n a mie granment	ch elli mi disse vero ché non à mica gravemente	3781
5078|5079	que je chevauchai par mi Gaule|por parler a I	ch io cavaleava per me Gaule per andare a uno mio zio	3782
5080	mien oncle		
5081	qui est conseillier le roi Claudas	ch è donzello del re Gaudas	3783
5082|5083	et|tant que mes chemins me mena au Roial Moustier ou vostre peres gist	si mi menò mi camino al Munistero Reale ove vostra madre giace	3784
5084	S	:	3785
5085	i demourai l		
5086|5087	nuit|et trouvai illuec vostre mere la millor dame	si trovai nel luogo vostra madre la miglior dama	3786
5088|5089	qui soit el siecle|et la plus sainte	e lla più sancta del mondo	3787
5090	si me fis connoistre a li	si mi fece conoscere a llei elle disse	3788
5091|5092	et qui je estoie|et de	ch io era di questo paese	3789
5093	quel païs;	;	3790
5094	et ele me demanda molt de vos	e ella mi domandò molto di voi	3791
5095	et je l an dis ce	e io ne le dissi ciò	3792
5096	que je avoie oi dire sanz i ce	ch io n avea udito di voi dire sanza ciò	3793
5097	que je ne vos avoie onques veu	che non voi avia unque veduto	3794
5098	et li dis	e lle disse	3795
5099	que vos estiez li mieudres chevaliers del monde	che voi eravate il miglior cavaliere del mondo	3796
5100	Je avoie cest anel an mon doi	E io avea questo anello in dito	3797
5101	si le vit par aventure; ele me demanda	si ch ella il vide	3798
5102	qui le m avoit donné	e ella il domandò chi m avea donato	3799
5103|5104	et je li voil celer;|quant ele	e io gliel volli celare quand ella mi disse	3800
5105|5106	? le me dist qu ele savoit bien de|qui je l avoie eu a	ch ella il sapea bene dond io l avea avuto	3801
5107	si me monstra maintenant le suen de son doi	:|si mi mostrò immantanente il compagno	3802|3803
5108|5109	qui ert de cele façon meismes :|et par ce connois je bien	ch è di questa fazione medesima perciò conosch i	3804
5110	que vostre peres m avoit dit verité	? bene|che vostro padre m avea detto veritàs	3805|3806
5111|5112	De ceste chose fu Lanceloz moult liez|et moult joianz plus	vDi questa cosa fu Lancelotto molto gioioso più	3807
5113	que qui li donnast la millor cité	che se ll uomo li donasse la miglior città	3808
5114	que li rois avoit	che l re Artù avesse	3809
5115|5116	Cele nuit furent cil de laienz moult lié|et firent moult grant joie	Quella notte feciono quelli di là entro molto gran festa	3810
5117	et moult furent lié de la venue Lancelot	e furono lieti della venuta di Lancelotto	3811
5118	et moult estoit la dame engrant de demander conment Hestor ses filz le faisoit		
5119	car ja avoit passé Il	ch elli avea due anni passati	3812
5120	anz qu ele ne l avoit veu ;	ch ella non l avea veduto|:	3813|3814
5121	et Lanceloz dist qu il n avoit mie Il	e Lancelotto le disse	3815
		che non avea mica due mesi passati	3816
5122	mois qu il le vit sain	ch elli il vide sano	3817
5123	et haitié	e atato	3818
5124	Aprés vespres firent mestre les tables	Apresso feciono mettere le tavole	3819
5125	et mangierent a joie	e mangiarono	3820
5126	et a leesce	e a letizia	3821
5127|5128	et quant la nuit fu venue|si firent	e quando la notte fu venuta sì feciono un letto a Lancelotto	3822
5129	I lit a Lancelot		
5130	si bel	si bello	3823
5131	et si riche com a tel home avenoit;	e ssi ricco come a tale huomo comvenia	3824
5132	si le couchierent	“|Si l coricarono	3825|3826
5133	et il s endormi maintenant	e elli|si dormi immantanente	3827|3828
5134	et ne s esveilla dusques au matin qu il fu jorz	e non|si svegliò insin qua al mattino	3829|3830
		ch elli fu giorno	3831
5135	Et se vesti Lanceloz	; allor|si vesti Lancelotto	3832|3833
5136	et apareilla	e apparecchiò	3834
5137	et oï messe en une chapele de laienz	e udi messa a una cappella di là entro	3835
5138	Et quant il revint el palais	;|e quand e' venne nel palagio	3836|3837
5139	si troeve les tables mises	si truova le tavole messe	3838
5140	car il voloient qu il manjast ainz qu il s am partist;	ch elli voleano|ch elli mangiasse anzi	3839|3840
5141	et il s asieent erranment	che si partisse e'ss asederono	3841
5142	Et quant il orent mangié tout par loisir	“E quando elli ebono mangiato|e tutto per lecere	3842|3843
5143	si se dreça Lanceloz	si i diriza Lancelotto	3844
5144	et demanda ses armes a Ha sire	e domanda sue arme	3845
5145	por Deu se il puet estre remanez encor cest jor seulement	Ail sire per Dio disse la dama s elli puote essere dimorate ancora questo giorno sola mentes	3846
5146	Et il dist	“Ed e' dice	3847
5147	que ce ne puet estre	che cciò non puote essere	3848
5148	car il a trop a faire	ch egli à troppo a ffare|;	3849|3850
5149	Et quant il est armez	e quand egli è armato	3851
5150	et montez el cheval		
5151	si se part de laienz	si si parte di là entro	3852
5152	et la damoisele chevaucha delez lui	E lla dama l acompagna|e cavalca dallato a llui	3853|3854
5153|5154	et li prie|por Dieu qu il se praingne garde d Estor son frere;	e l priega per Dio	3855
5155	si dist	ch elli	3856
5156	que se Diex li donnoit trouver il ne se partiroit	si prenda guardia d Astore suo fratello ed e' le disse che se ldio li donasse a trovarlo elli non	3857
5157	mais a piece de lui se il pooit	si partirebono mai a peza	3858
5158	Et quant il l orent i grant piece convoié	eQuand egli ànno gran peza acompagnato	3859
5159	si les fait arester	e elli fa ritornare	3860
		allor dice	3861
5160	et dist qu il n iront plus avec lui	che non veranno più con esso lui	3862
5161	et les conmande touz a Deu	si gli comanda tutto ardDio	3863
5162	Et quant la dame voit qu il s en vet	E quando la dama vide|che se ne andarono	3864|3865
5163	si li dist tout em plorant Biaux douz sire	si gli disse tutta impiangendo	3866
5164	por Deu	: Bel sire per Dio	3867
5165	et por l ame vostre bon pere pensez d Estor mon fil	e per la anima di vostra madre pensate d Astor mio figliuolo	3868
5166	et vostre frere	e vostro fratellos	3869
5167	Et il dist	; ed e' dice	3870
5168	que si fera il aseur an soit	che ssi farà elli tutta sicura ne sia ella	3871
5169	Atant s an torne la dame molt dolente de Lancelot	“Attanto|si torna la dama molta dolente di ciò	3872|3873
5170	que plus ne sejorne o lui	che Lancelotto non vi sogiorna più con esso lei	3874
5171	et il chevauche touz seus liez	Ed egli cavalca tutto solo	3875
5172|5173	et dolanz dolanz|por Lyonnel	e ssi fu molto dolente per Lyon	3876
5174|5175	dont il ne set nouveles|et liez	donde non sa nulle novelle	3877
5176	por Hestor qu il cuide par tans trover	e lieto per Astore|ch egli crede trovare	3878|3879
5177	Et li chauz fu levez granz	“E caldo fu levato grande	3880
5178	et mervilleus	e maraviglioso	3881
5179	si li anuia a chevauchier	si ll invidia molto il cavalcare	3882
5180	et il oste son hiaume	e elli trae suo elmo	3883
5181	qui molt li grevoit ce li estoit avis	che molto gli gravava ciò è suo aviso	3884
5182	et le baille a J	e l baglia al uno scudiere	3885
5183	escuier qu il ot trové el chemin	ch egli truova nel miluogo del camino	3886
5184	Si erra en tel manniere dusqu a none qu il entra en I	Si va in tal maniera insino a nona	3887
5185	forest vielle	ch egli entra in una foresta vecchia	3888
5186	et ancienjalne	e antica	3889
5187|5188	Il voit a l antree une chapele ou il avoit I|hermite molt prodome	: elli vide nell entrata una cappella ov egli avea un romito molto produomo	3890
5189|5190	et tout entor la chapele avoit a I|cimetire	e tutto intorno alla cappella avea un cimitero	3891
5191|5192	et a l entree I|croiz	e a l entrata una croce in un gran petrone di marmo	3892
5193|5194	et l|grant perron de marbre	E elli riguarda in sul petrone	3893
5195	Il esgarde sor le perron lestres vermeilles	e vide seritte molte maravigliose lettere	3894
5196	qui disoient: Os tu chevaliers erranz	che dicevano|: O tu cavaliere errante	3895|3896
5197	qui ceste part viens		
5198|5199	por aventure trover se tu ne vels morir n entrer mie en ceste forest|car tu n am porroies eschaper sanz mort ou sanz honte	che n queste parti vieni per aventure trovare se ttu non vuogli morire non intrare mica in questa foresta ché ttu no ne potrai scampare sanza morte	3897
5200	Li escuiers lut cels lestres	e sanza onta|MLo scudiere legge le lettere	3898|3899
5201	et dist a Lancelot: Sire entandez vos bien ce	e si disse a Lancelotto	3900
5202|5203	que cels lestres vuelent dire|? — Oil fait il	Sire intendete voi schel queste lettere vogliono dire	3901
5204|5205	—|Dont sai je bien	? Se voi il sapete dunque so io bene	3902
5206	fait cil		
5207|5208	que vos n iroiz en avant|car cil bries le desfant	che vo' non v andreste mica in avanti ché questo brieve il difende	3903
5209	—		
5210	Et tu ou iras		
5211	? fait Lanceloz		
5212	— Sire dusqu a chastel		
5213	qui est outre ceste forest		
5214|5215	—|Dont iras tu par cest chemin fait Lanceloz	— E te n andra' tu disse Lancelotto per questo camino in avanti	3904
5216	car il n i a autre voie		
5217|5218	— Voire fait il|car il le me covient a faire	? — Oil disse l valletto el mi convien fare	3905
5219	— Or va seurement fait Lanceloz	— Or va' disse Lancelotto sicuramente	3906
5220	car je te suirai	ch i' ti seguirõ	3907
5221	— Ha sire		
5222|5223	por Deu fait li vallez n i venez mie|car certes ce seroit trop aperte folie !	— Ail sir per Dio disse l valletto non ci venite mica ché certo ciò sarebbe troppa aperta follia	3908
5224	Dont ne veez vos	Dunque non vedete voi	3909
5225|5226	que cels lestres dient|? —	che questo brieve dice	3910
5227	Por cels lestres fait Lanceloz ne plus ne mains		
5228	car je ne lairoie en nule maniere	ch i' non lascerei i'nulla maniera	3911
5229	que je n i alasse	ch i' non v andasse	3912
5230	Lors resgarde vers destre	Allor riguarda Lancelotto sopra a destra	3913
5231	et voit l ermite	e vide il romito	3914
5232	qui avoit ouvert l uis de sa chapele	ch avea aperto l uscio della cappella	3915
5233	qui voloit chanter vespres	e voleva cantare vespro	3916
5234|5235	Il vait cele part|si le salue	E elli va in quelle parti	3917
5236	et li prodom li rant son salu	e saluta il produomo|e egli li rende saluto	3918|3919
5237|5238	et li demande|qui il est	e lli domanda chi elli è ed	3920
5239	et il dist qu il est chevaliers erranz	e li dice|ch egli è un cavaliere errante	3921|3922
5240	Et que alez vos querant	NaE|che andate vo' chegendo	3923|3924
5241	Et il dist qu il vait querant J	? diss egli|Ed e' li dice	3925|3926
5242	suen cousin	ch egli chiede un suo cugino	3927
5243|5244	qui a non Lyonnel|«	ch à nome Lyon	3928
5245	Et comment avez vos non	E come avete vo nome	3929
5246	? fait li hermites	? disse il romito	3930
5247	— Sire l an m apele Lanceloz del Lac	— Sire diss egli l uomo m apella Lancelotto de Lac	3931
5248	— En non Dieu fait il de vos ai je oi parler autre foiz	—Al nome di Dio disse il romito di voi ò udito altra fiata parlare	3932
5249	Vos estes li mieldres chevaliers del monde a tesmoing de maintes genz:	: vo'siete il miglior cavaliere del mondo al testimone di molte genti	3933
5250|5251	si seroit granz domages se vos vos metiez en leu|dont vos ne poissiez issir	si sarebbe gran danaggio se vo' vo metesti in luogo dove non potesti uscire ché troppo di gente vi morebbono	3934
5252	car trop de gent i perdroient		
5253|5254	et por ce vos lo je|que vos retorniez tout le chemin	che vo' ritornasti tutto il camino	3935
5255|5256	que vos estes venuz|car en la voie de ceste forest ne voi je en nule manniere	donde vo siete venuto ché nella via di questa foresta non vorei	3936
5257|5258	que vos en issisiez a :|car puis Il	che vo metteste ché da due anni in qua vi sono ben dugento cavalieri andati	3937
5259	anz an an ça i sont bien Il	che tutti mi giurano al dipartire	3938
5260	cens chevalier entré		
5261	qui tuit me creanterent au departir que se Diex lor donnoit eschaper de mort qu il revandroient ci raconter ce qu il trouveroient ne onques	che se ldio ne lor donasse a scampare sanza morte|che ritornerebbono qui a racontare a me ciò	3939|3940
5262	puis nus n an revint	ch egli troverebbono né unque poscia no rivenono	3941
5263	et por ce sai je bien qu il sont tuit mort	che sono tutti morti	3942
5264	Por ce vos di je bien sire	; perciò vo dico bel sire	3943
5265	que vos estes orandroit comme pilers de chevalerie	e vo f priego	3944
5266|5267	si vos di|que vos n i entrez	che vo non v entriate	3945
5268	car je sai bien	ch iso bene	3946
5269	que ja n en istrez	che già non uscirete	3947
5270|5271	— Or me dites fait Lanceloz de cels lestres|qui la sont	— Il Or mi dite disse Lancelotto di queste lettere sapete vo' chi lle fece	3948
5272	et certes savez vos		
5273	qui les fist		
5274|5275	— Certes fait il nenil|—	? —Certo diss egli no	3949
5276	Et i ont eles longuement esté		
5277|5278	? — Ofl fait li prodom plus de|VI	— E v ànno elle	3950
5279	anz		
5280	— Or vos comment a Dieu fait Lanceloz		
5281	quar trop ai demoré ici	si lungamente state	3951
5282|5283	—|Et ne feroiz vos mie fait li prodom ce	? disse Lancelotto	3952
5284|5285	que je vos di|que vos lessiez la voie de la forest	— S oil sire disse il produomo piui di sei anni	3953
5286|5287	? — Nenil voir fait Lanceloz|Ja	— Or v acomand io sa Diol disse Lancelotto ché già per cosa	3954
5288	por chose		
5289|5290	que g i voie ne la lairai a passer|quar trop seroit grant recreandise se ja avoie paor devant	ch i' vega non vi lascere io a passare ché troppo sarebbe gran codardigia s i avessi paura anzi	3955
5291	que je veisse le porquoi — Or vos dirai fait li hermites	ch i' udissi il perché|— Or vo dirò io disse il romito	3956|3957
5292	que vos i eroiz	che vo farete poscia	3958
5293	puis qu il est ainsi	ch egli è insi	3959
5294	que vos ne retornerez mie	che vo' non ritorneresti mica	3960
5295	Remanez huimais ceanz	: rimanete oggimai qua entro poscia	3961
5296	por ce qu il est pres de nuit	ch egli è presso di notte	3962
5297	et c est li mielz		
5298|5299	que g i voie a vostre oes|car se vos orandroit vos metez en ceste forest	ch io ne vega a vostro huopo ché se voi oraindiritto vi mettete in questa foresta elli vi converà giacere di sotto uno albero alla terra	3963
5300	qui est grant		
5301	et espesse il vos anuitera par aventure avant		
5302	que vos soiez II		
5303	liues alé :		
5304	si vos couvendra gesir souz l		
5305	arbre ou a la terre nue		
5306|5307	?|si n avrez	si nonn aresti	3964
5308	que mangier ne voz chevax	che mangiare né voi né vostro cavallo	3965
5309	Mais ceanz gerrez vos a aise	; ma qua entro giacerete voi ad agio	3966
5310	et avrez a mengier	e arete assai a man giare	3967
5311	et vostre cheval fain	e vostro cavallo altresi fieno	3968
5312	et avainne	e avena	3969
5313	et li vallez sera a repos	e l valletto sarà in riposo	3970
5314|5315	dont il n avroit|mais hui point	donde non arebbe oggimai punto	3971
5316	—	— Poscia	3972
5317|5318	Puis qu il vos plaist fait Lanceloz|que je remaingne je remaindrai	che voi piace disse Lancelotto i' rimarò	3973
5319|5320	et si est il J|poi trop tost	e si è egli un poco troppo tosto	3974
5321	Lors descent	eAllor discende Lancelotto	3975
5322	et cil li tient l estrier	e l valletto li tiene la staffa ed e' li dice	3976
5323	et li dist qu il remaingne huimais o lui	che rimanga ogimai con esso lui	3977
5324	et je te di loiaument fait il	e i' ti dico lialmente diss egli al valletto	3978
5325	que je te ferai compaingnie demain a trespasser la forest	ch i' ti farò domani compagnia al trapassar della foresta	3979
5326	Et cil remaint	E l valletto rimane	3980
5327	qui voit bien qu il ne porroit pas mielz faire	che ben vide|che non potrebbe meglio fare	3981|3982
5328	Cele nuit fu Lanceloz serviz	Quella notte fu Lancelotto servito	3983
5329	et aaisiez de quanque li prodom i pot	e onorato di quanto	3984
5330	car il anvoia	che l romito puote avere	3985
5331|5332	? son clerc pres d iluec a J|chastel	ch egli mandò suo cherico a un castello presso del luogo per acattare de pegioni	3986
5333	por achater poison		
5334	si come au jor del vandredi;	si come in di di ve nelrdi conviene	3987
5335	si mangierent a grant planté	si ebbono a mangiare a gran quantità	3988
5336	Aprés souper demanda Lanceloz au prodome conment la forest avoit non		
5337|5338	Sire fait il la gent de cest païs l'apelent la Forest Perdue|car il n i a nul	Sire diss egli gli uomini di questo paese la chiamano la foresta Perduta ché non è nullo	3989
5339	qui de l estre de laienz puisse savoir ainz est	che dell essere di là entro possa sapere	3990
5340|5341	si perdu quanqu il i entre|que l an n an set plus ne vent ne voie	si che l uomo no ne sa più né casmlpo né via	3991
5342	— Par foi fait Lanceloz ce est merveille	—Per fé disse Lancelotto ciò è maraviglia	3992
5343	que nus n an revient il m est avis	che nullo no ne riviene|; egli m è aviso	3993|3994
5344|5345	que ce est la Voie sanz Retor|et ja Diex ne m aïst se je le laissoie	che ciò è la Via Sanza Ritorno né già Dio non m aiuti s io lasciassi per nulla	3995
5346|5347	por riens|que je n i alasse	ch io non v andassi	3996
5348	et que je ne sache ou il remaingnent tuit	ch io non sappia ove rimangono tutti	3997
5349|5350	— Or vos en consaut Diex fait li prodom|car si m aïst Diex onques mes nus n i ala	—eOr vo n aiuti lddio disse il produomo ché se m aiuti ldio unque mai niuno non v andò dond io avessi	3998
5351|5352	dont je eusse|si grant paor com j ai de vos	si gran paura com io ô di vois	3999
5353	Cele nuit fu Lanceloz au plus a aise	l vQuella notte fu Lancelotto il più ad agio	4000
5354	que li prodons pot	che l produomo puote	4001
5355	et au matin	Al mattino quand	4002
5356	quant il fu levez li chanta la messe del Saint Esperit	e fu levato|si cantò il romito messa del Sancto Spirito	4003|4004
5357	puis s arma	; poscia|si s armò	4005|4006
5358	et quant il fu armez	e quand|e fu montato	4007|4008
5359	si conmande le prodome a Dieu	si comanda il produ omo a Dio	4009
5360	Et quant il l an voit aler	E quando il romito ne l vide andare	4010
5361	si prie a Nostre Seingnor	si priega Nostro Signore	4011
5362	que le ramaint a sauveté	che llo rimenasse assalvamento	4012
5363	Et il se met en la forest		
5364	et li escuiers avec li	e llo scudiere con esso lui	4013
5365	et Lanceloz li demanda a cui il est	e Lancelotto li domanda a cui egli è ed egli dice	4014
5366	Au roi Pellés de la Terre Forainne	ch egli è al re Pelles della Terra Forana	4015
5367	qui l anvoie au duc d Oc en message	che l mandò al duca in mesaggio	4016
5368	Einsinc ont chevauchié dusqu aprés prime par mi l ombre del bois tant qu il encontrent L	olnsi cavalcarono insin qua a terza per me l ombra del bosco tanto	4017
5369	damoisele	ch egli incontrarono una damigella	4018
5370|5371	qui portoit I|brachet entre ses braz	che portava un brachetto intra sue braccia	4019
5372|5373	Et Lanceloz avoit osté son hiaume|por le chaut	PtE Lancelotto avea tratto suo elmo per lo caldo	4020
5374	qui ert levez	ch era levato	4021
5375	si avoit son viaire descouvert; il salue la damoisele	si avea suo viso discoperto|;	4022|4023
5376	quant il l aproche	e elli saluta la damigella quand e' l apressima	4024
5377	et ele ne dist mot ainz le resgarde	e ella non gli disse motto anzi il risguarda ché tanto le sembia bello	4025
5378	quar tant li sambe biaux qu ele an devient toute esbahie	ch ella ne divenne tutta isbigottita	4026
5379|5380	si s areste|por lui mielz veoir	Si s aresta per lui meglio vedere ed	4027
5381|5382	et il s an merveille|por quoi ele le resgarde einsi	e si maraviglia molto perché ella l risguarda insi	4028
5383	si li dist Damoisele	si lle disse|: Damigella	4029|4030
5384	que vos en samble	che vo sembia	4031
5385	? — Certes sire fait ele il me samble	? —Certo sire diss ella e' mi sembia	4032
5386|5387	que ce est granz domages|quant I	che cciò è troppo gran danaggio quando	4033
5388	si biaux cors d ome vait a sa mort	si bel corpo d uomo va a ssua morte	4034
5389	et a sa honte:	e a ssua onta	4035
5390|5391	si m est|? avis	“sSi me n è aviso	4036
5392|5393	que molt en fait Diex a blasmer|quant il ceste part vos a conduit	che molto ne fa lddio a biasimare quando elli in queste parti vo à condotto	4037
5394|5395	car em plus perilleux leu ne poissiez vos pas aler|— Or ne vos esmaiez fait il damoisele touz li maux	ché in più periglioso luogo non vo puote elli fare andare	4038
5396	que vos pensez ne nos avandra Diex l otroit fait ele	che vo' pensate no no verrà passo	4039
5397	car si Paej se Deu plest	se Dio piace	4040
5398	m aïst Diex je le voldroie bien	— Dio il consenta diss ella ché se m aiuti ldio i' nol vorei micas	4041
5399	Si s em part atant li uns de l autre	Si si parte atanto l uno d altro	4042
5400|5401	Quant il sont J|poi esloingnié	Quando sono un poco islungati	4043
5402|5403	si dist li vallez a Lancelot Sire|por Deu	si disse il valletto a Lancelotto	4044
5404	car creez conseil		
5405	et aiez pitié de vos meesmes	e abiate pietà di vo' medesimo	4045
5406	et retornez	e ritornate	4046
5407|5408	N avez vos oi|que cele damoisele	! Non avete vo udito questa damigella	4047
5409	qui onques mes ne vos vit est couroucie de vos	ch unque mai non vo vide|e si è	4048|4049
		si crucciata di voi	4050
5410	et a vos a dit	e vo disse	4051
5411	que vos alez a mort	che voi andate a vostra morte	4052
5412	? Malement em pesera or a cels	? Malamente ne peserà a quelli	4053
5413|5414	qui vos connoissent|quant a cels	che or vo conoscono quando a coloro	4054
5415|5416	qui onques|mais ne vos virent em poise	ch unque ma non vo vidono ne pesa	4055
5417|5418	Por Deu retornez tant com vos en avez le loisir|et je	ePer Dio sire ritornate tanto come vo n avete il lecere	4056
5419|5420	por l amor de vos retornerai|por vos faire compaingnie	e io per l amore di voi ritornerò per voi fare compagnia	4057
5421	tant que vos soiez fors de la forest	tanto che voi siate fuori della foresta	4058
5422	Et il dist qu il nel feroit en nule manniere mes test s an ;	Ed e' dice|che nol farebbe i'nulla maniera ma ataci teb	4059|4060
5423	et il dist qu il n em parlera jamais	Ed e' dice|che non ne lli parlerà giamai poscia	4061|4062
5424	puis que ses cuers i est atornez	che suo cuore n è|si atornato	4063|4064
5425	Si ont tant alé qu il vindrent en J	l|Si ànno tanto andato	4065|4066
5426|5427	molt bele praerie devant J|tor ou il avoit tandu dusqu a XXX	ch elli vengono in una molto bella prateria davanti una molto bella torre ov egli avea tesi insino a venti padiglioni	4067
5428	pavillons les plus biax		
5429	et les plus riches	e più ricchi	4068
