3218	et conmancerent a parler d unneschoses !	e ella el mena in una camera di là entro presso d un verzieri|Si 'l fa mangiare poscia li dona buone armi	2708|2709
3219|3220	et d autres|et	e buono cavallo	2710
3221|3222	tant que la fille Baudemagu une damoisele|qui delez lui seoit li dist	e quand egli è apparecchiato come del montare elli disse alla damigella	2711
3223	que Madors de la Porte I	: eDamigella ditemi di qual torniamento i cavalieri di qua entro parlavano stasera apresso vespro	2712
3224	des chevaliers le roi Artus	— Sire diss ella volentieri	2713
3225	et Mordrez li frere mon signor Gauvain avoient tout vaincu	sEgli è vero|che 'l re Bando di Maguzo	2714|2715
3226	—		
3227|3228	Et quels chevaliers est cil Madors|? faît ele	e l re di Norgales giurarono un torniamento l uno incontr all altro	2716
3229	— Par foi fait l autre ce est J		
3230	des greingnors chevaliers		
3231|3232	que je onques veisse|et li mielz feranz de lance	e di gente incontro a gente	2717
3233|3234	Einsi parloient entr elz des chevaliers|Et Lanceloz est vestuz	Si ànno oggi stati asembiati in una prateria	2718
3235	et aparilliez		
3236|3237	et or messe|et li III	ch è due leghe presso di qui	2719
3238	chevalier orent envoié querre lor armes au chastel ou il les orent laissies		
3239	Et li rois Bademaguz lor manda qu il ne venissent au tornoiement devant aprés prime		
3240|3241	et qu il baillassent a Lancelot couvertures blanches|et ausi a son cheval	si che quegli di qua entro a cu' vo n udisti parlare ne sono stanotte venuti	2720
3242	et l	—	2721
3243|3244	escu blanc;|et il le firent ainsi	e qua' diss egli n ànno il piggiore	2722
3245|3246	Quant vint entor prime qu il erent tuit armé fors de lor hiaumes|si distrent a Lancelot qu il manjast I	ch egli non avea mica tante genti della metà come il re di Norgales	2723
3247|3248	poi pour aler plus seurement;|mais il dist	; ma egli ànno preso termine di ar sembiante giuovedi	2724
3249|3250	que no feroit|et il a monterent maintenant	E egli non f v avea	2725
3251	et se partirent de laienz		
3252	et errerent par la forest tant qu il vindrent en la place		
3253	Si erent ja assamblé		
3254|3255	que d unne part|que d autre plus de XX	che un giorno in mezo	2726
3256	mile		
3257|3258	et le faisoient bien d ambe JI|parz	E quando Lancelotto intende	2727
3259	mais moult avoit plus grant gent li rois de Norgales		
3260|3261	que li rois Bademaguz|Quant Lanceloz vint pres des jostanz	che l re Bando n è stato cacciato del campo	2728
3262|3263	si se traist a une part lui|et ses compaingnons	si n è molto dolente ché ciò è un degli uomini del mondo	2729
3264	et resgardent liquel le font mielz;	che più gli à fatto d onore	2730
3265|3266	si voit III|chevaliers par desus le roi de Norgales	:	2731
3267	qui trop bien le faisoient	si n è molto dolente di ciò	2732
3268	car il donnoient hardement as leur par lor bien faire a:		
3269|3270	si avoient ja tant fet|que la gent Bademagu estoient ja reculé plus d unne archie	ch egli non v è stato ché s egli vi fosse acciò	2733
3271	Et la fille au roi de Norgales em parole a ses compaignes		
3272	qui illuec estoient	che ssi sente sano	2734
3273	et dist oiant toutes Par Dieu moult fust i ancui biaux cist tornoiemenz se cil de la poïssent soffrir les noz		
3274	Mais il m est		
3275	? avis a ce qu il vont reculant qu il seront par tans mis a la fuie;		
3276	et ja Diex ne m aïst se molt ne font a prisier	e atato disiderante di portare arme non crede mica	2735
3277|3278	cil IlI|chevalier	che l re avesse avuto il piggiore	2736
3279	qui par devers les noz sont	si com egli à ora	2737
3280	car pour aux sont desconfit cil de Gorre	Allor monta in su' cavallo	2738
3281	— Damoisele fait la fille Baudemagu	e acomanda la damigella a Dio	2739
3282	qui sont il cil	e ella I priega	2740
3283	qui doivent estre prisié		
3284|3285	? — Par foi fait ele li uns en est Mordrez li freres mon signor Gauvain a ce vermeil escu|et li autres est Madors de la Porte li graindres chevaliers	che no lla dimentichi del convento	2741
3286	qui ci soit	ch ella li à	2742
3287	et li tierz est Galehodin mes nies cil		
3288	qui porte cel escu blanc		
3289	Ce sont cil		
3290|3291	qui mielz le font de toute ceste place|et par cui vostre gent sont desconfit	Si se ne va tanto ed entra in un veriere	2743
3292|3293	— Or ne vos esmaiez damoisele fait cele de Gorre|car si m aïst Diex	; del verziere entrò in una picola prateria	2744
3294	que se li rois vostre peres ne s anfuit il verra		
3295|3296	? ancui donner telz cox|dont il n atandroit I	Allor truova uno stretto sentiere	2745
3297|3298	por tote sa terre perdre|— He Diex fait ele	che l mena diritto in una foresta ov egli truova un padiglione teso davanti a un grande olmo	2746
3299|3300	qui les donra|? — Par foi fait ele veoir le porrez par tans	;	2747
3301|3302	car il est venuz|qui tex cox donne	e egli torna in quelle parti in sul cavallo per ciò	2748
3303|3304	En ce qu eles|? parloient einsi	che gente vi crede trovare	2749
3305	si oïrent le cri lever sor çaux de Gorre		
3306	qui s anfuioient	si discende	2750
3307|3308	et les aloient prenant cil de Norgales|Et Lanceloz apele cels	e all entrata vide di dentro due ceri ardenti	2751
3309|3310	qui avec lui estoient|et lor dist Sivez moi	e un gran letto coperto d uno sciamito	2752
3311|3312	car trop avons atandu|Lors laisse corre par mi les rans quanque cheval puet aler	vE egli viene al letto ma e'non vi truova né huomo né femina né nel padiglione altresi	2753
3313|3314	si fiert|si durement le premier qu il encontre qu il porte lui	:	2754
3315|3316	et le cheval a terre tout en I|mont	e quand	2755
3317|3318	et fiert del retor un autre sì qu il li fait la sele vuidier|Et quant il a son glaive brisié	e vide ciò	2756
3319|3320	si met la main a l espee|dont il se savoit bien aidier	si venne al su' cavallo	2757
3321	si conmance a ferir tout entor lui		
3322|3323	et a donner granz cox|et point amont	e gli trae el freno	2758
3324|3325	et aval ne n ataint home qu il ne le port a terre|Il esrache escuz des cox	e lla sella	2759
3326	et hiaumes des testes		
3327	si fait tant em poi d ore	e l mena a pascere	2760
3328	que touz li tornoiz s areste sor lui		
3329|3330	por veoir les merveilles qu il fet a|qu il n i a	Poscia	2761
3331	mais nul tant soit hardiz		
3332	qui a cop l ost atandre:		
3333	si occist	si disarma	2762
3334	et mehaingne touz cels de Norgales		
3335|3336	tant que a fine force les fait retorner plus de IIl|archies	e mette sua spada a suo capo	2763
3337	Tant fait par sa proesce		
3338	que tuit en parolent loing		
3339	et pres	e si	2764
3340	et dient		
3341	que tout vaint li ehevaliers as armes blanches		
3342	?;		
3343|3344	et li III|compaingnon	si dispoglia	2765
3345	qui devant ce avoient mis cels de Gorre a la voie		
3346	et qui estoient issu del tornoiement		
3347|3348	por aux reposer I|poi s an merveillent molt	e dice	2766
3349	quant il voient lor genz afoïr:	che si	2767
3350	si demandent	si coricherà entro poscia	2768
3351	que ce est	che non vi truova anima	2769
3352	Que ce est	Poscia dispegne i ceri per la chiarità|che mal no gli facesse	2770|2771
3353	? fait I	e si	2772
3354	vallez	si corica	2773
3355	N avez vos pas veu les merveilles qu il i a	e dorme immantanente|Appresso ciò non dimora guari	2774|2775
3356	? — Quels merveilles i a il	che là entro venne un cavaliere|e vid	2776|2777
3357	? fait Mordrez	e ceri spenti	2778
3358	— Par foi il i a l	si crede bene	2779
3359	chevalier a unes blanches armes I	che sua dama fosse indormita|e ch ella avesse	2780|2781
3360	deable L	e ceri spenti per la chiarità|'Elli era sanza ispada	2782|2783
3361	aversier	e sanza armadura	2784
3362	qui plus occirroit ancui de gent	si fu tosto dispogliato	2785
3363	que l an ne porroit d omes morz enterrer en Il	e si corica tostamente allato a Lancelotto|e si trae apresso di lui	2786|2787
3364	arpanz de terre	e ll abbraccia	2788
3365	N alez mie cele part se vos ne volez morir	e comincia a T baciare|ch elli crede veramente	2789|2790
3366	Que ja Diex ne m aïst se encontre s espee puet durer fers ne aciers Lors relacent lor hiaumes li III	che ciò fosse sua femina|csQuando Lancelotto senti quelli	2791|2792
3367	i compaignon	che nsi l baciava	2793
3368	et montent es chevax	si salta suso tutto isbigottito	2794
3369	et prannent escuz	e crede bene	2795
3370	et lances	che ciò sia dama o damigella|si 'l piglia alle due braccia	2796|2797
3371	et laissent corre a Lancelot devant	;“e que se n avede tantosto|e crede bene	2798|2799
3372	que cil de Norgales fuient ainsi comme li lievres devant les chiens	che ciò sia il liaggiatore di sua femina|si si disviluppa da llui	2800|2801
3373	Et Lan¬ celoz ot lance recouvree qu il toli a J	e l piglia co lle due braccia|e l solprende	2802|2803
3374	de ceaux	si che 'nanzi	2804
3375	qui s anfuioient	che Lancelotto se ne fosse presso guardia l à elli gittato di sotto lui alla terra|e mal vo coricaste con esso mia femina in mio padiglione medesimol	2805|2806
3376	si s adrece vers l un de cels III	Poscia li dona del pugno nel miluogo de denti|si ch a poco	2807|2808
3377	chevaliers	che no ne li à tratti nella bocca|e l sangue ne salta	2809|2810
3378	et ce estoit Mordrez	si che n à il mento tutto sanguinoso|eQuando Lancelotto	2811|2812
3379	et le fiert	si sente	2813
3380	si qu il li met par mi l espaule senestre le fer a tout le fust; il s ampaint bien	si malmenare|si l piglia per me la gola	2814|2815
3381	et le porte a terre tot anferré	e l fa volare per di suso lui	2816
3382	Et li rois Bademaguz	e l fa ferire inn un feristo	2817
3383	qui derrier lui estoit li baille I	che li êl miluogo del padiglione era|ch elli fece	2818|2819
3384	autre glaive	e Lancelotto	2820
3385	et li dist Sire tenez monstrez nos encore conment vos savez lances brisier	si rileva|e viene in quelle parti ov'egli ebbe sua spada lasciata	2821|2822
3386	Et il lesse maintenant corre vers Mador de la Porte	si la trae del fodero tutta ignuda|a luna lucea molto chiaro	2823|2824
3387	et cil li brise son glaive en mi le piz	si che l uomo potea alquanto vedere per me' l padiglione	2825
3388|3389	et Lanceloz|qui la soue porte bas le fiert	PQuando il cavaliere vide venire Lancelotto la spada tratta	2826
		si non l osa attendere anzi	2827
		si torna fuggendo tutto ignudo	2828
		e si mette inverso la foresta	2829
		eE Lancelotto il seguita tutto ignudo	2830
		ch atanto nol vuole mica lasciare	2831
		:	2832
		si lo caccia tanto sanza nulla roba	2833
		che l agiugne	2834
3390	si qu il li met par mi la cuisse le fer o tout le fust sì porte lui	si gli dona per me la testa della spada|si ch egli il fende tutto insin qua a' denti	2835|2836
3391	et le cheval a terre tout en I	e que cade morto a terra	2837
3392	mont	e si corica|e si dorme insino al mattino ma molto	2838|2839
		si sente brisciato del colpo	2840
		che que' li ebbe donato nel miluogo de denti	2841
		Allo 'ndomane quando l ugioletti cominciarono a cantare	2842
3393	et s em passe outre	si si leva|e vesti	2843|2844
		e pigliò sue armi	2845
		e monta in su' cavallo	2846
		poscia	2847
		si parti di là entro	2848
		ch eli non seppe passo a quella fiata chi l cavaliere fu	2849
3394	et trest l espee	ch egli avea morto|si incontra quattro scudieri	2850|2851
		che menavano a destra quatro destrieri tutti bianchi	2852
3395	et fiert Galehodin en l escu blanc	e avieno catuno bianche coverture	2853
		Apresso avieno due altri scudieri	2854
		che porta vano li arnesi dun cavaliere asbergo	2855
3396	si qu il en a abatus I	e elmo|e calze di ferro	2856|2857
3397	grant chantel :	e ginochiali	2858
		e cotte d armare di bianco esciamito	2859
		e l altro portava uno scudo bianco come neve	2860
		eElli saluta lo scudieri	2861
		e domanda a cui est quello arnese	2862
		che domane vuole essere al torniamento di due re	2863
3398	et l espee descent jus sor le cheval	—E come à nome quel cavalier	2864
		? dice Lancialotto	2865
		— Sire dicono egli l uomo l apella Galeadino	2866
		: fu figliuolo di Galeotto il signore de lLontane Isole	2867
		— usGià cui iuta egli	2868
		? disse Lancelotto	2869
		— Egli aiuta dison'egli al re di Norgales per ciò	2870
		che ces aeux est	2871
		— E quel torniamento dove sarà	2872
		? disse Lancelotto	2873
		— Bel sire disono egli per una prateria dove voi avete immantenente passato	2874
		Allora glicosmlanda Lancelotto a Dio	2875
3399	si qu il li coupe le col par devant les espaules	si se ne parte atanto|; quando egli à un poco andato	2876|2877
3400|3401	et abat en I|mont chevalier	si ode a dextra sonar una campana	2878
3402	et cheval	e s adiriza in quelle parti	2879
3403|3404	Quant li rois de Norgales|qui ot ja assez resgardé Lancelot	e truova una badia di monache bianche	2880
3405|3406	por les merveilles qu il faisoit voit celui cop|si ne l ose plus atandre ainz torne en fuie quanque li chevaux pot aler	Egli discende a l entrata	2881
3407	Lors conmance la criee trop mervilleuse		
3408|3409	car tuit cil de Norgales s enfuient|et cil de Gorre les anchaucent	e dà su cavallo a guardar a uno garzone	2882
3410|3411	et les prannent a lor volenté|Et quant Lanceloz voit qu il sont del tout torné a desconfiture	; poscia entra nel monisterio tutto armato fuor di suo elmo	2883
3412	et qu il n i a mes nul recouvrier	e discudo	2884
3413|3414	si se fiert en la forest|et s en vait grant oirre	e di lancia	2885
3415|3416	car il ne velt estre arestez de nelui|Assez fu quis	;e quando egli è là entro entrato e' vi truova la sirochia di Meliagante quella el trasse della dolorosa prigione dov egli era stato messo	2886
3417|3418	et demandé|mais il n i ot celui	E que' il riguarda	2887
3419|3420	qui le poïst trouver|Et quant li rois Bademaguz vit qu il s en estoit tornez en tel manniere qu il ne set qu il doie dire ne faire	e avisa tanto	2888
3421	et dist	e ella il conobbe	2889
3422	que voirement est il li plus maleurez hom	che ciò era Lancelotto ma molto|si maraviga	2890|2891
		che i belli capelli sono divenuti	2892
3423	qui onques fust	che soleva avere	2893
3424	quant il avoit ore o soi le meillor chevalier dou monde	Si si pensch egli è stato malato|e che perciò	2894|2895
3425	qui il deust faire joie	si gli son caduti	2896
3426	et feste	;	2897
3427	et ore l a perdu par sa mauvestié	si soffera di parlar al llui'nsin apresso messa	2898
3428	Et Galehodin	asOuando i frati l ebono cantata	2899
3429	que Lanceloz ot abatu fu remontez	e Lancelotto fu uscito del mistieri la damigella venne apresso lui|e lli disse	2900|2901
		eE quand e' la vide	2902
		si la conobbe	2903
3430	si com il pot	si le disse	2904
3431|3432	et vient au roi Baudemagu|et se fait connoistre a lui;	Mia dolce damigella vo' siate la benvenuta	2905
3433	et quant il le connoist	Come l avete vo poscia fatto|ch i' non vo vidi	2906|2907
3434	si li fait molt grant joie	? Sire diss ella ben Dio mercé|e lla vostra	2908|2909
		— E quale aventura diss elli vo à qua amenato	2910
3435	et li dist Sire je sui venuz a vos	? — ire diss ella i' vegno per uno torniamento|che domane sarà presso di qui	2911|2912
3436	que vos me diez	si l à impreso mi padre il re Bando di Maguzo contr al re di Norgale|E elli dice	2913|2914
3437	qui li chevaliers est	ch altresi era elli venuto per vederlo|Vere diss ella sire v andrete voi lo 'ndomane	2915|2916
3438	qui si bien l'a hui fait par deça	? — Oil diss elli s i' posso|— Dunque vo vore io	2917|2918
3439	— Biaux douz sire fet Baudemaguz	diss'ella pregare per Dio|e per amore	2919|2920
3440	por quoi le me demandez vos	che voi atasti a me	2921
3441	? — Sire fait il	; ed|e le disse	2922|2923
		che si farà elli	2924
		e volenteri di tutto su' podere	2925
3442	por ce	MeaSire	2926
		diss ella centomilia mercé di Dio	2927
3443	que je sui jones hom	Dunque so i' bene	2928
		che l re di Norgale vi perderà tutto	2929
3444	et sai encore poi des ames:	e mi' padre n arà l onore|E i' vo priego	2930|2931
3445	si avroie mestier d acointier moi d	che vo' rimagniate oggimai qua entro con esso meco|e domane moveremo ad andare a torniamento	2932|2933
3446	l	;	2934
		e voi il dovete ben fare ché se voi oraindiritto vo moveste vo' non trovereste oggimai	2935
3447|3448	si prodome com il est|por ce qu il m en apreist	si buono stare presso del torniamento	2936
3449	et por ce	E sappiate	2937
3450	que j en amanderoie de lui	che vo sarete molto ben servito di tutte le cose	2938
3451	et de sa compaingnie	che l uom potrâ	2939
3452	— Certes sire s il vos quenoissoit il vos avroit molt chier	Elli dice	2940
3453	car il ama molt mon signor vostre oncle	ch elli rimarà poscia|che le piace	2941|2942
3454	?	si si fa disarmare immantenente	2943
3455	et vostre oncle	si gli disse	2944
3456|3457	? le rama molt|que onques hom n ama plus autre	Vattene diritto al castello dellArpa ove tu troverai il re Bando di Maguz mi' padre	2945
3458|3459	Si vos di|por voir	:si gli dirai	2946
3460|3461	que ce est mes sires Lanceloz del Lac|— Lanceloz	ch i' ho qua entro monsignor Lancelotto de Lac	2947
3462|3463	? fait il|Ne cuidoie je mie vraiement qu il fust morz	che li dee domane atare al torniamento	2948
3464	?		
3465|3466	Mais puis qu il est vis je creant a Dieu|que jamais ne finerai de chevauchier se morz ou pris ou malades ne sui	ch elli il vegna domani a vedere tostamente s elli puote in nulla maniera	2949
3467|3468	tant que je l avrai trové|Et quant je le verrai	mvll valletto	2950
3469	si li prierai	si parte da sua dama	2951
3470	por l amor de mon oncle qu il tant ama qu il me retiengne avec lui		
3471	et me lest aler par les estranges terres cerchier les estranges aventures o lui		
3472	Et se il ce ne velt totes voies m aidera il mielz a conseillier		
3473	que uns autres ne feroit		
3474	Atant s em part del roi Baudemagu	e viene al re Bando di Maguzzo	2952
3475|3476	et s en vaît ainsi armez com il estoit qu il nel fait savoir a cestui ne a cest autre ne n anmainne avec lui escuier ne garçon;|si se fiert en la forest aprés Lancelot	si gli disse ciò	2953
3477	et chevauche toute jor ajornee qu il n ancontre home ne fame		
3478	qui noveles li die de ce qu il quiert	che sua figliuola gli manda	2954
3479	Et Lanceloz ot toute jor chevauchié las		
3480	et travilliez de ce qu il ot le jor fait		
3481	et ses chevaux se doloit		
3482	si durement	si si pensa	2955
3483	que del poindre qu il ot le jor fait		
3484	que des petites plaies qu il avoit a		
3485	que a painnes pooit il aler		
3486	que le pas		
3487|3488	Lors resgarde arriere lui|et voit venir	ch egli l andrà a vedere al più privatamente	2956
3489	J		
3490|3491	chevalier armé|et une molt bele dame avec lui	ch egli potrà ché per ventura Lancelotto non vuole mica	2957
3492|3493	Il le saluent|quant il viennent pres	che uomo il conoscesse al torniamento	2958
3494	et il a molt grant paor de quenoissance;		
3495	si respont basset	si mne fu elli l uno	2959
3496	que Diex les beneie	e l altro dussi	2960
3497	Biaux sire fait la dame		
3498|3499	qui estes vos|? — J	e l terzo quan	2961
3500|3501	chevaliers sui ce poez veoir|—	e 'l quarto semplice cavaliere molto era produomo	2962
3502	Si m aïst Diex fait ele chevaliers estes vos tel a mon esciant qu il n a vostre pareil ou monde:		
3503	si le sai par or̈r dire		
3504	et par veoir		
3505	et je vos pri par la riens		
3506	que vos plus amez el monde		
3507	que vos hui veingniez herbergier o moi en un mien chastel	che vo' vegniate con esso meco insino a una badia	2963
3508	qui ci pres est par couvant	che qui presso esto	2964
3509	que je vos mousterrai demain la plus bele riens		
3510	que vos onques veissiez		
3511	Et il dist qu il i ira volentiers par cest couvant		
3512	Or en venez donc fait ele		
3513	— Alez fait il	Egli dicono	2965
3514	et je vos suirrai		
3515	La dame s an vait avant		
3516|3517	et cil aprés|qui greingnor mestier eust de repos	che si faranno egli volentieri	2966
3518	que de chevauchier;		
3519|3520	si ont tant alé qu il vindrent en J|valee	Si montarono isnellamente	2967
3521	et voient el fonz del val I		
3522	chastel bien fait		
3523	et bien seant	e quand	2968
3524	dont li mur estoient fort		
3525	et grant		
3526|3527	et menuement crenelé|Quant il vindrent au chastel	e sono fuori del castello il re li chiama	2969
3528	si estoit ja grant nuit		
3529	et la dame apele celui		
3530	qui la porte gardoit		
3531	et li dit qu il ouevre la porte		
3532|3533	et cil|si fait	e llor disse	2970
3534	Et il antrent anz		
3535	et chevauchent dusqu au mestre palais ;		
3536|3537	et quant cil de laienz voient|que lor dame vient	— Vo meno diss egli a vedere maraviglie	2971
3538|3539	si li saillent a l encontre o cierges|et o tortiz	ch i' vo mosterò oraindiritto un sol cavaliere	2972
3540|3541	car autrement n i veissent pas|por la nuit	ch à in sé tutte le virtù per	2973
3542|3543	qui trop ert oscure|Si descendent la dame	che l uomo dee essere montato	2974
3544	et ele dist qu il ne s entremetent de lui	si ben guernito com egli è	2975
3545	mais je vos pri fait ele d onorer cel chevalier	ch egli è un de buon cavalieri del mondo	2976
3546|3547	et de servir|car je vos di fait ele qu il est li plus prodons del monde	e à in sé più prodeze	2977
3548	et le millor chevalier	che non à inn uom mortale	2978
3549	Et le descendent maintenant	e di	2979
3550	et li ostent l escu del col	si nobil core	2980
3551	puis le moinnent amont	che più nullo altro	2981
3552	et le desarment	e sire	2982
3553|3554	Et la dame le resgarde|et voit le vis gros	: ciò è miglior cavaliere	2983
3555|3556	et anflé|et le nes escorchié	e 'l più disiderato uasaandare c	2984
3557	et sanglant des cox qu il ot donnez	leghe di terra per lui vedere	2985
3558	et receuz ;	—ePer fé disse il re	2986
3559	si li fait aporter eve chaude a laver son col	si à l uomo molto più andato per lu' vedere	2987
3560|3561	et son vis|qui touz estoit nerciz des mailles del haubert	:	2988
3562|3563	Et quant ele resgarde l escu|si dist oiant touz ceus de laienz Ha escuz tant avez hui esté resgardez	si vo dirò come i vidi già fare una chesta per lui ov egli ebbe insino a quindici cavalieri	2989
3564	et desirrez d estre tenuz de maîntes beles puceles!	che tutti erano molto produomini	2990
3565	Si m aïst Diex bien se puet celui vanter		
3566	qui vos porte	e arditi	2991
3567|3568	que onques chevalier tel merveilles ne fit en I|jor com a hui fait cist	;	2992
3569	Et beneoiz soit Diex		
3570|3571	qui le me donna acointier|car il ne me poïst mie greingnor honor avenir de ce qu il est venuz a mon hostel	e lo 'nchiesono uno anno intero per vederlo né non ebbe nullo di loro	2993
3572	Lors entre en sa chambre	che l vedesse a quella fiata	2994
3573	et aporte robe de cendal a vestir a Lancelot;	: or sappiate|che quelli n andarono più di mille leghe	2995|2996
3574|3575	et quant il est vestuz|si le fait seoir	si nol trovarono elli mica	2997
3576	et li dist Sire reposez vos		
3577	car si maist Diex vos le devez bien faire		
3578	car asez avez esté travilliez	isTanto ànno andato	2998
3579	Et ele conmande a cels de laienz qu il apareillent a mengier	ch elli venero alla badia ove Lancelotto era	2999
3580	car il en est tans		
3581|3582	et il|si font	si discendono	3000
3583	Quant il furent assis a la table	;	3001
3584|3585	si vint laienz I|vallez	e valetto vene avanti	3002
3586	qui dist a la dame Dame mes sires est venuz	che disse alla damigella|: ibaDama monsignore est venuto	3003|3004
3587	— De par Deu fait ele di li qu il viengne mengier		
3588|3589	et qu il ne demort mie|car il a çaienz I	e ella va incontro a llui	3005
3590	chevalier a cui je voil		
3591	que il face grant joie	e l prende per la mano	3006
3592|3593	Li vallez vient a son signor|et li dist ce	e l mena in una camera ove Lancelotto era	3007
3594|3595	que sa dame li mandoit|Et il se desarma maintenant	; ema elli non dormia mica	3008
3596|3597	et ausint firent tuit li autre;|si vint el palais soi disieme de chevaliers	e quand	3009
3598|3599	et la dame se leva encontre lui|et ansi fist Lanceloz	e vide il re Bando di Fias	3010
3600|3601	Et li sires li conmande molt tost qu il se rasiet|et il	Maguzo venire	3011
3602|3603	si fait|Quant il furent assis	si si dirizò in istante	3012
3604	et il orent un poi mengié	e li corre allo 'ncontro	3013
3605	si li dist la dame Sire faites joie a vostre oste		
3606	car bien sachiez		
3607	que a plus prodome de lui ne poez vos faire honor		
3608|3609	— Prodom fait il dame|? Qu est ce	e lli gitta il braccio a collo	3014
3610	que vos dites	e gli disse	3015
3611	? Certes je ne di mie qu il ne soit prodom	che ben sia elli venuto	3016
3612	et vaillanz	poscia alli altri	3017
3613|3614	mais il a molt a faire en I|prodome plus	e llor fa molta bella cera	3018
3615	que je ne cuidoie hui matin		
3616|3617	Si ai tant apris en cest jor d ui|que je cuit qu il ait el monde	E l re s umilia molto inverso lui	3019
3618|3619	que I|prodome	e li disse	3020
3620|3621	Mais celui|que je di ai je bien hui veu esprouver entre chevaliers	ch egli è suo sergente	3021
3622	que puis	e suo amico	3022
3623	que chevalerie fu establie ne cuit je		
3624|3625	que hons mortex feist tels merveilles com il a hui faites|Lors li demande la dame ausi comme s ele n i eust mie esté Sire ou fu ce	eeHal sire disse Lancelotto per Dio mercé non mi dite giamai tali parole ché vo no mi potreste più crucciare ché nullo re non dee essere sergente a	3023
3626|3627	que veistes celui chevalier|que vos dites	si povero cavaliere com i' sono ma signore	3024
3628	? — Ce fu fait il a l assembles le roi Baudemagu		
3629	et del roi de Norgales		
3630	— Ha sire		
3631	quiex greingnors merveilles pooit il faire		
3632	que li autre faisoient	e comandatore	3025
3633|3634	? — Quelz dame|? Ce ne vos avroie je ouan conté	— A sire diss elli vo' non siete mica	3026
3635	Par foi ja Diex ne m aïst se je savoie pas raconter ce	si povero	3027
