1040	qu’il est pres de fere 	dixo estor fare yo lo que mandaredes 	916
1041	quanqu’il voldront. « 	y ellos le dixeron 	917
1042|1043	Or en venés |dont. font il, aprés nos. » 	pues veniduos enpos denos 	918
1044	Et il si fet, 	y el dixo 	919
1045|1046	si armés |com il estoit:	quele plazia 	920
1047|1048	si le mainent a une cave |qui estoit desos la tor et li mostrent l’entree 	y luego se fue enpos dellos 	921
1049|1050	et li dient : « Sire, |saiens est la dame emprisonee, 	asi armado 	922
1051	si la gardent dui lion si bien 	como estaua so la torre 	923
1052|1053	que nus n’ose de lui aprochier. » |Et quant Hestors l’entent 	e mostraronle la entrada 	924
1054	que laiens est la dame, 		
1055|1056	si ne tint plus parole a els, |ains se commande a Dieu 	e dixeronle 	925
1057|1058	et a fet le seigne de la crois en mi son vis, |puis se met en la cave : 	señor aqui esta la dueña en prision 	926
1059	et l’en i veoit molt cler, 	y la guardan dos leones 	927
1060|1061	kar la terre estoit crevee par desus en pluisors lieus|si que la clartés del jor espandoit par tot. 	mas ninguno denos no osa alla entrar 	928
1062|1063	Quant il est aval venus, |si vit les. II. lions 	y quando estor entendio quela dueña alli estaua no estubo conellos 	929
1064	qui estoient atachié a II. bones chaienes de fer ; 		
1065|1066	si estoit li uns a destre et li autres a senestre |et gardoient la voie 	mas en palabras antes se encomendo adios 	930
1067	que nus ne peust aler a la damoisele 		
1068	se par els non. 		
1069|1070	Quant il voit|que par mi els l’en covient a passer, 	e fizo la señal dela cruz en su frente 	931
1071	si embrace l’escu et le gete sus sa teste 		
1072|1073	et trait l’espee, |puis s’en torne vers les fions 	e metiose enla cueba 	932
1074|1075	qui faisoient ta plus male fin del monde, |kar il esgratinoient la terre a lor ongles 	que hera muy clara ca hauia enella lumbres 	933
1076	et se debatoient de lor coes.		
1077	Et il s’adrece a celui 		
1078	qui plus pres de lui estoit et tint l’escu devant lui, 		
1079|1080	et cil giete les ongles |por prendre l’escu;	y la claridad del dia entraua porellas 	934
1081|1082	et il hauce l’espee, |si le fiert 	y alumbraua toda la cueba 	935
1083	si qu’il li trenche les. ll, piés devant, 		
1084	puis recuevre 		
1085|1086	et le fiert par mi la teste a descovert |si qu’il le fent en Il. moitiés, 	y desque entro enla cueba salieron contrael dos leones 	936
1087	et cil chiet mors, 		
1088	qui plus ne puet durer. 		
1089	Et il s'adrece a l’autre tot maintenant, 		
1090|1091	kar molt li tarde |qu’il ait la dame delivree. 	quela guardauan ala señora dela torre 	937
1092|1093	Et|quant cil le vit venir, 	y quando estor los vio venir 	938
1094	si se drece sor les piés derrieres		
1095	et aert l’escu as dens et as ongles, 		
1096	si li esrache des mains si roidement 		
1097	qu’il fet Hestor flatir a terre tot envers. 		
1098	Quant li lions cuide traire ariere ses ongles 		
1099	qui en l’escu estoient enbatues,		
1100	si nes pot ravoir, 		
1101	kar molt estoit li escus fors. 		
1102	Et a Hestors se redrece, 		
1103	qui molt a grant honte de ce 		
1104	qu’il estoit cheus a terre, 		
1105|1106	si cort al lion sus si hardiement |que nus ne le veist 	asi contrasy no ouo pauor dellos 	939
1107	qui molt ne le tenist a preu; 		
1108	si le fiert si par mi le viaire 		
1109	qu’il li trenche le musel et les densb, 		
1110	Et cil se volt lancier vers lui, 		
1111	mes il ne pot por l’escu 		
1112	qui es piés se tenoit. 		
1113	Et Hestors drece l’espee,		
1114	si li coupe la teste, 		
1115	puis trenche tant des ongles 		
1116	com il en tenoit en l’escu, 		
1117	puis vient a la dame. 		
1118	Et quant ele le vit venir, 		
1119	si dist 		
1120|1121	que bien fust il venus, |et ll respont 	como aquel que hera de gran corazon 	940
1122	que bone aventure li doinst Diex; 		
1123	puis trenche une chaaine de fer 		
1124	dont ele estoit liee a 		
1125	et l’enmaine fors de la cave la 		
1126|1127	ou les gens les atendoient. |Et quant il voient lor dame, 	mas antes se encubrio consu escudo 	941
1128	si li font la greignor joie del monde 		
1129	et a Hestor autresi, 		
1130|1131	et les mainent al mostier |por rendre graces a Dieu de l’onor 	e metio mano asu espada 	942
1132|1133	qu'il lor avoit fete. |Quant il sont issus de l’iglise,	y fue contraellos 	943
1134	si voient venir les gens de la vile 		
1135	qui estoient vestu de lor meillors robes 		
1136	et lor venoient a l’encontre 	y ellos contrael 	944
1137	por fere joie et feste; 		
1138|1139	si dancent et harolent |et se deduient de tos les geus	e ouieron muy gran batalla 	945
1140	qu’il sevent; 		
1141	et la 		
1142	ou il voient Hestor, 		
1143	si li dient : « Bien viegne la flors des chevaliers del monde 		
1144	qui nos a delivrés del grant hontage 		
1145	ou nos estions!» A tel joie et a tel feste mainent Hestor en la maistre sale 		
1146	qui tote estoit portendue de pailes et b de dras de soie 		
1147	et estoit jonchiee d'erbe vert et soef olant. 		
1148|1149	Et quant il sont amont venu, |si desarment Hestor 	ca los leones lo ferian conlas vñas 	946
1150	et li aportent a vestir une ? robe de cendal por le chaut e; 		
1151	si s'asieent a une part entre lui et la damoisele, 		
1152	et Hestor li demande 		
1153	comment ele a non. « Sire, fet ele, j'ai non Angale de Raguidel: ensi a non cist chastials.		
1154|1155	Mais por Dieu, sire, de Mangart le Ros me dites noveles. |Est il voirs 	y le Ronpian la loriga por muchos lugares 	947
1156|1157	que vos l’aiés ocis ? — |Ki fu cil, fet il, 	e le fazian muchas llagas 	948
1158	que vos dites? il, il est mors. — Le veistes vos, fet ele, ocirre ? — 		
1159	On Ce fu, fet ele, li sires de cest chastel. — 		
1160	Certes, fet voir, fet il, je mer̈smes l’ocis de mes mains. — En non Dieu, fet ele, beneoites soient les mains 		
1161	qui l’ocistrent ! 		
1162	Et vos soiés beneois sor tos homes! 		
1163	Et beneois soit Diex 		
1164	qui ceste part vos amena, 		
1165	kar vos m’avés el cuer mise la greignor joie 		
1166	qui onques mes i fust mise, 		
1167	kar vos m’avés vengiee de l’ome el monde 		
1168	qui plus de mals et plus de hontes m’a fetes por noient, 		
1169	et si vos dirai tote l’acheison 		
1170|1171	por quoi ce fu voirs |qu’il m’ama molt durement, 	por do le salia mucha sangre 	949
1172	quant j'estoie pucele, 		
1173	et me requist d’amors; 		
1174	mes je le sentoie a si felon		
1175	que je ne l’amaisse por rien. Il me requist pluisors fois 		
1176	et fist requerre par autres 		
1177	et m’enveoit chescun jor I. suen frere por le dire: 		
1178|1179	si m’anuierent tant ses paroles |que je dis a son frere 	mas estor como hera de gran fuerça 	950
1180	que s’il i venoit iamés, je le feroie metre a malaisse.		
1181	Et cil escuiers fu fel et orgueillos; 		
1182	si me dist grant vilenie de ma gent mersmes; 		
1183	et quant I. miens cosins oi ce 		
1184	qu’il me disoit, 		
1185	si fu si corociés 	e de gran corazon 	951
1186	qu’il l’ocist. 		
1187	Quant Marigars li Ros le sot, 		
1188	si manda chevaliers et serians, 		
1189	quanqu’il en pot avoir, 		
1190	et entra tot par nuit en cest chastel entre lui et sa compaignie;		
1191	si fist ocirre tos cels 		
1192	que l’en i trova, cels 		
1193	qui ne voloient si home devenir. 		
1194	Mes li plus en remistrent vif, 		
1195	kar il se f̃ancierent a lui, 		
1196	des lors qu’il virent 		
1197	qu’il ne porroient a lui durer. 		
1198	Et il vint droit a la chambre 		
1199	ou ie gisoie, 		
1200	si jut a moi a force, 		
1201	et quant il ot ce fet, 		
1202	si ne me deigna a feme prendre, 		
1203|1204	ains fist querre IIl. jevenes lions |et les fist metre en cele cave 	comenzolos a ferir tan deReçio con su espada tajante 	952
1205	ou vos me trovastes a et moi avec; 		
1206|1207	et dist |que en vengement de son trere n’istroie je jamés de laiens 	que quanto alcançaua dellos a diestro y a siniestro todo lo cortaua 	953
1208|1209	devant |que uns sols chevaliers m’en geteroit par sa Proesce. 	asi que en poco de ora los fizo todos pedaços 	954
1210|1211	Et ensi le fist jurer a tos cels de cest chastel |que s’il moroit ançois de moi, il ne m’en osteroient altrement: 	e despues que ouo muerto los leones estor entro enla cueba e saco ala señora del castillo dende 	955
1212|1213	si ai demoré en tel dolor pres deXII. ans |que onques n’i menjai autre chose que pain et eve. 	que estaua y presa 	956
1214	Si vos ai ore contee la maniere 		
1215|1216	por quoi je fui mise la |ou vos me trovastes. 	y la guardauan aquellos dos leones 	957
1217|1218	Or redites a moi, |s’il vos plest, 	y lleuola al castillo suso 	958
1219|1220	qui vos estes|et comment vos avés non, 	y ella selo agradeçio mucho y preguntole quien hera 	959
1221	kar molt le desir a savoir. »	porque supiese deçir quien la librara 	960
1222	Et il dist 	y el la dixo 	961
1223	qu'il a non Hestor 	que hauia nombre estor 	962
1224	et est de la maison le roi Artu et compains de la Table Reonde. » Voire, fet ele. 		
1225	que vos soiés li bien venus, 		
1226|1227	puis que vos estes de la maison le roi Artu ! |Or cuit je bien 	e que hera de casa del Rey artur 	963
1228	que vos me dirois noveles d’un chevalier 		
1229	qui ausi en est. — 		
1230	Coment a il non ? fet Hestor. — 		
1231|1232	C’est, fet ele, mesire Lancelos del Lac. — |Par foi, fet il, de lui ne vos puis je mie assener, 	e que andaba en busca de don lançarote el y otros caualleros 	964
1233|1234	lar a cort n’en set l’en riens, |ains sumes	e dixo ella 	965
1235	por Iui meu jusqu’a XIII. chevaliers 		
1236|1237	qui jamés ne retornerons en la cort le roi Artu devant |que nos sachons 	que hera su prima cormana de don lançarote 	966
1238|1239	s’il est mors |ou vis. — 	como fue eso dixo estor 	967
1240	Bials sire, fet ele, 		
1241|1242	ou est il donques ?» |Et il li conte les noveles tot ensi 	yo voslo dire 	968
1243	com la roine les avoit dit a la cort; 		
1244	et quant cele les ot, 		
1245|1246	si se pasme|et dist: « 	dixo ella 	969
1247	Ha, lasse, quel damage 		
1248|1249	s’il est mors ! Jamés|si preudom ne morra 	sabed que mi madre fue hermana de Ruiban de benoit su padre de don lançarote 	970
1250|1251	Lors commence trop grant duel a fere a |et Hestor li demande 	e caso conel Rey de aquesta tierra 	971
1252|1253	de quoi ele le conoissoit. « Sire, fet ele, je nel conois mie de veue, |kar puis qu’il otI. mois passés ne le vi je, 	que fue mi padre 	972
1254|1255	et si est il mes cosins germains. |Mais l’en m’en a tant conté en la prison 	y no viuio mas de dos años 	973
1256|1257	ou j’estoie|que je savoie bien 	e yo finque de medio año 	974
1258	qu’il estoit vis, 		
1259	et por la grant proesce		
1260	que l’en m’avoit dite de lui l’amoie je plus que home del monde. — 		
1261	Comment le vos disoit l’en? fet Hestor. Ja ne pooit l’en a vos parler, fors par les lions! — 		
1262|1263	Si pooit, iet ele, bien, |kar il i avoit une autre entree 	e mi madre no viuio mas de siete años 	975
1264	par ou cil venoient 		
1265|1266	qui m'aportoient a mengier. — |Et comment pooit il estre vostre cosins ? fet Hestor. — Sire, fet ele, ma dame ma mere fu suer germaine le roi Ban de Benovc; 	e por que finque tan pequeña 	976
1267|1268	si le maria li rois en ceste terre, |mais ele ne vesqui mie 	perdi toda mi tierra saluo este Castillo e yo fuera asaz de Rica y de alta dueña 	977
1269	longuement, 		
1270|1271	lar ele morut dedens les J. premiers ans, |si que je n’avoie que demi an 	si mi padre viuiera 	978
1272|1273	quant ele trespassa de cest siecle. |Et aprés sa mort ne vesqui mes peres c’un an; 	mas desque el murio 	979
1274|1275	et par ce perdi je tote ma terre fors cest chastel: |si fuisse je haute dame, 	soy yo asaz pobre 	980
1276|1277	se mes peres vesquist, |mais il morut si tost 	e deseredada mucho fizieron gran honrra e alegria a estor aquellos del castillo 	981
1278|1279	que puis en ai esté povre et deseritee, » |Molt firent la nuit grant joie tuit cit del chastel 	y dixo estor ala dueña del castillo 	982
1280|1281	et molt ot grant luminaire par tote la vile. |Et Hestors dist 	señora vos me podedes tomar porvuestro cauallero 	983
1282|1283	que por l’amor de Lancelot le puet ele prendre |comme son chevalier, 	Por amor de don lançarote del lago 	984
1284|1285	et ele l’en mercie molt |Cele nuit fu Hestor bien herbergiés et aaisiés de totes les choses 	y ella selo agradeçio mucho aquella noche fue estor muy bien seruido de todas aquellas cosas 	985
1286	que l’en cuida 	que pudieron hauer 	986
1287|1288	qui bones li fuissent, |Al matin, 	y otro dia de mañana leuantaronse 	987
1289	si tost com li jors apparut, se leva	y estor oyo misa |e despues armose 	988|989
1290	et vesti ses armes aprés ce qu’il ot messe oie, 	e despidiose dela señora del castillo |e de toda su compaña 	990|991
1291	puis se parti de laiens 	y enComendolos a dios 	992
1292	et se remist en son chemin 	y metiose en su camino 	993
1293	ausi comme le jor devant. 	como ante hauia fecho 	994
1294	Mes atant laisse ore li contes a parler de lui	mas agora dexa el Cuento de fablar del y dela señora del Castillo 	995
1295	et retorne a mon seignor Vvain. LXVIII. L. 	y torna a don iban 	996
1296	Or dit li contes	por contar delo quele hauino 	997
1297	que, 	Agora dexa el Cuento de fablar de estor |y torna adon yban 	998|999
1298	quant mesire Yvain se fu partis de ses compaignons, 	Agora dize el Cuento que quando don yban se partio de sus compañeros 	1000
1299	si com li contes a devisé, 	ansi como el quento lo a deuisado 	1001
1300|1301	qu'il erra lll. jors entiers |sans aventure trover	que andubo quatro dias sin auentura fallar 	1002
1302	qui a conter face. 	que de contar fuese 	1003
1303	Al quint jor li avint endroit prime 	y al quinto dia le auino 	1004
1304|1305	qu’il entra en une forest |et il osta son hialme por le chaut	que yendo porla floresta tiro su yelmo 	1005
1306	qui ja estoit commenciés. 	porla gran calura que fazia 	1006
1307	Lors encontra sor un palefroi pumelé une damoisele	y entonçes encontro vna donzella 	1007
1308|1309	qui chevalchoit tote sole; il la salue, |quant ele l’aproche, 	que venia sola envn palafren 	1008
1310|1311	et ele lui autresi; |mais tantost com ele l’apercut, 	y quando llegaron çerca el vno del otro saluaronse ambos 	1009
1312|1313	si commence a sosrire, |et il se pense 	y la donzella se començo de Reir 	1010
1314|1315	que por noient ne rit ele pas, |si li dist: «Damoisele, par la rien 	y don yban la Rogo 	1011
1316	que vos plus amés, dites moi por	quele dixese 	1012
1317	quoi vos riés, 	porque se Reia 	1013
1318	se vos le poés dire ne devés. — Je le vos dirai, fet ele, 	y la donzella le dixo 	1014
1319	se vos me donés l. don 	yo voslo dire si me dieredes vn don 	1015
1320	qui assés poi vos grevera. — 	que poco vos costara muy de grado 	1016
1321	Certes, fet il, je le vos doing. — 	dixo don |yban yo voslo do 	1017|1018
1322	Et je vos dirai, fet ele, 	Pues agora vos lo dire 	1019
1323	ce 	dixo la donzella 	1020
1324|1325	que vos me demandés. ll est voirs |que je trespassai ore par devant I. paveillon	lo que me demandades sabed que yo pasaua porante vna tienda 	1021
1326	qui est ça avant, a l’entree d’une forest; 	que esta aca adelante ala entrada devna floresta 	1022
1327	si avoit dedens I chevalier et s’amie, 	enla qual estaua vn cauallero consu amiga 	1023
1328	et je m’arestui, 	e yo detubeme vn poco 	1024
1329	si oi 	e oy 	1025
1330	que la damoisele li demanda 	que le dixo ella |don cauallero 	1026|1027
1331	combien il feroit en l. jor por li 	que faredes vos pormi amor 	1028
1332	et il dist	yo fare tanto 	1029
1333	qu’il ne passeroit hui par devant le paveillon chevaliers ne damoisele 	que no pasara por aqui donzella 	1030
1334	dont il ne li donast le cheval, 	aque no tome su palafren 	1031
1335|1336	et ele dist |que ce voloit ele bien, 	y lo dare avos eso vere yo dixo ella 	1032
1337	Et en ce que je passoie outre, il sailli avant	entonçes pase yo porla tienda 	1033
1338|1339	et me volt tolir mon cheval; |et tolu le m’eust il, 	y quando el Cauallero me vio salio ami 	1034
1340	se la damoisele ne fust 	y tomome este palafren saluo 	1035
1341	qui le me commanda a rendre. 	que ella melo dio 	1036
1342	Et quant je m’en partis, 	y partime dellos 	1037
1343	si dis al chevalier 	pero dixe al cauallero 	1038
1344	que tels i porroit venir	que tiempo podria venir 	1039
1345	qui bien le feroit menteor de sa vantance 	quelo faria mentiroso desu promesa 	1040
1346	et il me dist	y el me dixo 	1041
1347	que j'en feisse tot mon pooir, 	que fiçiese todo Mi poder 	1042
1348	et je dis 	e yo le dixe 	1043
1349	que si feroie je, 	que ansi lo faria 	1044
1350	si m’en parti atant. 		
1351	Et tantost 		
1352|1353	com je vos vi, vos conui je bien, |Si commençai i a sosrire, 	y poresto quando vos vi començe a rreir 	1045
1354	por ce que je savoie bien 	porque se 	1046
1355	que vos l’en porriés bien fere mencongier, 	que vos lo faredes mentiroso |y sabed 	1047|1048
1356|1357	se vos voliés. |Si avés ore oi 	que el don 	1049
1358	por quoi je rnioie. 	que yo vos demando 	1050
1359	Et savés vos	es 	1051
1360|1361	quel don je vos demant ? — |Nenil, fet il, 	que me dedes su cauallo de aquel Cauallero por amor demi palafren 	1052
1362	devant que je l’oie. — Je vueil, fet ele, 	que el me tomo |E dixo don yban 	1053|1054
1363|1364	que vos me donés son cheval, |por ce qu’il me volt tolir le mien. » 	yo fare ay todo mi poder porvuestro amor 	1055
1365|1366	Et il dist |qu’il en fera son pooir de li doner. « 	y ella selo agradesçio mucho 	1056
1367	Donc retornerai je, fet ele, 	y le dixo yo me tornare conbusco 	1057
1368|1369	et vos menrai la |ou li chevaliers est. »	y vos mostrare do es el Cauallero 	1058
1370	Lors retorne la damoisele 	y luego se torno la donzella con don yban 	1059
1371|1372	et mesire Yvain li demande : « Damoisele, savés vos |qui ie sui ? — 	y el le pregunto si le Conoçia 	1060
1373	Ofl, fet ele, vos estes de la maison le roi Artu et de sa cort et b avés non mesire Vvain, li fiz al roi Urien. » 	y la donzella dixo si Ca vos sodes don yban fijo del Rey vrian |y sodes dela casa del Rey artur 	1061|1062
1374|1375	Et il s’en rit C rorest, |et la damoisele li mostre le paveillon. » Veez la, 	y conpañero dela tabla Redonda 	1063
1376	Ensi parlant s’en vont tant 	y don yban se callo |que no dixo palabra y ansi se fueron porla floresta 	1064|1065
1377	qu’il vienent pres d’une fet ele, le lieu 	fasta que vieron la tienda 	1066
1378	ou li chevaliers est. » 	entonçes le dixo la donzella |señor en aquella tienda fallaredes el cauallero 	1067|1068
1379|1380	Et il met maintenant son hialme en sa teste |et enbrace l’escu 	entonzes don yban enlazo su yelmo e tomo su escudo 	1069
1381|1382	et aloingne le glaive a |et s’en vet galopant cele part. 	y puso la lança so el su braço 	1070
1383	Et li chevaliers del paveillon saut, 	y fuese ado estaua el cauallero |y el cauallero dela tienda salio fuera 	1071|1072
1384|1385	tantost com il ot te cheval venir, |si monte en son destrier 	y tanto que vido a don yban subio ensu cauallo 	1073
1386	et prent son escu et son glaive 	y tomo su esudo y su lança 	1074
1387	et il fu bien armés de totes armes; 	y el estaua muy bien armado 	1075
1388|1389	si dist a mon seignor Yvain, de si loins |com il le voit: « Sire chevaliers, il vos en covient aler a pié, 	y dixo a don yban conuiene vos señor cauallero de yr apie y dexar ese Cauallo 	1076
1390	kKar m’amie velt avoir vostre cheval. — 	que mi amiga lo quiere |y dixo don yban 	1077|1078
1391|1392	Bials sire, fet mesire Yvain, |se vos volés 	si avuestra amiga Conuiene 	1079
1393	qu’ele ait le mien, 	que aya mi cauallo 	1080
1394	donc me covient il avoir le vostre, 	asi conuiene ami 	1081
1395	kar a pié ne m’en iroie je pas. — Il le vos covient, 	que aya ese vuestro ca de pie no yre yo avos conuiene delo dar dixo el 	1082
1396	fet il, a force fere, 	cauallero 	1083
1397	ou je me combatrai a vos; 	o devos conuatir conmigo |entonçes lo abre 	1084|1085
1398|1399	et lors si l’avrai, |si ne vos en savrai nul gré 	y no boslo agradeçere yo ni ella eso mesmo 	1086
1400|1401	ne ele ausi. — |Par foi, sire chevaliers, fet mesire Vvain, 	y dixo don yban devuestro agradeçimyento 	1087
1402	et de son gré et del vostre me sorferroie je bien, ançois 	ni del suyo me sufrire yo agora bien 	1088
1403	que je feisse chose 	antes que fazer cosa 	1089
1404	qui a honte me tornast. 	que a desonrra seme tornase 	1090
1405	Mes l’en me devroit molt tenir a fol, 	mas antes me deuian tener por loco 	1091
1406	se je mon cheval vos bailloie 	si mi cauallo vos diese 	1092
1407	por aler m’en a pié ! 	y me fuese yo depie |mas mucho sodes loco 	1093|1094
1408	Si n’estes mie sages, 	si cuidades |que vos diese mi cauallo 	1095|1096
1409|1410	se vos le cuidiés. — |Vos n’en feriés rien 	sin golpe ferir non faredes 	1097
1411|1412	por moi ? fet I chevaliers. — |Non voir, fet mesire Yvain. —	mas por my dixo el cauallero non por buena fee dixo don yban 	1098
1413	Or en estes vos donc, fet il, a la bataille, 	pues ala batalla sodes venido |dixo el cauallero 	1099|1100
1414	puis qu’autrement ne puet estre. » 	ca de otra manera non puede ser 	1101
1415	Lors s’eslonge li uns de l’autre plus d’un arpent 	enel nombre de dios dixo don yban |y luego se arredraron el vno del otro 	1102|1103
1416	et s’entrevienent 	y dexaronse venir contrasy 	1104
1417	si tost com li cheval porent aler. Li chevaliers fiert mon seignor Yvain 	quanto los cauallos los podian traer |y el cauallero firio asy a don yban muy duramente 	1105|1106
1418|1419	si qu’il li fet l’escu percier et fendre, |mes li haubers est si fors 	que le fendio el escudo mas la loriga era asi buena 	1107
1420	que maille n’en derront. La lance vole en pieces 	que malla no le Rompio |e la lança bolo enpieças quede muy grande 	1108|1109
1421	qui de grant vertu estoit enpainte; 	fuerça hera empujada 	1110
1422	et mesire Yvain 	y don yban 	1111
1423	qui un poi porta sa lance bas le fiert 	que llebaba la lança vn poco vaxa lo firio ansi por medio del escudo 	1112
1424	si que par mi l’escu 	que selo falso y la loriga 	1113
1425	et par mi le hauberc li met la lance el senestre costé; il l’empaint bien comme cil 	y metiole la lança porel Costado siniestro muy Reçio 	1114
1426	qui assés avoit vertu	como aquel que hera detan gran fuerça 	1115
1427|1428	et force, |si le porte del cheval a terre, 	y dio conel del cauallo a tierra 	1116
1429|1430	puis retret son glaive |qui encore n’estoit pas brisiés 	y saco del su lança sana 	1117
1431	et gete les mains as resnes del cheval ; 	y luego tomo don yban el cauallo del cauallero |y diolo ala donzella 	1118|1119
1432	si le prent 	que conel hauia venido 	1120
1433	et le donee a la damoisele. «Tenez, fet il, damoisele. 	y dixole |donzella tomad este cauallo 	1121|1122
1434	Sui je cuites a vos ? — Sire, fet ele, oil voir. — 	e soy bien quito devos |si señor dixo ella 	1123|1124
1435	Or vos commant donc a Dieu,» fet ¡l. 	pues agora vos encomiendo a dios |dixo don yban ala donzella 	1125|1126
1436	Si s’en vet maintenant 	y luego se partio della 	1127
1437|1438	et laisse cele del paveillon |qui fet trop grant duel de son ami 	y trauo asu demanda 	1128
1439	qui navrés est, 	como de primero 	1129
1440	si qu’ele cuide bien 	y dexo ala otra donzella façiendo muy gran duelo |porel otro cauallero su amigo 	1130|1131
1441	qu’il muire 	que cuidaua 	1132
1442|1443	Et mesire vvain rest entrez en son chemin, |si chevalche tot le Jor jusqu'ai vespre, 	que hera muerto y don yban se fue su camino 	1133
1444|1445	et tors est issus de la forest |qui des le matin li ot duré jusqu’a cele ore. 	y andado fasta visperas 	1134
1446	Et		
1447|1448	quant il vint a l’issue, |si encontre une damoisele 	que encontro vna donzella saliendo dela floresta 	1135
1449	qui faisoit le greignor duel del monde; 	que venia façiendo el mayor duelo del mundo 	1136
1450|1451	et mesire Yvain le salue |et li demande	y don yban la saluo y la dixo donzella 	1137
1452	por quoi ele plore. « 	que auedes 	1138
1453|1454	Por Dieu, sire, fet ele, |por ce	que asi llorades pordios señor 	1139
1455|1456	que j’ai trop grant duel, |kar a mes amis m’avoit baillié a garder le plus bel esprevier del monde 	por que mi amigo me dio a guardar vn gauilan el mas fermoso del mundo 	1140
1457|1458	et qu’il plus amoit; |si l’enportoie en nostre recet 	que el mucho amaua y yo traialo aun anuestra Casa 	1141
1459	qui est assés pres de ci, 		
1460|1461	et en ce |que je m’en venoie par devant une loge galesche, si sailli fors uns chevaliers 	y venia por antevna Ramada 	1142
1462|1463	qui le m’a tolu. |Et mes amis l’amoit sor tote rien : 	y salio ami vn cauallero 	1143
1464|1465	si cuit |qu’il b m’en ocirra, 	y tomomelo 	1144
1466|1467	kar il cuidera miels |que je l’aie doné 	y agora matarme ami amigo 	1145
1468|1469	que il le m’ait ensi tolu, |et	quando lo supiere 	1146
1470	por ce vois je tel duel menant. — Damoisele, fet mesire Yvain, or ne vos dementés plus, 		
1471|1472	mais retornés |et me mostrés celui 	ca mucho lo amaba e cuidara 	1147
1473	qui vostre oisel a. 		
1474|1475	Et ie vos creant |que je le vos rendrai a mon pooir. — 	que yo selo di demi grado al cauallero 	1148
1476|1477	Ha, sire, fet ele, de Dieu soiés vos beneois ! |Maintenant retorne la pucele 	que melo tomo 	1149
1478	et maine mon seignor vvain tot le chemin 	e poresto fago este duelo 	1150
1479	qu’ele estoit venue, 	que vos asi vedes 	1151
1480|1481	tant qu’il vienent en une valee.|Et lors li mostre un poi en sus del chemin a senestre la loge 	Como don yban derroco al cauallero 	1152
