1078	qui plus pres de lui estoit et tint l’escu devant lui, 	qui estoit plus pres de lui |et tint lescu deuant. 	891|892
1079	et cil giete les ongles 	et le lyon iecta ses ongles 	893
1080	por prendre l’escu;	pour le prendre.	894
1081|1082	et il hauce l’espee, |si le fiert 	Et hector le fiert si durement 	895
1083	si qu’il li trenche les. ll, piés devant, 	qu il lui couppe les pies de deuant 	896
1084	puis recuevre 	et puis recueuure 	897
1085|1086	et le fiert par mi la teste a descovert |si qu’il le fent en Il. moitiés, 	si le fiert parmi la teste: 	898
1087|1088	et cil chiet mors, |qui plus ne puet durer. 	tant	899
1089|1090	Et il s'adrece a l’autre tot maintenant, |kar molt li tarde 	quil lui fet en deux pieces. 	900
1091|1092	qu’il ait la dame delivree. |Et	et il cheut mort Il se adresse a lautre. 	901
1093|1094	quant cil le vit venir, |si se drece sor les piés derrieres	Et quant celui le uoit uenir il se dresse dessus les pies de derriere 	902
1095	et aert l’escu as dens et as ongles, 	et prent lescu aux ongles 	903
1096	si li esrache des mains si roidement 	et lui arrache des mains si durement 	904
1097	qu’il fet Hestor flatir a terre tot envers. 	quil fist hector uoller la ius tout en trauers. 	905
1098	Quant li lions cuide traire ariere ses ongles 	Quant le lyon cuide retraire ses ongles 	906
1099	qui en l’escu estoient enbatues,		
1100	si nes pot ravoir, 	de lescu il ne peut: 	907
1101	kar molt estoit li escus fors. 	car moult estoit fort lescu. 	908
1102	Et a Hestors se redrece, 		
1103	qui molt a grant honte de ce 		
1104|1105	qu’il estoit cheus a terre, |si cort al lion sus si hardiement 	Et hector se releua et courut sus au lyen si hardiement 	909
1106	que nus ne le veist 	que nul ne le uist 	910
1107	qui molt ne le tenist a preu; 	qui a preudomme ne le tenist. 	911
1108	si le fiert si par mi le viaire 	et le fiert tellement par le museau	912
1109	qu’il li trenche le musel et les densb, 	quil lui couppe tout 	913
1110|1111	Et cil se volt lancier vers lui, |mes il ne pot por l’escu 	et il se uoulut lancier a lui mes il ne peut pour lescu 	914
1112	qui es piés se tenoit. 	quil tenoit aux ongles. 	915
1113	Et Hestors drece l’espee,	Et hector lui court sus 	916
1114	si li coupe la teste, 	et lui couppe la teste 	917
1115	puis trenche tant des ongles 	et trenche tant des ongles	918
1116	com il en tenoit en l’escu, 	quil tint en lescu. 	919
1117	puis vient a la dame. 	Et lors ua a la dame. 	920
1118	Et quant ele le vit venir, 	Et quant elle le uist uenir/ 	921
1119	si dist 	si dist 	922
1120	que bien fust il venus, 	que bien feust il uenu 	923
1121	et ll respont 	Et il respont 	924
1122	que bone aventure li doinst Diex; 	que bonne auanture lui doint dieu 	925
1123	puis trenche une chaaine de fer 	puis trenche une chaine	926
1124	dont ele estoit liee a 	dont elle estoit lyee 	927
1125	et l’enmaine fors de la cave la 	et puis lemmaine hors de la caue la	928
1126	ou les gens les atendoient. 	ou les gens lactendoient 	929
1127	Et quant il voient lor dame, 	Et quant ilz uirent leur dame 	930
1128	si li font la greignor joie del monde 	si lui firent moult grant ioie 	931
1129	et a Hestor autresi, 	et a hector aussi 	932
1130	et les mainent al mostier 	puis les menerent au menstier 	933
1131	por rendre graces a Dieu de l’onor 	pour rendre graces a dieu de lonneur 	934
1132	qu'il lor avoit fete. 	quil lui auoit fait	935
1133	Quant il sont issus de l’iglise,	Et quant ilz furent issus du monstier 	936
1134	si voient venir les gens de la vile 	si uirent uenir les gens de la uille 	937
1135|1136	qui estoient vestu de lor meillors robes |et lor venoient a l’encontre 	qui uenoient a eulx 	938
1137	por fere joie et feste; 	pour leur faire ioie si karollent 	939
1138	si dancent et harolent 	et dansent 	940
1139	et se deduient de tos les geus	et deduisent de tous ieux 	941
1140	qu’il sevent; 	quilz scaiuent 	942
1141	et la 	Et la	943
1142	ou il voient Hestor, 	ou ilz uoient hector 	944
1143|1144	si li dient : « Bien viegne la flors des chevaliers del monde |qui nos a delivrés del grant hontage 	si lui dient Bien uiengne fa fleur de cheualerie A telle ioie menerent hector en la maistresse salle. 	945
1145|1146	ou nos estions!» A tel joie et a tel feste mainent Hestor en la maistre sale |qui tote estoit portendue de pailes et b de dras de soie 	Quant ilz sent uenus leans 	946
1147	et estoit jonchiee d'erbe vert et soef olant. 		
1148	Et quant il sont amont venu, 		
1149	si desarment Hestor 	si le desarment 	947
1150	et li aportent a vestir une ? robe de cendal por le chaut e; 	et lui apportent a uestir une robe de soie doublee de sandal pource |que il faisoit chault. 	948|949
1151	si s'asieent a une part entre lui et la damoisele, 	Si se assiet a une part hector et la dame. 	950
1152	et Hestor li demande 	Et hector lui demande 	951
		comment el a a nom. 	952
		Et elle dit 	953
1153	comment ele a non. « Sire, fet ele, j'ai non Angale de Raguidel: ensi a non cist chastials.	que elle a a nom orgualle de grindel/ |ainsi a a nom le chasteau 	954|955
1154	Mais por Dieu, sire, de Mangart le Ros me dites noveles. 	ou uous estes. |mais pour dieu fist elle sire de maugart me dictes nouuelles. 	956|957
1155	Est il voirs 	Est il uray 	958
1156	que vos l’aiés ocis ? — 	que uous lauez occiz. 	959
1157	Ki fu cil, fet il, 	Quest ce fait hector	960
1158	que vos dites? il, il est mors. — Le veistes vos, fet ele, ocirre ? — 	que uous dictes. |Cest fist elle le seigneur de cest chasteau. 	961|962
1159	On Ce fu, fet ele, li sires de cest chastel. — 	Certes|se dist hector il est mort. 	963|964
1160	Certes, fet voir, fet il, je mer̈smes l’ocis de mes mains. — En non Dieu, fet ele, beneoites soient les mains 	Et lauez uous ueu occiz. |Oy dit il/ moymes lay occiz. Eu nom dieu dit elle benoites soient les mains 	965|966
1161	qui l’ocistrent ! 	qui loccirent 	967
1162	Et vos soiés beneois sor tos homes! 	et uous soiez benoit sur tous hommes 	968
1163	Et beneois soit Diex 	Et loe soit dieu 	969
1164	qui ceste part vos amena, 	qui ceste part uous a amene. 	970
1165	kar vos m’avés el cuer mise la greignor joie 	car uous maues mis la plus grant ioie au cueur 	971
1166	qui onques mes i fust mise, 	qui oncques y feust/ 	972
1167	kar vos m’avés vengiee de l’ome el monde 	car uous mauez uengiee de lomme du monde 	973
1168	qui plus de mals et plus de hontes m’a fetes por noient, 	qui plus de honte me a faicte pour neant. 	974
1169|1170	et si vos dirai tote l’acheison |por quoi ce fu voirs 	si le uous diray mainteant Il fut uray	975
1171	qu’il m’ama molt durement, 	quil me ama menlt 	976
1172	quant j'estoie pucele, 	quant ie estoie pucelle 	977
1173	et me requist d’amors; 	et me requist damours	978
1174	mes je le sentoie a si felon	mes ie le sentoie si fellon 	979
1175	que je ne l’amaisse por rien. Il me requist pluisors fois 	qui ie ne lamasse pour riens il me requist par plusieurs foys/ 	980
1176	et fist requerre par autres 	et me fist requerir par aultres/	981
1177	et m’enveoit chescun jor I. suen frere por le dire: 	et me enuoioit par plusieurs iours querir par ung sien frere/ 	982
1178	si m’anuierent tant ses paroles 	si me ennuyerent tant ses parolles 	983
1179	que je dis a son frere 	que ie diz 	984
1180	que s’il i venoit iamés, je le feroie metre a malaisse.	que ie le feroie mettre en mal aise |se il ne me lessoit ester. 	985|986
1181	Et cil escuiers fu fel et orgueillos; 	Et celluy fut fellon et orguilleux 	987
1182	si me dist grant vilenie de ma gent mersmes; 	si me dist grant uillennie deuant mes gens/	988
1183	et quant I. miens cosins oi ce 	et quant ung mien cousin ouyt ce 	989
1184	qu’il me disoit, 	qu il disoit/ 	990
1185|1186	si fu si corociés |qu’il l’ocist. 	si en fut menlt courouchie. 	991
		et feist puys 	992
1187	Quant Marigars li Ros le sot, 	tant quil occhit son frere en ceste uille. |QUant maugart le roux ouyt ces nouuelles de son frere	993|994
1188	si manda chevaliers et serians, 	si en fut monlt courrouchie/ |et manda cheualiers et sergans tout ce	995|996
1189	quanqu’il en pot avoir, 	quil en pouoit auoir 	997
1190|1191	et entra tot par nuit en cest chastel entre lui et sa compaignie;|si fist ocirre tos cels 	et entra ceans luy et sa compagnie/ et fist occhire tous ceulx 	998
1192	que l’en i trova, cels 	qu il trouua/ 	999
1193	qui ne voloient si home devenir. 	qui ses hommes ne uoulloient deuenir 	1000
1194|1195	Mes li plus en remistrent vif, |kar il se f̃ancierent a lui, 	et laissa uiure tous ceulx 	1001
1196|1197	des lors qu’il virent |qu’il ne porroient a lui durer. 	qui a luy se allierent/ 	1002
1198	Et il vint droit a la chambre 	et puys uint a la chambre 	1003
1199	ou ie gisoie, 	ou iestoie 	1004
1200	si jut a moi a force, 	si geust auec moy a force 	1005
1201|1202	et quant il ot ce fet, |si ne me deigna a feme prendre, 	Et quant il eust ce fait ne me daigna prendre a femme: 	1006
1203	ains fist querre IIl. jevenes lions 	mes fist cherser deux iones lyons: 	1007
1204	et les fist metre en cele cave 	et me fist mettre en celle caue 	1008
1205	ou vos me trovastes a et moi avec; 	ou uous me trouuastes et les .ii. lyons auec moy/	1009
1206	et dist 	et me dist 	1010
1207|1208	que en vengement de son trere n’istroie je jamés de laiens |devant 	que en uengance de son frere ie ne seroie iames hors de leans 	1011
1209	que uns sols chevaliers m’en geteroit par sa Proesce. 	deuant que ung cheualier men iecteroit par force/	1012
1210	Et ensi le fist jurer a tos cels de cest chastel 	et ainsi le fist iurer a ceux de ce chastel 	1013
1211	que s’il moroit ançois de moi, il ne m’en osteroient altrement: 	et que|sil mouroit deuant moy il ne men osteroient aultremet/ 	1014|1015
1212	si ai demoré en tel dolor pres deXII. ans 	si y ay demoure en telle maniere/ et en ceste doulleur plus de .xii. ans/	1016
1213	que onques n’i menjai autre chose que pain et eve. 	que oncques ne mengay fors pain et eaue/ 	1017
1214	Si vos ai ore contee la maniere 	si uous ay compte la maniere 	1018
1215	por quoi je fui mise la 	comment ie feuz mise la 	1019
1216|1217	ou vos me trovastes. |Or redites a moi, 	ou uous me trouuastes/ 	1020
1218	s’il vos plest, 	si uous prie 	1021
1219	qui vos estes	que uous me dies uostre nen/ 	1022
1220	et comment vos avés non, 	et qui uous estes	1023
1221	kar molt le desir a savoir. »	car monlt le desire a sauoir/ 	1024
1222|1223	Et il dist |qu'il a non Hestor 	et il dist quit a a nom hector/ 	1025
1224	et est de la maison le roi Artu et compains de la Table Reonde. » Voire, fet ele. 	et quil est de la maison du roy artus compaignen de la table ronde/ 	1026
1225	que vos soiés li bien venus, 	uoire fist elle uous soyes le bien uenu puys 	1027
1226|1227	puis que vos estes de la maison le roi Artu ! |Or cuit je bien 	que uous estes de la maison du roy artus Or cuide ie bien 	1028
1228	que vos me dirois noveles d’un chevalier 	que uous me dires nouuelles de ung cheualier 	1029
1229	qui ausi en est. — 	qui en est aussy/ 	1030
1230|1231	Coment a il non ? fet Hestor. — |C’est, fet ele, mesire Lancelos del Lac. — 	comment a il nom fait hector/ il a a nen dist elle lancelot du lac/ 	1031
1232	Par foi, fet il, de lui ne vos puis je mie assener, 	Par ma foy dist hector de luy ne uous scairoye ie pas bien assener/ 	1032
1233	lar a cort n’en set l’en riens, 	car en court |ne en scait len riens. 	1033|1034
1234|1235	ains sumes|por Iui meu jusqu’a XIII. chevaliers 	Ains sommes meuz plus de .xiii. cheualiers 	1035
1236	qui jamés ne retornerons en la cort le roi Artu devant 	qui iames ne retournerens a court |tant 	1036|1037
1237	que nos sachons 	que nous en ayons ouys uraies nouuelles	1038
1238	s’il est mors 	sil est mort 	1039
1239	ou vis. — 	ou uif. 	1040
1240	Bials sire, fet ele, 	Beau sire fist elle 	1041
1241	ou est il donques ?» 	ou est il donques/ 	1042
1242	Et il li conte les noveles tot ensi 	et il luy compte tout ainsi les nouuelles 	1043
1243	com la roine les avoit dit a la cort; 	comment la royne les auoit dictes a la court/ 	1044
1244	et quant cele les ot, 	et quant elle le sceust 	1045
1245	si se pasme	si se pasme 	1046
1246	et dist: « 	puis dist. 	1047
1247	Ha, lasse, quel damage 	Haa quel dommage 	1048
1248|1249	s’il est mors ! Jamés|si preudom ne morra 	sil est mort iames aussi preudomme ne mourra 	1049
1250	Lors commence trop grant duel a fere a 		
1251	et Hestor li demande 	Et hector luy demande 	1050
1252|1253	de quoi ele le conoissoit. « Sire, fet ele, je nel conois mie de veue, |kar puis qu’il otI. mois passés ne le vi je, 	de quoy elle le cengnoit Sire fait elle ie le cengnois bien de ueue/ 	1051
1254	et si est il mes cosins germains. 	et sy est men cousin germain/ 	1052
1255	Mais l’en m’en a tant conté en la prison 	et ma len tant compte de luy en la prison 	1053
1256	ou j’estoie	ou ie estoye 	1054
1257	que je savoie bien 	que ie sauoie bien 	1055
1258	qu’il estoit vis, 	quil estoit uif/ 	1056
1259	et por la grant proesce	et pour la grant prouesse 	1057
1260	que l’en m’avoit dite de lui l’amoie je plus que home del monde. — 	qui estoit en luy ie lamoie plus |que tous les hommes du mende. 	1058|1059
1261	Comment le vos disoit l’en? fet Hestor. Ja ne pooit l’en a vos parler, fors par les lions! — 	Comment le uous disoit len fist hector on ne pouoit parler a uous fors parmp les lyons: 	1060
1262	Si pooit, iet ele, bien, 	si pouoit fist elle/ 	1061
1263|1264	kar il i avoit une autre entree |par ou cil venoient 	car il y auoit une aultre entree par ou ceulx uenoient 	1062
1265	qui m'aportoient a mengier. — 	qui me apportoient a mengier 	1063
1266	Et comment pooit il estre vostre cosins ? fet Hestor. — Sire, fet ele, ma dame ma mere fu suer germaine le roi Ban de Benovc; 	Comment fit hector pouoit il estre uren cousin/ |par ma foy fist elle 	1064|1065
		ce uous diray ie bien Ma dame de mere fut seur au roy ban de benoic son pere, 	1066
1267	si le maria li rois en ceste terre, 	si la maria en ceste terre. 	1067
1268|1269	mais ele ne vesqui mie |longuement, 	mes elle ne uesquist pas longuement/ 	1068
1270	lar ele morut dedens les J. premiers ans, 	car elle mourut dedens les .ii. ans 	1069
1271|1272	si que je n’avoie que demi an |quant ele trespassa de cest siecle. 	quelle y uint. 	1070
1273	Et aprés sa mort ne vesqui mes peres c’un an; 	Et apres sa mort ne uesquist men pere |que ung an. 	1071|1072
1274	et par ce perdi je tote ma terre fors cest chastel: 	Et par ce perdis ie toute ma terre fors ce chastel/ 	1073
1275	si fuisse je haute dame, 	si eusses ie este asses riche 	1074
1276	se mes peres vesquist, 	se mon pere eust uesquu: et asses haulte dame.	1075
1277|1278	mais il morut si tost |que puis en ai esté povre et deseritee, » 	Menlt firent la nuyt grant ioye tous ceulx du chastel. 	1076
1279	Molt firent la nuit grant joie tuit cit del chastel 	Celle nuyt fut hector bien aise. |et au matin si tost 	1077|1078
1280|1281	et molt ot grant luminaire par tote la vile. |Et Hestors dist 	que le iour apparust 	1079
1282|1283	que por l’amor de Lancelot le puet ele prendre |comme son chevalier, 	si se leua 	1080
1284|1285	et ele l’en mercie molt |Cele nuit fu Hestor bien herbergiés et aaisiés de totes les choses 	et se appareilla 	1081
1286|1287	que l’en cuida |qui bones li fuissent, 	et se arma 	1082
1288|1289	Al matin, |si tost com li jors apparut, se leva	apres ce	1083
1290	et vesti ses armes aprés ce qu’il ot messe oie, 	quil eust ouye la messe/ 	1084
1291	puis se parti de laiens 	puys se partist de leans 	1085
1292	et se remist en son chemin 	et se mist en son chemin tout ainsi 	1086
1293	ausi comme le jor devant. 	comment il auoit fait le iour de deuant. 	1087
1294	Mes atant laisse ore li contes a parler de lui	Mes a tant lesse ores le compte a parler de luy et de la damoyselle 	1088
1295|1296	et retorne a mon seignor Vvain. LXVIII. L. |Or dit li contes	et retourne a parler de mensieur yuain.	1089
1297|1298	que, |quant mesire Yvain se fu partis de ses compaignons, 	Comment messire yuain fist rendre a la damoyselle son espreuier 	1090
1299	si com li contes a devisé, 	et come il demoura malade a la chappelle du mont. C.xi. LE compte dist	1091
1300	qu'il erra lll. jors entiers 	que quant mensieur yuain. se fut parti de ses compaignens: il erra .iiii. iours entiers 	1092
1301|1302	sans aventure trover|qui a conter face. 	sans aduanture trouuer/ 	1093
1303|1304	Al quint jor li avint endroit prime |qu’il entra en une forest 	au .u. il uint uers une forest: 	1094
1305	et il osta son hialme por le chaut		
1306	qui ja estoit commenciés. 		
1307	Lors encontra sor un palefroi pumelé une damoisele	et encontre sur ung palleffroy une damoyselle 	1095
1308|1309	qui chevalchoit tote sole; il la salue, |quant ele l’aproche, 	qui cheuauchoit toute seulle/ il la sallue 	1096
1310	et ele lui autresi; 	et elle luy. 	1097
1311	mais tantost com ele l’apercut, 	mes tantost |come elle le apperchoit/	1098|1099
1312	si commence a sosrire, 	si commence a rire: 	1100
1313	et il se pense 	et il se pense 	1101
1314	que por noient ne rit ele pas, 	que pour neant ne auoit elle pas ris/ 	1102
1315	si li dist: «Damoisele, par la rien 	Si luy dist mensieur yuain damoyselle par la riens eu mende 	1103
1316|1317	que vos plus amés, dites moi por|quoi vos riés, 	que uous plus ames dictes moy 	1104
1318	se vos le poés dire ne devés. — Je le vos dirai, fet ele, 		
1319	se vos me donés l. don 		
1320|1321	qui assés poi vos grevera. — |Certes, fet il, je le vos doing. — 	pour quoy uous riez/ ie le uous diray fait elle 	1105
1322	Et je vos dirai, fet ele, 		
1323	ce 		
1324|1325	que vos me demandés. ll est voirs |que je trespassai ore par devant I. paveillon	se uous me dennes ung don. certes fait il uoullentiers. la damoyselle lni dit. ie passoie p deuant ung paueillon 	1106
1326	qui est ça avant, a l’entree d’une forest; 	qui est en ceste forest. 	1107
1327	si avoit dedens I chevalier et s’amie, 	Si y auoit ung cheualier et samie 	1108
1328	et je m’arestui, 	et ie me arrestay 	1109
1329	si oi 	si ouy 	1110
1330	que la damoisele li demanda 	que la damoiselle lui demanda 	1111
1331	combien il feroit en l. jor por li 	combien il feroit pour elle en ung iour. 	1112
1332	et il dist	Et il lui dit 	1113
1333	qu’il ne passeroit hui par devant le paveillon chevaliers ne damoisele 	quil ne passeroit huy par deuant son paueillon cheualier ne damoiselle 	1114
1334	dont il ne li donast le cheval, 	de qui il ne lui dennast le cheual. 	1115
1335	et ele dist 	Et elle lui dit 	1116
1336	que ce voloit ele bien, 	que ce uouloit elle bien. 	1117
1337	Et en ce que je passoie outre, il sailli avant	et ainsi |que ie passoie oultre il saillist auant 	1118|1119
1338	et me volt tolir mon cheval; 	et me uoulut oster mon cheual 	1120
1339	et tolu le m’eust il, 	et le meust tollu 	1121
1340	se la damoisele ne fust 	se neust este la damoiselle: 	1122
1341	qui le me commanda a rendre. 	car elle commanda |qu il le me rendist 	1123|1124
1342|1343	Et quant je m’en partis, |si dis al chevalier 	Et quant ie men partis ie dis au cheualier 	1125
1344	que tels i porroit venir	que tel pourra uenir illec 	1126
1345	qui bien le feroit menteor de sa vantance 	qui le fera menteur. 	1127
1346	et il me dist	Et il me dist	1128
1347	que j'en feisse tot mon pooir, 	que ie en feisse tout mon pouoir. 	1129
1348	et je dis 		
1349	que si feroie je, 		
1350|1351	si m’en parti atant. |Et tantost 	Si men partis atant et	1130
1352	com je vos vi, vos conui je bien, 	si tost comme ie uous congneuz 	1131
1353	Si commençai i a sosrire, 	si commenca a rire pource 	1132
1354	por ce que je savoie bien 	que ie sauoie bien 	1133
1355	que vos l’en porriés bien fere mencongier, 	que uous le feriez mensengier. 	1134
1356|1357	se vos voliés. |Si avés ore oi 	et cest la cause	1135
1358	por quoi je rnioie. 	pour quoy ie rioie. 	1136
1359	Et savés vos	Et sauez uous 	1137
1360|1361	quel don je vos demant ? — |Nenil, fet il, 	quel don ie uous demande. cest 	1138
1362|1363	devant que je l’oie. — Je vueil, fet ele, |que vos me donés son cheval, 	que uous me dennez son cheual pour le mien 	1139
1364	por ce qu’il me volt tolir le mien. » 	quil me uoulut tollir. 	1140
1365	Et il dist 	Et il lui dist 	1141
1366	qu’il en fera son pooir de li doner. « 	quil en feroit son pouoir. 	1142
1367	Donc retornerai je, fet ele, 	Et elle dit |que donc retournera elle 	1143|1144
1368	et vos menrai la 	et se menera 	1145
1369	ou li chevaliers est. »	ou est le cheualier. 	1146
1370|1371	Lors retorne la damoisele |et mesire Yvain li demande : « Damoisele, savés vos 	Sauez uous bien dit messire yuain 	1147
1372	qui ie sui ? — 	qui ie suis. 	1148
1373	Ofl, fet ele, vos estes de la maison le roi Artu et de sa cort et b avés non mesire Vvain, li fiz al roi Urien. » 	Oy dit elle. uous estes de la maison du roy artus |et compaignon de la table ronde 	1149|1150
1374	Et il s’en rit C rorest, 	et auez nom messire yuain le filz au roy urien. |Et il se teust 	1151|1152
1375	et la damoisele li mostre le paveillon. » Veez la, 	que mot ne dit. 	1153
1376	Ensi parlant s’en vont tant 	Ainsi sen uent parlant 	1154
1377	qu’il vienent pres d’une fet ele, le lieu 	tant quilz uiennent en la forest/ |et la damoiselle lui monstre le paueillen 	1155|1156
1378	ou li chevaliers est. » 	ou est le cheualier. 	1157
1379|1380	Et il met maintenant son hialme en sa teste |et enbrace l’escu 	et le cheualier sault hors du paueillon son heaume en sa teste 	1158
1381	et aloingne le glaive a 	et allengne le glaiue 	1159
1382|1383	et s’en vet galopant cele part. |Et li chevaliers del paveillon saut, 	et se met celle part 	1160
1384|1385	tantost com il ot te cheval venir, |si monte en son destrier 	ou messire yuain estoit. 	1161
1386	et prent son escu et son glaive 		
1387	et il fu bien armés de totes armes; 		
1388	si dist a mon seignor Yvain, de si loins 	Si dit a messire yuain de tant loingz 	1162
1389	com il le voit: « Sire chevaliers, il vos en covient aler a pié, 	comme il le uoit. Sire cheualier il uous conuient aler a pie 	1163
1390|1391	kKar m’amie velt avoir vostre cheval. — |Bials sire, fet mesire Yvain, 	car mamie ueult uostre cheual. Beau sire dit menseigneur yuain 	1164
1392	se vos volés 	sil conuient 	1165
1393|1394	qu’ele ait le mien, |donc me covient il avoir le vostre, 	que elle ait mon cheual il cenuient 	1166
1395	kar a pié ne m’en iroie je pas. — Il le vos covient, 	que ie aie le uostre |car a pie ne men iroie ie pas. Il le uous conuient baillier: 	1167|1168
1396|1397	fet il, a force fere, |ou je me combatrai a vos; 	ou a moy combatre fait le cheualier. 	1169
1398	et lors si l’avrai, 	et lors |si le auray ie. 	1170|1171
1399|1400	si ne vos en savrai nul gré |ne ele ausi. — 	et si ne uous en sauray ia gre ne elle aussi. 	1172
1401	Par foi, sire chevaliers, fet mesire Vvain, 	Par ma foy fait messire yuain de son gre 	1173
1402|1403	et de son gré et del vostre me sorferroie je bien, ançois |que je feisse chose 	et du uostre me passeray ie bien. 	1174
1404	qui a honte me tornast. 		
1405|1406	Mes l’en me devroit molt tenir a fol, |se je mon cheval vos bailloie 	Si estes fol de cuider 	1175
1407|1408	por aler m’en a pié ! |Si n’estes mie sages, 	que ie uous rende mon cheual 	1176
1409|1410	se vos le cuidiés. — |Vos n’en feriés rien 	sans coup ferir 	1177
1411	por moi ? fet I chevaliers. — 		
1412|1413	Non voir, fet mesire Yvain. —|Or en estes vos donc, fet il, a la bataille, 	Or estes uous denc uenu a la bataille dit le cheualier 	1178
1414	puis qu’autrement ne puet estre. » 	car autrement ne peut estre. 	1179
1415	Lors s’eslonge li uns de l’autre plus d’un arpent 	Lors se eslongnent lun de lautre 	1180
1416|1417	et s’entrevienent |si tost com li cheval porent aler. Li chevaliers fiert mon seignor Yvain 	et se meuuent si tost comme les cheuaulx peuent aller. Le cheualier fiert menseigneur yuain si durement 	1181
1418|1419	si qu’il li fet l’escu percier et fendre, |mes li haubers est si fors 	quil lui fent son escu 	1182
1420|1421	que maille n’en derront. La lance vole en pieces |qui de grant vertu estoit enpainte; 	et la lance uolle en pieces.	1183
1422	et mesire Yvain 	Et momseigneur yuain 	1184
1423	qui un poi porta sa lance bas le fiert 	qui portoit sa lance bas le fiert 	1185
1424	si que par mi l’escu 	si que parmi lescu 	1186
1425	et par mi le hauberc li met la lance el senestre costé; il l’empaint bien comme cil 	et le haubert lui mit sa lance parmi le coste senestre 	1187
1426|1427	qui assés avoit vertu|et force, 	et lempaint si bien 	1188
1428	si le porte del cheval a terre, 	qu il le porte du cheual a terre 	1189
1429	puis retret son glaive 	puis retire son glaiue 	1190
1430	qui encore n’estoit pas brisiés 	qui nestoit pas encores brise 	1191
1431	et gete les mains as resnes del cheval ; 	et iecte les mains a la resgne du cheual 	1192
1432	si le prent 	si le prent et le donne a la damoiselle |qui auec lui estoit uenue 	1193|1194
1433	et le donee a la damoisele. «Tenez, fet il, damoisele. 	et lui dit. Tenez damoiselle suis ie bien a uous quicte 	1195
1434	Sui je cuites a vos ? — Sire, fet ele, oil voir. — 	Oy sire fait elle.	1196
1435	Or vos commant donc a Dieu,» fet ¡l. 	or uous commande ie a dieu. 	1197
1436	Si s’en vet maintenant 	Si sen ua maintenant 	1198
1437	et laisse cele del paveillon 	et laisse celle du paueillon 	1199
1438|1439	qui fet trop grant duel de son ami |qui navrés est, 	qui trop grant deul faisoit de son amy: 	1200
1440	si qu’ele cuide bien 	car elle cuide bien uraiement 	1201
1441	qu’il muire 	quil en meure 	1202
1442	Et mesire vvain rest entrez en son chemin, 	Et messire yuain rentre en son chemin 	1203
1443	si chevalche tot le Jor jusqu'ai vespre, 	Si erra iusques a uespres 	1204
