696|697	et il els. |Tot ce veistes vos ? — 	y ellos aella esto vistes 	595
698	Voirs est, fet mesire Gauvain. — 	vos muy bien dixo el ome bueno verdad es dixo don galuan 	596
699	Or vos dirai, fet li preudom, 	agora vos dire dixo el |/ 	597|598
700	que ce senefie. Li serpens 	ome bueno esto |que senefica sabed 	599|600
701	qui estoit si grans	que la serpentina 	601
702	et si fors senefie le roi Artu vostre oncle 	que es grande e luenga y fuerte senefica al Rei artur vuestro tio 	602
703	qui se partira de sa terre 	que se partira desu tierra 	603
704	ausi com li serpens se parti de sa chambre	asi como la serpiente se partio desu Camara 	604
705	et laissera ses homes et ses parens en son païs, 	e el dexara sus parientes e sus amigos 	605
706	ausi com li serpens laissoit Ies serpentials. 	asi como la serpiente dexo alos serpentinos 	606
707	Et ausi com li serpens coroit sus al lieupart 	e ansi como la serpiente se fue al leon pardo 	607
708	et se combatoit a lui ne vaintre ne le pooit,	e se conuatio conel |e no lo pudo vençer 	608|609
709	ausi corra sus li rois a un chevalier, 	ansi el Rei artur yra sobrevn cauallero 	610
710	mais bleissier ne le a porra, 	mas no lo podra vençer 	611
711	si en fera il tot son pooir. 	y fara ay todo su poder 	612
712|713	Et tot ensi|com li serpens s’en revenoit en sa chambre, 	y ansi como la serpiente se torno ala Camara 	613
714	quant il veoit 	quando vido 	614
715|716	que le lieupart ne porroit metre au desos, |ensi » s’en revendra li rois en son païs, 	que no podia vençer al leon pardo ni metello sosi ansi se tornara el Rei artur a su tierra 	615
717	quant il verra 	quando viere 	616
718|719	que le chevalier ne porra bleissier. |Et lors vos avendra une aventure molt merveiltose, 	que no puede vençer al cauallero entonçes auerna vna auentura marauillosa 	617
720|721	que tot|ausi 	ca bien asi como perdistes la lumbre en quanto duro la vatalla dela serpiente y del leon pardo 	618
722|723	com la veue des gens a vos fu tolue en ce|que la bataille del lieu Part 	ental manera sera la lumbre desta vuestra proeça toda apagada 	619
724	et del serpent duroit, 		
725|726	ensi sera en cel point la iumiere de vostre proesce estainte. Aprés, |quant li rois sera revenus en son païs 	e despues quando el Rei artur fuere en su tierra ansi como la serpiente enla camara yran contrael los suyos 	620
727	ausi 		
728	com li serpens revint en la chambre, li corront sus 		
729|730	si home ausi |com li serpentel faisoient au serpent 	ansi como fueron los serpentinos contrala serpiente 	621
731|732	et duerra la bataille longuement |tant qu’il ocirra els et els lui. 	e durara la vatalla entre ellos 	622
733|734	Or avés or |que li serpens senefie : 	que el matara aellos y ellos ael e agora sabedes lo que la serpiente significa 	623
735|736	si ai fet vostre volenté, |ausi weil je 	mas como yo fize vuestra voluntad devoslo 	624
737	que vos raçiés la moie de ce 		
738|739	que je vos requerrai. » |Et mesire Gauvain li creante 	deçir Ruegovos 	625
740|741	que|si fera il. « 	que me prometades de fazer la mia 	626
742|743	Or vos covient done a jurer sor sains |que jamés jor de vostre vie ne parlerois de ce 	e don galuan selo prometio agora vos digo porel prometimiento 	627
744	que je vos ai dit, 	que me feçistes 	628
745	ne que vos ne le ferois savoir 	que no fagades esto sauer a ninguno 	629
746	ne a home ne a feme. » 	ny lo digades a / ome ni a muger 	630
747	Et il li jure sor sains,	e don galuan dixo 	631
748	mais molt est esmaiés des paroles 	que ansi lo faria e don galuan estaua espantado fuertemente 	632
749|750	qu’il li dites. |Si laisse atant ester 	delo que el / ome bueno le auia dicho 	633
751	et fet molt plus bele chiere 	e fazia mas apuesta cara delo 	634
752	que li cuers ne li aporte; 	que tenia en corazon 	635
753	si remist laiens cele nuit 	y el finco alli aquella noche |y el ome bueno lo siruio de todo aquello 	636|637
754	et fu aaisiés de quanque li preudom pot avoir. 	que ouo menester |que el pudo auer 	638|639
755	Et al matin, 	e otro dia demañana 	640
756	si tost com il ot or messe de la boche de l’ermite meismes, prist ses armes 	ansy como oyo misa armose |e caualgo ensu cauallo y acomendo al hermitaño mucho a dios 	641|642
757	et monta en son cheval ausi 	y el metiose ensu camino 	643
758	com il avoit fet le jor devant. 	asi como deantes auia fecho 	644
759	Mais or laisse atant li contes a parler de lui 	mas el cuento dexa agora de fablar del 	645
		e torna a estor Agora dexa el Cuento de fablar de galuan 	646
760|761	et retorne a Hestor |qui est entrés en sa queste. 	y torna A estor de Mares 	647
762	Or dit li contes 	Agora dize el Cuento 	648
763	que,	que quando estor se partio de don galuan 	649
764|765	quant Hestor |se fu partis de mon seignor Gauvain, 	que (quando estor se partio de don galuan 	650
766	qu’il erra par mi la forest vers tierce 	que) andubo todo aquel dia |pormedio dela floresta fasta visperas 	651|652
767	et lors encontra .I. naim sor I. chaceor 	y entonçes fallo vn enano sobre vn gran cauallo 	653
768	qui venoit le trot. 	que venia a mas andar 	654
769	Et quant li nains vint pres de lui, 	e quando el enano llego |çerca dixole el henano 	655|656
770	si li dist: « Sire chevaliers, vos alés trop avant !	señor cauallero mucho andades 	657
771	Coment, bials amis ? fet Hestor. — 	como dixo estor 	658
772|773	Ja plus, fet il, n'en savrois par moi.» |Si s’en torne sans plus dire. 	porque lo deçides ya pormi no lo sabredes dixo el enano 	659
774|775	Et Hestor chevalche totes voies, |lar molt li est a poi de ce 	y estor se fue su camino que no curo del e andubo tanto 	660
776|777	que li nains li a dita, |tant qu’il vint a II. perrons 	que llego ados pedaços de padrones 	661
778	qui estoient en mi le chemin, 	que estauan en medio del camino 	662
779	si avoit letres 	y auia letras 	663
780|781	qui disoient: « |Ja nus n’ira avant de ci, 	que deçian ansi ya no yra ninguno de aqui adelante 	664
782	s’il ne quiert sa honte. » Il conut les letres 	sino quisiere su daño 	665
783|784	et bien set |qu’eles vuelent dire, 	y estor leio las letras 	666
785	mais por ce ne retornera il pas, 	mas poreso no se torno vn paso |antes se fue adelante 	667|668
786	si com il dit, 	ca dixo 	669
787|788	kar nus ne doit avoir dotance |devant qu’il voie le porquoi: 	que no deuia hauer ninguno miedo sino viese 	670
789|790	se se met tot le droit chemin de la forest |tant qu’il vint a a l’issue, 	porque y fuese derecho porsu camino dela floresta 	671
791|792	et il ot osté de sa teste son hialme por le chaut |qui trop grans estoit. 	y el se hauia tirado el yelmo porla siesta grande 	672
793	eles li dient: « 	que façia entraron dos donzellas |y el saluo aellas y ellas ael y las donzellas le dixeron 	673|674
794	Ha, sire chevaliers, 	ay señor cauallero 	675
795|796	tant est grans|Et lors encontre Il. damoiseles, 	como es grande daño devos 	676
797|798	si les salue et damages, |quant vos ceste part venistes ! — 	que mucho sodes fermoso cauallero 	677
799	Por quoi ? fet il. — Por ce, font eles, 		
800|801	que vos ne poés eschaper |que vos ne muiriés 	mas estor no se detubo 	678
802	et ce sera molt grans damagesa, 		
803|804	kar vos estes trop bials. » Hestor ne s’esmaie por chose |que celes li dient, 	por cosa quele dixesen ni se desmaio 	679
805	ains les commande a Dieu 	antes las encomendo a dios 	680
806	et s’en vet tot droit vers un chastel 	y fuese contravn castillo 	681
807	qu’il vit devant lui. 	que estaua y çerca del 	682
808|809	Et quant il vint pres, |si vit une eve	y desque llego çerca del 	683
810	qui molt estoit roide et profonde, 	vio vn agua muy fonda 	684
811	et par desus avoit un pont de lé? de toises. Il vint jusqu’a un horme 	y ençima vna fuente de quatro toças |y estor llego a vn / olmo 	685|686
		que ay estaua 	687
812|813	et trueve une damoisele |qui seoit desos. Il le salue 	y vio so el vna donzella 	688
814	et ele li dit : « 	quele dixo 	689
815	Ha, sire chevaliers, mar i alez a cel chastel, 	ay señor cauallero |o maldito sea este castillo que mucho me pesa 	690|691
816	que vos seriés ja noiés. — 	porque venides ael |porque abredes aqui asaz de enojo 	692|693
817	Comment, damoisele ? fet il. — Je le vos dirai, ret ele. Veez vos cel chevalier 	como es eso dixo estor |yo voslo dire 	694|695
818	par dela cel pont, devers cel chastel ? — 	dixo la donzella |vedes aquel que esta cauo de aquella puente si dixo estor 	696|697
819	Oil, fet il, je le voi bien. — Sachiés, fet ele, 	pues saued dixo ella 	698
820|821	qu’il est si buens josterres |que je ne sai nui meillor el monde, 	que aquel es el mejor[ ]justador del mundo 	699
822|823	et il vos covendra a lui joster; |lsi sai bien 	yo se vien 	700
824	qu’il vos metra la 	que vos conuerna a justar conel 	701
825|826	ou il met les autres. — |Et ou les met il ? — 	e se que vos metera ado mete alos otros 	702
827	Par foi, fet ele, il ne trueve nul 	ado los mete dixo estor |Por buena fee 	703|704
828	que il ne port en l’eve 	dixo ella |el 	705|706
829	et lui et le cheval, 	no falla tal cauallero |que conel juste quelo meta ael y al cauallo en aquel agua 	707|708
830	et por ce vos loeroie je 	y por ende vos lo aria 	709
831	que vos n’alissiés mie cele part, 	que no fuesedes mas contra aquella parte 	710
832	kar en joster a lui 	quela justa vos non podredes escusar 	711
833	ne poés vos riens gaaignier. — Damoisele, fet il, 	y non podedes vos durar |contra el donzella dixo estor yo vere vien / oy eso 	712|713
834	ce verrai je par tens.	e luego se partio della 	714
835	Si le commande a Dieu 	y encomendola a dios 	715
836	et vient jusqu’al pont 	y fuese derecho ala puente 	716
837|838	et quant il est venus a l’entree, |si trueve un glaive apuié a un arbre	y ala entrada de la puente fallo vna lança arrimada a vn arbol 	717
839	et il le prent, 	y estor la tomo 	718
840	kar ausi n’en avoit il point; 	que no traia lança 	719
841	si se met sus le pont. 	y dexose meter porla puente 	720
842	Et ti chevaliers 	y el cauallero 	721
843	qui d’autre part estoit li crie 	que la puente guardaua 	722
844|845	qu’il se gart de lui, |et il dist 	y el cauallero le dixo cauallero guardaduos demi 	723
846	que si fera il a son pooir. 	si fare dixo estor si pudiere 	724
847	Lors laisse corre li uns a l’autre, les glaives aloingniés, 	y luego se dexaron yr el vno al otro las lanças so los braços 	725
848|849	si s’entrefierent sor les escus les greignor cops |qu’il pueent. Li chevaliers fet son glaive voler en pieces 	e dieronse muy grandes golpes enlos escudos y el cauallero quebro su lança enel escudo de estor 	726
850	et Estors le fiert si durement 	mas estor lo firio tan Reçiamente 	727
851	qu’il abat lui et le cheval en l’eve; 	que dio conel cauallero |e conel cauallo en tierra 	728|729
852	et se li chevaliers n’eust trové uun pel 	e caiera enel agua sino fuera porvn palo aque se trauo 	730
853	a coi il se tint, noiés fust sans faille. 	que ende fallo |y sin falla fuera muerto 	731|732
854	Et Hestor nel regarde plus, 	y estor no lo cato 	733
855	aïns s’en vet tot droit a la porte del chastel, 	mas antes se fue derecho ala puerta del castillo 	734
856|857	et quant il cuide entrer dedens, |si li clost l’en la porte a l’encontre, 	e quiso entrar dentro mas çerraronle la puerta 	735
858	et il demande a un home 	y estor pregunto a vn ome 	736
859	qui desus les murs estoit 	que estaua sobre el adarue 	737
860|861	por quoi il l’ont fermee. « |Por ce, fet il, 	que por que se çerraba asi la puerta 	738
862	que nus chevaliers estranges n’i entre,	y el le Respondio y dixole porque ningun cauallero entro aqui |que fuese estraño 	739|740
863|864	s’il ne jure ançois |qu’il deliverra cest chastel des malvaisses costumes 	que primero no jure de librar este castillo delas malas costumbres 	741
865	qui i sont a son pooir. — 	que ay enel e fara 	742
866	Par foi, fet Hestor, 	y todo su poder todo eso fare dixo estor de grado |Pues guardadlo 	743|744
867	se malvaisses costumes i a, je sui pres d'oster les a mon pooir. — Me creantés vos loialment, fet cil, 	asi dixo el ombre |asi lo juro de guardar 	745|746
868	que vos en ferois vostre puissance ? — 	dixo estor lealmente 	747
869	Ol, fet il, je le vos creant 	y luego le abrieron la puerta 	748
870|871	comme loials chevaliers. a» a a mon pooir. « |Tot ce ferai ie volentiers, ret Hiestor. 	y estor entro dentro y pregunto porlas costumbres del castillo quales heran 	749
872|873	et jou le creant loias |Et l’en li oevre maintenant la porte; 	y dixo el 	750
874	si entre Hestor laiens 	/ ome bueno yo voslas dire 	751
875|876	et lors demande des costomes del chastel |quels eles sont. « 	Como estor se vio conel cauallero follon del castillo 	752
877	Nos les vos dirons, font il. Il est voirs 	Ansi es verdad dixo el / ome bueno 	753
878	qu’il a caiens. I. chevalier, le plus felon et le plus cruel del monde 	que aca dentro ay vn cauallero el mas follon |y el mas malo de todo el mundo 	754|755
879	et est sire de cest chastel, 	e señor deste castillo 	756
880|881	mais il est si preus as armes |que nos ne savons nul meillor de lui 	mas es muy gran cauallero de armas que no sauemos de otro mejor 	757
882	Et por ce qu’il sent en lui si grant proesce, se combat a tos les chevaliers 	que el en toda esta tierra |y porque el es de tan gran proeça 	758|759
883|884	que aventure amaine ceste part. |Et	se conuate con todos los caualleros 	760
885	quant il en a alcun vaincu, 	quela ventura trae aesta parte o desque lo a vençido azelo desnudar del todo 	761
886	si le fet despoillier tot nu	e fazelo arrastrar 	762
887	et puis le fet trainer par totes les rues de ceste vile. Tiels est une des costumes de çaiens, 	pormedio delas Ruas de aqueste castillo |y esta es vna delas costumbres de aqui 	763|764
888|889	et c’est as chevaliers estranges.|Mais encore en i a une plus vilaine, 	paralos caualleros estraños y otra ay peor 	765
890	et si est a nostre oes; 	que esta dixo el |/ ome bueno 	766|767
891	kar il n’est nus des mois de r'an 	ca no ay mes de todo el año 	768
892	qu’il ne preingne une de nos files, 	que el no tome vna denuestras fijas 	769
893|894	por qu’ele soit pucele, |et gist a force a li 	que sea virgen y yaze conella 	770
895	et puis la livre as garçons a tenir en soignantage. 	y despues dala a vn garçon |quela tenga por mançeba 	771|772
896	Et ensi en a honies plus de XL. 	y ansi a confundido mas de sesenta moças birgenes denuestras fijas 	773
897	dont nos tuit somes hontels et dolens 	delo qual somos todos muy tristes y desonrrados ansi 	774
898	si que nos voldrions miels morir 	que mas querriamos ser muertos 	775
899	que vivre. 	que viuos 	776
900	Ce sont les malvaises costumes del chastel: 	e tales son las costumbres de aqueste castillo 	777
901	si covient 	y conuiene 	778
902	que vos metois paine a oster les 	que pongades y toda vuestra fuerça 	779
903	ou vos serrois pariures. » 	por las tirar sino seredes perjuro 	780
904	Et il dist 	e dixo estor 	781
905	qu’il en fera molt volentiers son pooir. « 	eso fare yo muy de grado 	782
906	Mais comment porrai ie trover le chevalier ? — 	mas do fallare al cauallero nos voslo mostraremos 	783
907	Molt aaisiement, font il, 	dixo el |/ ome bueno 	784|785
908|909	kar nos vos menrons la |ou il est. » 	ca nos vos lleuaremos alla do el es 	786
910	Lors le mainent en un molt bel jardin tot plain d’arbroisials, 	y luego le lleuaron a vn vergel lleno de arboles 	787
911	fors tant qu’il avoit en mi lieu une place 	y en medio ay vna plaça 	788
912	qui bien duroit un arpent de lonc et de lé 	quanto vna echadura de vallesta en ancho y en largo 	789
913	et estoit close tot entor de lons piex agus et fors;	y estaua çercada enderredor de buenos palos agudos y fuertes 	790
914	si li mostrent un cor d’ivoire 	y mostraronle vn cuerno de vidrio 	791
915	qui pendoit a un pin et li dient 	que estaua colgado devn pino |e dixeronle 	792|793
916	qu’il li covient soner cel cor, 	señor aquel cuerno vos conuiene de tocar 	794
917|918	s’il velt |que li chevaliers viegne avant. 	si queredes que venga el cauallero 	795
919	Et il le prent tantost, 	y estor lo tomo 	796
920	si le sone si haut 	y lo taño muy altamente 	797
921	que bien grant chevalier tot desarmé 	ansi que muy lexos se pudiera oyr 	798
922	et fu montés sor I. grant destrier blanc; 	entonçes salio devna torre vn gran cauallero desarmado sobre vn gran cauallo blanco 	799
923	et li chevaliers fu ros et lentilloz et ot le nes bas et rechignié : 	y el cauallero hera Rufo y pecoso |y las narizes Romas 	800|801
924	si sambla trop bien cruel home et felon. 	y los dientes rromoludos |y bien semejaba malo y follon 	802|803
925	Et la 	y fue se ado estaua estor y saluolo 	804
926|927	ou il vit Hestor, |si le salua maintenant 	y estor le dixo dios graçias 	805
928	et li dist : « Diex vos saut, sire chevaliers !» 	señor cauallero 	806
929	Et Hestor li rent son salu a grant paine. « 	y el cauallero le dixo a estor 	807
930|931	Bials sire, fet cil, |dont estes vos ? — 	señor de donde sodes vos 	808
932	Que vos en chaut, fet Hestors, 	e dixo estor 	809
933|934	dont je soie ? |Ja par moi nel savrois ore,	que vos da que ya pormi no lo sabredes vos agora 	810
935	se vos ne me creantés a fere tot mon plaisir. — Vostre plaisir, fet cil, ne feroie je pas, 	si me non jurades de fazer my plaçer vuestro plazer |dixo el 	811|812
936	se je ne veoie mon preu et m’onor. 	cauallero |no lo fare sino viere yo 	813|814
937	Et dites moi 	y primero mi honrra mas dezid 	815
938	quels vostre plaisirs seroit. — 	que es vuestro plazer 	816
939	Certes, fet Hestor, 	çierto dixo estor 	817
940	se vos me juriés sor sains 	si mevos jurades 	818
941	que jamés ne feriés honte a chevalier ne deshonor 	que jamas faredes desonrra a Cauallero 	819
942	puis que conquis l’avriés, vos feriés mon plaisir; 	desque lo ouieredes |vençido enesto faredes mi plazer 	820|821
943|944	et d’autre part |se vos me creantiés 	e de mas que me juredes 	822
945	que jamés ne feriés honte a vos homes de lor filles, 	que jamas faredes desonrra alos omes deste castillo desus fijas 	823
946	encor le feriès vos miels.	e enesto no me faredes menos plazer |ca benirme e conbusco e deçiros 	824|825
947|948	Et lors m’acorderoie je a vos a et vos diroie |qui je sui 	e donde so y quien dixo el cauallero 	826
949	et dont. — 	e como vos no melo diredes en otra manera 	827
950	Et vos nel diriés pas altrement ? fet cil. — Non voir, fet Hestor. 	e dixo estor porçierto no |e dixo el cauallero entonçes 	828|829
951	Or sachiés donc, fet cil, 	pues agora sabed 	830
952|953	que jamés a chevalier ne ferai honte devant |que je la vos aie fete. 	que no fare desonrra aningund cauallero fasta quela faga primero avos 	831
954	Lors s’en part d’iluec 	Como estor corto la cabeza al gran cauallero |e mato alos dos leones 	832|833
955	et s’en vet armer; 	que guardauan ala dueña 	834
956	et cil	Conesto se partio el cauallero ende y fuese a armar 	835
957	qui en la place estoient dient a Hestor : « Sire, savés vos 	y aquellos que estauan con estor dixeronle |señor sabedes vos 	836|837
958	por quoi il vint tos desarmés ? Il vos cuidoit tant faveler de paroles 	porque vino el cauallero desatinado |sabed 	838|839
959	que vos feissiés pes a lui 	que vos cuido tomar por palabras 	840
960|961	et que vos ostissiés vos armes; |et si tost com vos fuissiés desarmés, il vos feist prendre 	que si fiziesedes paz conel e que tirasedes vuestras armas 	841
962|963	et fere tote la honte |que l’en porroit dire de boche: 	e que tan ayna como fuesedes desarmado 	842
964	si a en tel maniere honi maint preudome et maint buen chevalier 	que vos fiziese prender |e que vos fiziese tantas desonrras 	843|844
965	qui encore en seront vengié en alcun tens, 	quantas se pudiesen dezir 	845
966	se Dieu plest. » En ce qu’il parloient, issi li chevaliers de la tor	por voca de / ome y ellos en quanto esto fablauan salio el cauallero dela torre 	846
967	et fu molt richement armés d’unes armes vermeiltes 	muy Ricamente armado devnas armas bermejas 	847
968	et ot a son col I escu vermeil 	y vn escudo vermejo al cuello 	848
969|970	et une tance en son poing; |et la	y vna lança enla mano y vn pendon 	849
971	ou il vit Hestor, 	y vinose derecho a do estaua estor 	850
972	si li dist : « Sire chevaliers, huimés vos devés vos garder de moi, 	e dixole |don cauallero guardadvos demy 	851|852
973	que je ne vos asseur pas. — 	que desde oy |mas no vos aseguro 	853|854
974	Ne ie vos, fet Hestor, 	ni yo avos dixo estor 	855
975|976	kKar onques ne vi chevalier |que je peuisse tant haïr 	ca nunca vi tan mal cauallero como vos sodes 	856
977|978	com je faz vos. » |Lors entrent en l’arpent 	y luego se metieron enla plaza 	857
979	qui estoit clos, 	que estaua çerca 	858
980	si com je vos ai dit, 	como vos dixe 	859
981	et laisse corre li uns vers l’autre, les glaives aloigniés, 	y luego se dexaron correr el vno contrael |/ otro las lanças so los braços 	860|861
982	et s’entrefierent sor les escus si grans cops 	y dieronse muy grandes golpes enlos escudos de tan grande fuerça 	862
983	que li glaive sont pechoié ; 	que fizieron bolar las lanças yn piezas 	863
984	si s’entrehurtent des cors et des visages si durement 	y toparonse delos cuerpos y escudos 	864
985|986	qu’il se portent des chevals a terre, |si estordi 	asi fuer-temente que dieron consigo entierra los cauallos sobrelos cuerpos 	865
987|988	qu’il n’i a celui |qui tos ne soit estonés. 	asi que quedaron anbos muy estordidos 	866
989	Mais Hestor se redreça tos premiers 	mas estor se leuanto primero 	867
990	et met la main a l'espee, 	y metio mano asu espada 	868
991|992	et cil refet autretel |qui de grant force estoit; si s’entrecorent sus, les espees drecies contremont, 	y el otro cauallero fizo otro tal y era de muy gran fuerça 	869
993	et s’entredonent par mi les hialmes grans cops 	e dieronse muy grandes golpes sobrelos yelmos 	870
994	si qu’il en font le feu saillir. 	asi que fuego fazian salir dellos 	871
995	Et li oeil lor estincelent es testes au fes des cops 	e cortauanse los çercos dellos 	872
996|997	qu’il s’entredonent; |si se depiecent les escus et les haubers 	e despedaçauanse los escudos e las lorigas e traianse avnas partes 	873
998	et se mainent une hore avant et autre ariere, 	y a otras arriua e ayuso 	874
999	si se font le sanc saillir des espaules et des bras et des testes 	e fazianse salir mucha sangre porlas espaldas y porlos braços 	875
1000	et sont al premier assaut 	e porlas cabezas 	876
1001	si par igal 	e tajauanse los yelmos conlas espadas tajantes e conuatianse ansi por igual 	877
1002	que l’en ne peust pas legierement le meillor eslire, 	que no podia ome escojer ligeramente |qual dellos auia lo mejor 	878|879
1003|1004	kar li mains vailtans estoit plains de grant proesce. |Tant se sont issi combatu 	ca el menos valiente era lleno de gran proeça e de gran ardimiento e tanto se conuatieron los caualleros 	880
1005	qu’il n’i a celui 	que no hauia 	881
1006|1007	qui assés ne soit las et traveilliés.|Mes cil del chastel a si tres grant chaut 	y tal dellos 	882
1008	qu’a poi qu’il ne muert d’anguoisse: 	que no fuese muy cansado 	883
1009	si est molt enpiriés d’alaine et de force. 	mas el cauallero auia muy gran calor 	884
1010|1011	Et Hestors le haste si durement |qu’il li covient guenchier as cops de l’espee Hestor 	que por poco no moria con cuita y estor lo feria ansi duramente 	885
1012	qui mainte fois l’a tasté jusqu’al sanc; 	que muchas vezes le fizo sentir su espada enla cabeza 	886
1013	si bSe cuevre de son escu 	e el cauallero se cobria desu escudo 	887
1014	tant com il puet 	lo mejor 	888
1015	et Hestors gete totes voies, com cil 	que podia mas estor lo feria muy duramente 	889
1016	qui molt avoit longue alaine; 	ansi como aquel que hera de muy gran fuerça 	890
1017	si le fiert sor le bras 	e de gran corazon 	891
1018	dont cil tenoit l’espee 	en tal manera 	892
1019|1020	si qu’il li fet voler le poing a tot l’espee a terre, |et cil giete I. cri molt doleroz.	quele dio vn tan gran golpe dela espada sobre el braço derecho ansi quele fizo la mano conla espada volar en tierra 	893
1021	Et Hestor remet s’espee el fuerre, 	y el cauallero dio vn gran grito amarauilla |y estor metio la espada enla vaina 	894|895
1022	si prent celui par le hialme	e tomo al cauallero porel yelmo 	896
1023	et li esrache de la teste 	e tiroselo dela cabeza muy deReçio 	897
1024	et dist 	e despues metio mano ala espada 	898
1025	qu’il li trenchera le chief, 	e dixole don cauallero 	899
1026	s’il ne se tient por outré, 	si vos non tenedes por vençido 	900
1027	et cil dist 	yo vos tajare la cabeza asi me ayude dios dixo el |cauallero 	901|902
1028	que ce ne sera ja, 	yo no fare cosa de 	903
1029	se Diex li art. 	quanto me deçides entonçes ouo estor muy gran saña del 	904
1030	Et Hestor met la main a l’espee, 	e fue contrael |e firiolo asi fuertemente de toda su fuerça 	905|906
1031	si le fiert par mi le col 	quele fizo bolar la cabeza porla plaza 	907
1032	si qu’il li fet la teste voler loing plus d’une lance. 	mas devna lança en luengo entonçes |dixo estor 	908|909
1033|1034	Lors demande a cels |qui entor lui sont 	alos que estauan enderredor del 	910
1035	si li covient plus a fere et il dient: « 	amigos conuieneme aqui |mas de fazer si dixeron ellos 	911|912
1036	Ol, il covient, font il, a delivrer la dame de cest chastel 	ca vos conuiene de liberar ala señora deste castillo 	913
1037|1038	qui ça desos est en prison en une cave, la |ou dui lion la gardent. » 	que aca esta en prision envna Cueba en poder de dos leones 	914
1039	Et il dist 	quela guardan muy de grado 	915
