709	ausi corra sus li rois a un chevalier, 	ainsi courra sus le roy a ung cheualier 	591
710	mais bleissier ne le a porra, 	et uaincre ne le pourra 	592
711	si en fera il tot son pooir. 	et si en fera tout son pouoir 	593
712	Et tot ensi	et tout ainsi 	594
713	com li serpens s’en revenoit en sa chambre, 	que le serpent retournoit en sa chambre 	595
714	quant il veoit 	quant il uit 	596
715	que le lieupart ne porroit metre au desos, 	qu il ne pouoit mettre le liepart au dessoubz 	597
716	ensi » s’en revendra li rois en son païs, 	ainsi sen ira le roy en son pais 	598
717	quant il verra 	quant il uerra 	599
718	que le chevalier ne porra bleissier. 	que il ne poourra le cheualier plessier. 	600
719|720	Et lors vos avendra une aventure molt merveiltose, |que tot	et lors lui auendia une merueilleuse auanture 	601
721	ausi 		
722|723	com la veue des gens a vos fu tolue en ce|que la bataille del lieu Part 	car tout ainsi comme la ueue des yeulx uous fut tollue 	602
724|725	et del serpent duroit, |ensi sera en cel point la iumiere de vostre proesce estainte. Aprés, 	ainsi que la meslee du serpent et du liepart duroit: en telle maniere sera la proesse de uren lumieree estaincte 	603
726|727	quant li rois sera revenus en son païs |ausi 	apres que le roy sera uenu en son pais: 	604
728	com li serpens revint en la chambre, li corront sus 	ainsi que le serpent reuint en la chambre 	605
729|730	si home ausi |com li serpentel faisoient au serpent 	si lui courrent ses hommes sus comme les serpenteaulx couroient sus au serpent 	606
731	et duerra la bataille longuement 	et durera la bataille lenguement: 	607
732	tant qu’il ocirra els et els lui. 	tant qu il les occira |et eulx lui. 	608|609
733	Or avés or 	Or auez ouy 	610
734	que li serpens senefie : 	que le serpent signifie:	611
735	si ai fet vostre volenté, 	si ay faict uostre uoulente |de le dire 	612|613
736	ausi weil je 	ainsi uueil ie 	614
737	que vos raçiés la moie de ce 	que uous facez la mienne de ce 	615
738	que je vos requerrai. » 	que ie uous requerray. 	616
739	Et mesire Gauvain li creante 	Et messire gauuain lui promet 	617
740|741	que|si fera il. « 	que si fera il. 	618
742	Or vos covient done a jurer sor sains 	Or uous cenuient denc iurer sur sains 	619
743	que jamés jor de vostre vie ne parlerois de ce 	que iamais iour de uostre uie ne parlerez de ce	620
744	que je vos ai dit, 	que ie uous ay dit 	621
745|746	ne que vos ne le ferois savoir |ne a home ne a feme. » 	et ne le ferez sauoir a homme ne a femme. 	622
747	Et il li jure sor sains,	Et il lui iure 	623
748	mais molt est esmaiés des paroles 	mais moult est esbay des parolles 	624
749|750	qu’il li dites. |Si laisse atant ester 	quil lui a dictes. il fait plus belle chiere 	625
751	et fet molt plus bele chiere 		
752	que li cuers ne li aporte; 	que son cueur ne lui porte 	626
753|754	si remist laiens cele nuit |et fu aaisiés de quanque li preudom pot avoir. 	et demeure leans celle nuit et au matin	627
755	Et al matin, 	si tost 	628
756|757	si tost com il ot or messe de la boche de l’ermite meismes, prist ses armes |et monta en son cheval ausi 	quil eust ouy messe print ses armes: monta a cheual	629
758	com il avoit fet le jor devant. 	et commanda lermite a dieu. 	630
759	Mais or laisse atant li contes a parler de lui 	Mais icy laisse le compte a parler de lui. 	631
760	et retorne a Hestor 	et retourne a hector des mares. 	632
761	qui est entrés en sa queste. 	lequel est entre en la queste de lancelot du lac. 	633
762|763	Or dit li contes |que,	OR dit le compte 	634
764|765	quant Hestor |se fu partis de mon seignor Gauvain, 	que quant hector se fut parti de monseigneur gauuain 	635
766	qu’il erra par mi la forest vers tierce 	quil erra toute iour parmi la forest iusques a uespres 	636
767|768	et lors encontra .I. naim sor I. chaceor |qui venoit le trot. 	et lors encontra ung nain monte sur ung roussin 	637
769	Et quant li nains vint pres de lui, 	Quant le nain uint pres de hector 	638
770	si li dist: « Sire chevaliers, vos alés trop avant !	si lui dit Sire cheualier uous allez trop 	639
771	Coment, bials amis ? fet Hestor. — 	Comment fist il. 	640
772	Ja plus, fet il, n'en savrois par moi.» 	Ia plus nen saurez|par moy fait le nain. 	641|642
773|774	Si s’en torne sans plus dire. |Et Hestor chevalche totes voies, 	Si sen retourne sans plus dire/ et hector cheuaucha tousiours 	643
775	lar molt li est a poi de ce 		
776	que li nains li a dita, 		
777	tant qu’il vint a II. perrons 	tant quil uint a deux perrons 	644
778	qui estoient en mi le chemin, 	qui estoient en my le chemin 	645
779|780	si avoit letres |qui disoient: « 	ou il y auoit lettres 	646
781|782	Ja nus n’ira avant de ci, |s’il ne quiert sa honte. » Il conut les letres 	qui disoient. Iamais cheualier ne ira plus auant de cy sil ne quiert sa hente. 	647
783|784	et bien set |qu’eles vuelent dire, 	Quant il eust les lettrens leues 	648
785	mais por ce ne retornera il pas, 	pourtant ne retourna il pas: 	649
786	si com il dit, 	car il dist 	650
787	kar nus ne doit avoir dotance 	que nul ne doit auoir doubtance 	651
788	devant qu’il voie le porquoi: 	deuant quil uoye la paour de quoy 	652
789	se se met tot le droit chemin de la forest 	Si sen ua le droit chemin de la forest 	653
790	tant qu’il vint a a l’issue, 	tant|qu il uint a lissue 	654|655
791	et il ot osté de sa teste son hialme por le chaut 	et lors encontra deux damoiselles 	656
792	qui trop grans estoit. 	si les salue. 	657
793	eles li dient: « 	et elles lui dient. 	658
794	Ha, sire chevaliers, 	Haa sire cheualier 	659
795	tant est grans	tant est grant dommage	660
796	Et lors encontre Il. damoiseles, 		
797|798	si les salue et damages, |quant vos ceste part venistes ! — 	quant uous uenistes en ceste part. 	661
799	Por quoi ? fet il. — Por ce, font eles, 	Et pour quoy fist il. |Pour ce font elles 	662|663
800	que vos ne poés eschaper 	que uous nen pouez eschaper 	664
801	que vos ne muiriés 	que uous ny mourrez.	665
802	et ce sera molt grans damagesa, 	et se sera moult grant dommage: 	666
803	kar vos estes trop bials. » Hestor ne s’esmaie por chose 	car uous estes menlt heau. |Et hector ne se esmoie de riens 	667|668
804|805	que celes li dient, |ains les commande a Dieu 	que elles lui dient aincois les commande a dieu 	669
806	et s’en vet tot droit vers un chastel 	et sen ua uers ung chasteau 	670
807	qu’il vit devant lui. 	qu il uist deuant lui. 	671
808|809	Et quant il vint pres, |si vit une eve	Et quant il uint pres il uist une eaue moult parfonde 	672
810	qui molt estoit roide et profonde, 		
811	et par desus avoit un pont de lé? de toises. Il vint jusqu’a un horme 	et par dessus auoit ung pent large de quatre toises. |puis uint iusques a ung ourme 	673|674
812	et trueve une damoisele 	et trouua une damoiselle 	675
813	qui seoit desos. Il le salue 	qui seoit dessoubz. Il la salue 	676
814	et ele li dit : « 	et elle lui dist. 	677
815	Ha, sire chevaliers, mar i alez a cel chastel, 	Ha sire dit elle mal y allez 	678
816	que vos seriés ja noiés. — 	car uous serez noye. 	679
817	Comment, damoisele ? fet il. — Je le vos dirai, ret ele. Veez vos cel chevalier 	Comment damoiselle fait il. |Ce uous diroie ie bien fait elle. Ueez ce cheualier 	680|681
818|819	par dela cel pont, devers cel chastel ? — |Oil, fet il, je le voi bien. — Sachiés, fet ele, 	par dela ce pent deuers ce chasteau: sachez 	682
820	qu’il est si buens josterres 	qu il est si bon iousteur 	683
821	que je ne sai nui meillor el monde, 	qu il ne a meilleur au mende: 	684
822|823	et il vos covendra a lui joster; |lsi sai bien 	et il uous conuendra a lui iouster si bien 	685
824	qu’il vos metra la 	qu il uous mettra la 	686
825	ou il met les autres. — 	ou il met les autres.	687
826	Et ou les met il ? — 	Et ou les met il damoiselle fist hector. 	688
827|828	Par foi, fet ele, il ne trueve nul |que il ne port en l’eve 	par ma foy dit elle il nen treuue nul 	689
829|830	et lui et le cheval, |et por ce vos loeroie je 	qu il ne mecte en leaue lui et le cheual Damoiselle dit hector ce uerray ie par temps. 	690
831|832	que vos n’alissiés mie cele part, |kar en joster a lui 	Lors commande la damoiselle a dieu 	691
833|834	ne poés vos riens gaaignier. — Damoisele, fet il, |ce verrai je par tens.	et puis uient iusques au pent. 	692
835|836	Si le commande a Dieu |et vient jusqu’al pont 	Et	693
837	et quant il est venus a l’entree, 	quant il est uenu a lentree 	694
838	si trueve un glaive apuié a un arbre	si uoit ung glaiue |qui estoit apuye a ung arbre. 	695|696
839	et il le prent, 	et il le prent. 	697
840|841	kar ausi n’en avoit il point; |si se met sus le pont. 	si se mect dessus le pont/ 	698
842	Et ti chevaliers 	et le cheualier 	699
843	qui d’autre part estoit li crie 	qui dessus le pont estoit lui escrie	700
844	qu’il se gart de lui, 	quil se garde de luy 	701
845	et il dist 	et il dist 	702
846	que si fera il a son pooir. 	que si fera il a son pouoir/ 	703
847	Lors laisse corre li uns a l’autre, les glaives aloingniés, 	et lors lesserent courre lun uers laultre 	704
848|849	si s’entrefierent sor les escus les greignor cops |qu’il pueent. Li chevaliers fet son glaive voler en pieces 	si sentrefierent sur les escus/ le cheualier brise sa lance: 	705
850	et Estors le fiert si durement 	et hector le fiert si durement 	706
851	qu’il abat lui et le cheval en l’eve; 	quil le fait flatir en leaue luy et le cheual:	707
852	et se li chevaliers n’eust trové uun pel 	et se le cheualier neust trouue ung pel 	708
853	a coi il se tint, noiés fust sans faille. 	a quoy il se retint il eust este noye sans faille. 	709
854	Et Hestor nel regarde plus, 	hector ne le regarde plus/	710
855	aïns s’en vet tot droit a la porte del chastel, 	ains sen ua tout droit a la porte du chastel. 	711
856|857	et quant il cuide entrer dedens, |si li clost l’en la porte a l’encontre, 	et quant il cuida entrer leans. on clouist la porte centre lny/ 	712
858	et il demande a un home 	et il demande a ung homme 	713
859	qui desus les murs estoit 	qui dessus estoit 	714
860	por quoi il l’ont fermee. « 	pour quoy la porte estoit fermee/ 	715
861	Por ce, fet il, 	pour ce fist il 	716
862	que nus chevaliers estranges n’i entre,	que nul cheualier esrange ne y entre	717
863	s’il ne jure ançois 	sil ne iure auant sur saintz 	718
864	qu’il deliverra cest chastel des malvaisses costumes 	quil deliurera le chastel des mauuaises coustumes 	719
865	qui i sont a son pooir. — 	qui y sont |et fera tout son pouoir de les oster.	720|721
866	Par foi, fet Hestor, 	Par ma foy fit hector 	722
867|868	se malvaisses costumes i a, je sui pres d'oster les a mon pooir. — Me creantés vos loialment, fet cil, |que vos en ferois vostre puissance ? — 	se mauuaises coustumes y a ie suys tout prest de les oster/ le creanchies uous ainsi/ 	723
869	Ol, fet il, je le vos creant 		
870|871	comme loials chevaliers. a» a a mon pooir. « |Tot ce ferai ie volentiers, ret Hiestor. 	ouy fist hector loyaument. 	724
872|873	et jou le creant loias |Et l’en li oevre maintenant la porte; 	et len luy oeuure la poite 	725
874	si entre Hestor laiens 	si entre leans 	726
875|876	et lors demande des costomes del chastel |quels eles sont. « 	et demande des coustumes du chastel. Nous le uous direns uoullentiers fit celluy. Il est uray 	727
877|878	Nos les vos dirons, font il. Il est voirs |qu’il a caiens. I. chevalier, le plus felon et le plus cruel del monde 	quil y a ceans ung cheualier le plus fellon et le plus cruel du monde. 	728
879	et est sire de cest chastel, 	et est seigneur de cest chastel: 	729
880	mais il est si preus as armes 	si est si preux aux armes 	730
881	que nos ne savons nul meillor de lui 	que nous ne scauens nul meilleur. 	731
882	Et por ce qu’il sent en lui si grant proesce, se combat a tos les chevaliers 	et par sa grant prouesse il se combat a tous les cheualiers 	732
883	que aventure amaine ceste part. 	que aduanture amaine celle part/ 	733
884|885	Et|quant il en a alcun vaincu, 	et quant il en a ung uaincu 	734
886	si le fet despoillier tot nu	sy le fait despoullier tout nu/ 	735
887|888	et puis le fet trainer par totes les rues de ceste vile. Tiels est une des costumes de çaiens, |et c’est as chevaliers estranges.	et le fait trainer par toutes les rues de ceste uille. 	736
889|890	Mais encore en i a une plus vilaine, |et si est a nostre oes; 	Et encore en y a une plus uillaine/	737
891	kar il n’est nus des mois de r'an 	car il nest iour en lan 	738
892	qu’il ne preingne une de nos files, 	quil ne prengne une de nos filles pour tant 	739
893	por qu’ele soit pucele, 	que elle soit pucelle/ 	740
894	et gist a force a li 	si gist a force auec elle/ 	741
895	et puis la livre as garçons a tenir en soignantage. 	et puys la baille a ses garchons a tenir en seruaige.	742
896	Et ensi en a honies plus de XL. 	Et ainsi en a il eues plus de .xl. 	743
897	dont nos tuit somes hontels et dolens 	donc nous sommes tous henteux/ et dollens 	744
898|899	si que nos voldrions miels morir |que vivre. 	si que entre nous de ce chasiel uouldriens mieulx mourir que uiure. 	745
900	Ce sont les malvaises costumes del chastel: 	OR aues ouyes les coustumes de ceste uile	746
901	si covient 	si cenuient 	747
902	que vos metois paine a oster les 	que mettes paine a les oster/ 	748
903	ou vos serrois pariures. » 	ou uous seres pariure.	749
904	Et il dist 	et il dist 	750
905	qu’il en fera molt volentiers son pooir. « 	quil fera uoulentiers tout son pouoir/ 	751
906|907	Mais comment porrai ie trover le chevalier ? — |Molt aaisiement, font il, 	mes comment pourrens nous trouuer le cheualier fist hector/ menlt aisiement fait celluy/ 	752
908	kar nos vos menrons la 	car nous uous menerent tout droit la 	753
909	ou il est. » 	ou il est. 	754
910	Lors le mainent en un molt bel jardin tot plain d’arbroisials, 	Lors amainent hector en ung monlt beau iardin tout plain de arbresseaulx fors tant 	755
911	fors tant qu’il avoit en mi lieu une place 	qu il auoit esleu une place 	756
912	qui bien duroit un arpent de lonc et de lé 	qui duroit bien ung arpent de long et de le/ 	757
913|914	et estoit close tot entor de lons piex agus et fors;|si li mostrent un cor d’ivoire 	et estoit close tout entour de bens pieulx aguz et fors. il luy menstrerent ung cor de yuire 	758
915	qui pendoit a un pin et li dient 	qui pendoit a ung pieu: |si luy dient 	759|760
916	qu’il li covient soner cel cor, 	qu il luy cenuient le cor senner 	761
917	s’il velt 	sil ueult 	762
918	que li chevaliers viegne avant. 	que le cheualier uiengne auant. 	763
919	Et il le prent tantost, 	et hector prent le cor 	764
920	si le sone si haut 	si le senne. 	765
921|922	que bien grant chevalier tot desarmé |et fu montés sor I. grant destrier blanc; 	Et maintenant issit de une tour ung cheualier grant mente dessus ung grant destrier blanc. 	766
923	et li chevaliers fu ros et lentilloz et ot le nes bas et rechignié : 		
924	si sambla trop bien cruel home et felon. 		
925	Et la 	Et la 	767
926	ou il vit Hestor, 	ou il uit hector 	768
927	si le salua maintenant 	si le sallue/ 	769
928	et li dist : « Diex vos saut, sire chevaliers !» 	et luy dist dieu uous sault sire cheualier. 	770
929|930	Et Hestor li rent son salu a grant paine. « |Bials sire, fet cil, 	Et hector luy rendist son sallut a menlt grant paine: Beau sire dist le cheualier 	771
931	dont estes vos ? — 	donc estes uous/ 	772
932|933	Que vos en chaut, fet Hestors, |dont je soie ? 	que uous chault fist hector ia par moy ne le scaires 	773
934	Ja par moi nel savrois ore,		
935|936	se vos ne me creantés a fere tot mon plaisir. — Vostre plaisir, fet cil, ne feroie je pas, |se je ne veoie mon preu et m’onor. 	se uous ne crancies a faire men plaisir. 	774
937	Et dites moi 	Or me dictes 	775
938	quels vostre plaisirs seroit. — 	quel uostre plaisir seroit fait le cheualier. 	776
939	Certes, fet Hestor, 	Certes dist hector	777
940	se vos me juriés sor sains 	se uous iures sus saintz 	778
941	que jamés ne feriés honte a chevalier ne deshonor 	que iames ne feres honte ne deshenneur a cheualier errant 	779
942	puis que conquis l’avriés, vos feriés mon plaisir; 	puis que uous lauries cenquis uous feries men plaisir.	780
943	et d’autre part 	Et daultre part 	781
944	se vos me creantiés 	se uous me ceancies 	782
945|946	que jamés ne feriés honte a vos homes de lor filles, |encor le feriès vos miels.	que iames ne feres honte a homme de cest chastel de leurs filles encore feries uous mieulx	783
947	Et lors m’acorderoie je a vos a et vos diroie 	et uous diroie 	784
948|949	qui je sui |et dont. — 	qui ie suis. 	785
950	Et vos nel diriés pas altrement ? fet cil. — Non voir, fet Hestor. 	Et denc uous ne le diries|pas aultrement fist celluy/ 	786|787
951	Or sachiés donc, fet cil, 	non uoir fist hector. |Or sachies 	788|789
952	que jamés a chevalier ne ferai honte devant 	que iames ne feray honte a chenalier 	790
953	que je la vos aie fete. 	deuant que ie uous laie faicte fait le cheualier: 	791
954	Lors s’en part d’iluec 	lors se part dilleuc 	792
955	et s’en vet armer; 	et se ua armer. 	793
956	et cil	Et ceulx	794
957	qui en la place estoient dient a Hestor : « Sire, savés vos 	qui en la plache estoient disrent a hector. Sire saues uous pour	795
958	por quoi il vint tos desarmés ? Il vos cuidoit tant faveler de paroles 	quoy il uint cha desarme/ |pour ce qu il uous cuydoit folloier par parolles 	796|797
959	que vos feissiés pes a lui 	de faire paix a luy. 	798
960	et que vos ostissiés vos armes; 	et que uous ostissies uos armes 	799
961	et si tost com vos fuissiés desarmés, il vos feist prendre 	et si tost comment uous eussies este desarme il uous eust fait prendre/ 	800
962	et fere tote la honte 	et fait tant de hente 	801
963	que l’en porroit dire de boche: 	que homme pourroit dire de bouche. 	802
964	si a en tel maniere honi maint preudome et maint buen chevalier 	Si a en telle maniere honny maint bon cheualier. 	803
965	qui encore en seront vengié en alcun tens, 	Et ce temps 	804
966|967	se Dieu plest. » En ce qu’il parloient, issi li chevaliers de la tor|et fu molt richement armés d’unes armes vermeiltes 	pendant quilz parloient ainsi/ le cheualier issit de la tour arme monlt richement de unes armes merueilleuses/ 	805
968	et ot a son col I escu vermeil 	et auoit a son col ung escu uermeil 	806
969	et une tance en son poing; 	et une lance en son poing/ 	807
970|971	et la|ou il vit Hestor, 	et quant il uist hector 	808
972	si li dist : « Sire chevaliers, huimés vos devés vos garder de moi, 	si luy dit |quil se gardast de luy/ 	809|810
973	que je ne vos asseur pas. — 	car il ne le asseure pas. 	811
974|975	Ne ie vos, fet Hestor, |kKar onques ne vi chevalier 	ne moy uous fist hector 	812
976	que je peuisse tant haïr 		
977	com je faz vos. » 		
978	Lors entrent en l’arpent 	lors entrent en lerpent	813
979	qui estoit clos, 	qui estoit clos/ 	814
980|981	si com je vos ai dit, |et laisse corre li uns vers l’autre, les glaives aloigniés, 	puys lessent courre les ungz aux aultres/ 	815
982	et s’entrefierent sor les escus si grans cops 	si sentrefierent par telle force sur les escus 	816
983	que li glaive sont pechoié ; 	que les glaiues sont rompuz 	817
984	si s’entrehurtent des cors et des visages si durement 	Et ilz sentreheurtent des escus et des uisaiges si durement 	818
985	qu’il se portent des chevals a terre, 	quilz se portent a terre les cheuaux sur le pre. 	819
986	si estordi 	Si sont tous deux si estonnes 	820
987	qu’il n’i a celui 	quil ny a celluy 	821
988	qui tos ne soit estonés. 	qui ne soit estourdi/ 	822
989	Mais Hestor se redreça tos premiers 	mes hector |se dreche premier 	823|824
990|991	et met la main a l'espee, |et cil refet autretel 	et mect la main a lespee/ et le cheualier en reffait autant. 	825
992|993	qui de grant force estoit; si s’entrecorent sus, les espees drecies contremont, |et s’entredonent par mi les hialmes grans cops 	Si sentredonnent de grans coups parmy les heaulmes 	826
994	si qu’il en font le feu saillir. 	tant qu ilz en fent le feu saillir/ 	827
995	Et li oeil lor estincelent es testes au fes des cops 		
996|997	qu’il s’entredonent; |si se depiecent les escus et les haubers 	et despiechent leurs escus et leurs haubers 	828
998	et se mainent une hore avant et autre ariere, 	si sentremainent une heure ament une autre aual 	829
999	si se font le sanc saillir des espaules et des bras et des testes 	et se font le sang saillir des espaulles des testes et des bras 	830
1000|1001	et sont al premier assaut |si par igal 	et sent au premier si egaulx 	831
1002	que l’en ne peust pas legierement le meillor eslire, 	que a peine peut on eslire le meilleur/	832
1003	kar li mains vailtans estoit plains de grant proesce. 	car le mains uaillant estoit de grant prouesse et de grant hardiesse.	833
1004	Tant se sont issi combatu 	Tant se sont combatuz 	834
1005	qu’il n’i a celui 	qu il ny a celui 	835
1006|1007	qui assés ne soit las et traveilliés.|Mes cil del chastel a si tres grant chaut 	qui ne soit las et trauaillie. Le cheualier a si grant chault 	836
1008	qu’a poi qu’il ne muert d’anguoisse: 	que a peu|quil ne meurt dangoisse: 	837|838
1009|1010	si est molt enpiriés d’alaine et de force. |Et Hestors le haste si durement 	car hector le haste si durement 	839
1011|1012	qu’il li covient guenchier as cops de l’espee Hestor |qui mainte fois l’a tasté jusqu’al sanc; 	qu il lui conuient perdre place 	840
1013	si bSe cuevre de son escu 	Si se cueuure de son escu au mieulx	841
1014	tant com il puet 	quil peut 	842
1015	et Hestors gete totes voies, com cil 	et hector iecte sus lui |comme ce lui 	843|844
1016	qui molt avoit longue alaine; 	qui moult auoit cueur et force. 	845
1017	si le fiert sor le bras 	si le fiert dessus le bras 	846
1018	dont cil tenoit l’espee 	dent il tenoit lespee 	847
1019	si qu’il li fet voler le poing a tot l’espee a terre, 	si qu il la fait uoller atout le poing. 	848
1020|1021	et cil giete I. cri molt doleroz.|Et Hestor remet s’espee el fuerre, 	Et celui iecte ung cry merueilleux et grant. Hector met son espee au fourreau 	849
1022	si prent celui par le hialme	et prent celui par le heaume 	850
1023	et li esrache de la teste 	et lui arrache. 	851
1024	et dist 	et dit	852
1025|1026	qu’il li trenchera le chief, |s’il ne se tient por outré, 	qu il lui couppera la teste: sil ne se tient pour oultre.	853
1027	et cil dist 	Et celui dit 	854
1028|1029	que ce ne sera ja, |se Diex li art. 	quil nen fera riens. 	855
1030	Et Hestor met la main a l’espee, 	et hector le fiert 	856
1031	si le fiert par mi le col 	si durement 	857
1032	si qu’il li fet la teste voler loing plus d’une lance. 	quil lui fist la teste uoller plus de une lance loingz.	858
1033	Lors demande a cels 	Lors demande a ceulx 	859
1034	qui entor lui sont 	qui entour lui sont 	860
1035	si li covient plus a fere et il dient: « 	sil en cenuient plus faire. |et ilz dient 	861|862
1036	Ol, il covient, font il, a delivrer la dame de cest chastel 	que oy. Il uous cenuient deliurer la dame de ce chasteau 	863
1037|1038	qui ça desos est en prison en une cave, la |ou dui lion la gardent. » 	qui est cy dessoubz en une caue: la ou deux lyens la gardent. 	864
1039	Et il dist 	Et il dit 	865
1040|1041	qu’il est pres de fere |quanqu’il voldront. « 	quil est tout prest. Uenez denc apres nous. Ilz le mainent en une caue dessoubz laire: si lui menstrent lentree 	866
1042	Or en venés 		
1043	dont. font il, aprés nos. » 		
1044	Et il si fet, 		
1045	si armés 		
1046	com il estoit:		
1047	si le mainent a une cave 		
1048	qui estoit desos la tor et li mostrent l’entree 		
1049|1050	et li dient : « Sire, |saiens est la dame emprisonee, 	et lui dient. Sire ceans est la dame en prison 	867
1051	si la gardent dui lion si bien 	et la gardent si bien les lyens 	868
1052	que nus n’ose de lui aprochier. » 	que nul ne ose a elle attouchier 	869
1053	Et quant Hestors l’entent 	Quant hector les entent 	870
1054	que laiens est la dame, 		
1055	si ne tint plus parole a els, 	si ne leur tient plus parolle 	871
1056	ains se commande a Dieu 	mais se recommande a dieu 	872
1057	et a fet le seigne de la crois en mi son vis, 	et fait le signe de la croix en my son uisage 	873
1058	puis se met en la cave : 	et puis descent en la caue. 	874
1059	et l’en i veoit molt cler, 	et len y ueoit moult cler 	875
1060	kar la terre estoit crevee par desus en pluisors lieus	car la terre estoit creuee en plusieurs lieux 	876
1061	si que la clartés del jor espandoit par tot. 	si que la clarte du iour se espandoit par tout. 	877
1062	Quant il est aval venus, 	Et|quant il est aual uenu il uoit les deux lyens 	878|879
1063|1064	si vit les. II. lions |qui estoient atachié a II. bones chaienes de fer ; 	qui estoient attachiez a deux chaines de fer. lun a destre 	880
1065	si estoit li uns a destre et li autres a senestre 	et lautre a senestre 	881
1066	et gardoient la voie 	et gardoient si la uoie 	882
1067|1068	que nus ne peust aler a la damoisele |se par els non. 	que nul ne pouoit de la dame approuchier. 	883
1069	Quant il voit	QUant hector uit 	884
1070|1071	que par mi els l’en covient a passer, |si embrace l’escu et le gete sus sa teste 	que par eulx le conuenoit passer il embrasse son escu 	885
1072	et trait l’espee, 	et trait lespee 	886
1073	puis s’en torne vers les fions 	puis ua uers les lyons 	887
1074	qui faisoient ta plus male fin del monde, 	qui faisoient la plus male fin du monde: 	888
1075|1076	kar il esgratinoient la terre a lor ongles |et se debatoient de lor coes.	et se batoieent de leurs queues pour enlx plus courroucer: 	889
1077	Et il s’adrece a celui 	car telle est la constume du lyon. Hector se tourne uers celui 	890
