0	avoir trové	auoir troue	0
1	Si li conte tote s’aventure issi com vos avés oi dire ça arrieres	Si li conte tote sauenture ainsi com li contes la retraite	1
2	tant qu’il conoist bien	Tant que il quenoit bien	2
3	que c’est il qu’ele quiert a	que cest ele|que il le quiert	3|4
4	Mais por le coros de la mort al seneschal ne se volt fere conoistre	mais por le corrous quil auoit de la mort au seneschal: ne se wet faire quenoistre a li	5
5	ains li respont Certes	si li dit	6
6|7	damoisele|chevalier	Certes damoisele	7
8	qui porte escu blanc ne conois je nul	qui port escu blanc ne sai ie nul	8
9	— En non Dieu		
10	sire		
11|12	fet ele|ce poise moi chierement	En no dieu fait ele de ce me poise il trop durement	9
13	Et il n’en tient plus a li parole	et il ne tient plus a li parole	10
14	ains part	Ains sen part	11
15	si tost com il l’ot commandee a Dieu a	si tost comme il lot comandee a dieu	12
16	et chevalche en tel maniere jusqu’a tierce tant qu’il vint a l’issue de la forest;	et cheuauche en tel maniere|tant quil uient a lissue de la forest	13|14
17	et il torne a destre vers un chemin viés	et il torne a destre uers le chemin uiee	15
18	et ancien;	et acien	16
19	si ne demora gueres qu’il vint a une eve P lee	Si ne demora gaires quil uient a une eue lee	17
20	et parfonde	et parfonde	18
21	mais il n’i trueve pont ne gué ne passage nul	mais il ni trueue ne pont ne gue ne passaige nul	19
22	Et il regarde d’autre part de l’eve	et lors regarde il dautre part de leue	20
23	si voit I	Si uoit|i	21|22
24	petit chastel molt bien seant	petit chastelet mout bien feant	23
25|26	clos de mur bateillié tot entor a la roonde|ll regarde grant piece le chastel	qui estoit clos de murs batilliez de toutes pars enuiron a la roonde Il esgarde Longuement le chastel	24
27	dont la façons li plest molt a regarder	dont Ia fasons li plait mout a esgarder	25
28	puis s’en torne contreval la riviere por savoir s’il i peust trover ne pont ne gué	et puis sen torne tot contreual la riuere|Por sauoir se il i troueroit ne pont ne gue	26|27
29	mais il n’en trueve point	mais il nen i trurue point :	28
30|31	et quant il voit qu’il n’i passera|si ne set	si ne sot	29
32	que fere	que faire	30
33|34	que retorner ne voldroit il mie|Atant voit issir del chastel une damoisele	car retorner ne wet il mie atant uoit issir une damoisele dou chastel	31
35	qui ert tote nue en sa chemise	qui estoit tote nue en sa chemisse	32
		si la menoient	33
36	si le menoient troi vilain molt vilainement a	iiii|tre ribaus mout uilment	34|35
37	et tenoit chescuns une hache en sa main;	et tenoit chascuns une hache en sa main	36
38	et ele crioit quanque ele pooit crier por els	et ele crioit quantque le pooit crier|por ciax	37|38
39	qui li faisoient tel honte	qui li fasoient tele honte	39
40	et tel laidure qu’il la venoient batant tot contreval la riviere	et tel laidure|que il la menoient batant tout contrtual la riuiere t	40|41
41	Et quant la damoisele vit le chevalier de l’autre part de ! l’eve	quant la damoisele uoit le cheualier dautre part la riuiere	42
42	si commence a crier Ha	si li comance a crier	43
43|44	gentilz chevaliers|secorés ceste damoisele	ha: gentis cheualiers secores ceste damoisele	44
45	que cist ribaut vuelent ocirre	que ciz ribaut wellet ocire	45
46	Ha		
47	frans hom		
48|49	ne m’i laissiés morir|se vos onques eustes pitié de nule gentil damoisele	ha; frans hons ne mi laissiez morir se uos eutes onques pitie de franche damosele	46
50	Quant Boors ot ce qu’ele li prie	quant boh̾|oit cele	47|48
51	si pitousement qu'il la secore	que si piteusement lapele	49
52	si ne set	et li prie quil la sekeure|Sire set	50|51
53	que fere	que faire	52
54	kar volentiers li aidast s’il peust;	car uolentiers li alait aidier se il poist	53
55	mais il voit l’eve noire	Mais il uoit leue	54
56	et parfonde	si parfonde	55
57	et si perilluse qu’il cuide bien noier	et si perilleuse|que il cuide bien perir se il se met dedans	56|57
58	s’il se met dedens;		
59	et d'autre part il voit cele	et dautre part il uoit cele	58
60	qui si durement crie merci;	qui si docemet li prie nc|ci	59|60
61	si l'em prent tels pitiés qu’il en laisse totes poors	Si len prent tes pitiez quil en laisse totes paours	61
62	et fet le signe de la crois en mi son vis	Si fait le signe de la crois enmi son uis	62
63	puis enbrace l’escu	puis enbrace lescu	63
64	et broche le cheval des esperons	et broche le cheual des esperons	64
65	et se fiert en l’eve	et se fiert en leue tot errantment	65
66	Et li chevals fu fors	Et li cheuaus fu fors	66
67	si commence a noer	si comance a noer	67
68	si tost com il ot terre perdue	si tost com il ot terre perdue	68
69|70	si l’enporte d’autre part de la rive a quelque paine|mais ançois ot beu de l’eve li uns	si lenporte dautͤ part la riue a quelque painne	69
71	et li autre		
72	et se li chevals ne fust		
73	si buens		
74	noié fuissent ambedui		
75	kar li chevaliers estoit pesans por les armes qu’il avoit vestues		
76	Quant il fu de l’autre part de l’eve		
77|78	si ne descendi pas|ains cort vers cels	Si ne descendi pas ains cort uers ciax	70
79	qui la damoisele tenoient	qui la damoisele renoient	71
80|81	et fiert|si le premier qu’il aconsieut qu’il li met le glaive par mi le cors	que il consieut quil li met le glaiue parmi le cors	72
82	si l’abat a terre	si labat mort aterre	73
83|84	et li autre s’enfuient erraument|por ce que desarmé estoient	et li autre sen fuient porre qu il estoient desarme	74
85	Et la damoisele	et la damaisele	75
86|87	qui delivree se voit se met a genols devant Boort|et dist Ha	qui deliuree ce uoit se met a genous deuant boh̾ ha gentis cheualiers fait ele beneois soiez uos de dieu	76
88	gentils chevaliers		
89	de Dieu soiés vos beneois		
90	quant vos m’avés de mort rescosse	quant uos mauez de mort rescoce	77
91	et aorés en soit Diex	et aoures soit diex	78
92	quant il ceste part vos amena	quant ils amena ceste part	79
93	kar cist gloton m’euissent ja morte	Car cil gloton meussent ia morte ce uos ne fussiez	80
94|95	— Damoisele|fet il	Damoisele fait il porcoi	81
96	por quoi		
97|98	— Sire fet ele|jel vos dirai bien	Sire fait ele ie le uos dirai bien	82
99|100	mais que vos m’aiés mise a sauveté|— Coment	mais que uos maiez misse a Sauuete	83
101|102	fet il|Avés vos	Coument fait il auez uos	84
103	dont garde	dont garde	85
104	— Certes		
105|106	fet ele|ja asseur ne seraî fant com je sache laiens le seignor del chastel	Certes sire faic ele ia a seur ne sera tant com ie saiche laiens le signeur de cest chastel	86
107	kar c’est li plus fel chevaliers del monde	Car cest li plus fel cheualiers dou monde	87
108	et li plus traîtres	et li plus traites	88
109|110	A ces paroles voient issir I|chevalier del chastel	a ces paroles uoit issir un cheualier del chastel	89
111	et la ou il vit Boort	et la ou il uoit behort	90
112	si li escrie Laissiés	si li est terre	91
113|114	dans chevaliers|la damoisele	Laissiez dans cheualiers la damoisele	92
115	que vos n’enmenrois mie! Par mon chief	que uos nen meneroie|et par mon chief mar la rescousites	93|94
116|117	mar le rescosistes|Si li cort quanqu’il puet le glaive alongié;	Si li acort quanquil puet le glaiue alongnre	95
118	et Boors retrait son glaîve a lui del cors a celui qu’il avoit ocis;	et behors retrait son glaiue del cors au ribaut|que il auoit ocis	96|97
119	si laisse le cheval corre	Si li laisse le cheual	98
120	et le fiert	et le fiert	99
121	si tres durement qu’il l’abat a terre	si durement quil labat a terre	100
122	si estordi qu’il n’a pooir de relever	si estordi|que cil na pooir de releuer	101|102
123	ains gist pasmés	Ains fu pasmes	103
124	kar il chai	Car il fu cheus	104
125|126	si felenessement qu’a poi|que la canole del col n'avoit brisee	si uilainnement qua pou quil not la chenole dou col bͥsie	105
127	Et Boors li vet a cheval par desus le cors	et behors li ua a cheual par desus le cors	106
128	tant que tot le debrise	tant que tout le debrisse	107
129	Et lors est la damoisele	et lors est la damoisele	108
130	si liee qu’ele ne puet plus	si lie|que ele ne puet plus	109|110
131	et dist a Boort Sire	et dit a beh̾|Sire fait ele nous nauons	111|112
132	nos n’avons mes garde	mais garde ce cuige	113
133	kar je ne cuit qu’il eust plus de chevaliers çaiens	Car ie ne cuit quil ait|mais cheualier laiens plus	114|115
134	que cestui;	que cestui	116
135	si vos dirai ore seurement ce	Si uus dirai ore seurement ce	117
136	que vos me demandastes n’a encor gaires	que uos me demandates na gaires	118
137	— Dites	Dites	119
138|139	fet il|— Sire	dont damoisele fait il	120
140|141	fet ele|entre moi	SIre fait ele par foi entre moi	121
142	et I	et|i	122|123
143	chevalier	cheualier	124
144	qui mes amis estoit chevalchions hui matin par mi cest chastel	qui mes amis estoit|cheuauchiens hui matin parmi cest chastelet illuec	125|126
145	et quant li freres a celui	et quant li freres a celui	127
146	que vos avés abatu me vit	que uos aues ore abatu: me uit	128
147	si me volt a force prendre	Si me uot a force prandre	129
148	kar il m’avoit molt longuement amee;	Car il mauoit mout longuement amee	130
149	si me prist al frain	Si me prist	131
150	et m’en volt mener a force	et me uost mener a force	132
		si tost comme il me tint au fraing	133
151	mes mes amis se combati a lui tant qu’il l’ocist	Mais mes amis se combati a lui|tant que il locit	134|135
152	Et quant cist	et quant ciz	136
153	que vos veez ci ore vit son frere mort	que uos ueez ore ci uit son frere mort :	137
154	si fist mon ami prendre a force de vilains	si fist mon ami prandre a force de uilains	138
155	et de gens	et de gent	139
156	et l’ocist en venjance de son frere	Et locit en la uangence de son frere	140
157	Mais de moi		
158|159	por cui Ses freres avoit esté ocis|dist il qu’il se vengeroit sans main metre;	mais de moi p̾ cui ses freres auoit este ocis dist il quil sen uangeroit sans main mestre	141
160	si me fist prendre a ces ribaus	Si me fist prandre a ses|iiii	142|143
		uilains	144
161	que vos veistes	que uos ueistes	145
162|163	et lor commanda qu’il me noiaissent|kar par armes	si lor coumanda quil me noiassent	146
164|165	dist il|ne vueil je mie qu’ele muire ;	Car par hommes ne uoeil ge gaie fait il quele morit	147
166|167	si m'enmenoient|si com vos veistes	Si [cum] amenerent ainsi com uos ueistes [raqrir]	148
168|169	morir|quant vos me venistes secorre par la volenté de Dieu	quant uos me [uenistes] secorre par la uolente de dieu	149
170	et par la vostre	et la uostre	150
		Sire fait la damoisele a beħ	151
171	Or vos ai conté mon errement ;	Or uous ai conte mon errement	152
172|173	si voldroie des Ore mes|se vostre plaisirs estoit	Si uorroie desormais se uostres [puisses] estoit :	153
174	que vos me menissois a salveté en un mien chastel	que uos me menissiez a sauuete en|i	154|155
		mien chastel	156
175	qui est ci pres	qui est ci pres	157
176|177	— Volentiers|fet il	uolentiers damoisele Sire a	158
178	Si le prent par les bras	si la prent par le bras	159
179	et le monte par devant lui sor le col de son cheval	et la mest deuant lui sur le col de son cheual	160
180	si a geté son escu derieres son dos	Si ageste erranmet son escu derier son dos	161
181	si s’en vet cele part ou la damoisele li enseigne	Si sen ua cele part ou la damoisele li ensangne|Si cheuaucherent ainsi	162|163
182	tant que ce vint aprés midi qu’il voient en un tertre I	tant que ce uint apres midi|et lors uirent deuant aux en lor chemin	164|165
		i	166
		tertre	167
		Ou il auoit	168
183	bel a chastel	i|tres bel chastel	169|170
184	et lors ataignent Il	et lors ataignent|ii	171|172
185	escuiers	escuiers	173
186	qui issoient d’un bossel	qui issoient dun boschet	174
187	et aportoit chescuns venoisons trosee detriers soi	et aportoit chascuns uenison trossee douant soi	175
188	Quant il virent la damoisele	et quant il uirent la damoisele	176
		qui beh̾ auoit deuant luy	177
189	si descendent a pié	si sont dessendu a pie	178
190	et li font grant joie com a celi	et li font la plus grant ioie dou monde a cele	179
191	qui lor dame estoit	qui leur lige dame estoit	180
192	mais molt se merveillent de ce qu’il la virent plorer:	Mais mout se merueillent|quant il la uirent	181|182
193	si li enquierent	si plorer|et plus de son ami	183|184
		que il ne uerent pas mandent	185
194	que ele a	que ele a	186
195	Et ele lor dit	et ele lor dit	187
		et conte coment ueuir auecques li	188
		Si li en quierent	189
196	comment ses amis avoit esté ocis	et de ses amis auoit este ocis|au chastel ou il trespasoient	190|191
197|198	et je meismes euisse esté morte|se ne fust cis frans chevaliers	Sire meismes fait ele eusse este morte : Ce ne fust ciz frans cheualiers ci	192
199	qui par sa debonaireté me resqueust	qui par sa debonairete|et par sa franchisse marescosse des mains a mes anemis	193|194
200	et se mist em peril de mort por ma vie sauver	et se mist en peril de mort por moi sauuer	195
		et se ne lauoie ie pas deserui	196
		et diex doint	197
201	Et lors conseille a l’un de ses escuierset cil se destrosse maintenant de sa venoison	que ie li puisse guerredoner|Lors conseille maintenant la damoisele a	198|199
202	si la baille a son compaignon por porter	i|des escuiers	200|201
		et il destrore maintenant sa uenisson	202
203	si s’en vet vers le chastel quanqu’il puet traire del roncin	et la baille a lautre por portee|Si sen ua uers le chastel quanque il puet de roncin traire	203|204
204	Et Boors demande a la damoisele	et behors demande a la damoisele	205
205	comment li chastials a non ou ses amis a esté ocis	comment li chastiax auoit non ou ses amis	206
206	Sire	auoit este ocis	207
207|208	fet ele|il a non Galedon	Sire fait ele il a non Galedon	208
209	et l’eve par ou vos passastes a non Galede	et leue par ou uos pasates a non banllete	209
210	Ensi parolent tant qu’il sont venu jusqu’al chastel	Ainsi parole|tant que il sont uenu ducau chastel	210|211
211	si le voit Boors bien seant	Sire uoit beh̾ mout bel	212
212	et fort	et mout bien sains	213
213	Et quant il montent ! le tertre	et quant il ont monte le tertre	214
214	si voient de laiens issir dames	si uoient issir de laiens dames	215
215	et damoiseles a grant plenté	et damoiseles grant plante	216
216	dont les unes karolent	dont les unes dancent	217
217	et les autres dancent	et les autre [|]	218|219
218	et les autres joent de divers geus;	et [lulent]|et les autre iouent de diuers gex	220|221
219	si estoient acesmees	si estoient totes acemees	222
220	et vestues richement	et mout richement uestues	223
221	et avec venoient chevaliers jusqu’a X	et auec elles uenoient cheualier iusqua|xx	224|225
222	qui molt faisoient grant joie;	qui mout fassoient grant ioe	226
223	et quant il voient Boort	et quant il uoient bohort	227
224|225	si crient tuit encontre lui Bien viengniés|sire	si crient tuit encontre lui bien uiengne li sires	228
226	qui nostre dame avez delivres de mort	qui nostre dame a deliuree de mort	229
227	et rescosse des mains a ses enemis	et rescousse des mains a ses anemis	230
228	Et lors font descendre lor dame	et lors font dessendre lor dame	231
229	et lui avec :	et lui auec	232
230	si ne vos porroit nus conter la joie	Si ne uos porroit nus comper la ioie	233
231	qui li fu fete	qui li fu faite	234
232	A tel joie	A tel ioie	235
233	et a tel feste enmainent Boort jusqu’al palés del chastel	et a tal faite en mainnent beh̾|ducau palais dou chastel	236|237
234|235	si le font desarmer|ou il volsist ou non	Si le font desarmer uossist ou non	238
236	et il le fist a envis	et il le fait mout enuiz	239
237	kar il n’estoit encore mie tens de herbergier	Car il nestoit mie eure ne tans de herbregier	240
238	Ensi remist Boors laiens	ensi remest laiens	241
239	si li firent grant joie li un	si li firont grant ioie|et li un	242|243
240	et li autre	et li autre	244
241|242	Et quant il orent mengié|a damoisele demande a Boort	Et quant il orrent mengie: la damoisele demande	245
243|244	comment il avoit non ét ¡l dist qu’il avoit non Boors li Essilliés|Et vos	comment il auoit non	246
245|246	fet il|damoisele	etil li dit	247
247	quels est li vostre nons		
248	— Sire		
249	fet ele	et uos	248
250|251	je ai non Blevine de Glocedun|issi a non cist chastials ou nos somes	comment fait il damoisele Sire fait ele iai non uenyne de glocedras ainsis a non li chastias ou nos somes A ses paroles	249
252	A ces paroles qu’il disoient	que il dissoient euousa	250
253	es vos I escuier	escuer	251
254	qui laiens entre	qui laiens entre	252
255|256	si s’agenoille devant la damoisele|Dame	et sa genoille deuant la damoisele	253
257|258	fet il|la damoisele de Honguefort vostre cosine vos salue	Dame fait il madarne la damoisele De honguefort uostre cousine uous salue	254
259	et vos mande qu’ele vient herbergier o vos	Et uous mande|que ele uient herbregrer o uus	255|256
260	Et quant cele l’entent	Et quant cele lentant	257
261	si saut sus	si saut sus	258
262	si liee	si lie	259
263|264	et si joiose|que nule plus	et si ioeuse com ele puet plus	260
265	et demande al vaslet ou ele est	et demande au uarlet ou ele est	261
266	Dame		
267|268	fet il|a mains de demie lieue pres de ci	Dame fait il a mains de demi lieu pres de ci	262
269	Et ele fet maintenant sa sele metre	et ele fait maintenant sa sele mestre	263
270	et dist qu’ele ira encontre li;	et dit|que ele ira encomtre	264|265
271	si monte	Si monte	266
272	et maine o li	et mainna	267
273|274	VI|chevaliers	ui cheualiers auecques li	268
275	et Illl	et|iiii	269|270
276	en laisse por fere compaignie a Boort ;	en laisse por faire compangnie a behͦ	271
277	si se part atant de laiens	si se part de laiens|entre li	272|273
278	Mes Boors	et sec cheualiers|Mais beh̾	274|275
279|280	qui les noveles a of̈es de cele de Honguefort|si ne set	qui les noueles ot oiez de cele de honguefort ne set	276
281	que fere	que faire	277
282|283	kar se il remaint laiens|ne puet estre	Car cil remaint laiens il ne puet estre	278
284	que l’en nel conoisse	que len ne le quenoisse	279
285	et ce ne voldroit il por rien:	et si ne uodroit ce por rien	280
286|287	si pense longuement a ceste chose|Quant il ot une piece pensé	Si se pance longuement ace	281
288	si se drece en estant	et se dresce en estant a ce	282
289	et demande ses armes tost	et demande ses armes|tost	283|284
290	et isnel	et inel	285
291|292	Sire|font cil	Sire font cil	286
293|294	qui avec lui estoient|qu’en volés vos fere	qui auec lui estoient quen uoles uos faire	287
295|296	— Je me vueil|fet il	Ie men ueil fait il aler	288
297	un poi aler esbatre jusqu’a cel boschel	i pou esbare iusqua cele forest	289
298	si revendrai orendroit	et reuandrai orendroit	290
		et cil	291
299|300	Cil n’osent son commandement refuser|si aportent ses armes	qui nosent son commandement escondire Li aportent	292
301	et il les prent	et il les prant	293
302	Et quant il est armés	et quant il est armes	294
303	si monte en son cheval a	si se part de laiens par la poterne par deuers|i	295|296
304	si se part de laiens par une posterne par devers le boschel	bochet	297
305	ne ne velt	si ne uoet	298
306	que nus li face compaignie	que nus li face compongnie	299
		et	300
307|308	Et quant il est l|poi eslongiés del chastel	quant il est i po eslongniez dou chastel	301
309	si torne a destre vers une forest qu’il voit haute	si torne a destre par deuers une forest haute	302
310	et espesse	et espesce	303
311	et s’en vet al ferir des esperons;	et sen ua au ferir des esperons	304
312	si se fiert en la forest	Si se fiert en la forest	305
313	et eirre tant qu’il li anuite ;	et erre tantquil li anuitie	306
314	et lors escote	et lors escoute	307
315	si ot une cloche soner	si oit une cloche soner	308
316	et il sot bien tantost	et il seit bien	309
317	que c’estoit hermitages:	que cest hermitages	310
318	si s’en torne cele part	si se torne cele part	311
319	et descent a l’uis	et descent a luis	312
320	si apele	et apele	313
321	et li hermites li oevre son huis	et li ermites li ouure	314
322	si a le reçoit a bele chiere	et le resoit a mout bele chiere	315
323	et le desarme il meismes	et le desarme il meismes	316
324	puis vet cueillir de l’erbe al cheval	et puis ua cuillir de lerbe il meismes por le cheual	317
325|326	et por fere lit al chevalier|Ensi est Boors remés chiés l’ermite	et por faire lit au cheualier Ainsi est boh̾ retrais chies lermite	318
		et la damoisele de glocdon cheuauche	319
327	et la damoisele de Glocedun chevalcha tant a qu’ele encontra cele de Honguefort;	quant ele fu partie de son chastel|tant que ele encontre la damoiselle de honguefort	320|321
328	si s’entresaluent	si sentre saluent	322
329	mais molt se merveille cele de Glocedun	mais mout ce merueille la damoisele de glocedun	323
330	quant ele voit sa cosine	quant ele voit sa cosine	324
331	si atornee	si atornee	325
332	et tote sa maisnie:	et tote sa mainiee ausi	326
333	si li demande l’acheison	Si li a demande lacoison	327
334	et cele li conte de chief en chief	et cele len conte la uerite de chief en chief	328
335	et dist	et dit	329
336	que jamés ne finera d’errer jusqu’el ait le chevalier trové	que iamais ne finera derrer|tant que ele ait le cheualier troue	330|331
337|338	et bien sachiés|fet ele	et bien sachiez bele cosine	332
339	bele cosine		
340	que c’est li plus bials chevaliers	que cest li muxdres cheualiers	333
341|342	et li mieldres|que je onques mes veisse	et li plus biax dou monde	334
343	et si est encore jovenes enfés;	et si est encore iones enfes	335
344	si ai tel duel	Si ai tel duel	336
345|346	quant il me membre de la vilenie|que je fis	quant ie mamenbre de la uilenie	337
347|348	qu’a poi|que li cuers ne me part el ventre	que ie li fis: ca pou Li cuers ne me part	338
349	— En non Dieu		
350|351	bele cosine|fet cele de Glocedun	En non dieu bele cosine fait cele de glocedun	339
352|353	s’il vos avint bele aventure|il ne m’est pas hui avenue mains bele	Si uos auint bele auanture: il ne mest pas hui auenue mains bele	340
354	Si li conte tot ensi com il li estoit avenu	Si li conte coument il li est auenu	341
355	et dist qu’ele a le chevalier herbergié	et dit|que ele a le cheualier herbregre	342|343
356	mais bien sachiés	et bien sachiez	344
357|358	fet ele|que c’est li plus bials chevaliers	que cest li plus biax cheualiers	345
359	que je onques mes veisse	que ie onques ueisse	346
360	et jovenes durement ;	et iosnes durement	347
361	si li devise sa façon	Si li deuisse sa fason	348
362	et son grant	et son grant	349
363	et sa mesure tant qu’a cele de Honguefort est avis	et sa mesure|Tant que a cele de honguefort est auis	350|351
364	que c’est cil qu’ele quiert	que ce est cil|que ele quiert	352|353
365	si li tarde molt qu’ele le voie	si li tarde mout quele le uoie	354
366	Ensi chevalchent jusqu’al chastel	ainsi cheuauchent|tant que au chastel sont uenues	355|356
367	si descendent la damoisele molt honorement	Si dessandent la damoisele de honguesfort mout honorablement	357
368	et molt font grant joie de li	et mout font grant ioie de li	358
369	Et lors sont montees el palés;	et lors sont montees el palais amont	359
370|371	si demande cele de laiens ou ses ostes est|Par foi	Si demande cele de laiens ou ses ostes est	360
372	font		
373|374	si chevalier|¡l s’en vet orrendroit tos armés fors de cest chastel	par foi font cil cheualier il sen ua maintenant tous armes fors de cest chastel	361
375|376	mais il nos dist qu’il revendroit tantost; n’onques por nul pooir ne volt soffrir|que nus de nos alast avec lui	mais il nous dit	362
377	—		
378|379	Quel part s’en ala il|fet ele	que il reuanroit tantost	363
380	— Dame	ne onques por nul pooir ne uost souffrir	364
381|382	font il|vers cel boschel	que nus alast auec lui	365
383|384	— Or tost|fet ele	que part sen ua il fait ele Dame font il uers cest bochet	366
385|386	montés|alés aprés lui	Or tost montes illec apres	367
387	si le nos ramenés	si le nous ramenez	368
388	Lors sont monté li X	Loes sont monte|x	369|370
389	chevalier	cheualier	371
390	et vienent jusqu’al boschel	et uiennent iuscau bochet	372
391	si le cerchent amont	si le serchent amont	373
392	et aval	et aual	374
393|394	mes del chevalier ne pueent riens trover|si en sont molt irié	mais del cheualier ne pueent point trouer	375
395	et dolent		
396|397	et mandent a lor dame qu’il ne le pueent trover|En non Dieu	En non dieu fait ele ainsi ne remandra il pas	376
398	fet ele	si mente ele	377
399	ensi ne remandra il pas		
400|401	Si monte|et tote sa maisnie	et coure sa mainie	378
402	et commande a cerchier le bois de totes pars	et comande a cenhier le bois de toutes pars	379
403	et il en font son commandement	Et il font son commandement	380
404	Mais tot ce ne lor valt riens	Mais tout ce ne lor uaut rien	381
405	kar il n'em puent avoir nul asenement a	Car il ne pueent trouer nul a lanement dou monde	382
406	Quant ele vit ce	quant ele uoit ce:	383
407|408	si s’en retorne en son chastel dolente|et corociee	si en retorne en son chastels	384
409	et conte a cele de Honguefort	et conte a cele de honguefort	385
410	comment ses ostes s’en estoit alez	comment ses ost en est alez	386
411	puis demande a cels de laiens Bials seignors	et puis demande a ciax de laiens oiez signor	387
412	quant s’em parti il — Par foi	quant sen ala il	388
413|414	dame|font il	Par foi dame	389
415	si tost com il vos en vit aler	si tost com il uous en uit aler	390
416|417	et dist qu’il revendroit tost|— Par foi	et dit quil reuandroit tost par foi signor gabe nos A	391
418	fet ele		
419|420	gabez nos a|Lors demanda cele de Honguefort quels armes il portoit	Et lors demanda cele de honguefort ques armes il a	392
421	et ele li devise	et cele li deuise	393
422	En non Dieu		
423|424	fet ele|je te trovai hui matin a l’entree d’une forest	En non dieu fait Se ioe lencontrai hui matin a lantree dune forest	394
425	mes il ne portoit mie tel escu com cil	mais il ne portoit mie tel escu	395
