0	avoir trové	auoir troue	0
426|427	que je quier|— Bele cosine	comme cil	396
428|429	fet cele de laiens|il le puet bien avoir changié	que ie quier bele cousine fait cele de Iaiens il le puet bien auoir changie	397
430	et je vos di al mien cuidier	puis et ie uos di au mien cuidier	398
431	que ce est cil	que cest ciz	399
432	que vos querez :	que uus querez	400
433	si vos prie	Si uous pri	401
434	que vos me laissiés o vos aler	que uous me laissiez a uos Aler	402
435	tant que trové l’aions	tant que troue laions	403
436	et lors savrai l’acheison por quoi il laissa mon ostel a tel ore	et lors saurai locoson por coi il a laisier mon ostel a tel eure	404
437|438	— Il m’est molt bel|fet cele de Honguefort	il met mout bel fait cele de hongefort	405
439	que vos i viegniés	que uous i uangnerez de	406
440	puis qu’il vos plest	que il uos plait	407
441	Ensi remistrent la nuit laiens	Ainsi remesent laiens la nuit	408
442	et al matin	et au matin	409
443|444	si tost com eles ! virent le jor|si leverent	si tost comme eles uirent le ior: se leuerent	410
445	et se partirent del chastel	et se partirent del chastel	411
446	et entrerent en la queste de lor chevalier	Si entrent en la quese de lor cheualier	412
447	Mais or laisse atant li contes a parler d’eles	mais or laisse li contes a parler atant deles	413
448	et de Boort	et de behort	414
449	et retorne a parler de Lancelot la ou il est entrez en la forest de Sarpenic	et retorne a parler de lancͣ|la ou il est entrer en la forest de sarpenic GRant chaut cedit li contes fist le ior	415|416
450|451	si com li contes a devise ariers|Or dist li contes qu’il fist grant chaut le jor	que lanc̃	417
452	que Lancelos entra en la forest de Sarpenic	entra en la foret de sarpenic	418
453	et por ce ne remest il mie qu’il ne chevalchast jusqu’à none;	et por ce ne remest il pas|que lanc̃ ne cheuanchast iusques a none	419|420
454	si li avint ensi qu’il n’encontra home ne feme jusqu’al vespre;	Si auint quil nancontra home ne fame iuscau uespre	421
455	mais lors sans faille	mais lors sans faille	422
456	si com il dut issir de forest	Si comme il dut issir de la forest	423
457	qui tot le jor li ot duré	qui tote ior li ot dure	424
458	encontra une damoisele	Si encontra une damoisele	425
459	qui molt faisoit grant duel	qui mout faissoit grant duel	426
460	et chevalchoit I	et cheuauchoit|i	427|428
461	palefroi noir a molt riehe lorain	palefroi noir a mout riche lomin	429
462	et a molt cointe sele de l'oevre d’Engleterre	et a mout riche cele de lueure dangeterre	430
463	Il salue la damoisele	Il salue la damoisele	431
464	et ele lui	et ele autresi lui	432
465|466	Damoisele|fet il	Damoisele fait lanc̃	433
467|468	kar me dites|s’il vos plest	car me dites ore ce il uos plait	434
469	por quoi vos plorés		
470	— Certes		
471|472	sire|fet ele	que uos auez	435
473|474	se je i' cuidoie avoir preu|je le vos diroie	et por coi uus plorez	436
475|476	— Damage|fet il	Certes sire fait ele se ie i cuidoie auoir preu ie le uos diroie	437
477|478	ll’i avrez vos ja|se Dieu plest	Damage fait il ni aurez uos ia se dieu plait	438
479	mais dites le moi par covent que	Mais dites le moi par couant	439
480|481	se je vos|puis aidier a vos esleecier	que ie uos en aiderai a eslaicier	440
482	je vos aiderai a mon pooir	a mon paoir ce ie uos en|puis aidier	441|442
483|484	— En non Dieu|sire	En non dieu sire fait ele	443
485|486	fet ele|donc le vos dirai je	dont ie uos dirai ge	444
487	ll est voirs	Il est uoirs	445
488|489	que Meleagans|li fiz al roi Baldemagu	que meleagant li fiz le roi bademagu ala oan a la cort le roi artu	446
490|491	ala a la cort le roi Artu por la roine Genievre conquerre|s’il peust;	Por la roine reconquerre ce il peust	447
492	et endementiers fist tant une damoisele	et andementiers fist tant une damoisele	448
493	qui estoit	qui estoit suers meleagan:	449
494|495	sa suer qu’ele geta Lancelot d’une tor ou Meleagans l’avoit mis en prison|ne sai por quoi	que ele ieta lanc̃ dune tor ou meleagans lauoit mis en prison	450
496|497	Quant ele l’ot delivré|si le tint avec li tant qu’il fu garis	et puis lenuoia a la cort le roi artu ou il ocit	451
498|499	kar molt avoit eu mesaise en la prison|et puis l’envoia a la cort le roi Artu ou il ocist Meleagan	mel̾	452
500	ce savons nos or bien	ci sauons nos ore bien	453
501	Mais si tost com li parent sorent qu’ele avoit Lancelot osté de la prison	mais si tost com cil parent sorrent|que ele auoit iete lanc̾ de prison;	454|455
		si dirrent	456
502	si distrent qu’ele l’avoit fait por Meleagan ocirre;	que ele lauoit fait por mes|ocirre	457|458
503	si le pristrent a force	Si la prissent a force	459
504	et l’acheisonerent de sa mort	et locoisonent de sa mort	460
505	et distrent que	et dirent	461
506|507	s’ele ne trovoit|qui l’en desfendist	que cele ne trouoit	462
508|509	qu'il feroient de lui justice|si grant com l’en doit fere de cele	qui la desfandit quil feroient de li iustice tele com len deuoit faire de fame	463
510	qui son frere ocist	qui son frere ocist	464
511	Et ele dist qu’ele troveroit bien	et ele dist|que le troueroit bien	465|466
512	qui la desfendroit:	qui la desfanderoit	467
513	si mist jor d’amener I	Si mist ior damener|i	468|469
514	chevalier por li desfendre	cheualier por li desfandre	470
515	si s’est	Si cest	471
516	puis porchaciee en Pluisors liex	puis porchacie en plusors lieus	472
517	mais onques ne trova chevalier	mais onques ne troua cheualier	473
518	qui ses armes en osast prendre contre celui	qui ses armes en ossast prandre encontre celui	474
519	qui apelee l’avoit	qui apelee len auoit	475
520	Or	Or	476
521	si est tant la chose alee	si est tant la chose alee	477
522	que li jors est aterminés a hui ;	que li iors fu A termines a hui	478
523	si n’a trové la pucele nul desfendeor	Si ne trueue la pucele nul desfandeor	479
524	et por ce dient li un	et por ce dient|et li un	480|481
525	et li autre qu’ele est atainte del meffet	et li autre|que ele est atainte dou meffait :	482|483
526|527	que l’en li met sus :|si l’ont jugiee	que len li met sus	484
528|529	ce m’est vis|a ardoir le matin	Si lont iugie ce mest uis le matin a ardoir	485
530|531	et por ce qu’il m’en membroit|or em ploroie je	et por ce quil men menbroit ore ploroie ge	486
532	si durement	si durement	487
533	kar certes ele estoit une des plus cortoises damoiseles ! del monde	Car certes ele est une des plus cortoises damoileles dou monde	488
534	et une des plus vaillans	et une des plus uaillans	489
535|536	— Or me dites|damoisele	Or me dites damoisele fait lanc̃	490
537|538	fet Lancelos|et s’ele trovoit demain	se le trouoit	491
539	qui la deffendist	qui la desfendist	492
540	dont ne seroit ele quite del jugement	dont ne seroit ele quite del iugement	493
541	que l’en a fet	que len li a fait	494
542	— Sire		
543|544	fet ele|je ne sai	sire fait ele ie ne sai	495
545	—		
546	Et est ce		
547|548	fet il|gaires loing	et esse fai il gaires long	496
549|550	que ele est|— Sire	sire il ni a	497
551|552	fet ele|il n’i a que	que	498
553	VI	ui	499
554	lieues englesches	lieues englesches	500
555|556	Se vos leviés demain matin|vos i seriés ains prime	se uous leuiez demain matin uus i seriez ains tierce	501
557|558	— Ou le porrai je|fet il	Ou la porroie ge fait il trouer	502
559	trover		
560	— Al chastel a		
561|562	fet ele|de Floego	Au chastel fait ele de floego	503
563|564	et cis chemins vos i menra droit|se vos le volés tenir	et ciz chemins uos i merroit se uos le uoliez tenir	504
565|566	— Or vos commant a Dieu|damoisele	Or uos comant a dieu damoisele fait il	505
567|568	fet il|Si s’em part atant	si sen part	506
569	et cele s’en vet faisant son duel	et sele sen ua faisant son duel	507
570	Et il chevalche tant qu’il vint fors de la forest	et il cheuauche tant quil uient fors de la forest	508
571	si vit devant lui une maison de religion	Si uoit deuant lui une maison de religion	509
572	et il torne cele part por herbergier	et il torne cele part por herbreger	510
573	Et quant il i vint	et quant il i est uenus	511
574|575	si trueve a la porte IlII|des freres	si trueue a la porte iiii freres	512
576	qui ja avoient chanté complie	qui ia auoient chantee complie	513
577|578	et estoient venu hors|al serain;	et estoient uenu au serain	514
579	si saillent encontre lui por fere descendre	Si saillent encontre lui por liu dessandre	515
580	et dient	Oroient	516
581	que bien soit il venus;	que bien soit il uenus	517
582	si le font entrer laiens	sire font entrer laiens	518
583	et li demandent s’il a mengié	et li demandent cil a mengue	519
584	et il dist	et il dit	520
585	que nenil	que nennil	521
586	et il font erraument mettre la table	et il font erraumet mestre la la table	522
587	mais il dist qu’il ne mengera devant qu’il ait esté al mostier	mais il dit quil ne mangera deuant quil ait este en mostier	523
588	lar il n’i entra hui	Car il ni entra encor hui	524
589|590	Lors entre en l’eglise|por orer	Lors entre lanceloz en lesglise por orer	525
591	et en ce qu’il se fu agenoilliés	et en ce quil se fu agenoilliez	526
592	si regarde a destre	si garde a destre	527
593	et voit unes prones d’argent trop richement fetes a floretes d’or	si uoit unes prones de fer dargent trop richemet faites|et florestes dor	528|529
594	et a oisials	et a oisiax	530
595	et a bestes	et a bestes	531
596|597	et dedens avoit V|chevaliers armés	et dedans auoit u	532
598	les hialmes es testes		
599|600	les espees es mains|ausi apresté de deffendre	cheualiers tous armes les hiaumes laciez les espees es mains ausi aprestes de desfandre: comme se len les uosist asaillir	533
601|602	que se l’en les volsist asaillir|De ce se merveilla molt Lancelos ;	Si se meruilla mout lanc̃	534
603	si se drece erraument	si se dresce erraument	535
604	et vet cele part	et ua cele part	536
605	si salue les chevaliers	et salue les cheualiers	537
606	et il dient	et il dient	538
607	que bien soit il venus	que bien soit il uenus	539
608	Et il entre dedens les prones par un petit huisselet a	et il entre dedens les prones par|i	540|541
		petit usselet	542
609	et esgarde les prones	et esgarde les prones	543
610	qui tant sont riches qu’il ne cuide pas	qui tant sont riches quil ne cuide pas	544
611	que nus rois les peust esligier;	que uus rois les poist eligier	545
612|613	puis voit delés les chevaliers une tombe|la plus riche	et puis uoit deles les cheualiers une tonbe la plus riche	546
614	qui onques fust fete par home	qui onques fust ueue|par home	547|548
615	kar ele ert tote d’or fin a chieres pierres precioses	Car ele ert tote dor fin a pierres precieusez	549
616	qui molt valoient miels d’un grant roialme	qui plus ualoient dun roiamne	550
617	Se la tumbe fu de grant bialté	et dee la conbe fu de grant biaute	551
618	nient ne monte la bialtés envers la richece	Noiant monte a la richesce	552
619	dont ele estoit	dont ele estoit	553
620	et avec ce estoit ele la greignor	et auec ce estoit ele la grignors	554
621	que Lancelos eust onques veue :	que lanc̃|ueist onques	555|556
622	si se merveille molt	Si se merueille mout	557
623	qui puet estre li princes	qui pot estre li princes	558
624	qui dedens fu mis	qui dedens fu mis	559
625	Il demande as chevaliers	si demande as cheualiers	560
626	qui sont iluec	que il font illuec	561
627	Sire		
628|629	font il|nos gardons le cors	Sire font il nos garoons le cors	562
630	qui en ceste tumbe est	qui est dedens ceste tonbe	563
631	qu'il n’en soit portez fors de çaiens;	que il nen soit portes hors de saiens	564
632	si somes	Si i somes	565
633	V	u	566
634	por garder le de jors	por le garder chascun ior	567
635	par nuit en i a autres	et par nuit en i a autre	568
636	V	u	569
637|638	qui font autretel servise comme nos faisons de jors|—	qui font autretel seruise com uos faisons de ior	570
639|640	Et por quoi|fet Lancelos	et porcoi fait lanc᷑	571
641	avez vos poor qu’il n’en soit portés	auez uos pa our|que il nen soit portes	572|573
642|643	— Sire|font il	SIre font il	574
644	por ce que uns des freres de çaîens	por ce que uns freres de saiens	575
645	qui molt est preudom	qui est mout preudoms	576
646	et de sainte vie nos dist n’a encor gaires	et de sainte uie nos dit na encore gaires	577
647	que uns chevaliers vendroit ceste part	que uns cheualiers uandroit ceste part	578
648	qui a force l’en osteroit	qui a force len osteroit	579
649	et fors de cest païs l’en feroit porter	et fors de cest pais len feroit porter	580
650|651	Et nos|gens de ceste terre	et nos gens de ceste terre uodriens miex morir quil fust remuez dantre nous	581
652	voldrions miels morir qu’il fust remués d’entre nos : por ce	porce	582
653	si le gardons issi com vos veez	si le gardons ensi com uos ueez	583
654|655	lar li preudom i nos dist|que li chevaliers ne demoreroit pas qu’il ne venist — Or me dites	Car li preudons nos dit quil ne demorroit mie: quil ne uenit	584
656|657	fet Lancelos|ne fu cil molt haus princes a cui l’en fist	Or me dites fuit lanc̃ ne fu cil mout riche princes a cui	585
658|659	si haute sepulture|— Sire	si riche sepouture fu faite	586
660|661	font cil|haus hom fu il	Sire font a haus hons	587
662	et riches; avec ce qu’il fu haus hom fu il li plus preudom	et riches fu il|et li plus prendons	588|589
663	qui onques fust a son tens	qui onques fust a son tans	590
664|665	— Ha|Diex	Ha: diex fait il	591
666	fet Lancelos		
667	qui fu il	qui fu il	592
668	— Sire		
669	font il		
670	se vos conoissiés letres		
671|672	veoir le porriés|kar ses nons est escris el chief de cele lame	Sire font il se uos quenoisiez lestre sauoir le poez Car ses nons est escris el chief de cele lame	593
673	Lors va Lancelos cele part	Lors ua lanc̃|cele part	594|595
674	si regarde les letres	et regardent les lestres	596
675	qui dient Ci gist Galehout li fiz a la Jaiande	qui dient: ci gist Gał̾ li fiz a la bele iaiende des longainnes illes	597
676	li sires des Lointaignes Isles a	et li sires de sorelois	598
677	qui por l’amor de Lancelot morut	qui por lanmor lanc̃|del lac morut	599|600
678	Et quant il vit ce	et quant il uoit ce	601
679	si chiet pasmés	si chiet pasmez	602
680	et gist grant piece a terre sans mot dire;	et gist grant piece a terre sans madire	603
681	et li chevalier le corent relever	et li cheualier le corent releuer	604
682	si se merveillent molt qu’il puet estre	si se merueille mout|que il puet estre	605|606
683	Et quant il revint de pasmison	et|quant il reuient de pasmissons	607|608
684	si s’escrie Ha	si sescrie	609
685	las!	halas	610
686	Quel dolor	quel dolor	611
687	et quel damage	et quel damage	612
688	Et lors fiert l’un poing en l’autre	et lors fiert lun pong a lautre	613
689	et esgratine son viaire	et esgratine son uiaire	614
690	si qu’il en fet le sanc salir de totes pars	et or fait le sanc de totes pars saillir	615
691	si se prent as chevels	Si se prant as cheuex	616
692	et se fiert grans cops del poing en mi le front	et se fiert grant corx del pong el fronc	617
693	et en mi le pis	et enmi le piz	618
694	et crie	et crie	619
695	si durement qu’il n’i a celui	si durement qul ni a celui	620
696|697	qui tote pitiés n’en preigne;|si se laidenge	qui pitie nen prangne	621
698	et maldit l’ore qu’il fu nes	et maudit leure quil fu nez	622
699|700	et dit Ha|Diex !	et dit ha diex	623
701	Quel damage	que perte	624
702	quel perte del plus preudome del monde	et quel dammage del plus preudome del monde	625
703	qui mors est por le plus vil chevalier	qui mors est por le plus uil cheualier	626
704	et por le plus malvés	et por li plus mauuais del monde	627
705	qui onques fust ! Tant fet Lancelos grant duel	Tant fait Lanceloz grant cri|et grant plain	628|629
706	que tuit cil de laiens le vienent regarder a merveille;	que tuit cil de laiens le uon esgarder	630
707	si li demandent	Si li demandent	631
708	qui il est	qui il est	632
709|710	et il ne puet mot dire|ains crie totes voies	et il ne lor uost mo dire ains crie totesuoies	633
711	et se debat	et se debat	634
712	et descire	et dessire	635
713	Quant il a son duel demené grant piece	et quant il a son duel mene grant piece	636
714	si regarde les letres	et il regarde les lestres	637
715	qui dient	qui dient	638
716	que por lui est mors Galehout;	que por lui est mors Galehoz	639
717	si dist	si dit	640
718	que or seroit il trop malvés	que or seroit il trop mauuais se il ausi ne moroit por lui	641
719	s’il ausi ne moroit por lui:si saut maintenant jus des prones	Si saut mainteuaut hors des prones	642
720	et pensa qu’il iroit querre s’espee	et panse|que il ira querre sespee	643|644
721	et qu’il s’en ocirroit	et quil sen ocirra	645
722	kar ausi avoit ele esté Galehout a	car ausi auoit ele este Gal̾	646
723	Et maintenant qu’il fu issus del mostier	maintenant|que lanc̃ fu fors del mostier	647|648
724	si encontra une des damoiseles del Lac	Si encontre une damoisele del lac	649
725	cele	Celi	650
726	qui a Boort avoit parlé devant le chastel de Honguefort	qui a beh̾|auoit parle deuant le chastel de honguefort	651|652
727	et ele le conuit bien	et ele le quenut bien	653
728	si le prent par le pan de la cote	Si le prant par le pan de la coste	654
729	et l’areste	et lareste	655
730	Qu’est ce		
731|732	fet ele|Ou alés vos ensi	Que esce fait ele ou alez uos ainsint	656
733	— Ha		
734	damoisele		
735|736	fet il|laissiés moi mes dolors finer	ha; damoisele fait il laissiez moi mes dolors finer	657
737	kar jamés n’avroie joie ne repos en cest siecle	Car iamais nauroye ioie ne repos : en cest siecle	658
738|739	— Parlés|fet ele	Parles a moi fait ele	659
740	a moi		
741|742	Et il ne li dit mot|ains se lance outre	et il ne dit mot ains se lance outre	660
743	si qu’il li eschape des mains	si quil li eschape del mains	661
744	Et quant ele l’en vit aler	Et quant ele len uoit aler	662
745	si li crie Je vos deffent	si li escrie	663
746|747	fet ele|par la rien	Ie uous desfan fait ele par la riens	664
748	que vos plus amez en cest monde	que uos plus amez en monde;	665
749	que vos n’ailliés avant	que uos nales auant iusqu atant	666
750	tant que vos aiés parlé a moi	que uos aiez parle a moi	667
751	Et il s’areste	Lors sareste	668
752	si la regarde	si la regarde	669
753	et quant il la conut	et quant il la quenoit	670
754	si li dist	si li dit	671
755	que bien soit ele venue	que bien soit ele uenue	672
756	En non Dieu		
757|758	fet ele|vos me deuissiés fere plus bele chiere	En non dienu fait ele uos me deussiez Sire mout plus bele chiere	673
759|760	que vos ne me fetes|al mains	que uos ne faites au mains	674
761|762	por ce que je sui messages vostre dame del Lac|— Ha	por ce que ie sui mesage uostre dame del lac	675
763	damoisele		
764|765	fet il|por Dieu ne vos poist	ha: damoisele fait il por dieu ne uos poist	676
766	certes je ai tant de dolor	Certes ie ai tantes dolors	677
767	que nus for Diex ne me porroit conforter	que nus fors dieu ne men porroit reconforter	678
768	ne a ne cuidiés	Ne ne cuidiez pas	679
769	que jamés aie joie por aventure	que ie iamais aie ioe: por auanture	680
770	qui me puist avenir	qui me puit auenir	681
771|772	— En non Dieu|fet ele	En non dieu fait ele	682
773	si avrois	si aurois	683
774	Escotez	escotes	684
775	que ma dame vos mande	que madame uos mande	685
776|777	— Or dites|fet il	Or dites fait il	686
778|779	— Ele velt|fet ele	Ele wet	687
780	que vos ostés le cors Galehout de caiens	que uos ostes le cors Gal̾ de saiens	688
781	et le fetes porter en litiere en la Dolerose Garde	et len faites porter en litiere|a la dolereuse garde el chastel	689|690
782	et iluec soit mis en la tombe meismes ou vos trovastes vostre non escrit;	et illuecques soit mis en terre en la tombe meismes ou uos trouastes uostre non escrit	691
783	et ele le velt ensi	Car ele wet ainsi	692
784	por ce qu’ele set bien	por ce que ele set bien	693
785	que en cel lieu sera vostre cors enterrez	que illuec sera uostres cors enterres	694
786	Et quant il l’ot	et quant il ot se	695
787	si en est molt liés	si en est mout liez	696
788	et dist	et dit	697
789	que molt li sont ces noveles plaisans	que mout li sont ses noueles plaisans	698
790	kar tot ensi le fera il ;	Et tout ainsi le fera il	699
791	puis demande	pius demande	700
792|793	comment sa dame le fet|Par foi	comment sa dame le fait	701
794|795	fet ele|ele a esté	Par foi fait ele ele a este	702
796	VIlI	uiii	703
797	jors deshaitiee trop durement	iorls deshaitie	704
798	kar ele trova en son sort	Car ele troua en son sort	705
799	si com ele meismes me dist puis	si com ele me dit	706
800	que si tost com vos troveriés la tombe Galehout	que si tost com uos trouerrez la tombe Gal̾	707
801	que vos vos ocirriés de duel	que uos uous ocirriez de duel	708
802	se vos n’estiés destornez	se uos nen estiez trestornez	709
803	Por ce m’envoia ele ça a grant besoing	et porce menuoia la a grant besong	710
804	si vos mande	si uos mande	711
805	que vos laissiés le duel ester	que uos laissiez le duel ester	712
806	qu’il ne vos puet fere se nuire non	Car il ne uous puet aidier de nuire non	713
807	et vos prie par la rien	et uos prie par la rien	714
808	que vos plus amés	que uos plus amez en se monde	715
809	que vos al plus bel	que uos au plus bel	716
810	que vos porrois vos reconfortés	que uus porrois uos reconfortes	717
811|812	et se vos ensi ne le fetes|bien sachiés	Et se uos ainsi nel fasiez bien sachiez	718
813	que al premier besoing	que au premier afaire	719
814|815	que vos avrois de li|ele vos faudroit	que uos ariez de li ele uos faudroit	720
816	Et il dist qu’il se confortera	et il dit|que ore se confortera il	721|722
817	puis qu’ele le velt	puis que madame le wet	723
818	Or vos covient	OR uos couuient fait ele uos arme prandre|Car ie sai bien	724|725
819	fet ele	que cil	726
820|821	vos armes prendre|kar je voi bien qu’il ne le vos en lairont mie en pes porter tant com il le porront deffendre	qui le gardent nel uos la iront pas en pais porter tant comme il le puissent desfandre	727
822	Et il dist qu’il i morroit ançois qu’il ne l’ostast de laiens;	Et il dit|que il i morroit ansois	728|729
		que il lait laiens	730
823	si se vet armer	Si sen ua armer	731
824	et la damoisele vient tantost as chevaliers	et la damoisele uient tandiz as cheualiers	732
825	qui gardoient la tombe	qui le gardoient	733
826|827	si lor dist Seignor|fet ele	et lor dit	734
828	volés vos destorner ce qu’il covient estre a force	Signor fait ele uolez uous destorner ce|que il couient auenir par force	735|736
829|830	et demandent por quoi ele le dist|Je le di	et il li demandent por coi ele le dit	737
831|832	fet ele|por le cors	gel di fait ele por cel cors	738
833	que vos gardez	que uos Gardes	739
834	et si savés bien qu’il en sera ostez	et si sauez bien|que il en sera ostes	740|741
835|836	— Non sera|font il	no sera font il	742
837	que nos puissons	que nos puissons	743
838|839	— En non Dieu|fet ele	par foi fait ele	744
840|841	si iert|et bien sachiés	si sera	745
842|843	fet ele|que cil est venus	que ciz est uenus	746
844	qui l’en ostera	qui lostera	747
845	Et se vos le contredites	et se uos le contredites uos i morres tuit	748
846	vos en morrois tuit: por ce vos vendroit il miels	et porte uos uodroit il miex	749
847	que vos le laississiés atant	que uos le laissisiez atant	750
848	ains	Ains	751
849	que vos vos en façois ocirre	que uos uous en laisisiez ocirre	752
850	Et cil dient	et cil dient	753
851	que ja tant com il soient vif n’en sera portés	que ia tant comme il soient uif nen sera portes	754
852|853	Et bien sache|font il	et bien saichent font il li cheualiers	755
854	li chevaliers		
855	qui venus est por avoir le	qui uenus|et por lauoir	756|757
856	que s’il estoit encore plus preus	que cil estoit encore plus preus	758
857	que Lancelos n’est	que lanc̃	759
858	si n’en menra il point	nest nen manra il point	760
859|860	— Or verrons|fet ele	Se uerrez uos fait ele coment il uos en auanra iusquaa nagaires A ces paroles uint laiens lanc̃	761
861|862	comment il vos en avendra|A ces paroles vint laiens Lancelos tos armés	tous armez	762
863	et quant li chevalier le voient venir	Et quant li cheualier le uoient uenir	763
864	si li demandent qu’il velt fere	si li demandent|que il wet faire	764|765
865	Je vueil		
866|867	fet il|avoir le cors	ie weil fait il auoir le cors	766
868	qui laiens est	qui saiens est	767
869	— Par foi		
870|871	font il|vos ne l’avrois mie por nient	Par foi font il uos ne laures pas por noiant	768
872	Nos ¡ morrons ançois tuit	donc i morrons ansois tuit	769
873	que vos l’enportois	que uous lemportoit	770
874|875	— A morir|fet il	Au morir fait il estes uos tuit	771
876	en estes		
877|878	donc tuit|puis que a mains ne vos en volés soffrir	puis que au mains ne uos en uolez souffrir	772
879	Si saut dedens les prones	Lors saut dedens les pronez	773
880	et il li corent sus	et cil li corrent sus	774
881	kar arrieres le cuident fere sailir por poor de morir;	car arreres le cuident faire flatir por paour de mort	775
882	si le fierent par la ou il le pueent ataindre	si le fierent par la ou il pueent ataindre	776
883	et il ot el poing l’espee nue ;	et il ot el poing lespee nue	777
884	si lor done grans cops	si lor done grant cox	778
885	et pesans	et pesans	779
886	et fiert le premier qu’il encontre	et fiert le premier quil puet encontre	780
887	si durement	si durement:	781
888	que por le hialme ne por la coife de fer ne remaint qu’il ne li mete l’espee jusqu’al test;	que por hiaume ne por la coiffe ne remaint|que il ne li meste lespee iuscau test	782|783
889	et il le hurte de soi	Si le hurte desor	784
890	Si l’abat a terre	et labat a terre	785
891	Et lors saillent molt irieement tuit li autre	et lors saillent tuit li autre	786
892	si depiecent son escu	si li deprirent son haubert	787
893	et son hialme	et son escu	788
894	et son hauberc	et son hiaume	789
895	et le blecent en pluisors lieus	et le blecerent en plusors lieus	790
