0	avoir trové	auoir troue	0
896	Mais il ne li chaut de rien qu’il li facent	Mais il ne len chaut de rien	791
897	kar tant est dolens	Car tant est dolens	792
898	que nus plus;	que nus plus ne puet estre	793
899	si lor laisse corre par grant ire	Si lor laisse corre par grant ire	794
900	et lor done de l’espee	et lordone de lespee	795
901	si grans cops	si grant cox	796
902	que tos les fet guenchir avant lui	que toz les fait guenchir auant lui	797
903	Et lors esgarde celui des IllI	Lors esgarde de celui des qͣtre	798
904	qui plus li faisoit mal	que miex le faissoit a son essianc	799
905	et cil estoit molt grans	et cil estoit mout grans cheualiers	800
906	et molt fors;	et mout fors	801
907	et Lancelos	et lanc̾	802
908	qui le vient ataignant li done par mi le hialme	qui le uient atangnant li done parmi le hiaume	803
909	si grant cop qu’il en fet le feu saillir	si grant cop|que il en fait le fen saillir	804|805
910	et l’espee glace	et lespee glace	806
911	qui de droit ne fu pas ferue	qui droit ne fu pas ferue	807
912	si descent desus la senestre espaule	Si li descent desous la senestre espaule	808
913	Li cops fu grans	et li cox fu grans	809
914|915	et par ire ferus|et bien i parut	et par ire feruset bien i parut	810
916	que l’espee cola par mi l’espaule a al chevalier	que lespee cola parmi lespaule au cheualier	811
917	si que li bras a tote l’espaule chiet desus le pavement	Si que li bras atout lespee chai seur le pauement|et cil trebuche a terre	812|813
		et se pasme: de langoisse	814
		que il sent	815
918	Et lors sont molt esmaié li autre troi	Et lors sont mout esmaiet li autre trois	816
919	si font molt malvés samblant d’els deffendre por le grant cop qu’il ont veu	Si font mout mauuais sanblant daus desfandre|por le grant cop quil ont ueu	817|818
920	et por l’espee	et por lespee	819
921	que chescuns d’els a ja sentie jusqu’al sanc	que chascuns daus a sentie iussqua sanc	820
922	Et Lancelos lor cort sus	et lanceloz|qui ne recroit pas lor cor sus	821|822
923	et en fiert I	et en fiert|i	823|824
924	el hialme	amont el hiaume	825
925	si qu’il le fet flatir a terre d’ambesdeus les paumes	si quil le fait flatir a teree|danbedeus les paumes	826|827
926	Et quant li autre dui voient ce	et quant li autre dui uoient ce:	828
927	si tornent en fuies vers l’uis a garison;	si corret᷑ uers luis|et uiennent a garison	829|830
928	et Lancelos vint ataignant le deerrain	et lanc̃ uient atangnant	831
929	si le fiert par entre l’escu	et en fiert a grant uue par entre lescu	832
930	et le bras	et le bras	833
931	si qu’il li trenche le poing	si quil li tranche le poing	834
932	et li escus chiet a terre	et li escus chiet a terre	835
933	et cil torne en fuies	et sil torne en fuie	836
934	qui maheignié se sent	qui afolez ce sent	837
935	Et Lancelos vient a l’autre	et lanc̃ uient a lautre	838
936	qui ja se relevoit	que ia se releuois	839
937	sel fiert de l’espee	si le fiert de lespee	840
938	si grant cop qu’il li fet le hialme voler en la place	si grant cop|que le hiaume li fait uoler en pieces	841|842
939	Et quant cil sent son chief nu	et quant cis sent son chief nu:	843
940	si cria merci	Si crie merci	844
941	et dist qu’il ne l’ocie pas	et dit quil ne locie pas	845
942	kar il est pres de sa volenté fere	Car il est pres de sa uolente faire	846
943	Or te covient donc	sans contredit Or te couient	847
944|945	fet Lancelos|fiancer	dont a fiencier fait lanc̃	848
946	que tu le cors mon seignor Galehout conduiras a la Dolerose Garde	que tu le cors Galeh̾|condiuras a la dolereuse garde	849|850
947	et iluec le feras garder	et illuec le feras garder	851
948	tant que je i viegne;	tant que ie i uaigne	852
949	et se l’en te demande	et se lon te demande	853
950	qui t’i envoie	qui ti enuoie:	854
951	si diras « cil	Si diras|que cil	855|856
952	qui ot les ames blanches le jor	qui ot les armes blanches|le ior	857|858
953	que li chastials fu conquis	que li chastiax fu conquis	859
954	Et il li fiance	et cil li fiance	860
955	que tot ensi le fera il	que tout ainsi le fera il	861
956	Lors prent Lancelos la lame par le plus gros chief	Lors prent lanc̃|la lemme par le plus gros chief	862|863
		si la tire de	864
957	si tire de grant force qu’a pou qu’il ne se deront tos	si grant force|que a pou quil ne se desront tous	865|866
958	si que li sans li vole par mi le nes	Si que li sans li uole parmi le nes	867
959	et par mi la boche	et parmi la boche	868
960	et li cors li sue d’anguoisse	et li cors li sue dangoisse	869
961	Mais por tote la destrece ne remaint qu’il n’ait la tombe levee en haut à; mes nule dolors qu’il eust onques ne monte rien a cele dolor qu’il ot	mais portoie la destresce ne remaint|que il nait la tombe leuee en haut	870|871
		mais nule dolors	872
		que il eust onques ne monte sur rien	873
		A cele	874
		que il ot	875
962	quant il vit le cors Galehout tot ensi armé com il estoit;	quant il uit le cors Galehot|ensi arme con il estoit	876|877
963	si trova s’espee delés lui	si troua lespee deles lui	878
964	qui molt estoit	qui mout estoit bele	879
965	et bone	et bone	880
966	et clere;		
967|968	et sans faille de l’espee meesmes se fust il ocis|se la damoisele ne li eust tolue erraument	et sans faille de lespee meismes ce fust il ocis se la damoisele ne li eust tolue	881
969	Lors fist Lancelos une biere fere de fust	Lors fait lanc̃|faire une biere de fust	882|883
970	et la fist covrir des plus riches pailes de laiens	et la fait courir des plus biax pailes de laiens	884
971	et quant il l’ot atornee al plus richement qu’il pot	et quant il lot atornre au plus richement|que il pot	885|886
972|973	li chevaliers prisons li dist Sire|fet il	Li cheualiers prisons dit	887
974|975	se l’en movoit tot de nuis|ce seroit sens	si fait il se len mouoit tout de nuit se seroit sens	888
976|977	— Por quoi|fet il	Por ce fait il	889
978|979	— Por ce que|se li chevalier de cest païs savoient	que ce li cheualier de cest pais sauoient	890
980|981	que l’en len deust porter|il feroient gaitier les trespas	que on le deust laiens porter: il feroient garder les trespas	891
982	si qu’il seroit arestés en alcun lieu ;	si que il seroit arester en aucun lieu	892
983	et por ce vos loeroie je qu’il meust orendroit	et porce loeroie ie|que il meust orendroit	893|894
984|985	kar il seroit bien eslongiés|ains qu’il fust jors	Car il seroit bien eslongiez	895
986	XX	xx	896
987	lieues englesches	lieues Galesches ains quil fust iors	897
988	Et il s’i acorde bien;	et il|si acorde bien	898|899
989|990	si met la litiere sor Il|palefrois amblans	Si mestent la biere seur ii cheuaus anblans	900
991	et enportent ensi Galehout fors de sa region;	et enportent ainsi Galeh̾|fors de la religion	901|902
992	si en font li frere grant duel	Si en font li frere mout grant duel	903
993|994	et molt en sont corocié|et dolenta de ce	et mout en sont dolent	904
995|996	que l’en l’enporte|Et Lancelos le convoie grant piece de nuis	et lanc̃ le conuoie gn̾t piece de nuit plorant	905
997	plorant	et plangnant	906
998	et regretant sa proesce	et regretant sa proesce	907
999	et sa valor		
1000	et se ne fust la damoisele	et se ne fust la damoisele	908
1001	qui avec lui estoit molt en eust plus fet qu’il ne fist	qui auec lui estoit mout en eust plus fait quil ne fist	909
1002|1003	mais ele l’en detorna|et il deffendi al chevalier	mais le le desfandi au cheualier	910
1004	que il nel feist en terre metre devant	que il ne fust enterres deuant|que lanc᷑	911|912
1005	que il fust venus	i fust uenus	913
1006	Si se part atant li uns de l’autre	Si se partent li un de lautre	914
1007	et il retorne a l’abeie	et lanc̃ retorne a labeye	915
1008|1009	si se couche|c’onques la nuit ne volt mengier ne boivre por chose	et se coche ne onques la nuit ne uot mangier ne boire por chose	916
1010	que l’en li deist	que len li deist	917
1011	ains plora	ains plora	918
1012	et dolosa tot adés;	et dolosa tout ades	919
1013	si li anuioit molt li jors	si li anuia mout li iors	920
1014	qui tant demoroit a venir	qui tant demora a uenir	921
1015	a Al matin	Au mation	922
1016|1017	si tost com li jors aparut|se leva	si tost com li iors aparut se lena lanc̃	923
1018	et oi messe entre lui	et oi messe entre lui	924
1019	et la damoisele	et la damoisele	925
1020	et puis s’arma	et puis sarma	926
1021	Lors li dist ele les noveles de Boort	et lors dist ele les nouelles de behort	927
1022	et ce qu’ele en avoit veu devant Honguefort	et se quele en auoit uen deuant le chastel de honguefort	928
1023	et il en fu molt liés	et il en fu mout liez	929
1024	Et ele li dist Sire	et ele li dist	930
1025	il vos vet querant ne jamés ne finera tant qu’il vos avra trové	Sire il uos ua querant ne ia|mais ne finera tant quil uos ait troue	931|932
1026	— Damoisele		
1027|1028	fet il|se vos le cuidiés trover ains de moi	ha; damoisele fait il se uus le cuidiez trouer ains de moi	933
1029	je vos voldroie proier	Ie uous uodroie prier	934
1030	que vos feissiés tant por moi	que uous feissiez tant por amor de moie:	935
1031	que vos li portissiés ceste espee	que uos li portissiez ceste espee	936
1032	qui fu mon seignor Galehout	qui fu monsignor Gal̾	937
1033	et li dites qu’il la DOrt de par moi	et li dires quil laport de par moi	938
1034	que molt est bone	car mout est bone	939
1035	Et ele dist qu’ele le trovera par tens	et ele dist|que ele le trouera par tans	940|941
1036	et bien fera cest message;	et que bien fera cest mesaige	942
1037	si s’en part atant de lui	Atant se part de lanc̃|la damoisele	943|944
1038	et il s’en vet droit vers le chastel de Floego	et il sen ua tout droit uers le chastel de floego	945
1039	si i vint a hore de prime	Si i uint a hore de prime	946
1040	Et il esgarde es pres defors la vile	et des garde es pres de fors La uille	947
1041	si voit molt grant gent entor le feu ou l’en devoit ardoir la suer Meleagan	si auoit mout de gent entor|i	948|949
1042	et quant il aperçoit le feu	fe|Et quant il aparsoit le feu	950|951
1043	si a poor de la damoisele	si a paor de la damoisele	952
1044	Lors broche le cheval	et lors broche li cheual	953
1045	et vint errant cele part tant com il puet del cheval traire	et uient corant cele part|tant comme il puet de cheual traire	954|955
1046	Et quant il est venus jusque la	et quant il uien iusque la	956
1047	si esgarde	si esgarde	957
1048	et voit la damoisele	et uoit la damoisele	958
1049	qui ja estoit amenee al feu por destruire	que ia estoit amenee au feu por destruire	959
1050	si estoit en pure sa chemise	Si estoit en la pure chemisse	960
1051	et le tenoient	si la tenoien	961
1052	VI	ui	962
1053|1054	pautonier|trois d’une part	pautenier trois deuant	963
1055	et trois d’autre;	et trois derier	964
1056	si n’atendoient a geter le el feu fors le commandement as juges	Si natandoient a geter li el feu fort le comandement les menistres	965
1057	et ele ploroit trop durement	et ele ploroit trop meruilleusement	966
1058	et regretoit Lancelot Ha	et regretoit lanc̾	967
1059	gentilx chevaliers Lancelos	ha gentil cheualiers lanc̃	968
1060	kar pleust ore a nostre Salveor	car pleust ore a dieu	969
1061	que vos seuissiés ceste novele	que uos seussiez ceste nouelle	970
1062	si fuissiés pres de ci a demie lieue! Certes a l’aide de Dieu	et uos fussiez pres de ci a demi lieue|Certes a laide de dieu	971|972
1063	et de la vostre seroie je encore anuit rescosse malgré tos mes enemis	et ala uostre seroie ie encore ennuit rescouce maugre mes anemis	973
1064	Mais vos ne le savés pas a	Mais uos ne le sauez pas	974
1065	si me covendra ore morir por la vie	si me couanra morir|por la uie	975|976
1066	que je vos sauvai emprés Dieu;	que ie uos sauuai apres dieu	977
1067	mais certes il ne m’en poise pas tant por moi com il fet por le coros	mais certes il ne men poise pas tant por moi comme por uos|por le corrous	978|979
1068	que vos en avrois	que uos en arrois	980
1069	quant vos le savrois	quant uos le saurois	981
1070	Mais ce me reconforte molt	mais ce me reconforte mout	982
1071|1072	que je sai bien|que les damoiseles gaaigneront tant en ma mort	que ie sai bien queles damoisele gaangneront tant en ma mort	983
1073	que jamés nule ne vos requerra d’aide	que iamais nule ne uos requerra a aide	984
1074	que vos li faillois tant com il vos remenbre de moi	que uos li faillois tant comme il uos membera de moi	985
1075	kar vostre cuers est	Car uostres cuers est	986
1076	si frans qu’il ne puet estre sans trop grant merites rendre a totes celes	si sains quil ne puet estre sans grant merites rendre a totes celes	987
1077	qui de par moi se reclaiment:	qui de par moi se reclameront	988
1078	si m’est avis qu’il m’est molt miels a m’ame de morir por loialté fere	Si mest auis|que il est miex a marme de morir por la loiaute faire	989|990
1079	et por geter de prison	et por oster de prison	991
1080	si vaillant home comme vos	si uaillant home comme uos estes ;	992
1081	que vos fuissiés mors par la desloialté de Meleagan	que uos fussiez mors par la desloiaute meleagant	993
1082	qui en prison vos avoit mis par traïson	qui uos auoit mis en prison par traison	994
1083	Ensi disoit la damoisele molt tendrement plorant	ANsi dissoit la damoisele ml̃t tandrement en plorant	995
1084	et lors vint Lancelos poignant cele part ou il la vit:	et lors uint lanc̃|cele part ou il la uit	996|997
1085	si dist a cels	et dit a ciax	998
1086|1087	qui le tenoient Laissiés la damoisele! — Por quoi|sire	qui la renoient Laissiez la damoisele	999
1088|1089	fet J|chevaliers armés	Por qoi sire fait uns cheualiers	1000
1090|1091	qui avant saut|le lairons nos	qui auant saut por quoi la lairons nous	1001
1092|1093	— Por ce|fet il	Por ce fait il	1002
1094|1095	que vos n’avés droit en li por fere mal|—	que uous ni auez droit en li faire morir	1003
1096|1097	Si avons|fet cil	Si auons fait cil	1004
1098|1099	si grant|que nos l’avons atainte de murdre	que nos lauons atainte do mudre	1005
1100	dont je l’apelai	que nos li meciens sus	1006
1101	et ele s’en offri a deffendre	et ele sen offri a desfandre	1007
1102	mais ele ne trova onques	Mais ele ne troua onques|cheualier	1008|1009
1103	qui por li en prist escu	qui por li enprrist escu	1010
1104	et ce n’est pas merveille	et se nest pas m̾ueille	1011
1105	que chescuns set bien quele en a desloialment ovré	que chascuns set bien	1012
1106	— De quoi	comment ele en a erer de coi fait lanc̃	1013
1107	fet Lancelos	Decce fat cil	1014
1108|1109	— De ce|fet il	que ele deliura lanc̃	1015
1110|1111	qu’ele delivra Lancelot por Meleagan ocirre|son frere	por ocirre meleagan son frere	1016
1112|1113	— Se vos|fet Lancelos	Ce uos fait lanc̃	1017
1114	osiés mostrer qu’ele eust fet traïson ne murdre	le uoliez mostrer	1018
1115|1116	je seroie pres del deffendre|—	que ele fist traison ne murdre: Ie seroie pret del desfandre	1019
1117|1118	Qui estes vos|fet cil	Qui estes uos fait cil	1020
1119|1120	— Uns chevaliers sui|fet Lancelos	uns cheualiers sui fait cil	1021
1121	qui vieng ceste part por ceste damoisele deffendre	Qui uing ceste part por li desfendre	1022
1122|1123	— Par foi|fet cil	Par foi fait cil	1023
1124|1125	se je voloie|il ne m’en covendroit ja combatre	Ce ie uoloie il ne men conuanroit ia conbatre	1024
1126	kar des ier en est ! ele atainte	Car des ier eu est ele ia atainte	1025
1127	puis qu’ele ne pot trover	puis que ele ne post trouer	1026
1128	qui la deffendist	qui la desfandist	1027
1129	mais je sent ma querele a	mais ie sen ma querele	1028
1130	si loial	si aloial	1029
1131|1132	et si droituriere qu’il n’a chevalier el monde vers cui je ne l’osaise bien prover au|grant droit	et si a droituriere; quil na cheualier el monde uers cui ie ne lo fasse bien prouer au grant droit	1030
1133	que je i ai	que gi ai	1031
1134|1135	— En non Dieu|fet Lancelos	EN non dieu fait lanc̃	1032
1136	or i parra	or i parra	1033
1137	que je sui pres	car ie sui pres	1034
1138	que je la desfende vers vos	que ie la deffande uers uos	1035
1139|1140	— Voire|fet cil	Uoire fait cil	1036
1141	par mon chief	par mon chief	1037
1142	et vos en morrois comme traitres	et uos en morrois comme traites	1038
1143	et desloials	et desloiax	1039
1144	Lors traient la damoisele loins del feu	Lors traient la damoisele ensus del feu	1040
1145	et li chevalier s’entreslongent li uns de l’autre	et li cheualier sentͤa longuet li uns de lautre	1041
1146	si s’entrevienent	Si sentreuienuent nent	1042
1147	si tost com li cheval pueent aler	si tost conli cheuaus lor pueent aler	1043
1148	et s’entrefierent des glaives	Si sentrefierent des glaiues	1044
1149	si durement qu’il les font voler en pieces;	si durement quil les font uoler en pieces	1045
1150|1151	puis s’entrehurtent|si des cors	puis sentrehurtent des cors	1046
1152	et des visages qu’il n’i a celui	et des uisages|Si que il ni a celui	1047|1048
1153	qui tos ne soit estordis	qui tous ne soit estordis	1049
1154	et desconreez	et desconrares	1050
1155	Mais li chevaliers par est	mais li cheualiers est	1051
1156|1157	si estonés qu’il ne se puet tenir en sele|ains vole jus del cheval	Si estordis quil ne se puet tenir en sele ains bale a terre	1052
1158	et al parchaoir feri li quins del hialme en la terre	et au parcheoir feri li coins en cͣre del hiame	1053
1159	si qu’a bien pou qu’il n’a le col brisié	Si qua bien pou|que cil na le col brisie	1054|1055
		s	1056
1160	Et quant Lancelos a fet son tour	quant lanc̃|a fait son cor	1057|1058
1161|1162	si descent|kar honte li seroit de requerre a cheval celui	si descent Car honte li fust de requerre a cheual celui	1059
1163	qui est a pié;	qui estoit a pie	1060
1164	si trait l’espee	Si trait lespee	1061
1165	et cort sus a celui	et cort sus celui	1062
1166	qui ja se relevoit	qui ia ce releuoit	1063
1167	si li done par mi le hialme tel cop qu’il le fet a terre flatir des paumes	Si li done|si grant cop parmi le hiaume quil le fait uoler a terre des paumes	1064|1065
1168	et des genols ;	et des ienos	1066
1169|1170	puis recuevre I|autre cop	Si quil recueure un autre cop	1067
1171	et le fiert		
1172	si qu’il le fet tot parchaoir	si quil le fait tout parcheoir	1068
1173	et le prent par le hialme	et lors le prent par le hiaume	1069
1174	si le traine jusqu’al feu	et le traine iuscau feu	1070
1175	et le gete dedens	et le gecte dedens	1071
1176	Et cil estoit	et ciz estoit	1072
1177	si estordis	si estordiz	1073
1178	et tant avoit perdue la force del cors	et tant auoit perdu la force dou cors	1074
1179	que relever ne se pot	que releuer ne se puet	1075
1180	si le covint remanoir el feu	si le couint remanoir	1076
1181	et morir en tel maniere	et morir en tel maniere	1077
1182	Et lors vienent avant cil	Lors uiennent auant cil	1078
1183	qui le champ gardoient	qui le feu gardoient	1079
1184	si dient a Lancelot qu’il en a assés fet	Si dient a lanc̃|quil auoit assez fait	1080|1081
1185	et li rendent la damoisele saine	et li rendent la damoisele sainne	1082
1186	et haitiee	et haitie	1083
1187	et il la fet vestir	et il la fait uestir	1084
1188	puis li demande qu’ele velt qu’il face mes	pus Li demande|que ele uet	1085|1086
		que il face mais	1087
1189|1190	Sire|fet ele	SIre fait ele	1088
1191	que vos me menés a salveté a mon chastel	que uos me remenez a mon chastel	1089
1192	Et il dist	et il dit	1090
1193	que volentiers:	si fera il	1091
1194	si le fet monter	Si la fait monter	1092
1195	et le conduit jusqu’al chastel ou ele l’ot gardé maint jor	et la conduit iuscau chastel oue ele lauoit garde maint ior	1093
1196	Li chastials avoit non Galefort	Ciz chastiax auoit non Balefort	1094
1197	et seoit sor une petite riviere	et seoit sor une petite riuiere	1095
1198	si estoit molt aaisiés de totes choses	Si estoit mout aisiez de totes choses:	1096
1199	et fors a merveille	et fors a merueillens	1097
1200	Et quant Lancelos vint la	et quant lanc̃	1098
1201	il ne fet pas a demander se l’en li fist joie	uint la il ne fait pas a demander cil en fist ioie	1099
1202|1203	kar cil del chastel savoient ja bien|que lor dame estoit delivree par I	Car cil del chastel sauoien ia bien commen lor dame estoit deliuree par	1100
1204	chevalier	i|cheualier	1101|1102
1205	qui o li venoit	qui o li uenoit	1103
1206	Et quant il le virent	et quant il le uirent	1104
1207	si le reçurent a	Si le resurent a	1105
1208	si grant joie com se ce fust Damedieu meismes	si grant ioie comme ce fudt diex meismes	1106
1209	et s’agenoillent tuit devant lui	et sagenoillent deuant lui par la ou il uenoit	1107
1210	et crioient a une vois tuit ensamble Sire	Et crioient a une uois tuit ensanble	1108
1211	sor tos cels del monde soiés vos bien venus	Sire sor tous ciax dou monde soiez uous li bien uenus	1109
1212	qui nostre grant duel avés torné en grant joie A tel feste ont laiens Lancelot receu	Car nostre grant duel auez atorne a ioie|a tous iors mais	1110|1111
		A tel Ioie out lanc̃	1112
1213	et quant il ont la damoisele descendue devant son mestre palés	receut|Et quant il ot la damoisele descendue deuant son palais	1113|1114
1214	si s’en volt aler maintenant	Si sen uoloit aler maintenant	1115
1215	kar il n’estoit mie encore plus de tierce	Car il niert encore plus de tierce	1116
1216	Mais ele le prist al frain	mais ele le print au franc	1117
1217	et le fist descendre a fine force a	et le fist descendre a fine force|et li dist	1118|1119
1218|1219	et dist Par Sainte Crois|vos ne m’eschaperois mie ensi	Par foi sire cheualiers ainsi ne meschaperes uos mie	1120
1220	Lors le commande a desarmer	et lors li comande a desarmer	1121
1221	et vaslet saillent avant por fere son commandement a;	et uarles saillent por faire son coumandement	1122
1222|1223	et tantost com il ot son hialme osté|et ele le conut	et tantost comme il a oste son hiamre ele le quenoit	1123
1224	si li cort les bras tendus	Si li cort les bras tandus	1124
1225	et le volt baisier en la boche	et le uet baisier a force en la boche	1125
1226|1227	quant il li guenchist|et ele li baise la face	quant il li guenchit ele li baise la boche	1126
1228	et le col	et le col	1127
1229	et le menton	et le menton	1128
1230	puis que autre chose n’em puet avoir ;	puis que autre chose nen puet auoir	1129
1231	si plore de pitié	Si pleure de pitie	1130
1232|1233	et li dist Ha|gentilx chevaliers	et dit ha: gentiz cheualiers tant uos auoie desire a ueoir	1131
1234	tant vos avoie desirré a veoir ains	ains	1132
1235	que je moreuisse!	que ie morisse	1133
1236	Mais comment l’avez vos	Mais coment lauez uos	1134
1237	puis fet	puis fait	1135
		que ie ne uos ui	1136
1238|1239	Et il li dist Bien|Dieu merci	et il dit mout bien la dieu merci	1137
1240	—		
1241|1242	Et ceste part|fet ele	Et ceste part fait ele	1138
1243	comment venistes vos	comment uenistes uos	1139
1244	qui avant ier vos en partistes	qui auant ier uos en partites	1140
1245	— Par foi		
1246|1247	fet il|une grant acheison	Par foi fait il une grant ocoisons mi amena	1141
1248|1249	m’i amena|Si li conte comment	Puis li conte coment uns cheualiers a unes armes uermeilles lauoit apele de traisson a la cort le roi artu	1142
1250|1251	I|chevalier o unes armes vermeilles l’avoit apelé de traïson a la cort le roi Artu por la mort de Meleagan;	por la mort de meleagͣ	1143
1252|1253	si l’en covient a deffendre en la cort le roi Baudemagu|Ha	Si li couient a desfandre en la cort le roi bademagu de gorre	1144
1254|1255	fet ele|je sai bien	Ha; fait ele ie sas bien	1145
1256	qui il est	qui il est	1146
1257	C’est Argodras li Ros	Cest agodras li rous	1147
1258	et li chevaliers	et li cheualiers cui uos auez ocis	1148
1259	que vos avés hui ocis	et ars hui en cest ior	1149
1260	et ars estoit ses freres;	estoit ses freres	1150
1261	si ne sai	Si ne sai	1151
1262	que vos puissiés fere	que uos en puissiez faire	1152
1263	kar se mes peres set	Car ce mes peres cest	1153
1264	que vos aiés ocis Meleagan	que uos auez ocis mel̾	1154
1265	je criem qu’il ne vos face ocirre por le grant duel qu’il avra des noveles	mon frere ie crien|que il ne uos face ocirre por le grant duel	1155|1156
1266	— Coment	que il en auoi	1157
1267	fet Lancelos	Coument fait lanc̃	1158
1268|1269	nel set il mie encore|— Certes	ne le cest il encore pas	1159
1270|1271	sire|nenil;	Si maist diex fait ele nenil	1160
1272	si est Meleagans en cest païs aportés plus a de XV	Si est mell|aporte en cest pais bien a	1161|1162
		xu	1163
1273	jors	iors	1164
1274	et est el chastel des Illl	et est el chastel de|iiii	1165|1166
1275	Pierres	pierres	1167
1276	et le gardent iluec	et le gardent la	1168
1277	si celeement	si celeement	1169
1278	que li rois n’en set encore riens:	que li rois nen cest encore riens	1170
1279	si en covendra esploitier al plus sagement	si uos en couenra esploitier au plus saigement	1171
1280	que vos porrois	que uos porrois	1172
1281|1282	Mes a|quant est li jors	Et quant est li iors	1173
1283	que vos vos en devés deffendre	que uos nous en deuez desfandre	1174
1284	Et il dist	et il dit	1175
1285	que c’est le jor de la Magdalaine	que cest le ior de la magelainne	1176
1286|1287	Or vos en conseut Diex|fet ele	Or uas en consaut fait ele diex	1177
1288	kar j’ai grant poor	que iai grant paour	1178
1289|1290	que Argodras ne vos face anui par traïson|— De ce	que agodras ne uous face anui par traison	1179
1291|1292	fet il|n’aiés ja garde! Tot son pooir en face	De ce fait il naiez ia garde tout son pooir en face	1180
1293	que je n’en avrai ja poor	que ie ne le dout pas	1181
1294	Assés parlerent cele nuit de maintes choses a	Assez parleren cele nuit de maintes chosez	1182
1295	et molt firent cil del chastel grant joie de lor dame qu’il cuidoient avoir perdue	et mout firrent cil del chastel grant Ioie de lor dame|que il cuidoient auoir perdue	1183|1184
1296	et or l’ont saine	et orlat sainne	1185
1297	et haîtie	et haitie	1186
1298	Et al matin	Et au matin	1187
1299	si tost com li jors parut cler	quant li iors aparut biax	1188
