0	avoir trové	auoir troue	0
1300	se leva Lancelos	et clers se leua lautre de son lit	1189
1301	et se parti de la damoisele	et se parti de la damoisele	1190
1302|1303	quant il fu armés;|et ele le commande molt a Dieu	Quant il fu armez la damoisele comande a dieu	1191
1304	et li pria qu’il s’en revenist par li al repairier;	et li prie|que il sen reuenist par li au repairier	1192|1193
1305	et il dist	et il dit	1194
1306|1307	que si feroit il|s’il pooit	que si feroit il se il puet	1195
1308	Si se remet en son chemin	et il se remest en son chemin	1196
1309	et eirre tot le jor jusqu’al vespre	et erre iuscau uespre	1197
1310	et lors aproche d’une riviere	et lors aproche une riuiere	1198
1311	que l’en apeloit Aglonde	que len apele aglode	1199
1312	si en estoit l’eve molt parfonde	et si en estoit leue parfonde	1200
1313	et molt noire	et mout noire	1201
1314	Et quant il vint pres de l’eve	et quant il uint pres de leue|si uit	1202|1203
1315	si vit trois paveillons tendus pres de la rive;	iii|pauillons	1204|1205
		tandus delez la riuiere	1206
1316	si en estoit li uns grans	et en estoit li uns grans	1207
1317	et bials	et biax	1208
1318	et li autre dui estoient moien	et li autres estoient moien	1209
1319|1320	Et lors issi del greignor paveillon I|chevaliers tos desarmés	et lors issi de lun des pauilons uns cheualiers tous armez	1210
1321	qui li dist	qui li dit	1211
1322	que bien soit il venus	que bien soit il uenus	1212
1323|1324	et il li rent maintenant son salu|Ha	et il li rent tout maintenant son salu	1213
1325	sire		
1326|1327	fet il|vos me samblés chevaliers errans	ha: Sire uos me sanblez cheualiers errans	1214
1328	et je aim tos cels	et ie ain tous seus	1215
1329	qui en tel mestier usent lor vie	qui en tel maniere ussent lor uie	1216
1330	kar je meismes sui chevaliers errans	Et ie meismes sui cheualiers errans	1217
1331	et por ce vos vueil je proier	Si uos uoroie prier	1218
1332	que vos herbergiés anuit mes o moi;	que uos herberresiez hui|mais auec moi ennuit	1219|1220
1333|1334	kar se vos passés avant de ci|vos ne troverois se forest non	Car ce uos passez de ci uos ne trouerois ce fores non	1221
1335	si salvages	si sauuages:	1222
1336	que vos i porrois tost desvoier	que uos i porrois moutost desuoier	1223
1337	Et il est bien tens de herbergier	et il est bien tans de herbreger	1224
1338	ce veés vos bien : por ce vos lo	ce ueez uus|Por ce uos loie	1225|1226
1339	que vos remanois	que uus remenois	1227
1340	et vos avrois ostel bel	et uos aurois ostel	1228
1341|1342	et buen tot a vostre voloir|— Bials sire	et bel	1229
1343|1344	fet Lancelos|puis qu’il vos plest	et bon au ren chois Biax sire fait lanc̃ des	1230
1345|1346	je remaindrai|et por vostre proiere	que il uos plait ie remendrai por uostre proiere	1231
1347	et	et	1232
1348	por ce que vos dites	por ce que uos me dites	1233
1349|1350	que vos estes chevaliers errans|a	que uos estes cheualiers errans com ie sui Ices descent lancel	1234
1351	Lors descent		
1352	et vaslés saillent des autres paveillons	et uarles saillent des autres pauillons	1235
1353	si le desarment	si le desarment	1236
1354|1355	et li aportent I|mantel de samit legier a afubler por le chaut	et li portent un mantel de samis uermeil legier por le chaut	1237
1356	qui grans estoit ;	qui grans estoit	1238
1357	si le mainent el grant paveillon avec l’autre chevalier	si le mainnent el grant pauillon entre lui|et le cheualier	1239|1240
1358	Et lors parlerent ensamble	et lors parolent ensanble entre lui	1241
		et ses grans cheualiers	1242
1359	et s’entracointierent	et lanc̃|et satracointent	1243|1244
1360	et demanda li uns a l’autre de son estre	et demande li uns a lautre de son estre	1245
1361|1362	Li chevaliers enquiert a Lancelot|dont il vient	Si demande li cheualiers don il uient	1246
1363	et ou il vet	et don il ua	1247
1364	et quele aventure le maine	et quel auanture le mainne	1248
1365	si sol	si seul	1249
1366	et il li conte une partie de son estre	et il li conte une partie de son estre	1250
1367	et autre l’en çoile e;	et une partie len soile	1251
1368	et totes voies li dist	et totesuoie li dit	1252
1369	que en la cort al roi Baudemagu voldroit estre por soi deffendre vers un chevalier	que a la cort bademagu: uodroit estre|por soi desfandre uers un cheualier	1253|1254
1370	qui l’a apelé de traïson	qui apelela de traison	1255
1371	En ce qu’il parloient ensi	EN ce quil parloient ensamble	1256
1372	orent li escuier mise la table	si ont li escuier misses les tables	1257
1373	si vont laver;	Si ont laue	1258
1374	si s’asiet Lancelos	Si ont assis lanc̃	1259
1375	et li chevaliers	et le cheualier	1260
1376	et une damoisele	et une damoisele	1261
1377	qui molt ert bele	qui mout estoit bele	1262
1378	et estoit amie al seignor de laiens;	et estoit amie au signor de Laiens	1263
1379	si mengierent tuit troi ensamble	Si mengerent cui troi ensenble	1264
1380	mes cele	mais cele	1265
1381	qui Lancelot esgarde ne se puet saoler de lui veoir	qui lanc̃ esgarde ne se puet saouler de lui esgarder	1266
1382	Kar tant li samble bials qu’ele ne prisa onques mes bialté d’ome envers cesti :	Car tant li sanble biax:|que ele ne prisa onques	1267|1268
		mais biaute a ome enuers la soie nule rieu	1269
1383	si l’esgarde	Si le regarde	1270
1384	si viselment	si uiseument	1271
1385	que tot en laisse le mengier n’a autre chose n’entent	que tout en laisse le mengier	1272
1386	fors a lui remirer	Na autre chose nentant fors a lui remirer	1273
1387	Si ont li escuier osté le premier mes de sor la table c’onques la damoisele n’en tasta	Si ont li escuier oste le premier mes desus la table|que onques la damoisele nen tata	1274|1275
1388	ains pensa totes voies	ains pance totesuoies	1276
1389	Et en cel pensé li descent el cuer une	et en se panser li dessent une	1277
1390	si grant amor qu’ele aime Lancelot outre ce	si tresgrant amor|que ele aimme lautͣ	1278|1279
		outre ce	1280
1391	que feme n’ama mes home;	que fame nemma|mais home	1281|1282
1392	si li est avis	Si li est bien auis	1283
1393	que s’il l’amoit qu'ele seroit beneuree	que ce il lenmoit|que ele seroit bone euree	1284|1285
1394	Mais ci endroit n’em parole plus li contes	mais ci endroit nen parole plus li contes	1286
1395	kar ça avant le devisera	Mais sa auant en la deuine page le uos deuisera il bien	1287
1396	et comment ele l’ama merveillosement	et coment ele lenma meruilleusement	1288
1397	et comment ele le proia	et coment ele le proia	1289
1398	et la merveille	et la merueille	1290
1399	que ses amis en fist	que ses amis en fist	1291
1400	quant il sot qu’ele l’amoit	quant il sot|que ele lemmoit	1292|1293
1401	et comment cele morut por ce qu’il la refusa	et coument ele morust porce|que il la refasa	1294|1295
1402	tot ce vos trespassera li contes ci endroit por deviser une aventure qu’il lor avint el paveillon ou il estoient	Tout ce nos trespasera li contes ci endroit|por deuiser une auanture	1296|1297
1403	Ci dist li contes que	qui lor auint el pauillon|OR dit li contes	1298|1299
1404	quant il orent le secont mes eu	que quant il orrent le secont mes eu	1300
1405	es vos un chevalier armé d’unes armes vermeilles	E uous un cheualier arme a unes armes uermeilles	1301
1406	qui vint corant par devant le paveillon o grant compaignie de chevaliers	et uuit acorant par deuant le pauillon o grant compangnie de cheualiers	1302
1407	Et cil as armes vermeilles	et ciz as armes uermeilles	1303
1408|1409	qui devant venoit entre el paveillon a|et voit	qui deuant uenoit: entra el pauillon	1304
1410|1411	I|escuier	et uoit un escuier	1305
1412	qui servoit a la table	qui seruoit a la table	1306
1413	si estoit freres al chevalier de laiens	et estoit freres au cheualier de laiens	1307
1414	Et il cort maintenant cele part	et il cort maintenant cele part	1308
1415	si le prent par les espaules	et le prant as espaules	1309
1416	et le lieve devant lui sor l’arçon de la sele	et le trait deuant lui sor larson de sa cele	1310
1417	si s’en torne a tot	Si sen torne atant	1311
1418	Et quant cil del paveillon voit ce	et quant cil del pauillon uoit ce:	1312
1419|1420	si crie a Lancelot Ha|bials sire	Si crie a lanc̾	1313
1421|1422	je sui mors|se cil enporte ensi mon frere	a biax sire ie sui mors ce ciz en porte mon frere	1314
1423	kar il l’ocirra	Car il locirra ia	1315
1424	s’il n’est secors:	ce i nest cecorus	1316
1425	si vos pri por Dieu	Si uous pri por dieu	1317
1426	que vos i metés paine	que uos metes painne en lui rauoir	1318
1427	Et Lancelos saut de la table	Et lanc̃ saut de la table	1319
1428	et demande ses armes	et demande ses armes	1320
1429|1430	et I|escuiers vint avant	et uns escuiers saut auaut	1321
1431	si li dist Par foi	si li dist|Par foi sire	1322|1323
1432|1433	sire|vos armes	et uos armes	1324
1434|1435	et vostre cheval enmainent il ! — Voire|fet il	et uostre cheual enmainnent il	1325
1436|1437	par mon chief|ja por ce ne remaindra	uoire fait cil: par mon chief iaporte ne remandra	1326
1438	que je nes sieve	que ie nes sieue	1327
1439	Lors vient fors del paveillon	Lors uient fors del pauillon	1328
1440	et li chevaliers o lui	et li cheualiers o lui	1329
1441	et il esgarde cels	et regardent cex	1330
1442	qui s’en vont	qui sen uont	1331
1443	qui ja avoient passé l’eve par J	qui ia auoiet passe leue par|i	1332|1333
1444	pont de fust;	poncel de fust	1334
1445	et Lancelos demande al chevalier s’il remaindra	et lanc̃|demande au cheualier ce il remaindra	1335|1336
1446|1447	Sire|fet il	Sire fait cil non	1337
1448|1449	nenil|ains vos ferai compaignie	ains uos ferai compangnie	1338
1450	tant que nos aions trové	tant que nos aions troue	1339
1451	qui armes vos baut	qui armes nos baut	1340
1452	Lors acueillent lor voie tot a pié	Et lors acuellent lor uoie|tout a pie	1341|1342
1453	et vienent au pont	et uienent au pont	1343
1454	si passent outre	si passent outre	1344
1455|1456	et s’adrecent a I|tertre par ou li chevalier s’en vont;	et sadrescent au tertre par ou li cheualiers sen ua	1345
1457	si n’ont gaires alé	Si nont gaires ale	1346
1458	quant il encontrent I	quant il uoient|i	1347|1348
1459	chevalier armé d’unes armes noires	cheualier arme a unes armes noires	1349
1460	qui venoit al pont par I	qui uenoit au pont par	1350
1461	chemin de travers	i chemin de de trauers	1351
1462	Et quant il voit Lancelot	et quant il uoit lanc̃	1352
1463	si s’areste	si sareste	1353
1464	por ce que bien le conoissoit	por ce que bien le quenoissoit	1354
1465	si li demande ou il vet ensi a pié tos desammés	Si li demande ou il ua|Si a pie	1355|1356
1466	Qui estes vos	et ansi desarmes	1357
1467|1468	sire chevaliers|fet Lancelos	Qui estes uos fait il sire cheualiers	1358
1469|1470	qui me demandés ou je vois|— Je sui	qui me demandes ou ie uois	1359
1471	fet il		
1472|1473	I|chevaliers d’estrange païs	Ie sui fait il de cest estrange pais	1360
1474	mais molt me merveil de ce	mais mout me merueil de ce	1361
1475	que je vos voi ensi aler	que ainsi uos uoi aler	1362
1476	Et Lancelos li conte	et lanc̃|li conte	1363|1364
1477|1478	comment il estoit herbergiés|et comment I	comment il estoit ainsi herbregiez	1365
1479|1480	chevaliers vint laiens ou il menjoit|qui prist a force I	et coment li cheualiers enporte lescuier	1366
1481	vaslet		
1482	et le mist sor le col de son cheval		
1483|1484	Et encore m’a il plus meffet|fet Lancelos	et encor ma il plus mesfait fait fait lanceloz	1367
1485	kar cil	Car cil	1368
1486	qui avec lui vindrent enporterent mes armes	qui auec lui uindrent enportent mes armes	1369
1487|1488	et enmenerent mon cheval|—	et en mainnent mon cheual	1370
1489|1490	Quel guerredon|fet cil	Quel guerredon porroi ge atandre de uus se ie uos bailloie mes armes	1371
1491	porroie je atendre de vos		
1492	se je por vos me desarmoie		
1493	et vos bailloie mes armes		
1494	et mon cheval	et mon cheual	1372
1495|1496	— Certes|fet Lancelos	Certes fait lanc̃	1373
1497	tel com vos deviseriés	tel com uous deuiserois	1374
1498|1499	— Se vos|fet il	Ce uous fait cil me creantes	1375
1500|1501	el premier lieu ou je vos troverai armé|por	que el premier lieu ou ie uos troueroie arme	1376
1502	que je soie desarmés		
1503	me creantés a doner vos armes Ie vos bailleroie les moies	puis que ie fusse desarmes me donriez uos armes|le uous bailleroie les moiees	1377|1378
1504|1505	— Certes|fet Lancelos	Certes fait cil	1379
1506	si ferai je	si ferai ge	1380
1507|1508	por|que vos ne me truisiés combatant	puis que uos ne me trussiez conbatant	1381
1509	Et cil descent maintenant	et cil descent maintenant	1382
1510	si se desarme	si se desarme	1383
1511	et baille a Lancelot tot son hernois	et baille a lanc̃ son harnois	1384
1512	et il s’en appareille	et il sarme	1385
1513	et monte en son cheval	et monte en son cheual	1386
1514	puis dist a son oste qu’il s’en retort; Imes il dist	Puis dit a son oste quil sen retort|et il dit	1387|1388
1515	que non fera	que non fera	1389
1516	Si ferois	Si ferois fait lanc̃	1390
1517	fet Lancelos a lar je conoistrai bien les armes a celui	Car ie quenoistrai bien ciax as armes|que ie uois querant en	1391|1392
1518	que je vois querant en quelque lieu je les truisse	quel que lieu|que ie les truisse	1393|1394
1519	Et cil dist	et cil dit	1395
1520|1521	puis qu’il velt|s’en retornera:	puis quil le ueit il sen retornera	1396
1522	si s’en vet	Si sen ua	1397
1523	et enmaine o lui le chevalier	et enmainne le cheualier auecque lui	1398
1524	qui molt est liés de ce	qui mout est liez de ce	1399
1525|1526	que Lancelos li doit I|guerredon	que lanc̃ li doit guerredoner	1400
1527	Et Lancelos aquelt son chemin aprés cels	Et lanc̃ aquiet son chemin apres ciax	1401
1528	que	que il sieut	1402
1529	il sieut tant qu’il est venus el tertre en haut	tant que il est uenus el haut tertre	1403
1530|1531	et lors voit devant lui la forest|que l’en apele la forest des Trois Perilx	et lors uoit deuant lui la forest des trois perilx	1404
1532	et ce por quoi ele fu ensi apelee devisera bien li contes ça avant	et ce porquoi ele fu ainsi apelee ce deuissera li contes sa auant	1405
1533	Quant il fu amont el tertre	Quant lanc̃|fu amon el tertre	1406|1407
1534	si esgarde devant lui	si regarde	1408
1535	mais il ne voit nul de cels	Mais il ne uoit deuant lui nus de ciax	1409
1536	que il queroit	que il guiert	1410
1537	kar il s’estoient ja ferus en la forest	Car il cestoient ia feru en la forest	1411
1538	Et totes voies sieut il les esclos des chevals	et totesuoiez sieut il les escloz des cheuaus	1412
1539	tant que il vient a l’entree de la forest;	tant que il uient en lentree	1413
1540	et lors encontre une damoisele tote chenue	et lors encontre une dame tote chenuee	1414
1541	qui chevalchoit molt cointement	qui cheuauchyt mout coitement	1415
1542	et estoit tote deslie	et ert tote desliie	1416
1543	ses treces par ses espaules comme pucele	ses tresces par ses espaules comme pucele	1417
1544|1545	et avoit en son chief l|chapel de roses	et auoit en son chief un chapelat de rosez	1418
1546	kar c’estoit entor la Saint Johan	Car cestoit Entor la feste saint iehen	1419
1547	Il le salue	Il la salue	1420
1548	et ele li dist	et ele li dist	1421
1549	que bone aventure li doinst Diex	que bone auauture li doint diex	1422
1550|1551	Damoisele|fet il	Dame fait lanc̃	1423
1552	me savriés vos a dire	me saurrez uos adire	1424
1553|1554	quel part uns chevaliers o unes armes vermeilles s’en vet|— En non Diex	quel part uns cheualiers a unes armes uermeilles sen ua	1425
1555|1556	fet ele|je le vos enseigneroie bien	En nodieu fait ele ie le uos ensangneroie bien ce ie uoloie	1426
1557	se je voloie		
1558|1559	— Dites le moi|fet il	Dites le moi fut il par couent	1427
1560|1561	par covent|que je soie vostre chevaliers el premier lieu ou vos me requerrois	que ie soie uostres cheualiers el premier lieu ou ie buos trouerai	1428
1562|1563	— Se vos me creantés|fet ele	Se uous me uoles creanter	1429
1564	que vos me sievrois de	que uos me siere de	1430
1565	quel hore	quel hore	1431
1566|1567	que vos en semoigne|je le vos enseignerai	que ie uus en semongne ; ie le uos en sangnerai	1432
1568	Et cil li creante	et il li creante	1433
1569	dont il se repenti	dont il se repanti	1434
1570	puis molt durement tel hore fu	puis mout durement tel hore fu	1435
1571|1572	Or alés|fet ele	Or uos en alez fait ele par ci	1436
1573	tot cest chemin		
1574	si li mostre I	si li mostre|i	1437|1438
1575	sentier estroit	estroit santier	1439
1576	qui aloit al travers de la forest	qui aloit outre uers de la forest	1440
1577|1578	Si ne tornés|fet ele	Si ne tornez de nule part	1441
1579|1580	de nule part|et quant vos avrois alé entor demie lieue	et quant uos aures ale entor demie lieue :	1442
1581	si verrois delés I	si uerres delez|i	1443|1444
1582	vivier trois paveillons tendus	uanier aux pauillons tandus	1445
1583	La dedens troverois le chevalier	La dedens troueres le cheualier	1446
1584	que vos querés	que uos queres	1447
1585	que l’en apele Arramant le Gros;	que len apele arramant le gros	1448
1586	si le conoistrois a ces enseignes qu’il a en mi le front II	Si le quenoistres a ses ansangnes quil a el fronc|ii	1449|1450
1587	plaies	plaieez	1451
1588	Or vos en poés aler	Or uos en poez aler	1452
1589	mais que vos m’aiés dit vostre nom	mais que uos mauez dit uostre non	1453
1590	Et il se nome molt a envis	et il se nome mout a enuiz	1454
1591|1592	et totes voies li dist qu’il a non Lancelot del Lac|Alez a Dieu	et totesuoiez dit il quil a non lanc̃ del lac	1455
1593|1594	fet ele|Atant s’en part	si sen part atant	1456
1595	et s’en vet tot le chemin qu’ele li avoit enseigné	et sen ua tout le chemin|que cele li auoit ensangnie	1457|1458
1596	si grant aleure com il plus puet del cheval traire	Si grant aleure comme il puet del cheual traire	1459
1597	tant que il atainst les chevaliers	Et tantost ataint les cheualiers	1460
1598	que il sievoit	que il suoit	1461
1599	Et cil lor i escrie	et il les escrie	1462
1600	si haut	si haut	1463
1601	que bien porent oîr	que bien le pueent entandre	1464
1602|1603	et maintenant li vient acorant li uns d’eus|l’escu al col	et maintenant li uient acorant li uns daus lescu au col la lance el poing	1465
1604	le lance el poing		
1605	et fu armés de totes armes	et fu armes de toutes armes	1466
1606	Et Lancelos le fiert	et lanc̃ le fiert	1467
1607	si que	si que por le haubert ne remaint:|que il ne li meste parmi le cors	1468|1469
1608	pour le hauberc ne remaint qu’il ne li met par mi le cors le fer del glaive	et le fer|et la glauie	1470|1471
1609	si l’empaint bien com cil	Si lenpant bien comme cil	1472
1610|1611	qui assés ot|et cuer	qui auoit assez cuer	1473
1612	et force:	et force	1474
1613	si le porte del cheval a terre	Si le porte a terre	1475
1614	et retrait son glaive a lui;	et retrait son glaiue a lui	1476
1615|1616	si voit I|autre venir tot appareillié de joster	Si uoit un autre uenir a lui tout aparillie de ioster	1477
1617	et il nel refuse pas	et il nel refuse pas	1478
1618	ains li torne le chief del cheval	ains li torne le chief del cheual	1479
1619	et cil	et cil	1480
1620	qui vint acorant li done tel cop en l’escu	qui uint acorant li done tel cop sor lescu	1481
1621	que tote sa lance vole en pieces	que la lance uole tote en pieces	1482
1622	Et Lancelos	et lanc̃	1483
1623	qui un poi porta sa lance bas	qui tuit sa lance|i	1484|1485
1624	l'ataint par desus l’arcon de la sele	pou bas le fiert par desus larson de la sele	1486
1625	si le fiert	Et le fiert	1487
1626	si que les mailes del hauberc ne pueent soffrir le grant cop	si que les maillez de haubert ne pue en soufrir le grant cop	1488
1627|1628	que li glaives ne li voist par mi le cors|si que li fers pert d’autre part;	et li glaiuez li pert de lautre part	1489
1629	si l’empainst	et il len paine	1490
1630	si durement qu’il le porte a terre	si durement|que il porte	1491|1492
1631	et lui	et lui	1493
1632	et le cheval	et le cheual ensanble a terre	1494
1633	Et lors dient cil	Et lors dient cil	1495
1634	qui devant s’en aloient	qui deuant sen aloret	1496
1635|1636	que molt joste bien li chevaliers|quant	que mout ioste bel li chrł	1497
1637|1638	Il|de lor meillors compaignons a ensi abatus	que deus de nos mallors cheualiers a abatus	1498
1639	Et Lancelos laisse corre a els tos	et lanc̃ lait corre a aus	1499
1640	qui encore estoient nuef;	qui encor estoient	1500
1641	si ot l’espee traite	ix|Si trait lespee	1501|1502
1642	por ce que ses glaives estoit brisiés al chevalier qu’il ot derrainement abatu ;	que ses glaiues estoit abatus|et brisiez au daurien cheualier	1503|1504
1643|1644	si lor detrenche lor escus|et lor depiece lor hialmes	Si lor detranche lor hiaumes	1505
1645	et lor ront les haubers sor les bras	et lor uont Lor haubers sor|Les bras	1506|1507
1646	et sor les espaules;	et sor les espaulez	1508
1647	si fet tant par sa proesce	Si fait tant par sa proesce	1509
1648	que tuit cil	que tuit cil	1510
1649	qui le voient s’en merveillent	qui le uoient sen esmaient|et merueillent	1511|1512
1650	Et la ou il voit le chevalier as armes vermeilles	Et la ou il uoit le cheualier as armes uermeilles:	1513
1651|1652	si nel mesconoist pas|ains li adresce par mi els tos	Si ne le mesquenoit pas ains li adresce parmi aus cous	1514
1653	et li done	et li done	1515
1654	si grant cop par mi le hialme	si grant cop parmi le hiaume	1516
1655	que cil est	que cil est	1517
1656|1657	si estordis qu’il ne se puet es arçons tenir|ains vole a terre	si estordiz quil ne se puet es arsos tenir ains uole a terre	1518
1658	Et Lancelos li va par desus le cors a cheval	et lanc̃ li ua par desus le cors A cheual	1519
1659	tant que cil pert la vertu	si que tout le cors li debrise|et li faut la uertus	1520|1521
1660|1661	et la force tote|Et lors sont li autre molt esmaié	et li forte tote Lors sont tuit li autre esmaiet	1522
1662	kar bien cuident	Car bien cuident	1523
1663	que cil soit mors	que cil soit mors	1524
1664	qui lor sires estoit;	qui lor sires estoit	1525
1665	si se metent en paine del vengier	Si ce mestent en painne de lui uangier	1526
1666	et corent sus a Lancelot tuit ensamble	et courent sus lanc̃|tuit	1527|1528
		ensanble	1529
1667	Mais il nel truevent pas	Mais ne le trueuent pas	1530
1668	si esbahi qu’il ne soit tos pres de soi deffendre;	si esbahit :|que il ne soit tous pres de lui desfandre	1531|1532
1669	si lor abandone son escu	Si lor abandone son escu	1533
1670	et tient l’espee	et ci ot lespec	1534
1671	dont il lor done grans cops par la ou il les ataint	dont il lor done grans cox|par la ou il les ataint	1535|1536
1672|1673	ne onques por pooir qu’il aient ne li porent tolir terre|ains se met par mi els maintes fois	et onques por pooir quil aient ne li purent tolir terre ains sen ua parmi aus tous maintes fois	1537
1674	quel gré qu’il en aient	quel gre|que il auient	1538|1539
1675	Et de tant li avient il bien qu’il n’aconsieut chevalier a droit cop qu’il ne face s’espee sentir en char nue ou il nel port del cheval a terre:	et detant li auient il bien quil nataint cheualier a droit cop; quil nel face santir en char nue|ou il ne le port del cheual a terre	1540|1541
1676	si lor esrache les escus des cols	si lor esrache les escuz des cox	1542
1677	et les hialmes des testes	et les hiaumes des testes	1543
1678	et lor decoupe poins	et lor decope|et poins	1544|1545
1679	et bras a	et bras	1546
1680	et se hurte en els de cors	et se hurte en aus|de cors	1547|1548
1681	et de cheval ;	et de manbres	1549
1682	si en a V	Si en a	1550
1683	si atornés qu’il gisent a terre	u	1551
1684	si conreé qu’il n’ont pooir de relever	si accenes quil non pooir de leuer eux	1552
1685	Quant li autre voient ce	Et quant li autre uoient ce;	1553
1686	si lor est avis que	si lor est auis	1554
1687|1688	s’il i demorent plus|il n’em pueent eschaper sans morir	que ce il i demeuret plus quil nen pueent eschaper sans mort	1555
1689	et por ce s’enfuient al plus tost qu’il pueent vers la forest ou il la voient plus espesse	Et por ce sen fuient au plus tost|que il pueent uers la ou il uoient plus espesce la forest	1556|1557
1690	Et Lancelos ne les sieut mie granment	et lanc̃	1558
1691	ains retorne al chevalier qu’il ot abatu	ne les sieut mie grant piece ains sen retorne au cheualier quil ot abatu	1559
1692	celui as armes vermeilles	Celui as armes uermeilles	1560
1693	kar il voldra savoir	Car il uodra sauoir	1561
1694	qui il est	qui il est	1562
1695	Et quant il i est venus	Et quant il i est uenu	1563
1696	si trueve l’escuier	si trueue lescuier	1564
1697	que il queroit	que il|que il queroit	1565|1566
1698	que on avoit mis sor I	que len auoit mis seur|i	1567|1568
1699|1700	roncin|les mains liies triés le dos	roncin: les mains liees derier le dos	1569
1701	et vient a lui	et il uient a lui	1570
1702	si le deslie	si les deslie	1571
1703	Et quant il se sent delivrés	et quant ciz ce sent deliures	1572
1704	si li chiet as piés	si li chiet as piez	1573
1705	et le mercie de Dieu ;	et le mercie de dieu	1574
1706	et Lancelos descent	et lanc̃ dessent	1575
1707	si li baille son cheval a garder	si li baille son cheual a garder	1576
1708	puis vet al chevalier	et ua au cheualier	1577
1709	qui ja s’estoit relevés en son seant	qui ia cestoit releues en son ceant	1578
1710	si estordis qu’il ne veoit gote	Si estordis quil ne ueoit goute	1579
1711	Et Lancelos li esrache le hialme de la teste	Et lanc̃|li errache le hiaume de la teste	1580|1581
1712	si felenessement	si felenescement :	1582
1713	que cil flatist à terre des paumes	que ciz flatit a terre des paumes:	1583
1714	et de tot le viaire;	et de tout le uiaire	1584
1715	si saine del nes	Si sainne dou nes	1585
1716	et del front trop durement	et dou front trop durement	1586
1717	Et Lancelos dist qu’il l’ocirra	et lanc̃	1587
1718	s’i ne se tient por outré;	dit quil locirra cil ne se tient por outres	1588
1719	et cil est	et cil tantost se repasme	1589
