643	e Ronpieron Por muchos lugares 	Et lors lassaillent moult ireement tous les autres.|Si luy depecent son escu et son heaume et son haubert et le blecent en plusieurs lieux. 	730|731
644	mas el no daua cosa por aquello quele façian 	mais il ne luy chault de riens|quil luy facent. 	732|733
645	tanto estaua de sañudo 	car tant est doulent 	734
646|647	e dexo de correr aellos |Con gran yra 	qui plus ne puet si leur laisse courre de grant ire. 	735
648	e dauales dela espada tales Golpes 	et leur donne de lespee si grans coups 	736
649	asi quelos façia de si arredrar e Lançarote Paro mientes en aquel 	que tous les fait guenchir auant luy |Lors regarde celuy des quatre 	737|738
650	que mas mal le façia 	qui luy faisoit plus de mal a son adius. 	739
651	que hera muy grande e muy fuerte 	et il estoit moult grant et moult fort. 	740
652	e diole asi vn golpe tan grande ençima del yelmo 	et lancelot lactaint par le heaume si grant coup 	741
653	que el fuego fiço salir del 	quil en fait saillir le fer. et lespee glace |qui de droit ne fu pas ferue 	742|743
654|655	e el golpe desçendio al honbro |e Como fue dado de gran fuerça 	si luy descend dessoubz la senestre espaule le coup fu grant et feru par yre. 	744
656	asi que porla loriga no finco 	et bien y parut. |car lespee coula parmy lespaule au cheualier 	745|746
657	quele no derribase el braço conla espada en tierra 	si qui le braz a toute lespaule chey dessus le pauement.	747
658	e el cauallero conel gran dolor cayo luego en tierra amorteçido 	et il trebuche a terre |et se pasme de langoisse 	748|749
659	e los otros desque aquel golpe vieron fueron muy desmayados 	qu il sent. |et lor sont moult esmayez les autres troys. 	750|751
660	e fiçieron mal senblante dese defender porlos grandes golpes que façia 	si font moult mauuaiz semblant de deffedre pour le grant coup 	752
661	e porla espada 	quilz ont eu. et pour lespee 	753
662	que auia sentido cadavno enlas carnes 	que chascun a sentie icquau sanc 	754
663	e lançarote no cato 	Et lancelot 	755
664	mas aquel que derribo 	qui oncquez ne recroit leur court sus 	756
665	ante dio al otro vn tal golpe por çima del yelmo quele fiço dar con anbas manos en tierra 	et en fiert lun amont ou heaume|si quil le fait flatir a terre des deux paumes 	757|758
666	e desque los otros esto vieron començaron a foir por guaresçer 	Et quant les autres deux uoyent ce |si tournent uers luys 	759|760
667	e lançarote alcanço 	pour fouir a garison. 	761
668	aquel que yua de tras e firiolo asi duramente entre el onbro y el escudo 	Et lancelot actaint le derrain |si le fiert entre lescu et le braz 	762|763
669|670	que tenia enbraçado |que el braço conel escudo le fiço bolar en tierra 	si quil luy trenche le poing. 	764
671	e el cauallero fuese fuyendo ansi llagado 	et lescu chiet a terre a cil tourne en fuye 	765
672	como estaua e lançarote fuese enpos el otro 	qui se sent mehaigue |Et lancelot reuient a lautre 	766|767
673	que auia fincado 	qui se releuoit. 	768
674	e firiolo asi enlo alcançado ençima del yelmo 	si le fiert de lespee si grant coup 	769
675	que selo fiço volar dela cabeza 	quil luy. fait uoler le heaume en la place.	770
676	e el cauallero desque vido su cabeça desarmada Con pauor de muerte 	Et quant il sent son chief nu 	771
677	que ovo pidio le merçed 	si me mercy 	772
678	e dixole 	et dit	773
679	ay buen cauallero no me matedes 	quil ne loccie pas 	774
680	que yo fare toda vuestra voluntad 	car il est prest de faire sa uolente.	775
681	tu me juraras 	Or te conuent donc fiancer 	776
682	dixo lançarote que llebes el cuerpo demi señor galeote ala dolorosa guarda 	que tu conduyras le corps de monss galehot a la douloreuse garde. |Et ilecquez le feras garder 	777|778
683|684	e desque |y fueres 	tant que ie y uiegne. 	779
685	si te preguntaren quien te ymbia 	Et se len te demande 	780
686	tu les diras 	qui te y enuoye. tu diras cil 	781
687	que el cauallero delas armas blancas 	qui eut les armes blanches le iour 	782
688	que el castillo conquisto te ymbia alla 	que le chasteau fut conquis. 	783
689	e el cauallero selo juro 	et il luy fiance 	784
690	asi façer 	que ainsi le fera il.	785
691	e lançarote se fue luego parala tumba 	Lors prent lancelot la lame par le plus gros bout 	786
692	e tomo a manos el cobertor Porel Cabo 	si tire de si grant force 	787
693	que mas hera grueso asi afuerça 	qua pou quil ne se derompt tout. |si	788|789
694|695	porlo leuantar |quela sangre le quebro porla cabeça 	que le sang luy uole par le nes et par la bouche.	790
696	e porlas narizes quelas açerdas de todo el cuerpo se le estendieron muy fuertemente 	et le corps luy sue dangoesse. |mais pour toute la destrece ne demeure pas 	791|792
697	asi que por fuerça ovo el cobertor a leuantar maguer Mucho hera pesado 	quil ne leue la tombe en hault. |ne nulle douleur	793|794
698	Mas nunca el tal duelo ovo como estonçe 	quil eut oncquez |mais ne fu rien a celle douleur 	795|796
699	e tal Pesar 	quil eut	797
700|701	quando el vido el cuerpo de Galeote |e estaua armado de todas armas 	quant il uu le corps galehot tout ainsi arme 	798
702	e tenia su espada cabe 	comme il estoit.|si trouua lespee pres de luy 	799|800
703	si que hera muy buena e clara 	qui moult estoit bonne et bele	801
704	e sin falta el se ouiera conella muerto 	Et sans faille de lespee mesmes se fust il occis 	802
705|706	si la donçella |Que del lago auia venido delas manos no sela tirara 	se la damoiscle ne luy eust tollue erraument. 	803
707	e luego fiço façer lançarote vnas andas 	Lors fist lancelot faire une litiere de fust. 	804
708|709	e cobrir de muy Ricos paños |e poner enellas el cuerpo de Galeote 	et la fist couurir des plus riches pales de leans.	805
710|711	e el cauallero Dixo a lançarote señor yo vosloaria |si vos plugiese 	Et quant il leut atournee au plus richement 	806
712|713	que luego Mouiese de aqui conel cuerpo de galeote |Porque dixo lançarote 	quil peut. le cheualier prisonnier luy dist. sire fait il se len mouuoit de nuyt 	807
714	porque señor dixo el cauallero 	ce seroit grant sens. 	808
715	porque si los caualleros desta tierra lo supieren 	pour quoy fait il. par ce |que si les cheualiers de ce pays sauoient 	809|810
716	que de aqui lo queredes llebar faran guardar los tres pasos 	que len le deust la porter ilz feroient guecter les trepas 	811
717	asi que sera detenido en algund lugar 	si quil seroit arreste en aucun lieu. et pour ce uous loueroye ie |quil meust maintenant 	812|813
718	e poresto seria bien 	car il sera bien esloigne 	814
719	que nos alongasemos de aqui esta noche vnas diez leguas bien acordades Dixo lançarote 	auant quil soit iour de uingt lieues anglesches. |Et il si accorde bien. 	815|816
720	e luego fiço poner las andas sobre dos palafrenes muy andadores 	si mect la litierie sur deux palefroys amblans. 	817
721	e lleuarlo asi Mas mucho ouieron gran pesar los frailes quando asi lo vieron lleuar 	et emportent ainsi galehot hors de la religion |si en font les freres grant deul. 	818|819
722	e lançarote fue gran pieça 	et sont moult corroucez et doulans de ce |qui len lemporte.	820|821
723|724	llorando conel cuerpo de Galeote |e diçiendo sus proezas e su valor 	Et lancelot li conuoye grant piece de nuyt plourant et plaignant et regretant sa prouesce et sa ualeur. 	822
725	e si no fuese porla donçella 	et se ne fust la damoisele	823
726	que del lago auia venido 	qui auec luy estoit. 	824
727	Mucho fiziera mayor duelo 	moult en eust plus fait |quelle ne fist	825|826
728	mas ella selo estoruaua 	mais elle len destourna 	827
729|730	e anteque lançarote del cuerpo se tornase |Dixo al cauallero 	et il deffendy au cheualier 	828
731|732	yo vos defiendo |Que el Cuerpo demi señor galeote no fagades enterrar 	quil ne le fist mectre en terre 	829
733|734	fastaque yo mesmo alla vaya |e el Cauallero dixo 	uicquez a ce que luy mesmes y fust.	830
735|736	que asi lo faria |entonçe se partio dellos lançarote 	Si se part atant lun de lautre 	831
737	e tornose al abadia 	et lancelot retourne a labaye|si si couche 	832|833
738	mas en toda aquella noche no quiso comer ni veuer 	ne oncquez la nuit |ne uoult boyre ne manger pour chose 	834|835
739	por cosa que le dixesen 	quon luy dist 	836
740	e non fazia sino llorar 	ains pleura et dolousa |si luy ennuyoit moult le iour 	837|838
		qui tant demouroit a uenir. Au matin 	839
741	e mucho se quexaua 	si tost|que le iour apparu 	840|841
742	Porque tanto aquella noche le duraba 	se leua lancelot |et ouy misse luy et la damoisele 	842|843
743	e luego Que el dia aparesçio lançarote se leuanto 	et puis sarma. 	844
744|745	e la donzella otrosi |e fueron a oyr misa 	et lors luy dist elle les nouueles de boort. 	845
746|747	e desque la misa fue aCabada Armose |e despidiose del fraile 	et ce 	846
748|749	e entro ensu camino conla donzella e ellos asi yendo la donçella le conto nuebas de boores |e de como le contesçiera enel castillo de ongeforte 	quelle en auoit ueu deuant hunguefort. 	847
750	e el fue dello muy alegre 	et il en fut moult lie 	848
751|752	e ella le dixo sabed señor |que vos a buscado 	si luy dist. Sire il uous uait querant ne iamais ne finera 	849
753|754	e nunca jamas quedara |fastaque vos falle 	iucqua ce quil uous ait trouue. 	850
755	Ay donçella dixo lançarote 	Haa damoistle fait il 	851
756	si vos lo cuidades fallar yo vos querria rrogar 	se uous le cuidiez trouuer auant moy ie uous uoudroye prier 	852
757	que fiziesedes tanto pormi quele llebasedes esta espada 	que uous feissez tant pour amour de moy |que uous luy portassee ceste espee 	853|854
758	que fue demi señor galeote 	qui fu a messire galehot et luy dices |quil la porte de par moy 	855|856
		car moult est bonne. 	857
759	e dezilde quela traiga pormi amor 	Et elle dit|quelle le trouuera tantost 	858|859
760	ca mucho es buena e fermosa yo lo fare dixo la donçella de grado Luego se partio el vno del otro 	et que bien fera ce message. |si se part atant de luy. 	860|861
761|762	e lançarote se fue contra el castillo de florenga |e andubo tanto 	et il sen ua tout droit. uers le chastel de fleogo 	862
763	que llego alla ante de prima 	si y uint a heure de prime. 	863
764	e vio ante la villa gran jente alrrededor de vn fuego 	et il regarde es prez dehors la uille. |si uoit moult grant gent entour ung feu. 	864|865
765|766	e en aquel fuego auian de quemar ala hermanade meliangas |e lançarote 	Et quant il aparceut le feu 	866
767	que aquello vido dio delas espuelas al cauallo 	si a paour de la damoisele 	867
768|769	e llego alla ca bien cuidaua |que ya quemauan la donçella 	qui ia estoit amenee au feu pour destruire. 	868
770	e quando el y llego vio la donçella estar ante el fuego envna muy pobre camisa 	si estoit en sa pure chemise 	869
771	e tenianla seis billanos tres dela vna parte e tres dela otra 	et la tenoient six pautonniers dune part et troys dautre |si nactendoient a la gecter 	870|871
772|773	e no esperauan al sino el mandamiento delos juezes |parala hechar enel fuego 	ou feu fors le commandement des uiges. 	872
774	e la donzella lloraua muy fuertemente 	Et elle plouroit merueilleusement 	873
775	e llamaua a lançarote e deçia ay mi buen cauallero 	et regretoit lancelot. |Haa lancelot gentilz cheualier De celle mesmes matiere. 	874|875
776	e pluguiese agora anuestro señor 	que pleust ores a nostre seigneͬ 	876
777	que supiesedes estas nuebas 	que uous sceussez ceste nouuelle 	877
778	e estubiesedes çerca de aqui media legua 	et que feussez a demye lieue pres de cy. 	878
779|780	e conla ayuda de dios |e conla vuestra seria yo aCorrida e librada 	et certes a maide de dieu et de la uostre seroye ie encor ennnuyt rescousse malgre tous mes ennemys. 	879
781	e mas vos no lo sabedes 	et si ne li scauez pas. 	880
782	e asi me conuerna a morir 	si me conuiendra ores mourir pour la uie |que ie uous sauuay. 	881|882
783	mas no me pesa tanto pormi como porel pesar 	mais certes il ne men poist pas tant pour moy	883
784	que vos abredes 	comme il fait pour le corroux. 	884
785	Quando lo supieredes Mas esto me conorta mucho 	Mais ce me reconforte moult. |car ie scay bien 	885|886
786	que yo se quelas donçellas ganaran mucho enla my muerte 	que les damoiseles |qui queront tant en ma mort	887|888
787	que jamas donzella no vos rrequirira de ayuda 	que iamais nulle ne uous requerra daide. 	889
788	que le vos non fagades tanto que vos acuerde demi 	a qui uous faillez tant|quil uous rememberra de moy. 	890|891
789	ca vos sodes tan noble e tan franco 	Car uostre cuer est si franc 	892
790	que siempre dareis buen galardon a todos aquellos 	quil ne puet estre sans trop grant merite rendre a toutes celles 	893
791	que demi se lamentaren 	qui de par moy uous reclament. 	894
792	e mucho me sera buena al alma esta muerte que Resçibire 	Si mest adius |quil est moult mieulx a ma uie de mourir 	895|896
793	porque saque de prision atan noble ome 	pour si hault affaire et pour gecter de prison si uaillant homme 	897
794	Como vos que vos fuerades muerto 	comme uous estes 	898
795	porla deslealtad de meliangas 	que uous feussez mort par la desleaute de meleagan 	899
796	que en prision vos tenia 	qui en prison uous auoit mis par traison. 	900
797	por su gran traiçion e esto deçia la donçella llorando muy dolorosamente 	Ainsi disoit la damoisele moult tendement plourant. 	901
798	e lançarote vino luego aquella parte 	Et lors uint lancelot poiguant celle part 	902
799	do la donçella tenian 	ou il la uit. |si dist a ceulx	903|904
800	e dixo aquellos que la tenian dexadla donçella 	qui la tiennent laissez la damoisele par courtoisie. 	905
801	Porque señor dixo vn cauallero que delante salio la dexaran ellos 	Et ung cheualier arme sault auant et dist. 	906
802	Porque dixo lançarote 	pour quoy la lairrons nous. par ce fait il 	907
803|804	Porque no auedes derecho |Porque la matar 	queͥ uous nauez droit de la faire mourir. 	908
805	si auemos dixo el muy grande 	Si auons fait il 	909
806	ca ella fue acusada de muerte 	car ie lay actainte dung meurtre 	910
807	e ella se ofreçio a defender porvn cauallero 	dont ie lapellay. |et elle sen offry deffendre 	911|912
808	mas nunca fallo cauallero 	mais elle ne trouua oncquez 	913
809	que porella quisiese tomar escudo 	qui pour lie en prist escu. 	914
810	e no es marauilla 	et ce nest pas de merueilles. 	915
811	ca cadavno sabe su deslealtad 	car chascun sceit bien	916
812	e que es Esta deslealtad dixo lançarote 	quelle en a desloyaument ouure |de quoy fait lancelot. 	917|918
813	Que es dixo el Cauallero 	De ce fait il 	919
814	que solto De Prision a lançarote 	quelle deliura lancelot 	920
815	Para matar a meliangas su hermano 	pour occire meleagant son frere. 	921
816	si vos dixo lançarote 	Se uous ousiez monstrer fait lancelot 	922
817	osaredes mostrar que hizo deslealtad o traiçion enlo soltar yo so presto dela defender 	quelle ait fait traison ne murmure. ie suys prest du deffendre. |Oui estes uous fait il. Ie suys ung cheualier fait il 	923|924
		qui uiens ceste part 	925
		pour deffendre ceste damoisele. 	926
818|819	Quien sodes vos dixo el cauallero |vn cauallero dixo Lançarote 	par foy sire fait il. il ne men conuiendroit ia combatre 	927
820|821	so que vengo aqui |poresta donçella defender 	si ie uouloye. 	928
822|823	Por buena fee dixo el cauallero si yo quisiere no me conbatiria mas sobre esta rrazon |que ayer se cumplio el plazo 	Car ia pieca en est elle ataincte 	929
824|825	enque ella se auia de defender |mas yo se 	puis quelle na peu trouuer 	930
826	que no fallo quien la defendiese 	qui la deffende. 	931
827|828	mas yo se |que ella es asi enesto desleal 	mais ie sens ma querele a si loyal et si droiturier 	932
829	que no a cauallero enel mundo 	quil ny a cheualier ou monde uers 	933
830	conquien no me osare conbatir sobre esta Razon 	qui ie ne losasse bien prouuer au grant droit 	934
831	ansi me esfuerço enmi gran derecho enel nombre de dios dixo lançarote agora paresçera 	que ie y ay. |Certes fait lancelot ores y parra 	935|936
832|833	que yo so presto dela defender |de verdad dixo el cauallero 	car ie suys prest de la defendre uers uous uoire fait il. 	937
834	porla mi caueza vos moriredes 	par mon chef uous en mourres comme traistre 	938
835	porende como traidor e desleal e luego tiraron la donçella del fuego 	et desleal |Lors tirent la damoisile au dessus du feu. et les cheualiers se esloiguent si tost 	939|940
836	e los caualleros se dexaron correr el vno contrael otro 	que les cheuaux peuent courre |et sentrefierent des glayues si fort 	941|942
837	quanto los cauallos los pudieron lleuar 	quilz les font uoler en pieces. 	943
838	e firieronse delas lanças tan fieramente 	puis sentrehurtent des corps et des uisages 	944
839	asi que las lanças fiçieron bolar en pieças 	si quil ny a celuy 	945
840	e toparon envno delos cuerpos e delos yelmos 	qui ne soit tout estourdy et estonne. 	946
841	que el caballero no se pudo tener enla silla 	mais le cheualier est si estonne |qu il ne puet tenir en sele. 	947|948
842|843	ante cayo del caballo en tierra |e al caer ouierasele el pesqueço de quebrar 	ains uole ius du cheual. et au choir fery li quint du heaume en terre 	949
844	ca dio de cabeça del yelmo en tierra 	si qua pou quil na le coul froisse 	950
845	e quando lançarote torno desçendio 	Et quant lancelot a fait son tour |si descent. 	951|952
846	ca el lo no queria acometer de Cauallo 	car honte luy seroit de requerre a cheual celuy 	953
847	porque el estaua de pie 	qui est a pie. |si trait lespee 	954|955
848|849	e metio mano al espada |e fuese parael 	et court sus a celuy 	956
850	que ya hera leuantado 	qui ia se releuoit. 	957
851	e diole tal golpe ençima del yelmo 	si luy donne si grant cop par my le heaume	958
852	quele fiço dar de manos en tierra e el que se yua por leuantar 	quil le fait flatir des paumes et des genoux a terre 	959
853	diole otro golpe dela espada 	puis recueuure ung autre cop 	960
854	que dio luego conel atordido en tierra 	et le fiert |si quil le fait tout choir 	961|962
855|856	e tomolo Porel yelmo |e tiro tan Reçiamente 	Et lors le prent par le heaume et le trayne iucquau feu 	963
857	que selo arranco dela cabeza 	si le gecte dedans 	964
858	E el finco muy estordido e sin fuelgo 	Et il estoit 	965
859	e asi auia perdido la fuerça del cuerpo 	si estourdy et tant auoit perdu la force du corps 	966
860|861	Que se no podia rreboluer |e lançarote tomolo porlos braços 	quil ne se peut releuer. si luy conuint demourer ou feu 	967
862	e dio conel enel fuego 		
863|864	e dexolo |ay morir ental manera 	et mourir en telle maniere. 	968
865	e luego vinieron a lançarote 	et lors uiennent auant ceulx 	969
866	los quela guardauan 	qui le champ gardoient. 	970
867|868	e dixeronle |señor asaz auedes fecho 	si dient a lancelot 	971
869	e los que tenian la donçella traxeronsela delante e el fizo la vestir 	quil en a assez fait |et luy rendent la damoisele saine et haitie	972|973
870	e dixole donçella 	et il la fait uestir |puis luy demande 	974|975
871	que queredes mas que faga 	quelle ueult |quil luy face 	976|977
872	señor 	mais Sire fait elle |que uous memmenez en mon chastel. 	978|979
873	dixo ella 	et il luy dit 	980
874	que vaiades con migo 	que uoulentiers 	981
875	fasta mi castillo Donçella 	si la fait monter |et la conduit iucquau chastel 	982|983
876|877	muy de Grado dixo lançarote e luego se fueron parael castillo |e aquel castillo auia nombre galeforte 	ou elle lauoit garde maint iout De celle mesmes matiere dessusdicte. Le chasteau auoit nom galefort 	984
878	e estaua ençima devna pequeña Ribera 	et seoit sur une petite riuiere.	985
879|880	e estaua bien asentado de todas partes |e fuerte amarauilla 	si estoit moult aise de toutes choses et fort a merueilles 	986
881	e quando lançarote y llego no cale demandar 	Et|quant lancelot uint la il ne fait pas a demander 	987|988
882	si conel fizieron gran alegria 	si len luy fait ioye. 	989
883	ca los del castillo sabian muy bien 	car ceulx du chastel scauoient bien 	990
884|885	como su señora hera ya librada |Porvn cauallero 	que leur dame estoit deliuree par ung cheualier 	991
886	que auia venido e quando los del castillo los vieron venir a lançarote 	qui uenoit o lie |Et quant ilz le uirent 	992|993
887	ansi lo Reçiuieron con gran alegria 	si le receurent a si grant ioye 	994
888	como si la madre de dios Mesma fuese 	comme se ce fust dieu. 	995
889|890	e fincaban los ynojos |por do el venia e deçian todos avna voz 	et sagenoillent tous deuant luy. 	996
891|892	bien venga el buen cauallero |sobre todos los omes del mundo 	et crient a une uoix tous ensemble Sire sur tous ceulx du monde. soyez uous le bien uenu 	997
893|894	Que nuestro duelo torno en alegria |A tal Plazer y a tal alegria fue lançarote rrescebido enel castillo 	qui nostre grant deul auez toͬne en grant ioye telle feste ont leans receu lancelot. 	998
895|896	como vos digo |e desque la donçella desçendio antesu gran palaçio 	Et quant il eut descendu la damoisele deuant son maistre palays. 	999
897	luego se quiso yr don lançarote 	si sen uoult maintenant aller. 	1000
898	que aun no hera mas de terçia mas ella lo tomo porel freno 	car il nestoit pas encor plus de tierce. |mais elle le print au fraing 	1001|1002
899	e lo fiço decender a fina fuerça 	et le fist descendre a fine force 	1003
900|901	e dixole |Por sancta cruz don cauallero vos no me escaparedes ansi 	et luy dist par saincte croix sire cheualier uous ne meschaperez pas ainsi. 	1004
		Lors le commande a desamer. 	1005
902	e luego lo mando desarmar e los escuderos que y estauan fizieron luego su mandado 	et uarletz saillent |pour faire son commandement 	1006|1007
903	e luego quele tiraron el yelmo la donzella corrio ael 	Et tantost |quil a oste son heaume elle le cognoist. 	1008|1009
904	e echole los braços al cuello 	si luy coure les braz tenduz et le uoult baiser en la bouche. |et il guenchist. 	1010|1011
		et elle luy baille la face et le coul et le menton. 	1012
905	e enla faz e començo a llorar con piedad 	puis quautre chose nen puet auoir. |si pleure de pitie 	1013|1014
906	e dixo 	et luy dist haa gentil cheualier	1015
907	ay señor quanto vos deseaua ver 	tant uous auoye desire a ueoir auant 	1016
908	anteque muriese 	que ie mourusse. 	1017
909	e como vos a ydo despues 	mais comment lauez uous puys fait. 	1018
910|911	que vos vi muy bien dixo lançarote |merçed a dios señor dixo la donçella 	et il luy dist. bien dieu merey. et	1019
912|913	como vos auino de venir asi contraesta parte |que aun tan poco a 	comment estes uous uenu ceste part 	1020
914|915	que vos partistes demi |por buena fee 	qui auant hier uous en partistes.	1021
916|917	dixo lançarote |Por buena auentura que me auino 	Par foy fait il une grande achoison me y amena. 	1022
918	e luego le Conto 	si luy compte 	1023
919|920	como vn cauallero le Recto de traiçion enla corte del Rey artur |Porla muerte de meliangas 	comment ung cheualier unes armes uermeilles lauoit appelle de traison a la court du roy artus pour amour de meleagant 	1024
921	e heme a defender enla corte del Rey bandemagus ay señor 	si luy en conuient deffendre en la court du roy bandemagu. 	1025
922|923	dixo ella |yo se quien es cauallero 	Haa sire fait elle ie scay bien 	1026
924	Ca es argodras el Rubio hermano del cauallero 	quil est. cest arqodras le roux. et le cheualier	1027
925	que agora matastes 	que uous auez huy occis 	1028
926	mas señor no se 	et ars estoit son frere. |si ne scay 	1029|1030
927	que vos faga ca e miedo 	que uous puissez faire. 	1031
928	que si mi padre sabe como matastes a meliangas 	car se mon pere sceit de uray|que uous auez occis meleagant iay paour 	1032|1033
929	que vos faga matar porel gran pesar 	quil uous face occire pour le grant deul 	1034
930	que abra destas nuebas 	quil aura des nouuelles. 	1035
931	como dixo lançarote 	Comment fait lancelot ne le sceit il encores pas 	1036
932|933	no lo sabe ansi me ayude dios dixo ella |no maguer 	Si maist dieu fait elle nennil. 	1037
934|935	que a quinze dias |que an traido aesta tierra el cuerpo de meliangas 	si a este meleagant apporte en ce pays plus de .xx. iours a. et est ou chastel des quatre pierres. 	1038
936	mas tienenlo enel castillo delas quatro piedras muy encubiertamente 	et le gardent ilec |si celeement	1039|1040
937	quelo no sepa su Padre 	que le roy nen scait ores riens 	1041
938	e ansi vos conuiene de vos encubrir muy sabiamente 	Si uous conuiendra esploicter au plus sagement |que uous pourrez. 	1042|1043
939	mas quando es el dia 	mais quant est le iour 	1044
940	que vos auedes de defender el dia dela magdalena 	que uous uous en deuez deffendre. 	1045
941	dixo lançarote 	et il luy dit 	1046
942	si dios me ayude dixo la donçella 	que cest le iour de la magdalene. |Or uous en conseille dieu fait elle. 	1047|1048
943|944	yo he gran miedo |que vos el faga matar algodras 	car iay grant doubte 	1049
945|946	por Alguna traiçion deso dixo lançarote |no ayais Miedo 	que argodras uous face ennuy par traison. 	1050
947	e el faga todo su poder Ca yo me guardare deGuisa 	De ce fait il face tout son pouoir. 	1051
948|949	Que no aya del pabor |Conel ayuda de dios 	car ie nen auray ia paour ne doute. 	1052
950	Asi fablaron toda aquella noche de muchas cosas 	Assez parlerent celle nuyt de maintes chosss. 	1053
951	e Mucho façian gran alegria los del castillo porque asi auian cobrado a su señora 	et moult firent ceulx du chastel grant ioye de leur dame 	1054
952	Que ayudauan ental manera Perder 	quilz cuidoient auoir perdue. |et ores lont saine et haitie. 	1055|1056
953	e enla mañana 	Et au matin |si tost	1057|1058
954	en quanto el dia aparesçio claro se leuanto lançarote 	que le iour esclarsit |se leua lancelot. 	1059|1060
955	e se partio dela donçella e des que fue armado 	si se party de la damoisele |quant il fu arme. 	1061|1062
956|957	e la acomendo a dios Señor |dixo la donçella 	et elle le commanda moult a dieu	1063
958	yo vos Ruego 	et le pria 	1064
